3800,1950年12月19日に山口県柳井町（現・柳井市）で創立。創業者は、卓球の全日本チャンピオン（混合ダブルス）だった'''田舛彦介'''（たますひこすけ、1920年8月20日-2004年7月22日）。初代の社長は、田舛彦介の父である田舛義一が務め、1959年に田舛彦介に社長の座を譲った。3代目の社長は田舛彦介の長男である田舛公彦が就任。続く4代目の山田俊策と5代目の大澤卓子は、創業家の出身ではない。「株式会社タマス」の前身である「タマス運動具店」時代の1949年、東京都杉並区に東京出張所を開設。1952年に現在の所在地に移転した際に東京支店に改称し、翌1953年に東京支店内でラケットの自家生産を開始。その後、業績の拡大などに伴って1956年に柳井の本社を閉鎖し、東京に本社を移転した。2018年11月、本社屋の老朽化に伴って新社屋を建設。青梅街道に面した1・2階をガラス張りのデモンストレーションルームとし、外から特製卓球台が見える演出を行っている。また、1967年に埼玉県所沢市に工場を建設。現在は「バタフライ・テック」という名称で、ラケットとラバーの生産工場に加えて、研究開発の施設を備えており、バタフライ卓球用品を生み出すもの作りの拠点となっている。そのほか、卓球の普及と発展を目的として、1983年に本社敷地内に「バタフライ卓球道場」を開設。卓球台が8台常設され、合宿などができる施設を備えており、国内外の数多くの団体が鍛錬の場として利用している。卓球用品メーカーとしての特長は、研究開発型製造業として数多くのヒット商品を生み出していることにある。1967年発売の「スレイバー」は高い反発弾性を誇り、国内外多くのチャンピオンに愛用された。また、他メーカーに先駆けてハイテンションラバーを開発し、1997年7月に世界初のハイテンションラバー「ブライス」を発売。続いて2008年に発売した「テナジー05」をはじめとする「テナジーシリーズ」は、トップクラスの選手を中心に高いシェアを保っている。さらに海外市場への事業展開を積極的に行い、1973年にドイツに現地法人を設立したのを皮切りに、中国（上海）、韓国（ソウル）、タイ（バンコク）に子会社を置く。現在、バタフライブランドは世界100か国以上に普及し、オリンピックや世界卓球に出場する選手の半数以上に使用されている。近年は世界卓球の用具スポンサーを務め、2009年横浜（日本）、2010年モスクワ（ロシア）、2012年ドルトムント（ドイツ）、2013年パリ（フランス）、2014年東京（日本）、2015年蘇州（中国）、2016年クアラルンプール（マレーシア）、2018年ハルムスタッド（スウェーデン）で、ボールや卓球台などを提供している。2009年から、発祥地の柳井にある「柳井市体育館」の施設命名権スポンサーを務めており、同体育館には「バタフライアリーナ」の愛称が付けられている。
3800,2001年に、日立化成の住宅機器・環境開発部門を分離して設立された。キッチン・浴室・給湯・環境設備に強みを持ち、日立製の電化製品を活用した商品が多い。ガス器具は、自社製品は少なく、ノーリツやリンナイのOEM製品が主流となっている。バランス釜後継機のホールインタイプの給湯器（壁貫通型ガス給湯機）を、ノーリツへOEM供給している。また、システムキッチン部門はLIXILと提携している。浴室製造の歴史は古く、前身の日立化成は1963年に、現在主流となっているプラスチック製バスを日本で最初に開発し、ホテルや公団団地に多く採用された。FRP成形技術を生かした浄化槽は、南極昭和基地でも使われている。茨城県の結城事業所（環境品製造）、富山県の富山事業所（システムバス関係）、栃木県の宇都宮事業所（キッチン、洗面製造）の製造3拠点がある。かつて存在した広島県の福山工場（浄化槽、ミニキッチン製造）は、2008年4月閉鎖され結城工場へ移管された。2008年1月、株式の過半数以上をプライベート・エクイティ・ファンドであるニューホライズンキャピタルに譲渡{{citeweb|title子会社株式の譲渡に関する基本合意のお知らせ|urlhttp:www.hitachi-chem.co.jpjapaneseinformation2007n_071026.html|publisher日立化成工業株式会社|accessdate2008-05-15}}、これにあわせ2009年4月1日に商号から「日立」の文字を外し、「株式会社ハウステック」に商号を変更した。ただし、日立化成からの経緯で、子会社や地域の販売代理店には、現在も日立化成の略称「日化」を冠する企業が残る。2011年から一時、子会社の日化メンテナンスと共同持株会社の株式会社ハウステックホールディングス（''HousetecHoldingsInc.''）を設立したが、2013年6月1日付で、当社に吸収したhttp:www.housetec.co.jpcompanynews201304post-42.html当社グループ会社組織再編に関するお知らせ|ハウステック。2012年6月15日、ニューホライズンキャピタルは保有全株式を家電量販店最大手のヤマダ電機に売却{{PDFlink|http:www.newhorizon.jpnewspdf20120510.pdfハウステック、ヤマダ電機に売却～企業再生を完了、ファンドの社会的使命を完遂～}}-ニューホライズンキャピタル2012年5月10日付ニュースリリースし、ヤマダ電機のグループ会社となったhttp:housetec-hd.comnewsnews_detail.php?item111株式譲渡に伴うハウステックグループの今後の体制について-ハウステックホールディングスニュースリリース2012年7月3日（2013年2月17日閲覧）。
3800,鎌田栄太郎が1954年3月に鎌田ポリエステルを創業。1959年3月17日に昭栄化工株式会社を設立。1960年1月よりオートバイ用ヘルメット製造に着手。きっかけは、鎌田が新橋で経営していた旅館を出張などで利用していた本田技研工業|ホンダ社員から、外国製ヘルメットに対する不満を聞いていたことから。当初はリヤカーにヘルメットを積んで納品した。1965年には本田技研工業の純正ヘルメットに採用。1968年に茨城工場を建設、7月にはアメリカに現地法人を設立。1980年代には世界一の生産量を誇るヘルメットメーカーに成長。1986年に当時本田技術研究所より独立し設計事務所を営んでいたCKデザインの佐々木和夫を技術顧問として迎えた。佐々木提案によるヘルメットの快適性をテーマに風切音や換気性などの改善と向上に努め、頭部を保護するだけではなく快適性も備えたものへと発展させた。この機能を具備したヘルメットはオンロード用だけのとどまらず、オフロードも含め波及した。この頃に新橋の鎌田の旅館は本社ビルに改装され一階は日本料理屋として打合せなどにも活用されていた。旅館の息子というだけあって鎌田の料理の腕前もなかなかのものだった。1992年、放漫経営などによる資金繰りの悪化から会社更生法の適用を申請。三菱商事の支援もあって当初計画を前倒しして1998年に更生手続を終了。同年5月に株式会社シヨウエイ、同年8月に現社名に変更する。2004年、ジャスダックに上場するが、2007年10月7日上場廃止。同年東京証券取引所2部に上場。2015年10月29日に東京証券取引所第一部に指定替えされた。
3800,1950年（昭和25年）創業。2002年（平成14年）1月に、株式会社パイロットおよびパイロットプレシジョン株式会社との株式移転|共同株式移転により株式会社パイロットグループホールディングス（現・株式会社パイロットコーポレーション）を設立し同社の傘下となる。同社では、主として幼児向けの知育玩具を中心に、ラバー・ダック|アヒル隊長、メルちゃん、ハローキティ等のキャラクター玩具などを製造・販売している。またパイロットコーポレーションが販売するボールペンやマーカー、サインペン、インクなどの製造も手がけている。
3800,印刷物のオフセット製版を目的に1972年に会社設立、その後、1986年に東京、1987年に大阪で写研出力業務を開始、1992年にサービスビューロー事業（顧客からデジタル原稿を預かり一定の加工を施した上、印画紙、フィルムを出力するDTP出力サービスなど）を開始。他にもオンデマンド印刷やオフセット印刷、サインディスプレイといったあらゆるプリント（印刷）を取り扱っている。また、2012年に高精細の3Dプリンタを使用した立体造形出力サービスを開始し、名目上2D、3D問わずあらゆるデータの出力が行えるようになった。1998年にジャスダック市場へ上場。2015年1月5日に単独株式移転により持株会社'''株式会社日本創発グループ'''を設立し、持株会社体制に移行したhttp:www.lithmatic.co.jppdfnews2014ir_20140814-04.pdf単独株式移転による純粋持株会社体制への移行について。これに伴い東京リスマチックに代わり、日本創発グループがジャスダック上場企業となったhttp:www.lithmatic.co.jppdfnews2014ir_20141201-01.pdf株式会社日本創発グループの新規上場承認に関するお知らせ。2018年、本社を荒川区から港区に移転。日本創発も台東区に移転。
3800,ペットフードを中心に、首輪・脱臭剤などの愛玩動物を目的とした製品の開発・製造・販売をおこなう。特にプレミアムフード系の製品を中心に拡充されていることで知られる。社名は創業者で現会長の林明雄の名に因むもの。英文社名にあるH.Aは林の姓と名をそれぞれ表しているが、企業の英文社名においては珍しいケースでもある。
3800,"大正末年の創業直後からSPレコードのレーベル印刷を手がけ、レコード関連のパッケージ印刷などを業務の中心に据えて事業を進めてきたname\""aera\""{{citenews|titleレコジャケ美術館の愉悦町工場の中のアナログ音楽ワールド|newspaperアエラ|date2009-01-12|page43}}-聞蔵IIビジュアルで閲覧。日本の音楽・映像・ゲームソフトパッケージの製造メーカーとしては国内最大手のひとつである{{citenews|author土方慎二|newspaper読売新聞（東京朝刊）|date2011-01-12|title1000枚の美しきLP蒲田　洋楽ジャケット展示|page33}}-ヨミダス歴史館で閲覧。例えば、CDの紙ジャケットは、金羊社が一九堂印刷所とともに市場をほぼ独占しているname\""a060701\""{{citenews|title四十男の心と財布、わしづかみCDに「紙ジャケ」ブーム名盤復刻など5千超|newspaper朝日新聞夕刊|date2006-07-01-|page5}}-聞蔵IIビジュアルで閲覧。2009年9月9日に発売されたザ・ビートルズの『ザ・ビートルズMONOBOX』では、コンペティションにより全世界向けのパッケージを金羊社が製造しており、それまでにも自負していた世界でもトップレベルの印刷品質name\""aera\""を証明することになった{{citeweb|urlhttp:b4univ.exblog.jp13551924|titleいつまでもあると思うな・・・|author宮永正隆|publisher宮永正隆|date2010-01-23|accessdate2012-05-07}}。また、パッケージの受託製造以外では、音楽情報サイトの運営や音楽ジャケットアートのイベントを開催するなど音楽を楽しむ為の活動や、アニメ作品への資金拠出などもおこなっている。金羊社は、レコード・ジャケットの展覧会なども主催してきたが、2008年に社屋を新築した際、その一角にレコード・ジャケット等を展示する常設のギャラリーを設けたname\""aera\""。"
3800,1923年（大正12年）に創業者の中林安右衛門が大阪市内で製本所を開いたのが始まり。その後1959年（昭和34年）には手帳の製造を開始し、さらには1968年（昭和43年）から現在まで同社の代表的製品である「フエルアルバム」を製造開始し、現在も発売され続けるロングセラー商品として、多くの人たちに親しまれている。ちなみに「フヤスアルバム」というのも存在する。名前からしてフエルアルバムのまがい物に思われがちだが、こちらも正真正銘ナカバヤシの製品である。OA機器はかつての子会社である「ロアス」ブランドで展開している。紙製ながらもUVカットシートをセットした写真フレームであるVカットマットは人気が高い。その他、同社を代表する商品には手帳があり、隠れたロングセラー商品となっている。2008年にhttp:www.obunsha.co.jp旺文社が販売する英語教育教材がNHK主催の教育コンテンツ国際コンクール・第35回「日本賞」のコンテンツ部門【幼児向けカテゴリー】で優秀作品に選ばれた。この教材に付属する音声ペンの供給はナカバヤシである。1979年、草壁焔太|草壁焔太著の急成長会社の内紛を描く『実力専務去る『実力専務去る』六芸書房、1979年12月。』が発刊。同族企業ナカバヤシの内紛を描いた暴露本である。2005年、チャイルドシート専門メーカーのリーマン株式会社を完全子会社化し、育児関連事業へ踏み出した。2006年9月にドイツ・ケルンで開催された国際ベビー用品展示会にチャイルドシートを出展した。2007年、インターネットを利用してオリジナルの写真集を作成できるサービス「フエルフォトブック」のサービスを開始。2008年にはB2B向けにもサービスを展開するなど、継続的に活発な活動を展開している。2009年に音声ペンやセキュリティ製品等を扱うwebショップhttp:ansist.comshopingindex.htmlANSISTダイレクトをオープン（後、webショップはIT部門へ引き継ぐ形でANSISTダイレクトは閉鎖）。2017年には株式公開買付けにより、東芝テック株式会社の子会社であった国際チャート株式会社を子会社化しているhttps:www.nakabayashi.co.jp_filesNews0493file20171208.pdf国際チャート株式会社株式に対する公開買付けの結果及び子会社の異動に関するお知らせ。
3800,元アルゴノートゲームス社員であり、スターフォックスおよびスターフォックス2、X(ゲーム)|X、サルゲッチュ|ピポサル2001などのプログラマだったディラン・カスバートらによって設立。ディランは、アルゴノートと任天堂との契約により、17歳から任天堂で働くことになった。その経緯から、キュー・ゲームスは任天堂およびソニー・コンピュータエンタテインメントのゲームやシステム開発（PlayStation3の起動画面のグラフィック等）に携わっている{{citeweb|urlhttp:www.accumu.jpback_numbersvol16Q-GAMES%E3%80%80%E3%82%AD%E3%83%A5%E3%83%BC%E3%82%B2%E3%83%BC%E3%83%A0%E3%82%B9%EF%BC%8D%E4%BC%9A%E7%A4%BE%E7%B4%B9%E4%BB%8B.html|titleAccumuVol.16Q-GAMES　キューゲームス−会社紹介|workAccumu|publisher京都コンピュータ学院|accessdate2014-09-03}}。
3800,男性向けの主力商品、特許第3686998号技術のヘアウィービングシステム（編み込み式増毛法）は、特殊な3本の糸だけを使って頭髪部分に毛髪製品編み込んでいくスヴェンソン独自の技術。（特許文献参照）金具や接着剤を使う従来の増毛法より、ご自身の頭皮に負担が少なく、24時間着脱不要という点では、実際に生活したときの「安心感や快適さ」という点で大変実用的である。実際に自社製品を使用しているアドバイザー（営業担当者）も多く、実体験に基づいたアドバイスを得意とする。また、抗癌剤投与等により脱毛した患者のための医療用ウィッグも製造販売している。近年は患者の外見ケアのサポートとしてウイッグだけではなく、治療中の生活に必要なアイテムの販売や、患者やその家族の心のケアとしてがん哲学外来メディカルカフェhttp:www.gantetsugaku.orgがん哲学外来メディカルカフェ開催の場として、店舗の一角を提供する活動も行っている。ヘアケア製品の販売としては「レフィーネ」http:www.8341.jpレフィーネを2006年より展開しており、主力商品としてレフィーネヘッドスパトリートメントカラーを扱う。会長の兒玉圭司は世界卓球選手権大会の日本代表に選ばれた後、日本代表選手団監督を務め、現在は明治大学体育会卓球部総監督、日本学生卓球連盟会長を務めている。岸川聖也（卓球選手）が所属契約を2006年4月1日から2009年3月31日までの3年間結んでいた。2016年1月1日より丹羽孝希（卓球選手）と5年間のスポンサー契約を締結。テレビCMが東京メトロポリタンテレビジョン|TOKYOMXで、ラジオCMがエフエムナックファイブ|NACK5や中国放送|RCCラジオなどで流れている。「スベンソン」と誤表記されることも多いが、正しくは「スヴェンソン」である。
3800,1970年、ハインリヒ・バウムガルトナー（HeinrichBaumgartner）とクラウス・ブラント（KlausBrand）の2人が、「シュヴァルツヴァルト|黒い森」に位置するシルタッハ（Schiltach）に自動車部品製造販売会社を設立する。“BBS”は、この2人の創始者と創立の地の名によるものである。設立当初は繊維強化プラスチック製エアロパーツのサプライヤーであったが、エアロパーツがヨーロッパツーリングカー選手権（ETC）のレーシングカーに採用され、その関わりで1972年にレーシングカー用の3ピースアルミホイールを製造するようになった。1983年、ドイツのBBSと共同出資で日本BBSを設立。以降、鍛造アルミホイールおよび鍛造マグネシウムホイールはワシマイヤー（現：BBSジャパン）が製造し、日本国内外の自動車メーカーに多く供給されている。鍛造マグネシウムホイールは、F1用ホイールとして供給されている（一般市販用はモデルによりドイツ製又は日本製）。BBS社のアルミホイールは、ハブからリムに向かって伸びるX字あるいはY（V）字状スポークの「メッシュタイプ」デザインをアイデンティティとする。同社製メッシュタイプホイールのデザインを模した、所謂「BBSタイプ」も各社から販売されている。OEMとしてメッシュタイプではないホイールも製造しているが（主にドイツ製）、OEM先のセンターキャップを装着するなどしており一見BBS製と判別できないものも多く、スポークの裏側にひっそりとBBSの刻印があることも多い。一般市販車用アルミホイールとしては特に高品質で、高級品・上級品とされ、メルセデス・ベンツ、ポルシェといったドイツ車はもとより、日本車にも純正採用、もしくは購入時オプションとして設定されている事も多い。また、フォーミュラ1|F1ではメルセデスAMGF1|メルセデス、フォース・インディア、ロータスF1チーム|ロータスなどがBBS製鍛造マグネシウムホイールを採用していたが、2014年のF1世界選手権|2014年現在はマルシャF1チーム|マルシャが採用するにとどまっている。なおSUPERGTにおいては2014年のSUPERGT|2017年現在、GT500でサード(企業)|SARD、中嶋企画|NAKAJIMARACING、モーラ(レーシングチーム)|MOLA、ニッサン・モータースポーツ・インターナショナル|NISMOなどが採用しており、日本国内のレーシングシーンでのシェアは比較的高い。2011年1月7日にワシマイヤーの公式ウェブサイトにて、ドイツBBS社が日本での民事再生法に該当する「SelfAdministratedInsolvency」を申請したとの知らせが掲載。BBS社は事実上の倒産となったが、同年11月、ワシマイヤーの親会社であった小野ホールディングスが同年12月31日付でBBS社の鋳造ホイール部門を除く製造部門、商標権を買収することを発表したhttp:www.fukuishimbun.co.jplocalnewseconomics31804.html小野グループが独BBS社を買収　商標権、鍛造部門（福井新聞2011年12月1日）2011年12月2日閲覧http:www.bbs-japan.co.jptopicsinfo_111130.pdfドイツBBS社のMotorsport部門の買収及びBBSブランドのレーシングホイール・鍛造ホイール商標権の買収ついて（日本BBS株式会社）。2012年10月26日に東京地方裁判所にワシマイヤーの会社更生法|会社更生手続開始の申立てが行なわれた。2013年11月にワシマイヤーは、子会社の日本BBSなどとともに、前田工繊の完全子会社となったhttp:v3.eir-parts.netEIRView.aspx?cattdnet&sid1101576更生会社ワシ興産株式会社及び更生会社ワシマイヤー株式会社の更生計画認可決定の確定、株式取得（完全子会社化）に関するお知らせ（前田工繊株式会社）。
3800,東京都板橋区本町に本社を置く、粘着関連製品の総合メーカー。社名の由来は、リンケージ(結合)＋テクノロジー。「粘着応用技術」「表面改質技術」「特殊紙・剥離材製造技術」「システム化技術」という4つの固有技術を基盤とし、それらを融合させることによって製品を開発している。そのラインアップはシール・ラベル用の粘着紙・粘着フィルムをはじめ、ガラス飛散防止対策フィルム、屋外サイン用粘着シート、内装用化粧シート、自動車関連粘着製品、半導体関連テープ、液晶関連フィルムなど。またバーコードプリンタ、ラベリングマシン、半導体関連装置などの各種関連装置の開発・製造も行っている。
3800,1957年に加藤祐治によって創業された関水金属彫工舎を前身とする。関水金属は鉄道模型専業であり、直流二線式のNゲージおよびHOゲージ・16番ゲージの車両、線路、ストラクチャー・アクセサリー、制御機器などを製造する。日本国内向け製品だけでなく外国向け製品も製造し、輸出比率は事業の3割を占める。日本向け製品は子会社の'''株式会社カトー'''を、アメリカ合衆国|アメリカ向け製品は、現地法人'''KATOUSA'''(''KATOU.S.A.Inc.'')を通して発売される。ヨーロッパ向け製品は、現地メーカーからの受注生産という形態で製造を担当している。日本では「カトー」と呼称されるが、アメリカでは「ケイトゥ」と呼称されることが多い。主な生産国は日本で、埼玉県鶴ヶ島市と坂戸市に2工場を稼動させている。内製化率が高く創業時から自社開発と自社製造に対するこだわりが強い。2004年、加藤祐治は経営から退き、息子の加藤浩を中心とする経営体制となった。2007年9月現在の執行役員は、創業者の加藤家と国竹家で占められており同族経営となっている。同社の製品は鉄道模型専門店|模型専門店のほかに模型の取り扱いがある家電量販店や玩具店などでも販売されている。系列会社である'''株式会社ホビーセンターカトー'''が東京（本社ビル内）と京都（京都府下京区）にて直営ショップを開設しているほか、ホビーセンターカトーによりECサイト|インターネット通信販売も行われている。なお、埼玉工場の敷地内には、国鉄EF65形電気機関車の先頭部カットボディが展示されており、この16番モデルがホビーセンターカトーで発売されている（2013年12月現在）。
