5200,日本国内外における生産拠点からの輸出入を行う総合商社である。輸出入品目は大きく分けて「自動車用品」「繊維製品」「産業資材」の3品目で、内訳は品目資材および各種加工製品となっており、日本国内の各製造拠点へ輸入した資材を各種加工製品として加工・販売を行い、カーホイール、中古自動車、中古ピアノなどを中心に、各種商品を主に大韓民国|韓国や中華人民共和国|中国へ輸出しているhttp:www.geosan.jpcontents.html巨山ジャパン株式会社取扱品目。
5200,輸入の促進及び対内投資事業の円滑化に関する臨時措置法（FAZ法）の制定に基づいて、愛媛FAZ構想が策定される中でFAZ推進母体として設立された。輸入促進基盤施設である愛媛国際物流ターミナルや愛媛国際貿易センター（通称アイテムえひめ）の運営・管理の他、見本市の誘致・企画、貿易、貿易情報の提供等の業務を行っている。
5200,商社・港湾業者・木材業者等数多くの企業の合同出資により設立され、江東区若洲にある15号地木材ふ頭を運営している。木場や新木場という地名があるように東京港には古くから貯木場があり、国内で消費される輸入木材の集約地としての機能が備わっていた。旧来、原木を運んできた貨物船は岸壁に接岸することなく、沖荷役といわれる方法で東京港内の海上で作業が行われていたが、次第に輸入木材は原木ではなく製材として輸入されることが多くなり、近年木材埠頭の需要が高まってきた。そこで輸入関連商社16社、港湾運送関連業者16社、木材業者44社の合同出資により設立されたのがこの会社である。
5200,{{右|left|galleryファイル:ContainerBox.jpg|ジャパンカーゴ・グループ会社の冷蔵食材配送に利用されるコンテナgallery}}すかいらーくグループの配送業務を中心に手がける。*本社：埼玉県東松山市御茶山町13-12*設立：1988年
5200,*所在地：〒231-0023神奈川県横浜市中区(横浜市)|中区山下町(横浜市)|山下町2番地産業貿易センタービル4階*代表取締役社長:高島正之*資本金：150億2千8百万円*財団設立：1981年12月25日*株式会社設立：2012年7月26日
5200,倉庫業を主な業務とし、一般倉庫のほか、食品を保管する定温倉庫、危険物倉庫なども所有する。また、不動産|不動産業も展開し、賃貸|賃貸管理・仲介などを行う。
5200,親会社である日立造船を主要取引とし、大阪及び舞鶴、九州地区で運輸・倉庫業を行う企業である。
5200,全農サイロ株式会社は、1968年設立の神戸サイロ株式会社、1969年設立の東海サイロ株式会社、1970年設立の鹿島サイロ株式会社の3社が1975年に合併して発足した。出資比率はJA全農が90%、東洋埠頭が4%、澁澤倉庫・名港海運が各3%。全国6箇所のサイロで飼料・油脂|油糧用のトウモロコシ|とうもろこしやダイズ|大豆等を扱うほか、コンテナでの牧草の輸送、大豆の選別などを行う。年間の取扱量は500万トン弱。
5200,1941年（昭和16年）4月1日設立。港湾運送事業を主力とし、国際輸送事業や兼業事業を行う。社名は、TRADE（トレード）とIDEA（イデア）を合わせた合成語である。2011年（平成23年）2月には東海地方を地盤とするトランコム株式会社と資本業務提携を締結し、同社が筆頭株主となっている。
5200,大手食品メーカーのキユーピーを親会社とし、本体や協力会社が共同配送に用いる貨物自動車|トラックの荷台には「キユーソー便」のロゴが入っている。東京証券取引所|東証第1部に上場。キユーピーグループの物流を一手に請け負っているが、グループ以外にも積極的に営業展開を行っており、現在売上高に占めるキユーピーグループ関連の比率は30%程度である。社名は前身の「キユーピー倉庫」から略したものであり、親会社・キユーピー同様に小文字の「ュ」ではなく大文字の「ユ」が使われている。
5200,太平洋セメント系企業で、アジア船向けターミナル業務が中心となっている。近年はロシア向けの国際輸送や静脈物流（リサイクル関連の物流）に力を注いでいる。以前は太平洋セメントの子会社であったが、2010年に一部株式を鈴与グループの鈴与建設に譲渡し、子会社でなくなっている。
5200,神戸市|神戸で海運|海運業を営み、'''神戸海運五人'''男と称された乾財閥当主乾新兵衛が、1925年に土地の売買、賃貸借および金銭の貸付を行う目的で「関東土地株式会社」を設立した。2014年10月の合併で消滅会社となった（旧）「乾汽船株式会社」は乾財閥の持株会社であった乾合名会社の後身である。
5200,キャッチフレーズは、'''車社会に夢・豊かさ・安心を'''かつては運輸事業部門も存在していたが、トヨタ自動車系の物流会社であるユーネットランスに統合された。
5200,新潟港の東港区・西港区を主要拠点として倉庫・運輸などの物流事業を中心に展開している。付帯事業として不動産会社|不動産業をはじめ、新潟市中央区のANAクラウンプラザホテル新潟、佐渡市相川地区のホテル大佐渡などのホテル事業を行っている他、新潟市東区(新潟市)|東区の新潟臨港病院を運営する医療法人新潟臨港保健会を保有している。1960年代頃から、ゼネラルモーターズ（シボレー、ポンティアックなど）の輸入・販売を行っていたが、第二次オイルショックの影響で1980年に撤退した。
5200,国内向けの物流・不動産業を営んでいた三菱商事の子会社・「菱光ロジスティクス」と、三菱商事のロジスティクス部門から分社化し、国際複合一貫輸送業・貿易事務などを担当していた「エム・シー・トランスインターナショナル」(McTI)が合併し、2006年4月に発足した。合併後は商社系物流会社の中でも最大規模となった。狭義の物流という枠組みにとらわれることなく、情報力・金融戦略・グローバルネットワークなど、総合商社系物流会社としての利点を最大限活用しつつ、グローバルでシームレスなロジスティクスサービスの実現のため注力するとしている。
5200,"。*1906年（明治39年）-前身である東海倉庫株式会社設立name\""概要\""。*1926年（大正15年）3月13日-名古屋倉庫株式会社と東海倉庫株式会社が合併し設立name\""概要\""name\""EDINET\""。*1949年（昭和24年）5月-名古屋証券取引所に株式を上場（1961年10月、制度改正（第2部発足）により第1部へ）name\""概要\""name\""EDINET\""。*1999年（平成11年）{{要出典範囲|date2016年2月20日(土)05:15(UTC)|5月}}-新名古屋ミュージカル劇場（劇団四季専用劇場）完成name\""概要\""。*2000年（平成12年）2月-東京証券取引所市場第1部に上場name\""概要\""name\""EDINET\""。*2005年（平成17年）4月-プライバシーマークを取得name\""概要\""name\""EDINET\""。*2006年（平成18年）10月-トランクルーム部に書類保管センターを開設name\""概要\""name\""EDINET\""。*2008年（平成20年）7月-名古屋北営業所大口倉庫を新設name\""概要\""{{Citeweb|urlhttp:www.toyo-logistics.co.jpirimagesnewsnagoyakita20080514.pdf|title営業所開設のお知らせ|formatPDF|publisher東陽倉庫|language日本語|accessdate2016-01-23}}。*{{要出典範囲|date2016年2月20日(土)05:15(UTC)|2015年（平成27年）3月-再開発事業により住宅・商業・業務複合施設「テラッセ納屋橋」を着工}}。"
5200,1959年（昭和34年）6月22日設立。主な事業は物流情報サービス事業とロジスティックスマネジメント事業、貨物運送事業、情報技術|IT・アウトソーシング事業である。
5200,日本郵船グループの中核を担う企業であり、航空貨物の取扱を主力業務に成長を続け、貨物の集配から保管、梱包、混載、通関などの手配を行い、複合一貫輸送サービスを提供するフレイト・フォワーダーとして世界規模で事業を展開するグローバルロジスティクス企業である。近年は従来の航空輸送部門に加え、海上輸送部門にも力を注いでいる。また、高機能な物流拠点や3PLを核としたロジスティクス事業も拡大しており、企業の物流戦略により深く関わりサポートする、ロジスティクス・プロバイダーへと進化を遂げている。以前は旅行業も営んでいたが、1994年に郵船トラベルとして分社化した。2006年10月にはヤマトホールディングス|ヤマトグループである、ヤマトロジスティクス|ヤマトロジスティクス株式会社との間で戦略的提携を行い、共同混載事業を開始、また2007年2月には、スイス・バーゼルに本社を置く世界有数の国際物流企業である、パナルピナグループとの間でフレイト・フォワーディングに関わる包括的な相互協力契約を締結し、パナルピナの航空・海上輸送に関わる日本での代理業務を受託する一方で、郵船航空としては海外の自社ネットワークに加え、パナルピナ側には特定地域における代理店業務を委託している。2010年10月1日に日本郵船物流グループ子会社であるNYKロジスティクスと統合し、「郵船ロジスティクス株式会社」としてコントラクト・ロジスティクスを中心に展開。
5200,1977年に航空貨物エージェントとして設立され、2000年以降LG電子・化学をアウトソーシングし、企業拡大する。http:www.pantosjapan.comPantosJapanHomepagehttp:www.koreaherald.combusinessDetail.jsp?newsMLId20111114000550KoreaHerald現在39カ国、104の地域に169の事業所（倉庫を含む）を所有し、総従業員数は延べ4000名である。http:www.pantos.comenPantosLogisticsHomepagehttp:www.gscintell.comTransportIntelligence事業範囲は海上・航空輸送、陸上・鉄道輸送、倉庫、物流コンサルティング、国際エクスプレス、プロジェクト輸送、通関業等である。http:www.pantos.comenPantosLogisticsHomepage
5200,神戸市|神戸で海運業を営み、'''神戸海運五人'''男と称された乾財閥当主乾新兵衛が、1925年に土地の売買、賃貸借および金銭の貸付を行う目的で設立した「イヌイ倉庫株式会社」（設立当時の商号は「関東土地株式会社」）と、乾財閥の持株会社であった「乾合名会社」の後身である（旧）「乾汽船株式会社」が2014年10月に合併して、現在の乾汽船株式会社となった。
5200,貿易不均衡是正を目的とした時限立法「輸入の促進及び対内投資事業の円滑化に関する臨時措置法」（通称「FAZ法」）に基づく輸入促進地域内に位置し、主に入居企業による輸入品の保管・荷捌き・加工などが行われている。A棟・B棟・C棟・管理棟からなり、川崎港コンテナ埠頭に近接し、首都高速湾岸線|高速湾岸線を通じて横浜港・東京港・東京国際空港|羽田空港へも短時間で到達できる。
5200,敷地内に4つの物流ビルを持ち、このうち先に作られたA棟・B棟は地上6階建て・延床面積が約17万平方メートルで5トントラックまでの車両が自由に行き来できる仕様となっている。また道を1本隔てた場所には延床面積約3万6000平方メートルのC棟、同8700平方メートルのD棟がある。また地上11階立てのセンタービルは企業の事務所として利用され、さらに展示場では各種イベントが行なわれている。敷地外である東京都大田区東糀谷にもTRC羽田ビルを所有し、企業の事務所として利用されている。
5200,"三河港神野埠頭にターミナルを持ち、ブラジルから専用の冷蔵タンカーで運ばれた濃縮還元|濃縮オレンジジュースの貯蔵や、飲料メーカーの仕様にあわせたブレンドなどの業務を行う。1990年にブラジルの果汁会社2社により設立、現在はベルギーのシトロスコヨーロッパ社とオランダのコンチネンタルジュース社が株主となっているname\""cci\""http:www.toyohashi-cci.or.jpjoho2010interview201010.html社長インタビュー（豊橋商工会議所）。ターミナルの操業開始は1993年5月でname\""nissyoku-1995-4-14-7T\""、タンカーからの受入設備、容量1000トン|tの冷蔵貯蔵タンク20基、ブレンド設備、ドラム缶充填設備、ローリー充填設備などを有する。出荷は一部タンクローリーでも行われるが、多くはドラム缶が使われるhttp:www2.ngu.ac.jp~akimotogradishikawa.htm日本のオレンジ果汁バルク物流（石川百代）名古屋学院大学。一部は、アジア諸国へも輸出されているname\""cci\""。"
5200,|総資産|従業員数546名（2013年2月現在）http:anshin.symba.jpaboutoverview.html会社概要|決算期3月|主要株主シンバホールディングス株式会社　100%|関係する人物安里信秀(創業者)、安里繁信|外部リンクhttp:anshin.symba.jp|特記事項}}'''株式会社あんしん'''は、沖縄県浦添市に本社を置く、沖縄県を中心とする物流事業者。シンバホールディングスの中核企業。
5200,1948年、近畿日本鉄道の国際貨物部門として業務を開始し、1970年、近鉄航空貨物株式会社として独立。1972年10月、単独混載の免許を取得し、グループ混載から離脱。これが飛躍の原動力となった。その後も積極的に海外展開を進め、中国では日系最大級のネットワークを有する。創業時から手がける航空貨物輸送に加え、海上貨物輸送、ロジスティクスまでワンストップでサービスを提供している。日系フォワーダー大手3社の中では外資系荷主に強い顧客基盤を持っており、積極的・戦略的な顧客開拓を行っている。2015年、APLLogisticsLtd(以下APLL)を買収。APLLが持つ米国自動車メーカーや米国大手アパレル、大手流通などの欧米系顧客基盤を生かしてフォワーディング事業を拡大している。直近の中期経営計画では、欧米メガフォーワーダーと伍して戦うために物量拡大を最重要課題と位置づけ、「航空輸出重量70万トン、海上輸出容積70万TEU」を目標としている。
5200,"観光道路の屋島ドライブウエイは、自動車専用の有料道路として、1961年（昭和36年）4月26日に供用を開始した。正式名称は「屋島自動車道」である。観光客の増加と公衆の利便性の増進のため、道路工事費4億6198万円をかけ「屋島ドライブウエイ株式会社」が設置group\""注\""駐車場の屋島寺側に「屋島ドライブウェイ開発者真鍋康男顕彰碑」が設置されている。、運営した。道路延長は3664メートル(m)、道路幅員7&nbsp;m（有効幅員6&nbsp;m）、起点標高は16&nbsp;m、終点標高は282&nbsp;m、山上の駐車場は10542平方メートル（乗用車、バス等380台を収容）である。屋島南麓の屋島神社・四国村上流の入口ゲート（料金所）を通過すれば、南嶺山上の駐車場に至るnameihyasimafudoki。有料道路は、道路交通法による車両通行規制があり、エンジン排気量125&nbsp;立方センチメートル|cc以下の二輪車（原動機付自転車を含む）・軽車両・歩行者は通行できない。通行可能な時間帯は、6時30分-22時00分である。正月などを除き、他の時間帯はゲートを閉鎖した{{Citeweb|urlhttps:www.city.takamatsu.kagawa.jp28550.html|title屋島ドライブウェイの無料化について|publisher高松市|accessdate2017-7-27|archiveurlhttps:web.archive.orgweb20171012180002http:www.city.takamatsu.kagawa.jp:8028550.html|archivedate2017-10-12|}}。"
5200,*本社所在地-東京都墨田区東向島四丁目1番5号*設立-1948年（昭和23年）12月4日*代表者-小田桐修*資本金-6543万2200円*事業内容#倉庫業#物品の仕分け、梱包及び発送業務の請負業#販売業務#上記に付帯する一切の業務*取引業種-アパレルメーカー、各種雑貨卸、玩具卸、販売促進|SP、通信販売、建築資材商社、精密機器商社、学校法人等
5200,内陸の総合物流でトップクラス。多種多様な貨物を取扱い、保管から、輸送、流通加工、通関、梱包、情報処理に至るまで、倉庫・運送・国際の一貫した総合物流体制を確立している。また、トランクルームサービス、引越運送等も取扱い、その拡充にも積極的に取組んでいる。
5200,"|資本金7億5625万円name\""概要\""|発行済株式総数|売上高|営業利益|経常利益|純利益|純資産|総資産|従業員数連結2000名（2017年7月現在）name\""概要\""|支店舗数|決算期|会計監査人|所有者|主要株主商船三井|株式会社商船三井br近鉄エクスプレス|株式会社近鉄エクスプレスname\""概要\""|主要部門|主要子会社|関係する人物|外部リンクhttps:www.mol-logistics-group.com|特記事項}}'''商船三井ロジスティクス株式会社'''（しょうせんみついロジスティクス、英:MOLLogisticsCo.Ltd.)は、商船三井グループの海上・航空輸送を主な業務とする企業（フォワーダー）である。"
5200,主力の梱包事業では、過酷な流通条件に対応した包装設計が特徴となっている。物流の入り口である梱包分野を重視し、業務全体の合理化、省力化を図り、顧客に還元するのが同社物流事業の強みである。最近では3PLや国際物流分野に注力しており、成田国際空港|成田空港周辺に2箇所、横浜港大黒ふ頭周辺に2箇所、保税・通関機能を持った加工拠点を用意している。微細電子部品から、精密医療機器、大型工作機械にわたる同社の流通加工技術は、顧客からも高く評価されており、倉庫や保税・通関、運輸などの事業を、コア技術の梱包とシステム化し、トータル・ソリューションの形態で提供することも多い。
5200,バンダイは商品の輸送コスト削減を目的に1963年9月に同社運輸部を分離して「'''バンダイ運輸株式会社'''」を設立、以降はバンダイ→バンダイナムコグループにおける物流部門を担ってきた。2007年7月に国内における貨物自動車運送事業、倉庫業などを「'''ロジパルエクスプレス|株式会社ロジパルエクスプレス'''」として分社化。以降、バンダイロジパルは国際物流業務、サード・パーティー・ロジスティクス、アーケードゲーム|アーケードゲーム機のメンテナンスを主要業務としている。ロジパルエクスプレス設立後も行っていたアーケードゲームの物流業務は、2016年4月までにロジパルエクスプレスへの移管が完了している。通関業者|通関業に関しては、AEO（AuthorizedEconomicOperator）認定通関業者制度に基づく認定通関業者となっている。
5200,複数の顧客のコンテナ1本に満たない少量の貨物を仕向け先ごとに1本のコンテナにまとめて輸送する海上混載輸送サービスが事業の主軸namenikkei{{Sfn|経済界|2008|p135}}。五大港（東京港、横浜港、名古屋港、大阪港、神戸港）の他、門司港、博多港などに設けた拠点から世界の主要都市向けに直行便の海外混載輸送サービスを行っている{{Sfn|経済界|2008|p135}}。直行便がない国々へもシンガポールや香港、釜山、ロサンゼルスなどに設けた現地法人のハブ港を利用して輸送を行う{{Sfn|経済界|2008|p135}}。通関業務や、荷揚げ後の列車、トラック輸送の手配や管理も代行している{{Sfn|野口|2009|p61}}。
5200,設立は1952年（昭和27年）12月11日で、旧本社は石川県石川郡(石川県)|石川郡野々市町(現：野々市市）本町（北陸鉄道石川線押野駅近く）。2002年（平成14年）7月8日、現在地に移転した。貸切バス事業のほかに、旅行代理店業務を行っている（企画旅行|ツアー主催は北日本観光自動車旅行事業部の北日本観光旅行が行う）。2014年（平成26年）10月17日より金沢-東京間の高速路線バスの運行を開始したhttp:www.kitanippon-kanko.jphighwayindex.html高速バス：時刻表・運賃表|北日本観光旅行・北日本観光バス-北日本観光バス。
5200,石油元売各社が製造・販売している潤滑油製品の共同保管及び共同配送を目的に発足したＪＲ貨物のグループ企業。現在では石油元売だけでなく、潤滑油や化成品など主に危険物に該当する製品を製造するメーカーや販売会社の商品も取り扱っている。全国に4つの危険物専用の物流センターを保有しているが、配送業務は主に外部の輸送会社に委託しているhttp:www.oil-logistics-systems.co.jpservice.html営業案内。本社は平成25年に東京都千代田区から東京都中央区(東京都)|中央区に移転した。物流センターは、北海道物流センターが北海道苫小牧市に、盛岡物流センターが岩手県盛岡市に、郡山物流センターが福島県郡山市に、九州物流センターが福岡県朝倉市にあるhttp:www.oil-logistics-systems.co.jpdistribution_center.html物流センター。1993年（平成5年）10月29日にJR貨物と日本オイルターミナルの出資で設立された。その後の増資で石油元売各社の資本も入っているが、JR貨物と日本オイルターミナルの2社が主要な出資者であるhttp:www.oil-logistics-systems.co.jphistory.html沿革。2018年（平成30年）1月1日に日本オイルターミナルへ吸収合併されたhttps:response.jparticle20171129303090.htmlJR貨物グループの石油・物流2社が合併　2018年1月1日レスポンス2017年11月29日。
5200,貨物軽自動車運送、委託運送店の開発および育成、軽貨物自動車販売、損害保険代理業などが業務の中核であった。現在の会社は、2007年4月に（旧）軽貨急配株式会社（後のトラステックスホールディングス→タイガー管理）の会社分割により事業会社として設立された軽貨急配株式会社を前身とする。2007年3月末時点で約16億円の債務超過に陥っていたが、CLSA（ファンド）の支援を受け債務超過解消。2008年3月末時点で約3億円の資産超過に改善。創業者一族は退陣し新経営陣とファンドからの派遣役員により「ビジネスモデル」の改革が進められていたが、2008年9月末時点で再度債務超過となる。2009年3月デットエクイティスワップにより債務超過を解消。しかし、当時の親会社であったトラステックスホールディングスが2000年10月の大阪証券取引所2部上場以前から不正会計や虚偽の決算報告書を作成していたことが判明し、さらに有価証券報告書の虚偽記載が発覚したため、大阪証券取引所は2009年2月にトラステックスホールディングスの上場廃止を決定。その後もトラステックスホールディングス自体の経営が悪化していたことから、2011年2月に、軽貨急配および軽貨急配シーエスの全株式をBy-Qホールディングスへ譲渡http:www.tsr-net.co.jpnewsflash1210677_1588.htmlTSR速報タイガー管理（株）東京商工リサーチ2011年4月20日。2012年1月1日、'''株式会社Q配サービス'''に社名変更。2015年6月16日、運送業務の外部委託料に消費税増税分の上乗せをしなかったとして、公正取引委員会から、支払いなどを実施するよう勧告を受けたhttp:mainichi.jparticles20160617ddn041020012000cＱ配サービス税３％分未払い、防止勧告　公取委毎日新聞2016年6月17日http:www.q-hai-service.co.jpcorporateinformationinfo_160616.html公正取引委員会による勧告についてQ配サービスニュースリリース2016年6月16日。2017年4月1日付で、株式会社ロジクエストへ吸収合併された。
