3800,*1933年(昭和8年)　-　東京事業社として創業。*1962年(昭和37年)　-　三菱文具株式会社を東京都文京区に設立、文具量販専門商社として発足。*2014年(平成26年)　-　妙高コーポレーション株式会社に社名を変更。*2017年(平成29年4月)-プラス株式会社グループの一員となる。
3800,家庭用を中心とした水栓を中心に水周り製品の企画から販売までを行う。その他シャワーのヘッドや便所|トイレ用温水洗浄便座や、造園|ガーデニング用散水ノズルなども製造している。同社の製品である「Kiwitap」は2007年グッドデザイン賞を受賞している。また日本国内及び国外のバー(酒場)|バーやレストランの店内の内装を手掛けていることで知られる森田恭通とのコラボレーション製品も存在する。
3800,前職場の廃業に伴い、2002年に創設。http:digital.asahi.comarticles2listlist_midorikawakenji.html〈仕事のビタミン〉緑川賢司・ミナロ社長「情報発信、BtoC、連携連帯」をキーワードに、中小製造業の世界で、いち早くブログやSNSを取り入れ、顧客数を1000倍にした。地域の子ども達へ、体験彫刻などのワークショップを開催http:www.navida.ne.jpsangyocomenttodaykoten0724.html「立体」を強く意識、教科書で勉強するより、モノを作ってみる。～ケミカルウッド壱番店様、小学生を迎えてのサマースクール開催～、将来の技術者候補のきっかけを作っている。2012年に『全日本製造業コマ大戦協会|全日本製造業コマ大戦』を立ち上げ、2015年2月には『世界コマ大戦』http:biz-journal.jp201503post_9397.htmlひとりの男が大企業優遇の日本を変える！外務省も後援、世界中の中小製造巻き込みに成功！を開催し、7カ国の海外チームが参戦する等、世界を巻き込む一大プロジェクト事業に発展した。
3800,創業者の深尾茂が1946年に大阪で、敗戦からの復興を目的として設立された合板製造業が始まり。1950年には日本で最初のプリント合板を製造し、戦災で住宅を失った人々に、新たな住宅を普及させた。このため同社は木材製品に強いことでもその名を知られる。その後1960年代には事業を拡大、組み立てハウス事業（この分野ではいち早く大和ハウス工業が足を踏み入れていたため、のちに撤退せざるを得なくなる）やモーターボート販売などの事業に乗り出す。当時地震に強い住宅「永大ED工法ハウス」を発売してヒット商品となるが、不採算事業を多数抱えていたことや、撤退するタイミングを逃す間に経営状況が悪化、1978年に会社更生法を申請、1800億円の負債を抱えて倒産。以後はフローリング|床材やシステムキッチンなどの製造・販売を軸に事業を進める。1970年代にはTBSテレビ|TBS系の「時事放談」の番組スポンサーをつとめていたこともある。なお、かつて存在した玩具メーカー「永大（現在は倒産）」とは資本・人材を通じて、関連性は一切ない。2011年12月28日、33年ぶりに東証一部に指定された。
3800,油絵具やアクリル絵具、水彩絵具|透明水彩絵具、ガッシュ|不透明水彩絵具、ドローイングインク等を製造している。1985年より彩色を必要とする作家を対象に「ホルベイン工業#奨学制度|ホルベイン・スカラシップ」を発足させるなど、メセナ活動をする企業でもある。また、アートに関する総合リンクサイト・情報サイトである「ホルベイン・アーチストナビ」を運営している（下記外部リンク参照）。
3800,童友社は、創業者内田一雄により、1951年に荒川区三河島町で有限会社として設立された。当初は紙製玩具の製造を行っていたが、1962年にプラモデルの製造を開始し、1964年にプラモデル専業メーカーとなった。1978年には旧・相原模型の金型を引き継いで日本の名城シリーズの販売を開始し、1990年頃より旧・日東科学教材|日東科学製の旅客機シリーズ、1992年には山田模型の金型を中心とした「ノスタルジックカーシリーズ」の販売を開始した。1996年に株式会社への改組を行った。2000年代初めの食玩ブーム時に発売した塗装済みプラモデルの「翼コレクションシリーズ」は、2011年現在でも新作の作られる人気シリーズとなっている。同社のラインアップは城|名城・名車などのプラモデルから収益性の高いラジコン、ミニチュアサイズの完成彩色モデルや食玩などである。また近年はアジアの模型メーカーの輸入代理店として、ミリタリーモデルなどの輸入販売を手がけている。
3800,1882年（明治15年）、'''北村商店'''として創業。1970年代後半の「ハマトラ(ファッション)|ハマトラ」ブームもあり、横浜元町ブランドとして、地元では高い知名度を誇る。1989年（平成元年）以降は全国展開を開始し、2010年末で、国内に32店舗を構える。
3800,剣道やなぎなた用の防具(剣道)|防具を中心に剣道衣・袴ならびに竹刀の製造、その他空手衣を製造販売している。個人商店クラスの武道具製造企業が多い中で、同社は居合で使う居合刀の製造や、日本式甲冑の製造販売も行っており、海外に住む日本刀収集家からの評判が高い（同様に日本刀も製造販売ならびに古い刀の保存愛護も行っている）。関西地区を地盤としており、大阪は梅田にある大阪駅前第2ビルと富国生命保険|富国生命ビル、京都旧武徳殿前と谷町9丁目に店を構えている。以前は大阪・梅田の阪急イングスに店舗を置いていたが、日本刀を扱っていることから、防犯上の問題が生じたため、富国生命ビル内に店舗を移転した。*本社・本店：大阪府大阪市天王寺区六万体町1-32*梅田店：大阪府大阪市北区梅田1番地大阪駅前第2ビル2F*京都店：京都府京都市左京区聖護院円頓美町44-6京都旧武徳殿前*谷九店：大阪府大阪市天王寺区生玉町9-21
3800,*「チラシ」、「カタログ」、「書籍・雑誌」、「フリーペーパー」、「地図」、「教科書」、「ダイレクトメール」、「PRツール（会社案内・封筒・紙袋・クリアファイル・カレンダー等）」、「店舗ツール（ポスター・POP・看板・のぼり等）」、「紙包材（パッケージ・紙器・包装紙等）」の総合印刷を行う。*「国内最大規模の輪転印刷工場」や、「パッケージやPOPの印刷・組立を行う枚葉印刷工場」、「DMの印刷加工・封入・発送代行をワンストップで行うDM専門工場」を主要な拠点とする。*他社に先駆け、印刷の全工程デジタル化を達成した。*省エネ設備の開発など、環境への取り組みに力を入れている。
3800,主に若狭塗箸をはじめとして工芸品、キッチン用雑貨品、文房具の製造・販売を手がける。若狭塗箸は、新聞・テレビ・雑誌で紹介されることも多い。同社製の箸は直営店「にほんぼう」をはじめ、全国有名百貨店、オンラインショップ等で購入することができる。
3800,"旧第一勧銀グループの一員であり、2017年3月末に撤退予定name\"":0\""http:www.ksustech.co.jpirpdfinfo20160927.pdfマッチ製造販売事業からの撤退に関するお知らせ、兼松日産農林株式会社、2016年10月1日閲覧。ではあるが、マッチの製造でも有名である。また、以前は合併会社の旧・兼松デュオファストが手掛けていた工作機械（ネイルガン|自動くぎ打ち機）事業も手掛けていたが、同業大手のマキタへ事業譲渡している。"
3800,1933年（昭和8年）に浜松市で、技術者の石川隆巳と、財務担当の大谷藤四郎が「三葉楽器製作所」としてピアノ作りを始めた{{citeweb|author長坂之義|urlhttp:www.toyo-piano.co.jpapolloshachou1401002335.html|title東洋ピアノの歴史（東洋ピアノ社長のブログ）|publisher東洋ピアノ製造|date2014-01-15|accessdate2014-11-02}}。1948年（昭和23年）6月、東洋ピアノ製造株式会社として資本金100万円で設立。自社ブランドのAPOLLOピアノ製造の他、株式会社ピアノギャラリーを通じてスタインウェイ・アンド・サンズ|スタインウェイピアノの正規特約店として販売事業も手掛けている。また、日本ピアノグレード認定協会（PIARA）を通じて、PIARAピアノコンクールやPIARAピアノグレードの運営を行っている。
3800,創業者の依田友一により、第二次世界大戦後間もない銀座で、1947年にレストランとして創業される。しかし当時の日本人の平均月収が5000円にいかない時代に、フルコース料理を1000円で提供していたため、開店後半年余りで、東京都|都が施行した条例（75円以上のメニューの禁止）に伴い、製菓部門のみを残し、喫茶店として再出発する。多数の文化人が集う喫茶店として人気を博すと共に、その後1950年代は大型の蓄音機を設けるなど、銀座という一等地で、コーヒーや菓子以上に、「文化」を提供するサロンとしての役割を果たすと共に、今日までクラシックなスタイルを維持し続けていることで知られる。また同社の代表的製品のドライケーキは、1960年代からの主力製品として、贈答用に多数用いられており、パイ、クッキーのみならず、喫茶店のみではあるがショートケーキやシュークリームなどもメニューとして、加わっている。1967年には青山(東京都港区)|青山に喫茶店をオープンさせ、その後も目黒(目黒区)|目黒2013年3月31日閉店。や原宿当時入居していたビルの老朽化に伴い、2003年に閉店した。にも店を構える。また都内の各百貨店にも売店が設けられている。創業当初から「真面目な味を心がけています」との社是の元、関東地域限定で今日まで一貫した経営を続けている。
3800,1946年11月1日に佐々木恭三が京都市下京区に運動具店を創業。のちに1950年に大阪市中央区(大阪市)|中央区松屋町に移し、社名を「株式会社佐々木恭商店」と改める。1956年に「佐々木株式会社」（佐々木スポーツササキスポーツ）に社名を変更、1972年に現在地の上本町に本社を移す。1983年に創業者・佐々木恭三死去。1987年に現社名に変更。社名のエスエスケイは、創業者・佐々木恭三の名字|苗字をローマ字に直した「'''S'''a'''S'''a'''K'''i」から来ている。ミズノと同様、野球用品を主力として製造・販売を手がけ、プロアドバイザリースタッフとしては、元阪神タイガースの村山実、元読売ジャイアンツの柴田勲を皮切りに、現在は幅広いプロ野球選手とのプロアドバイザリースタッフ契約を結んでいる。また、2005年からはプロ野球セントラル・リーグ審判部とも、審判服・審判用具の契約を結んでいる（パシフィック・リーグはミズノと契約。2003年までは両リーグ審判部は、ミズノと契約をしていた。）野球以外のスポーツ用品では、デンマークに本拠を置くサッカー用品の「ヒュンメル」やドイツに本拠を置くアウトドア用品の「ショッフェル」の国内総代理店として商品を取り扱っている。鈴与グループのSSKとの関連はない。
3800,1883年（明治16年）に大阪市西区阿波座にて「増田孔官堂」として創業される。今日まで線香の製造を専業としており、竹取物語|かぐや姫マークの登録商標でその名を知られる。同社を代表するブランド、「仙年香」（1904年発売）、「松竹梅」（1930年発売）、「蘭月」（1923年発売）は、それぞれが世代を超えて広く愛されているベストセラーブランドであり、同社の販売する線香は「香りよい、使いよい、こころ温まるお線香」としてその名を知られている。{{出典の明記|date2016年9月}}また、一貫してお線香の技術革新にも取り組んでおり、生活習慣の変化に合わせた、「けむりの少ないお線香」「灰が少なく、散らばりにくいお線香」等の開発を行っている。1990年代までTBSテレビ|TBS系で、昼前に放送されていた「JNNニュース」「JNNニュース1130」でも1992年の放送開始から半年間スポンサーとして、また秋田県と福井県では、別番組でもスポンサーを担当していたことがある。を中心に民放の番組で、人形アニメ|人形アニメーションを使ったコマーシャルメッセージ|CMを制作・放映していた。
3800,元々は東京都台東区上野にあった材木店「松田材木店」が、1957年に流山市内に卓球台製造工場をつくったのがはじまりである{{Citeweb|date2012年8月23日|urlhttp:www.city.nagareyama.chiba.jptourism58001867.html|title昭和の産業史その2|publisher流山市|accessdate2015-04-29}}。その後、1962年に卓球台部門が独立してできた企業が三英である。現在においても、国内における卓球台製造のシェアの7割を占めており{{Citepressrelease|titleオフィスで卓球ができる1台2役のマルチテーブル「ピンポンワークテーブル」新発売|publisherプラス(企業)|プラス|date2015年1月26日|urlhttp:www.plus.co.jpnews150126.html|accessdate2015-04-29}}、夏季オリンピック（1992年1992年バルセロナオリンピックの卓球競技|バルセロナ、2016年2016年リオデジャネイロオリンピックの卓球競技|リオhttp:www.asahi.comareakanagawaarticlesMTW20160408150130002.html【アスリートを支える】青い卓球台復興願って-朝日新聞2016年4月8日http:www.sanei-net.co.jpnews?tag%E3%83%AC%E3%82%B8%E3%83%A5%E3%83%96%E3%83%AB%E3%83%BCHomeTagsレジュブルー-三英(SAN-EI)ニュース、2020東京http:world-tt.comps_infops_report_detail.php?&pgHEAD&pageBACK&bn000001&rpcdno2113#21132020東京五輪の卓球台が三英に決定-卓球王国WEB、2016年10月1日閲覧）や、世界卓球選手権等といった国際大会での使用実績も多い。卓球台の他にも、公園等で設置されている遊具などを製造販売する企業。ジャングルジムや滑り台といった一般的なものから、健康遊具まで多岐にわたって企画製造されている。スポーツの分野でも、卓球以外で跳び箱・マット、水泳用コースロープや、フィットネスマシンなどといったスポーツ用品などの取り扱いも多くなっている。特に2005年に発売された遊具「プライムコンビ」は構成パーツを組み立てるタイプの遊具として、高い評判を得ている。2015年11月、日本体育産業株式会社（本社：長野県長野市）の全株式を取得し、関連会社としたhttp:www.sanei-net.co.jpnews?p2328日本体育産業（株）の株式取得について-三英(SAN-EI)ニュース。
3800,1941年に長谷川勝呂が創業した木製模型メーカーの「長谷川製作所」を前身とする。飛行機・自動車・艦船などのスケールモデル、キャラクターモデルおよび鉄道模型を生産している。「'''飛行機のハセガワ'''」として知られている。静岡県焼津市八楠に本社が所在する。本社の屋上にF-104(戦闘機)|F-104が、玄関前にT-3(練習機)|T-3が展示されている。
3800,プラモデル、ガレージキット、フィギュアの製造、卸売、小売販売会社。そのほかエアブラシ、レジンキャスト、シリコーンゴムなどといった工具や造形材料の製造販売も行っている。「WAVE」と表記されることも多い旧ロゴは「WaVE」という小文字とも大文字とも付かないデザインで、現ロゴは「wave」と小文字表記になっているが、そういった事情とは無関係にこう呼ばれる。。ガレージキットメーカとして初のインジェクションキット（いわゆる普通のプラモデル）の製造を行っている。完成品キャラクターフィギュアとして「トレジャーフィギュアシリーズ」と「TFCBEACHQUEENSシリーズ」の2種類を展開しており、方針としてコレクションに適したサイズ（主に110サイズ）と価格（主に4000円前後）で提供している。特に、「TFCBEACHQUEENSシリーズ」は水着の美少女フィギュアに特化したシリーズで、ヒロインの水着姿が登場した作品（『けいおん!』など）はもちろん、水着とは全く縁がない作品（『魔法少女まどか☆マギカ』など）まで製作されている。
3800,平塚の釣り具店であるアングラーズクラブ・ライズが母体となって誕生したメーカーで、当初はライズ店長の原田佐敏が代表取締役に、そしてライズの店員であった島津靖雄がロッド部門であるパームスブランドのチーフデザイナーに、メゾンの飯田重祐をルアー部門であるアンレースのチーフデザイナーに迎えいれた。当初はライズオリジナルとして展開していたが、1988年にアングラーズリパブリックを立ち上げる。当初はTEAMRISEの河辺裕和が代表を務めるゲーリーヤマモトカスタムベイツから発売されていたが、その後、ルートフィッシング(東日本)と谷山商事(西日本)に発売元を変更し、1994年に自社で販売を行うようになった。ロッドに関しては、原田佐敏が代表取締役を務める2006年まではダイコー(釣具)|ダイコー製爆釣chなどの国産ブランクに拘っていたが、松下久洋に変わってからは中国製のロッドも増えてきている。また、ジギングロッドの02グランドスパイからは沼田純一が、ジェイドミラーや04ギャラリーのX4モデルやVグラスモデルからは飯田重祐もロッドデザイナーに加わった。Lookat!Vol.25一方、島津靖雄はテーパーアンドシェイプ立ち上げ後もしばらくの間はアングラーズリパブリックのチーフロッドデザイナーとしてロッドデザンに参加していた。2018年10月1日、社名をパームスに変更した。
3800,製品の規格は、Nゲージ・HOゲージなどが主流。金属製キットが大半であるが、一部はプラスチック製の製品もある。製品化される形式は、私鉄車両が中心で、中でも江ノ島電鉄|江ノ電や東急玉川線|玉電、都営地下鉄などを多く製品化している。また近鉄23000系電車の製品化もしていた。
3800,機械式キャッシュレジスターを生産していたアスター精機から独立して設立された模型メーカーである。神奈川県横浜市緑区(横浜市)|緑区に本社を置き、蒸気機関模型であるライブスチームを生産している。
3800,1897年（明治30年）、博文館主の大橋佐平が自社の書籍・雑誌を印刷するために創設した博文館印刷工場が前身。1925年（大正14年）、美術印刷中心の精美堂との合併により共同印刷株式会社となった。出版印刷・商業印刷を主軸に、紙器やチューブなどのパッケージ、ビジネスフォーム、ICカードなども手掛けている、従来から総合印刷業としては1位大日本印刷、2位凸版印刷に次ぐ第3位と長らく言われていたが、現在はトッパン・フォームズ、日本写真印刷に次いで業界5位。近年は、デジタルコンテンツの制作や、データプリントサービスを核にしたBPO業務、医薬・産業資材など、印刷技術を応用して新しい製品・サービスを生み出し、各種分野に進出している。かつては労働運動も盛んで、徳永直『太陽のない街』のモデルとなったことでも有名。また『週刊少年ジャンプ』（集英社）など多くの漫画雑誌の印刷を手がけており、その関係から2003年にはコミック向け電子組版システムとして『ComicPacker』を自社開発しているhttp:www.jagat.or.jppast_archivescontentview5428.htmlコミックの電子化と出版の変遷-JAGAT・2014年2月3日。
