3750,*創業日：1995年（平成7年）11月10日*資本金：1億5000万円*従業員：30名*代表者：新英和（代表取締役社長）*所在地：東京都大田区平和島5丁目6番地1号*主要製品：光学薄膜製品の設計・開発・製造　及び販売
3750,村田製作所の生産子会社。リード付きコンデンサ、EMI除去フィルタの製造の他、同じ村田製作所の生産子会社である出雲村田製作所からチップコンデンサの包装・出荷業務を受託している。近年、コンデンサ以外のチップ部品にもリード線を取り付けて付加価値を向上させる、リード加工ビジネスにも注力している。
3750,ブラザー工業の持分法|持分法適用会社で、1940年（昭和15年）1月に当時の日本ミシン製造株式会社（現・ブラザー工業株式会社）の協力工場として創業。1950年（昭和25年）に組織変更し昭和精機株式会社となった。1997年（平成9年）には株式会社エクシングより証明書自動交付機の開発・製造権を翌年の1998年（平成10年）には営業権を譲り受けている。
3750,*企業名　オプトウエア株式会社*沿革　1998年（平成10年）11月　設立*代表者　代表取締役　菊地弘*資本金　3300万円*本社所在地　栃木県足利市芳町50
3750,血圧計、心拍計、パルスオキシメーターなどの医療機器を幅広く開発・販売している。主力製品は血圧計であり、とくに家庭用血圧計に関しては輸出も多い。パルスオキシメーターは、新規の市場参入ながら2006年にグッドデザイン賞を受賞し、国内の市場を拡大した。光学精密機器では、カメラ用の絞り（アイリス）関連機器が主力製品。群馬県の他、中国およびインドネシアに海外工場を持つ。また、輸出対策として、中国およびドイツに販売拠点を有する。
3750,*1996年5月、設立。*2015年7月、破産手続きhttp:kanpou.makelog.net20150729h27n170-30倒産情報公告資料室*2015年12月、閉鎖https:robins.jipdec.or.jprobinserence_DetailAction.do?robinsKey01346088457008サイバー法人台帳
3750,2013年7月1日、親会社であるシチズンホールディングス（現：シチズン時計）は、自社時計生産能力の国内強化を図るため、それまで国内各地の関連会社でバラバラに行われていた時計部品の製造・組み立てを一元的に運営する企業として、2007年に事業子会社として継承分離したシチズン時計株式会社（2016年にシチズンホールディングスへ吸収合併）の時計製造関連部門と国内主要時計製造グループ企業5社（シチズン平和時計、シチズンマイクロ（旧会社）今回の事業再編により「シチズンマイクロ株式会社」における精密機器製造等の分野は、同社の主要子会社であった「株式会社コマテック」が「シチズンマイクロ株式会社」に商号変更し事業継承している。、シチズン東北、シチズン時計ミヨタ、シチズン時計河口湖）を統合して設立した。スローガンは'''「世界一優良なる時計製造工場の実現！」'''で、スイスなどの海外高級時計グループが渦巻く国際社会において長期に渡って培ってきた高い技術力と品質に経営資源を集中させることで対抗しうる競争力の強化を見込んでいる。
3750,主に、親会社のエイビットが製造・開発した独自の企業向けIP電話セットなどを販売していた。2010年9月まではコンシューマ向けとしてウィルコムの通信モジュール、W-SIMのRX420AL・RX430ALの販売・サポートも手がけていた。現在は、上海市にグローバル事業統括拠点、摂津市に日本国内拠点を設置している。日本国内では、法人市場へIP-PBX等が不要なP2P対応のSIP-IP電話機、また文教市場へキッズ救急という学校放送と連携した緊急通報システムを営業展開している。なおキッズ救急は京都市238校5000教室以上へ導入実績を持っている他、多くの自治体へ導入実績がある。上海市のグローバル事業統括拠点は中国市場への進出が目的と見られるが、現状実績は見られない。
3750,複写機、プリンターなどに使用する乳化疑集製法トナー（EAトナー）を製造販売している。工場は早月川と富山県道138号栗山追分線に挟まれるように位置しており、総合工場棟であるX棟と、EA棟を3棟置く。
3750,2004年に筑波大学教授の山海嘉之によって設立された{{Citeweb|urlhttp:www.cyberdyne.jpcompanyindex.html|title会社情報-CYBERDYNE|publisherサイバーダイン株式会社|accessdate2011-01-25}}。HAL(パワードスーツ)|HALを製造していることで知られる。これは、装着することによって身体機能を拡張・増幅・補助することができる世界初のサイボーグ型ロボットであり、製品としてレンタル方式およびリース方式でのみ提供されていた{{Citeweb|authorCharlieSorrel|date2011-01-11|urlhttp:wired.jpwv20110111%E6%97%A5%E6%9C%AC%E3%81%AE%E3%83%91%E3%83%AF%E3%83%BC%E3%83%89%E3%82%B9%E3%83%BC%E3%83%84%E3%80%8Ehal%E3%80%8F%E3%80%81ces%E3%81%A7%E3%83%87%E3%83%A2%E5%8B%95%E7%94%BB|title日本のパワードスーツ『HAL』、CESでデモ|publisherWIRED.jp|accessdate2011-01-25}}。これは山海が「今はまだ黎明期の技術で開発の進化が早いため、購入した製品がわずか1～2年で旧機種扱いになるのはユーザーに申し訳ない。」と考えており、またレンタルだと提供した全製品を自社で管理出来るため新機種への移行も比較的容易で、どのように使われているかも把握しているため、悪用への抑止効果もあるという。平成27年11月、厚生労働省はHALの製造・国内販売を承認したhttp:www.nikkei.comarticleDGXLASGG25H3T_V21C15A1EA1000筑波大発ＶＢの装着型ロボ、医療機器に初承認http:www.yomidr.yomiuri.co.jppage.jsp?id126969歩行助ける装着型ロボット「ＨＡＬ」、製造販売を承認。
3750,輸出を含めた歯科用レントゲンの国内生産台数でシェアトップであり、2007年6月期の売上高は約44億円、経常利益は2億5000万円だった{{citation|urlhttp:business.nikkeibp.co.jp:80articlepba20090313189019|title【日本を救う小さなトップランナー】朝日レントゲン工業（歯科用レントゲン撮影装置の製造）}}。
3750,役物をはじめとする遊技機用の各種合成樹脂|プラスチック製品等のデザイン・設計・開発・製造、販売を行っているほか、健康食品などを扱うウェブサイト「ジャスティーワールド」の運営も行っている。なお、社名の”日本”は「にほん」と読むが、英称では「NIPPON」としている。
3750,*アメリカ合衆国ニューヨーク州ロチェスター(ニューヨーク州)|ロチェスターに本社を置くBausch&LombInc（ボシュロム　インコーポレッド）の日本法人。*スローガンは、“確かな視界で快適な暮らしを(PerfectingVisionEnhancingLife.)”*Bausch&LombIncは、アメリカ合衆国フロリダ州で開催される女子テニスのボシュロム・チャンピオンシップ（Bausch&LombChampionships）の大会パートナーでもある。*中核製品は、メダリストブランドを擁するソフトコンタクトレンズ。
3750,"フィリップスの分析機器部門が2002年にSpectrisに買収され、X線回折（XRD）と蛍光X線（XRF）による分析装置を製造、販売する。アルメロとイギリスブライトンのサセックス大学に研究拠点を構え、オランダの2箇所に生産工場と教育センターを設置しているname\""jaimadirectory\""{{citeweb|urlhttps:www.jaimadirectory.jpmaker_disp.php?code112|titleパナリティカル（スペクトリス（株）PANalytical事業部）|accessdate2016-12-20}}。"
3750,"時計技師のSamuelSmithによって1851年に設立されたname\""沿革\""。同グループは、ジョン・クレーン、スミス・メディカル、スミス・ディテクション、スミス・インターコネクト、フレックス・テックの5つの部門から構成される企業で{{Citeweb|last|first|titleSMITHSGROUPPLC（スミスグループ）|publisher|journal|date|volume|pages|urlhttp:www.alamco.co.jpcolumnavesteindex-id72.html|accessdate2017-02-22}}、現在ではM&Aによって数々の分析機器メーカーを傘下に収め、医療機器や爆発物探知機、計測器等を手がける世界有数の企業グループを形成する。1980年代に売却するまでオドメーターや速度計等の自動車用の計器類も製造していた。ロンドン証券取引所（LSE）に上場する銘柄のうち時価総額上位100銘柄で構成される、時価総額加重平均型株価指数であるFTSE100種総合株価指数にも選定される"
3750,"2004年にニュージーランドで設立された。name\""沿革\""。ドイツのアーヘン工科大学、ニュージーランドのマッセー大学、ヴィクトリア大学ウェリントンの研究チームによって初期の技術と知的財産が開発された。永久磁石式核磁気共鳴分光計Spinsolveが主力商品。"
3750,"|資本金10百万円name\""概要\""|発行済株式総数|売上高10億5800万円（2015年度）name\""概要\""|営業利益|経常利益|純利益|純資産|総資産|従業員数36名name\""概要\""|支店舗数|決算期|会計監査人|所有者|主要株主スズケン|株式会社スズケン100%|主要部門|主要子会社|関係する人物|外部リンクhttp:www.kenzmedico.co.jp|特記事項}}'''ケンツメディコ株式会社'''（KENZMEDICO）は埼玉県本庄市に本社を置く医療機器メーカーである。大手医薬品商社スズケンの子会社。世界初のステレオ聴診器「ステレオフォネット」やラパポート聴診器である「マルチスコープ」などを販売する。"
3750,コンピュータ用メモリモジュールの製造に特化し、日本国内で設計・製造をしている。高い精密加工技術や品質基準による高品質で高信頼性のメモリモジュールの製造を得意としており、高級なパーソナルコンピュータ|PCで採用される。また、Macintosh用のメモリも多くラインナップしており、幅広い製品に対応するメモリモジュールを製造している。搭載されるメモリチップはハイニックス半導体|ハイニックスやサムスン電子|サムスン、エルピーダメモリ|エルピーダ、マイクロン・テクノロジ|マイクロンなど多岐にわたる。
3750,新日本製鐵のLSI事業部が元々行なっていたRFID事業を吉川工業が引き継ぎ、RFIDチップおよび関連製品の設計・製造・販売を目的として1999年に設立した。2012年10月に「吉川セミコンダクタ株式会社」に吸収合併され、吉川アールエフセミコン|株式会社吉川アールエフセミコンに社名変更した。
3750,元は金物行商から始まったが、直角精度を持った鉄工スコヤの製造を皮切りに測定工具の品種を増やしていった。その後日曜大工用品の製造を開始し、金物店やホームセンターを取引先としたDIY業界にも進出。1987年にはレベルポイントS・Mがグッドデザイン賞を受賞した。その後ピラーズキャッチも受賞した。測定工具の精度管理に伴う校正サービスの事業も行っており、ピンゲージ業界では初めてJCSS校正事業者に認証登録された。
3750,同社は1990年に大判カメラ市場に参入した。組立暗箱ではない大型ビューカメラは商品撮影や建築撮影を専門とする業者以外はあまり使用しないため規模の小さな市場であり、いわばすでに飽和状態であって新規に参入するメーカーはほとんどなく、不況時の参入は業界関係者を驚かせた。最初の製品はFC-45Aで重量が1.1kgと軽量であるのがセールスポイントである。その後8×10in判のFC-810、5×7in判のFC-57、あおり(写真)|アオリ機構を排してさらに小型軽量化したFC-45miniを製作。また以前より高級オーディオ用レコードプレーヤー#構成|トーンアームを製作している。
3750,宮崎県の誘致企業として、1984年7月に吉川工業と宮崎沖電気（現ラピスセミコンダクタ|ラピスセミコンダクタ宮崎）との共同出資により「'''吉川セミコンダクタ株式会社'''」として設立された。1997年8月には、日本国外での生産拠点として、インドネシアのビンタン島に関連子会社'''PT.YoshikawaElectronicsBintan（ヨシカワエレクトロニクスビンタン）'''を設立した。2012年10月に吉川アールエフシステムを吸収合併し、株式会社吉川アールエフセミコンに社名変更した。
3750,まだ、「デジタル」という言葉すら、それほど日本の社会では馴染み深くはなかった1972年（昭和47年）。『デジタル技術を利用した優れた製品を世に送り出し、社会に貢献したい。』そのような思いから設立された会社が「デジタル電子株式会社」であった。以来、今日に至るまで産業用機械を開発・販売し続けている。みどり会の会員企業であり三和グループに属しているhttp:www.midorikai.co.jpmember.htmlメンバー会社一覧-みどり会。
3750,人工透析|透析、血管造影、輸液等に用いられる血管用カテーテルの開発・製造・販売を行う企業である。
3750,東日本旅客鉄道や埼玉新都市交通などの鉄道車両及び車両基地設備に関する設計・メンテナンス・（総合車両製作所総合車両製作所新津事業所|新津事業所において）車両製造などを行っている。メンテナンス業務では静態保存機などのアスベスト封じ込め・除去業務も行っている。
3750,環境、食品、化粧品、医薬品など様々な分野の分析で使用されているガスクロマトグラフ・高速液体クロマトグラフィー|液体クロマトグラフの関連装置・消耗品の製造・販売を行う。http:www.gls.co.jpbrochuregeneral_index.htmlクロマトグラフィー業界の総合技術企業。クロマトグラフィーに係る製品の企画・開発から製造・販売・メンテナンスまで自社で一貫した提供システムを行っている。ジーエルサイエンスグループの社員は『創立の根本精神及経営理念』を基とし、真に社会性のある企業への成長をめざし、「社会に対し社会性を十分発揮してその存在価値を高め、社員個々の幸福を勝ち取り、企業の維持、発展をならしめ、そこから得られた技術や利益を株主、社員、社会に公正に分配する」ことを基本理念とし、創立以来の永久スローガンである【'''道は一つ、共に進もう'''】を合言葉に行動している。社長メッセージhttps:www.gls.co.jpcompanymessage.htmlより引用
3750,1990年（平成2年）4月2日にパソコンソフトや事務機器を開発・製造する会社として設立され{{Citeweb|date1990-03-06|urlhttp:www-06.ibm.comjppress199003065.html|titleオフィス・ソリューション開発で新会社『株式会社ライオス・システム』設立|publisher日本アイ・ビー・エム株式会社|accessdate2018-02-16}}、IBMなどへノートパソコンを供給していたが、1999年（平成11年）3月31日に解散した{{Citeweb|date1999-04-04|urlhttp:www.nikkeibp.co.jparchives05454790.html|title役割終えたライオス・システムが解散|publishernikkeiBPnet|accessdate2018-02-19|archiveurlhttp:archive.fo5UoTO|archivedate2013-05-01}}。事業はリコーおよびその関連会社が引き継いだ{{Citeweb|date1999-04-01|urlhttps:pc.watch.impress.co.jpdocsarticle990401rios.htm|title「チャンドラ」のライオス・システム、会社を清算・解散|publisherPCWatch|accessdate2018-02-16}}。
3750,1955年『'''株式会社リリー商会'''』として創業。1989年に現社名となる。清拭綿・お産用ナプキンなど衛生材料消耗品の製造販売や、病院からの滅菌処理の委託業務も行っている。特に、1960年に開発したお産用ナプキンは日本で最初に開発・製品化した。ベビー用品レンタル事業を1982年より新潟県内のみ展開、内祝いギフトの販売も行う。
3750,『SEED』ブランドのコンタクトレンズ、コンタクトレンズケア用品の製造販売、眼鏡レンズ・フレームの製造販売を行っている。2017年（平成29年）3月期の連結売上構成は、コンタクトレンズ・ケア用品事業95.0%、眼鏡事業3.6%、その他1.3%となっている。日本で初めてコンタクトレンズの研究を行った「東京コンタクトレンズ研究所」を母体としている。1962年（昭和37年）に「マイコン」（マイ・コンタクトレンズの略）としてブランド化。これは、1970年（昭和45年）に開かれた日本万国博覧会|大阪万博のタイムカプセルに収められている。更に1972年（昭和47年）には「マイコンソフト」と銘打ったソフトタイプコンタクトレンズを、1984年（昭和59年）には「マイコンハイO2」という酸素透過性ハードタイプレンズを市販した。1985年（昭和60年）、シードコンタクトレンズ研究所の設立に伴いブランド名を現在の「'''シード'''」に変更。社名も1987年（昭和62年）にそれに変更された。更に1992年（平成4年）には煮沸消毒のいらないソフトレンズ「コンセプトF」を新発売した。近年では一定期間（1週間-1ヶ月程度）の使いきりタイプのコンタクトレンズも発売されている。1993年（平成5年）から眼鏡事業を開始。特に2000年（平成12年）には、松雪泰子が企画・プロデュースした「VividMoon」という眼鏡ブランドを開拓した。2004年（平成16年）に、国産初となる2週間使い捨てソフトレンズ「シード2weekPure」を発売した。また、2009年（平成21年）には、国産初の1日使い捨てソフトコンタクトレンズ「シード1dayPure」発売した。なお、京都府京都市にあるシード平和|シード平和株式会社（建築会社、旧名：株式会社シード）、大阪市都島区にあるシード(文具)|株式会社シード（消しゴムメーカー）とは別会社で資本関係などはない。
3750,*1968年（昭和43年）1月26日に、茨城県那珂市菅谷に設立。*資本金は3億円（株式会社　ニコン100%出資）。*従業員数：183名*工場敷地：敷地面積　30025.87平方メートル（福利厚生施設含む）*売上高：約68億円（平成16年度実績）*ISO9000|ISO9001、ISO14000|ISO14001認証取得
3750,1957年、並木精密宝石株式会社（なみきせいみつほうせき）から分離独立。時計の軸受宝石販売からスタート。その後製造も開始し、受石・穴石・振石・爪石の4種類全てを世界で初めて製造。また、軸受宝石の押出成形技術と研磨技術から、1980年には、光通信部品のフェルールの生産も開始。1990年後半には世界のトップシェアーに至る{{Citeweb|urlhttp:www.ktc-densen.comhtmlShinbunbacknumber20130610.html|titleアダマンド工業　光フェルール2ケタ増で推移（出荷ベース）|publisher電線新聞|accessdate2013-06-10}}。2018年（平成30年）1月1日、親会社の並木精密宝石株式会社に吸収合併され、アダマンド並木精密宝石|アダマンド並木精密宝石株式会社となった。アダマンドという社名の由来は、硬いものを加工することを得意としたため、「非常に固い」、「堅固無比のもの」を意味するADAMANTから。
3750,その名の通り、モノを壊さずに欠陥・異常を検出する業務を主におこなう。近年では異常の検出よりも、異常に対する原因究明に関連する業務が多くなっている。また近年では耐震偽装問題に絡んで、コンクリート製の建築物に関する内部調査・劣化を調べるという案件も多い。もともと日経産業新聞に広告を多く出稿していたこともあって、発行元の日本経済新聞社ならびにテレビ東京系列局との関係が深く、テレビ大阪製作テレビ東京系の単発番組の提供スポンサーになることも多い。みどり会の会員企業であり三和グループに属しているhttp:www.midorikai.co.jpmember.htmlメンバー会社一覧-みどり会と同時に大輪会の会員企業であるhttp:izumisano-kyuryo.jpdairinkai大輪会（だいりんかい）とは-http:izumisano-kyuryo.jp泉佐野丘陵緑地公式サイト内のページ。。
3750,"|資本金3億7610万円name\""公式概要\""|発行済株式総数|売上高|営業利益|経常利益|純利益|純資産|総資産|従業員数35人（2017年11月現在）name\""公式概要\""|支店舗数|決算期|会計監査人|所有者|主要株主|主要部門|主要子会社|関係する人物|外部リンクhttps:logbar.jpjaindex.html|特記事項}}'''株式会社ログバー'''（英：LogbarInc.）は日本のベンチャー企業。"
3750,ublisher東京航空計器株式会社公式サイト|accessdate2015-11-16}}を始める。*1938年（昭和13年）-東京府北多摩郡狛江村#年表|狛江村に社員教育施設として第2工場を建設する。*1941年（昭和16年）-狛江工場が陸海軍共同管理工場に指定され、従業員16000名の国内最大の航空機用航法計器メーカーとなる。*1944年（昭和19年）-戦意高揚と生産性を高めるため、昭和を代表する作詞家西條八十と作曲家久保田公平に依頼して「東京航空計器狛江工場歌」と「必勝轉輪音頭（狛江工場音頭）」を制作する。*1945年（昭和20年）-川崎市木月住吉町、苅宿(川崎市)|苅宿の本社工場現在の川崎市中原平和公園が米軍印刷局として占領軍|GHQに接収され、航空関係の製造を停止する。狛江工場で映写機、顕微鏡、カメラ用雲台などの民需品の製造を始め、同時に本社を狛江工場に移転する。*1952年（昭和27年）-GHQによる航空関係の製造停止が解除されて製造と修理を再開する。ファクシミリ|模写電送装置の製造とトーシャファックス（謄写版|謄写紙製版機）の開発を始める。*1953年（昭和28年）-米軍機搭載品のオーバーホールと修理を始める。*1966年（昭和41年）-東京国際空港整備地区に地上飛行訓練所を開設する。*1967年（昭和42年）-主に製品の組立と部品を製造する、株式会社トーコーを設立する。米国に現地法人UNITEDINSTRUMENTSINC.を設立する。*1972年（昭和47年）-株式会社トーコーエンジニヤリングを設立する。*1977年（昭和52年）-株式会社上田トーコーを設立する。*1979年（昭和54年）-名古屋営業所を名古屋市に設置する。*1980年（昭和55年）-東京国際空港整備地区に羽田メンテナンスセンタービルが竣工する。*1982年（昭和57年）-半導体ウェーハhttps:www.tkk-air.co.jpproductsemiconductoroverlaymodelmac.html重ね合せ測定（検査）装置の製造を始める。*1983年（昭和58年）-狛江に本社と工場が竣工する。*2010年（平成22年）-狛江市から町田市に本社と工場を移転する。陸上自衛隊10式戦車装備品の製造を始める。*2014年（平成26年）-一般社団法人https:uas-japan.org日本UAS産業振興協議会の設立に参画{{Citeweb|urlhttp:internet.watch.impress.co.jpdocsnews20141016_671717.html|title日本のドローン産業振興を目指すコンソーシアム発足、ヤフーやリコーも参加|publisherInternetWatch|date2014-10-16|accessdate2015-11-16}}する。*2017年（平成29年）‐主に産業用無人機UAVと無人システムを設計・製造して販売する、株式会社TKKワークスを設立する。
3750,人工腎臓や人工心肺装置、カテーテルや採血・輸血・輸液システムなどの医療機器・医薬品などが有名。本社は東京都港区(東京都)|港区港南2-15-2。また、大分県佐伯市の佐伯工場内に本社機能の一部を有する本店を置く{{PDFlink|http:www.kawasumi.jppdfnews2010iten100929.pdf本店所在地および本社事務所の移転に関するお知らせ}}川澄化学工業株式会社、2010年9月29日。生産は大分県内の3工場及びタイランドの100%出資子会社KAWASUMILABORATORIES(THAILAND)CO.LTD.の2工場で行われる。
