3800,1958年（昭和33年）に創業。以来、金属床義歯を中心とした歯科技工を行っている。その後、歯科技工の精密技術を活かして他の医療機器分野（補聴器）に事業拡大し、補聴器用イヤーモールドからさらにインイヤーモニターに事業展開している。
3800,火薬加工品製造、パーティーグッズ製造及び貿易業務、花火の打ち上げ、ブライダル事業（巨大クラッカーなど）を行っている。玩具煙火では国内一のシェア(約80%)を誇り、300を超えるパテントを保持する。本社の他に松野町にロボット工場を新設し製造工程の機械合理化を進めている。クラッカーだけで年間10億円の売り上げを誇る。クラッカーは300種類。商品開発のほとんどに社長自ら携わる。創業は明治17年。花火を作る工場を建てたのが始まりである。しかし、花火は夏以外の季節は売れず、工場は開店休業状態が多かったことから社長(3代目)が火薬を使って作るクラッカーの開発を行った。1950年代、西洋文化の普及により一般家庭でのパーティが行われるようになり、花火部門を縮小し、クラッカーを主力商品にシフトする。1976年にはそれまで日本国内に存在しなかったキャップ型の玩具銃用火薬「カネキャップ」を開発、現在でも継続して販売するベストセラー商品となった。1995年に入社した現社長は新商品開発に従事し、それまで6種類であったクラッカーを300種類にまで増やす。これにより従来より売上が倍増し、国内の80％を独占するようになった。
3800,第二次世界大戦中、中島飛行機でエンジンの開発をしていた創業者が戦後に興した会社で、常に業界をリードし続け、日本以外でも高い評価を受けている。実機と同じメカニズムの模型用4サイクルエンジンをいち早く量産化した。また、現在では数少ないが、熱心な愛好家のために船舶模型用蒸気エンジンを供給し続けるメーカーでもある。またそれを搭載できる船のキットも発売している。
3800,大月菊男が1930年に創業した神戸の老舗の真珠加工会社。真珠の養殖から、加工、販売までを行う一貫メーカーで、日本を原産とするアコヤ真珠の取扱量ではトップ。全国真珠養殖漁業協同組合連合会および愛媛県漁業協同組合連合会が実施しているアコヤ真珠1級品入札会では、近年、同社が落札額、落札量とも第1位を続けている。1975年（昭和50年）には、真珠の輸出額で業界第1位になり、その地位は現在でも続いている。（日本真珠輸出組合統計）真珠業界の業界団体である社団法人日本真珠振興会の現在の会長は、同社社長の大月京一が務めている。
3800,本社は京都市上京区堀川通上立売通|上立売下ル北舟橋町835。創業は1855年。御守袋製造として業界最大手企業。
3800,南洋材丸太の入手難からいち早く北洋材針葉樹合板への移行を果たした。さらに、当初、2009年1月とされていた(1年延期となった)北洋材丸太の輸出関税の税率アップ(税率が25％から80％となり事実上の丸太の輸出禁止)に向けて、国産材丸太の利用も手がけ、国産材利用を進める林野庁の補助金も利用して国産材に対応した施設導入も行っている。;工場*舞鶴工場-京都府舞鶴市*七尾工場-石川県七尾市{{節stub}}
3800,主に繊維に対する刺繍やプリントを得意とする二次加工専門社で、国内では東京都に営業所を置いている。また、国外においては中華人民共和国の上海に刺繍・プリント工場を設置、また青島市|青島にも製品プリント工場を設けている。
3800,“暮らしと水をむすぶ…。”をキャッチコピー|キャッチフレーズにして、止水栓・継手・サドル付分水栓などの給水装置製品、給水管を使用した直結型スプリンクラーを供給している。製品によってはMVKのブランド名で呼ばれることがある。
3800,ガソリンスタンドの設計・施工、および地下埋蔵式のタンク・防火水槽の設計・施工を主な事業としているメーカーで、本社のある金沢市を含む全国3か所に工場を有している。玉田工業の独自の技術として、鉄に繊維強化プラスチック（FRP）で覆う「SF二重殻タンク」の製法を持っており『経済人胸の内外III』259ページ記載。、この技術は特許を得ている。また、2011年3月11日の東北地方太平洋沖地震（東日本大震災）により発生した東京電力の福島第一原子力発電所事故において、原子炉から発生した高濃度の放射性物質を含む汚染水の貯蔵タンクを受注http:www.tamada.co.jpcompanynews110524.php福島原発、汚染水貯留タンク受注-玉田工業ニュース（2011年5月24日）{{PDFlink|http:hokuriku.mof.go.jpimgkeizaishinsai.pdf北陸管内の経済情報（平成23年度第1回全国財務局長経済会議）}}-北陸財務局2011年6月6日{{リンク切れ|date2015年8月}}。同年6月4日からJビレッジ（福島県双葉郡楢葉町）を経由して福島第一原子力発電所に搬入が行われており{{PDFlink|http:www.tepco.co.jpnufukushima-npimageshandouts_110603_02-j.pdf福島第一原子力発電所で使用する大型タンクの搬入について}}-東京電力2011年6月3日http:www.shimotsuke.co.jpnewstochigitopnews20110605533865汚染水タンク、本県から福島原発へ-下野新聞2011年6月5日{{リンク切れ|date2015年8月}}、8月まで搬入が続けられる予定http:www.asahi.comnationalupdate0604TKY201106040381.html汚染水用タンクの輸送作業始まる東電、福島第一へ-朝日新聞2011年6月4日{{リンク切れ|date2015年8月}}。
3800,業務用防塵マスク販売会社であったが、2000年代に入ってから元ヒューマン(ゲーム会社)|ヒューマンの戸川浩明が同社を買い取り、ゲームソフトウェア開発主体に事業転換した{{Citejournal|和書|year2009|month8|title『風雲!大籠城』開発者インタビュー|journalゲームサイド|volume6|issue4|pages56|publisherマイクロマガジン社|accessdate2009-11-04}}。コンシューマーゲーム版恋愛ゲーム(ゲームジャンル)|恋愛アドベンチャーゲーム等の開発下請けを経て、2009年にゲームブランド・'''nn.system'''（エヌエヌドットシステム）を立ち上げ、パブリッシャー（販売）にも進出した。子会社としてクロンを設立、2013年時点ではフラッシュ暗算やタワーディフェンスのソフトもクロンに移行している。
3800,*本社-兵庫県明石市魚住町。*代表取締役-落合泰明（おちあいやすあき）*営業所-大阪、東京、名古屋市|名古屋、九州
3800,*バーナー製造*金型製造*アウトドア用品製造
3800,*本社：愛媛県四国中央市*事業：ポリエチレン製品、紙製品の製造・販売
3800,東京都中央区(東京都)|中央区にショールームを持ち、施主の希望を細かく取り入れ、低コストでデザイン性と機能性を兼ね備えた製品を提供するため、設計事務所からの評価も高い。得意分野は、ウレタン塗装扉、天然木扉、オーダーステンレスカウンター、オーダーシンク、ハーフェレ社製品の組み込み、ブルム社製品の組み込み等である。
3800,家具の製造および販売（卸売）を行う会社である。香川県内においては小売販売も行っている。古くは漆工芸品（高松漆器）の工房であった。現在も伝統工芸品の技術を継承しており、漆塗りの技術を生かした和洋家具に強みを持っているのが特色である。高松、東京、大阪、福岡にショールームを置いている。
3800,主力商品は、フラットなフェースを持たない円柱型のパター「トゥルーロール」。開発者でありTru-RollPUTTERSINCの代表でもある、シェルダンロングは2005年の夏に多くのゴルファーがかかえる、「パッティングについての悩み」を解決する方法を発見した。様々な形状のパターをテストする中、フッとしたきっかけで「丸い形状」のものでボールを打った場合、直進性が高くなることを発見した。既存のパターの様に平らな形状と、円柱状の形状のヘッドでボールの転がりの比較テストを行い、実証することができた。円柱型ヘッドという従来のパターとは「全く異なった新しいデザイン」のヘッドにすることだった。http:ja.tru-rollputters.comaboutトゥルーロールHPaboutより
3800,"|資本金9000万円name\""概要\""|売上高30億円name\""概要\""|従業員数50名name\""概要\""|決算期8月name\""概要\""|外部リンク{{Official|http:www.ariaguitars.com}}{{Jaicon}}{{Enicon}}}}'''荒井貿易株式会社'''（あらいぼうえき、{{Lang-en-short|''ARAI&CO.INC''}}）は、楽器の輸出入及び国内卸販売などを行う商社である。自社ブランドに'''アリア(楽器ブランド)|アリア'''、'''アリアプロII'''などがあるname\""概要\""。"
3800,創業者の井本忠博により1946年に個人商店として発足。その後、1952年に改組され、株式会社井本運動具店となる（現社名のイモトには1965年に変更されている）。スポーツ用品メーカーとしての知名度は決して高いとは言えないが、ナイキ、アディダス、チャンピオンプロダクツ、プーマ、Kappa、フランクリン、ウイルソン・スポーティング・グッズ|ウイルソン、パトリック(靴)|パトリック、トッパー、ラコステ、レワード、などのスポーツ用品をライセンス生産している。
3800,1951年（昭和26年）に「ブラザー孔版社」として創業した印刷会社。なおブラザー工業とは全く関係はない。
3800,ステンレス製のパネルタンク・貯湯槽・配水池、熱交換器、各種タンクなど主に水を扱う建築設備を製造販売している。かつてはシステムキッチンなど住宅設備機器メーカーとしても知られていたが、株式会社ウッドワンの連結子会社となった時期に住宅設備機器事業を株式会社ベルキッチンに会社分割し、現在はベルキッチンとは資本関係もない。
3800,"|資本金4050万円name\""会社概要\""|売上高|総資産|従業員数48人name\""会社概要\""|決算期|主要株主|主要子会社|関係する人物|外部リンクhttp:www.matsukan.jp|特記事項}}'''松勘工業株式会社'''（まつかんこうぎょう）は、埼玉県加須市に本社を置く武道具製造企業であるname\""剣日200704\""{{Citebook|和書|chapter剣日調査局レポート創業明治40年!!積み重ねた剣道具製造の歴史|title剣道日本|volume2007年4月号|publisherスキージャーナル株式会社|page136-137}}。武道用品の製造のほか、本社敷地内、上尾市、狭山市の直営店と全国の取次店で同社製品の販売を行っているname\""剣日200704\""。"
3800,1989年4月に創業し、2005年11月に株式化。オフィスレイアウトから保安|セキュリティ工事、内装工事まで行い、パーテーション工事ではハイパーテーションとローパーテーションで目的や用途に合わせたオフィスつくりを行う。http:www.dom-biz.comcorphothot205.html注目!企業情報企業ミュージアムより参照
3800,''株式会社ヒョウドウプロダクツ'''は2004年にアールエスタイチから独立し、皮革製品を中心としたレーシングスーツなどのライディングギアを製造し、HYODのブランドで販売している企業である。直営店であるHYOD-PLUSの他、HYODSPORTSを営業している。
3800,2005年12月、'''東芝EMI'''（現・ユニバーサルミュージック(日本)|ユニバーサルミュージック合同会社・VirginMusic|VirginMusicレーベル）が製造部門を分割・売却する形で同社の御殿場工場をメモリーテック株式会社が買収して新会社「トエミ・メディア・ソリューションズ」を設立した。2006年4月には、三洋電機系の'''三洋マービック・メディア'''から光ディスク事業を譲り受けた（企業本体は通信カラオケ大手のBMBが買収）。2007年12月、トエミ・メディア・ソリューションズ東京事務所が独立して「株式会社トエミ・メディア」を設立。2008年7月1日、トエミ・メディア・ソリューションズ御殿場工場とメモリーテック富士工場が経営統合し、「メディアロジテック株式会社」が新たに発足した。2015年4月1日、メディアロジテック株式会社とともに、メモリーテック株式会社に吸収合併され解散。
3800,*1978年に設立。当初はトラクションエンジンの模型の輸入を手掛けていた。しかし、市場そのものが小さく苦労した。その後、ミニカーの取り扱いに軸足を移した。自社ブランド『'''MAKEUPLSJ'''』（メイクアップ　ルックスマートジャパン）を展開している。143スケールのハンドビルド・モデルカーを製作している。*2002年にイタリアのMRCollection社と共同でLookSmartというブランドを立ち上げ、2005年には、ブランド名を'''EIDOLON'''（アイドロン）に変更。また、LookSmartをあくまでも1つのブランドとしているMRCollectionと違い、全社挙げての主力製品と捉えている。*バビットメタル|ホワイトメタル製組み立てキットのスーペリアモデルスというシリーズも展開され、公式サイトでは開発時の苦労話を見ることが出来る。*ニッケルの電鋳でボディを作るという精密感の再現では優れるが生産性の低さにより他では手掛けない手法を採る事も厭わない。*これまで国内の業者が扱っていなかった製品を取り扱っている。*また、国内のスクラッチビルド|スクラッチビルダーの育成にも力を入れており精密工作技術を駆使した1台100万円以上するような模型も取り扱っている。
3800,事業内容は以下の通りである。*総合Reproコンサルティング事業*総合Eco関連事業*不動産事業
3800,*産業に特化した製品として戦後早くから標準規格に準拠した製品を多く製造。ファミリー企業であることから製品ラインの中止が突然発生することなく、製品寿命の長い生産体制を整えている。**社名：ハーティング株式会社HARTINGK.K.**所在地：神奈川県横浜市港北区新横浜1-7-9　友泉新横浜一丁目ビル2F**設立：1985年12月4日**代表者：代表取締役：フィリップハルティング　　
3800,1953年に、名古屋市熱田区で創業（創業時の社名は「'''ホウトク金属株式会社'''」）。主に金属製の家具の製造販売を行っていた。学校用の机と椅子の製造を始めたのは、1961年。その後本社を小牧市に移し、1971年に名前を現在の「'''株式会社ホウトク'''」に改名。2007年1月に、小牧市にある本社兼工場で火災が発生。しかし同年2月初旬には、工場の操業を再開した。
3800,自動証明写真装置では世界トップシェアを持つ{{仮リンク|フォトミーインターナショナル|en|Photo-MeInternational}}の日本法人として1963年に設立された。
3800,1953年に発売され、今日まで発売され続けるロングセラー商品「マジックインキ」の発売元としてその名を知られる。この他にも、同社が所有する「ギター」ブランドの画材|描画材の製造販売でもその名を知られている同社の企業サイトのドメインがguitar-mgであるのは、これに由来するものである。。主に油性・水性フェルトペンの銘柄は「マジックインキ」、美術用絵の具類の銘柄は「ギター」とに区別されており、2つのブランドで長きに渡って、安定した知名度を持つ。かつては1970年代から1980年代にかけて'''「♪お空の色はどんな色、お山の色はどんな色、夕焼けの色は？ギターペイント」'''というテレビCMソングが放映されていた。
3800,"|売上高連結94億45百万円（2013年8月期）|総資産連結49億23百万円（2013年8月末現在）|従業員数33名（連結352名）（2013年8月末現在）name\""gaiyo\""|決算期8月末日|主要株主|主要子会社|関係する人物|外部リンクhttp:www.trans-action.co.jpwww.trans-action.co.jp|特記事項|}}'''株式会社トランザクション'''は、東京都渋谷区に本社とする雑貨事業を営むグループ企業を傘下におく純粋持株会社。"
3800,洗濯、バス、キッチンなどで使用する合成樹脂|プラスチック製品の企画から販売までをおこなう。範囲は極めて広く、それぞれの分野におけるシェアも高い。同社の社名は東京と和歌山のそれぞれ一文字を取って、社名に冠したもの。創業者の吉田喜一は様々な製品をつくっては、日本各地に売り込みを重ねており、同地に本社を置く家庭用日用品メーカーの中ではパイオニアともいえる企業である。
3800,スキー、スノーボードの製造、及び、販売を主力事業としている。br主に自社ブランドである'''オガサカスキー(OGASAKASKI)'''及びbr'''ブラストラック（BLASTRACK)、'''オガサカスノーボード（OGASAKASNOWBOARDS)、'''ノベンバースノーボード（NOVEMBERSNOWBOARDS）、'''スクータースノーボード（SCOOTERSNOWBOARDS)の製品を展開している。
3800,主に業務用で使用する針の製造をおこなう。用途は医療用針から、マイナスイオン放電針からインクジェット用針まで、広い範囲にわたって製造されている。元々はメリヤス針の製造元として、創業したが、国内から繊維の生産拠点の減少にともない、そうした針をつくるノウハウを活かし、様々な用途の針を製造しながら、今日まで生産を続けている。
3800,1906年（明治39年）10月創業の印刷会社。印刷事業のほか、ビジネスプランニングやデザイン、DTPおよびウェブサイトの制作、分析・データマイニングなどを行っている。
3800,創業者で現会長の五味健により、観賞魚用品の輸入販売を目的に1977年に大阪府大東市で'''五味商事株式会社'''として創業ならびに設立される。翌年には観賞魚用エアーポンプを輸入販売するなど、同業界ではパイオニア的存在として知られる。観賞魚用品事業での成功と同事業への経営資源の集中を期に現在の社名に変更すると共に、現在は観賞魚用品を中心に、猫、犬、爬虫類、ウサギ、ハムスターなどの小動物を対象にしたペット用品などに事業拡大している。また、業務用大型水槽も取り扱っておりhttp:www.gex-fp.co.jpstoregyomufishjyuki.html店舗販売什器のご紹介：店舗用生体販売什器、90cm水槽6本などの水槽や、くつろぎスペース用、金魚祭り用など各種ある。
3800,*1963年11月、大阪市浪速区に野球用具の販売を主体とする三恵スポーツを創業。*1967年10月、三恵運動用品株式会社を設立。*1970年8月、現在地に移転。*1977年2月、現在の社屋が完成する。*1982年3月、神奈川営業所を開設。*1990年2月、社名をハイゴールドに改める。*1991年2月、埼玉営業所を開設。*2008年2月、神奈川と埼玉の営業所を統合し、関東支社を開設。
3800,*1936年2月、山口義彦が、運道具製造卸業を開始。*1946年2月、現在地に移転。*1950年2月、株式会社となる。*1970年7月、札幌店を開店。*1974年3月、東京都優良法人都知事賞を受賞。*1975年4月、優良申告法人第一回表彰状を受賞。*1977年2月、新潟店を開店。*1977年12月、仙台店を開店。*1978年5月、大阪店を開店。*1980年5月、本社に商品センターを開設。*1980年9月、大宮店を開店。*1982年3月、横浜店を開店。*1983年7月、福岡店を開店。*1996年10月、名古屋店を開店。*2009年10月、埼玉に物流センターを開設。
3800,"ジオラマを主力商品とし、かつては鉄道模型メーカーでもあった。バンダイと取引をしている{{Citejournal|和書|title杉本清の競馬談義第64回ゲスト・平井豊光さん|year1990|month7|journal優駿|page84|publisher日本中央競馬会|quote}}{{Citeweb|date2005-05-02|urlhttp:www.bandai.co.jpreleasesJ2005050203.html|titleナムコとバンダイの共同持株会社設立による経営統合に関するお知らせ|workプレスリリース|publisherバンダイ|language日本語|accessdate2012-01-13|quote(6)株式移転の当事会社の概要→(12)主要取引先}}。2006年7月に東京おもちゃショーで、軌間3ミリメートルのミニ鉄道模型'''Tゲージ'''シリーズを発表して世界から注目を集めた。同シリーズは2008年から市販が開始された。2011年5月現在、量産化されている鉄道模型では世界最小であるが、2010年夏に香港の鉄道模型メーカーにTゲージの販売権を売却し、鉄道模型業からはわずか4年で撤退した。代表取締役社長は平井　克彦（ひらい　かつひこ）name\""umanity\""{{Citeweb|author水戸正晴|date2010-05-31|urlhttp:umanity.jpracedatarace_newsdet.php?nid8965|title【ダービー】平井宏承氏「夢のよう」|publisherウマニティ|language日本語|accessdate2012-01-13}}。"
3800,1979年創業。創業者のゲーリー・アダムスはいわゆるメタルウッド（金属製ヘッドのドライバー等）の発明者として知られており、創業当初からメタルウッドを主力商品としている。1984年にフランスのサロモングループ傘下となり、その後1997年にサロモンがアディダスに買収されたことからアディダス傘下入り。アディダスは2005年にサロモンを売却するが、テーラーメイドについては売却せずにグループ内に残していた。2016年5月にアディダスがゴルフ用具部門からの撤退を決め（ただしシューズとウェアについては継続する）、それに伴い当社を売却する方針を明らかにしたhttp:news.golfdigest.co.jpnewstgtarticle629301アディダスがテーラーメイドを売却へ-GDO・2016年5月5日。売却先選定は難航したものの、翌2017年5月に米国の投資会社であるKPSキャピタル・パートナーズに全株式を売却することが発表されたhttp:news.golfdigest.co.jpnewspgaarticle685861テーラーメイドを485億円で米投資会社に売却　アディダスが発表-GDO・2017年5月11日。
3800,1920年（大正9年）に高知で綿の製造をおこなう「大三製綿所」として創業される。明治時代|明治期から大正時代|大正期にかけて、時の内閣総理大臣であった桂太郎の「ニコポン主義」にあやかり、1929年（昭和4年）に同社製造の綿を「'''ニコホン綿'''」として商標を登録する。戦後は脱脂綿を軸に綿棒・カラーパフ・フィルターパック・ガーゼ・マスク・ウェットティッシュー・大人用紙おむつなどの製品を製造販売している。2000年（平成12年）に白元へ株式譲渡したのを機に同社のグループ傘下に入る。2010年（平成22年）には、丸三産業と業務提携を行い、2014年（平成26年）に白元が経営破綻した後に、丸三産業の子会社となる。
