3800,画像:Lovedoll001.jpg|thumb|250px|オリエント工業製ラブドールの例土屋はもともと東京都台東区の上野および浅草『セックスメディア30年史』p.223でアダルトショップを経営していたが、当時のダッチワイフがあまりにも空気漏れが多く、女性用の性具(バイブレータ(性具)|バイブレータ)と比べて著しく実用性が低いことから、これの根本的な改良に乗り出し、ダッチワイフ製造会社、オリエント工業の起業に至った。その際親交のあった脳神科医から、障害者が実際の性行為を行うこともままならぬ状況におかれながらも性欲をもてあましnamenagasawa1997.53、また風俗嬢にも相手にされないなど非常に難儀しているという実情を知り、優れたダッチワイフの必要性を痛感した事が起業の動機だという『風俗の人たち』『ニッポン「もの物語」』および『セックスメディア30年史』。障害者については性処理相談や10%の障害者割引制度などで支援を行っている『南極1号伝説』pp.93-94、pp.98-99、『あやしい取材に逝ってきました』。同社によればそもそも開業当時は障害者へ向けての販売しか行っておらず、通信販売時にも障害者手帳のコピーの提示を必要としていたというnamenagasawa1997.54。それが「高齢者なら」、「独身男性なら」、「既婚者でも単身赴任中なら」と、徐々にハードルは下がっていったnamenagasawa1997.55。1977年創業の老舗であり、長年にわたって使用者のニーズに合わせて様々な商品を開発、販売している。2012年現在はシリコーン製、ソフトビニール製の製品が多い。シリコーンを使うことで透明感のある肌の再現を実現している水口幸広のレポート漫画『週刊アスキー2007SUMMER特別編集カオスだもんね!特別編』143ページによる。。購入は原則として通信販売であるが、東京都台東区上野と大阪府大阪市中央区(大阪市)|中央区南船場のショールームでは直接納品後に持ち帰ることも可能{{Citeweb|titleQ&A-よくいただくご質問|urlhttp:www.orient-doll.comfaq#q14|publisherオリエント工業|accessdate2011-08-20}}。製品のリアルさから、ショールームへの搬入時に死体と間違われ、警視庁に踏み込まれたことが幾度かある。また、不要になった際にはオリエント工業に郵送すれば「里帰り」として引き取り、処分と人形供養を行うといったサービスもある『セックスメディア30年史』p.223、{{Citeweb|titleQ&A-よくいただくご質問|urlhttp:www.orient-doll.comfaq#q24|publisherオリエント工業|accessdate2011-08-20}}。ちなみに、出荷は嫁入りと称する。同社のラブドールのボディと頭部の原型はそれぞれ専門の造形師が担当している。なお一般企業と同じくアルバイトも受け入れており、ボディ原型の担当者は東京藝術大学で彫刻を学んでいた際、アルバイトでラブドール制作に関わり、そのまま入社したというhttp:engineer.typemag.jparticleorient-doll東京藝術大院卒→オリエント工業の造形師が、究極の機能美を追究した先に見た「ドール×Tech」の未来-エンジニアtype。また、オリエント工業製ドールを時間貸しするレンタル業者、ラブドール風俗も存在する。同社との関係は不明である。ドールが高額な事がレンタルを利用する一因であり、そのサイズ・存在感を鑑み、購入後の維持出来るかを確認する意味合いからも、実際に試してから購入するというケースも多い{{要出典|date2011-08}}。2010年には歯学部生の訓練用としてテムザックと昭和大学歯学部が共同開発した患者ロボット『昭和花子』の軟部組織再現に技術協力するなど、ラブドール以外の分野にも進出を始めている。なおテムザックのプレスリリース{{Citeweb|urlhttp:www.tmsuk.co.jplineuphanakoindex.html|titleプレスリリース|accessdate2019年4月19日|archiveurlhttps:web.archive.orgweb20160304200705http:www.tmsuk.co.jplineuphanakoindex.html|archivedate2016年3月4日|deadlinkdate2019年4月}}では、オリエント工業の関与について触れられていない。2012年、ドン小西、糸井重里、壇蜜らと共に第15回みうらじゅん#みうらじゅん賞|みうらじゅん賞を受賞。
3800,1947年に創業し、1952年に株式会社へ改組。「サイトウ」ブランドの名で、マリンバやヴィブラフォンなどの鍵盤打楽器を製造し、製品はオーケストラや吹奏楽|吹奏楽団などで採用され、ヤマハと並んで鍵盤打楽器の主要メーカーとなった。しかし、マリンバの音板に最適な木材であるローズウッド(木材)|ローズウッドがワシントン条約の規制品目に指定されたことから、材料費が高騰し経営が悪化。さらに2011年7月期から赤字決算が続いていたことから、2017年11月6日に事業を停止し、東京地方裁判所立川支部へ破産を申し立てhttps:www.tsr-net.co.jpnewstsr20171114_01.htmlTSR速報（株）斉藤楽器製作所東京商工リサーチ2017年11月14日http:www.itmedia.co.jpbusinessarticles171114news070.html鍵盤打楽器メーカーの「斉藤楽器製作所」破産ITmediaビジネス2017年11月14日、同年11月30日に破産手続開始決定を受けたhttp:n-seikei.jp201712saitougakki-tousan.html追報：（株）斉藤楽器製作所（東京）破産手続き開始決定JC-net.2017年12月11日。負債総額は約5億円。1947年の同社創業以来、日本国内において鍵盤打楽器の一貫製造を行っていた「SAITO（サイトウ）」ブランドの存続、既存顧客への楽器保守が危ぶまれていたが、その後、野中貿易が引き継ぎ、取り扱いを行うこととなった{{Citeweb|urlhttp:www.saitogakki.co.jp|titleSaitogakkiseisakusho|accessdate2018-09-08}}。斉藤楽器製作所は、2018年8月9日に法人格が消滅した。
3800,1945年4月に芝製作所として創業し、セルロイド人形の製造を開始。1954年にソフトビニール人形の製造を開始した。1963年に法人に改組。1967年にはタカラ(玩具メーカー)|タカラ（後のタカラトミー）から初代「リカちゃん」の製造を受託。1971年に初の自社発売製品である「ファッションドール虹のナナちゃん」「お風呂ベビー人形お風呂あぶちゃん」を発売。自社ブランド製品の他にも、1973年にはハズブロの「あしながレギー」をライセンス生産、アサヒ玩具、ツクダオリジナルなどからも製造委託を受けていた。1991年には製造事業から撤退し、外注生産を行うOEMメーカーへ転換。その後はバンダイ、パイロットインキ、メガハウスなどからOEM生産を受託し、1998年12月期には22億6830万円をあげたが、その後は同業他社との競合、主力外注工場がある中華人民共和国|中国における原価上昇などにより経営が悪化。2017年7月20日に事業を停止し、同年7月26日に東京地方裁判所に破産を申請。同日付で破産手続開始決定を受けた{{Citeweb|urlhttp:www.tsr-net.co.jpnewstsr201708002_02.html|title（株）シバ|accessdate2017-12-23|publisher東京商工リサーチ}}。2018年1月に法人格が消滅した。
3800,バッグの輸入会社を経営していた寺田和正が、1994年（平成6年）設立した企業。若い女性向けの商品を主に展開している。社名に「ジャパンリミテッド」とあるため、外資系企業の日本法人のように思えるが、日本の企業。「ジャパンリミテッド」と付いているのは、国際的なブランドにする意志を表している。「奥さまは魔女(テレビドラマ)|奥さまは魔女」の登場人物名（ヒロインの名がサマンサ、その娘がタバサ）とは無関係で、類似したのは偶然、としているが、社名の出典は明かされていない。なお、タバサの正確な名前は「タビサ（Tabitha）」である。旗艦店は、2005年（平成17年）4月にオープンした「サマンサタバサデラックス表参道GATE店」。2006年（平成18年）には、日本国外初の路面店を、ニューヨークのマディソンアベニューに出店を果たした。プロモーションモデルには、ヒルトン姉妹やヴィクトリア・ベッカムを始めとした海外のセレブリティ|セレブを社長自らが交渉し、積極的に起用するなど、国内のみにとらわれず、海外への戦略志向も強い。
3800,"甲斐国（山梨県）では、地元に水晶が産出されるようになった文久年間（1861年-1863年）に水晶の研磨加工、水晶印の篆刻が始まった。同社の所在する町内岩間は、山梨県西南部の富士川左岸の山間地に位置しており、山梨県令藤村紫朗によって地場産業の奨励が行われ、甲斐国（山梨県）の伝統産業のひとつである水晶の研磨加工技術、水晶印の篆刻技術を用いて、象牙、牛角（旧名：オランダ水牛）、黒水牛、柘などの印鑑製造が発達したhttp:www.rokugoinsho.comhistoryrekishi.html六郷における印章業の歴史六郷町印章業連合組合name\""iwama\""甲斐古文書研究会編『各駅停車全国歴史散歩山梨県』河出書房新社、1983年2月28日発行、pp.108-109http:www.tsumugi-spa.comstamp六郷町印章業連合組合つむぎの湯案内窓口。1940年（昭和15年）、西八代郡岩間村（当時）にて山梨物産が創業された。岩間の印鑑製造は、技術者の育成とともに主要産業となりname\""iwama\""、販路を全国に広げていったname\""iwama\""。また、'''六郷印章業連合組合'''が設置され、岩間の印鑑製造は全国シェアの50パーセントを占めるまでに発展したname\""iwama\""。その後、山梨物産は2006年（平成18年）株式会社化し、現会社を設立した。創業以来の印章ブランドの信玄印を販売しており、2006年（平成18年）には信玄印を商標登録し、山梨物産株式会社の公式ホームページにてWEB販売を開始している。"
3800,"大阪府東大阪市で在日韓国人2世『失敗するから人生だ。』P123である大山森佑が創業したプラスチック製の養殖用ブイや育苗箱をつくっていた町工場である大山ブロー工業所をname\""diamonnd20160404\""、1964年に森佑の急逝に伴い大山健太郎大山健太郎は在日韓国人3世にあたり、在日であることを昔からオープンにしている。2003年に日本国籍を修得している。本人曰く、表面的には在日であることを理由に差別を受けたことはないという。前掲梅沢（2013）よりが19歳で引き継ぐ。1971年に法人化して'''大山ブロー工業株式会社'''へ改組。その後1972年に宮城県南部に新設した仙台工場（現：大河原工場）を主力工場とし、発祥の地である東大阪の工場を閉鎖name\""diamonnd20160411\""{{citenews|titleダイヤモンド・オンライン今月の主筆第2回アイリスオーヤマ社長　大山健太郎どんな時代でも利益を出し続ける経営の仕組み|publisherダイヤモンドオンライン|date2016-04-11|urlhttp:diamond.jparticles-89353?page2|accessdate2016-05-08}}。1989年に本拠地を政令指定都市移行間もない仙台市へ移転し、1991年に現社名へ改称する。家庭用プラスチック製半透明収納ケースの販売数量が爆発的に伸び会社が大きく成長。家庭用プラスチック製品の製造販売を得手とし業界国内最大手で利益率は極めて高い。現在は家電製品を主にLED照明や収納、インテリア用品、園芸用品、ペット用品、日用品、資材、食品などを取り扱う。ホームセンターなどに様々な製品を納入するほか、ネット通販企業にも商品を納入する{{Citenews|titleアイリスオーヤマ、米国工場6カ所に倍増　アマゾン向け拡大|newspaper日本経済新聞|date2015-09-15|urlhttp:www.nikkei.comarticleDGXLASDZ14IC5_U5A910C1TI1000|accessdate2016-05-08}}。毎年1000点の新商品やモデルチェンジ品を生み出すname\""diamonnd20160404\""{{citenews|titleダイヤモンド・オンライン今月の主筆第1回アイリスオーヤマ社長　大山健太郎毎年1000点の新商品は「生活者の困った」から生まれる|publisherダイヤモンドオンライン|date2016-04-04|urlhttp:diamond.jparticles-88894|accessdate2016-05-08}}。日本国内13社、中華人民共和国|中国8社、アメリカ合衆国|アメリカ1社、ヨーロッパ2社、大韓民国|韓国1社、ベトナム1社にグループ企業がある。2012年、家電部門を一気に拡大する。当時、日本の大手家電メーカーは海外勢との競争に敗退し、大規模なリストラを断行していた。大山は、これをチャンスと捉え、東芝、シャープ、パナソニック、三洋電機など一般に大手家電メーカーと呼ばれる企業で職を失った優秀な技術者を大量に採用。自社の持つアイデアと彼らの持つノウハウをミックスしようと考えた。例えば、シャープでエアコンのエキスパートだった元社員はスマホを使って誰でも簡単に遠隔操作できるエアコンを開発、ヒットさせた。他製品でも同性能なら大手他社の半値程度で売り出し、シェアを拡大させた。毎週「新商品開発会議」が催され、その場で様々なアイデアが出されるが、アイデアと同等に重要な判断基準は価格であり、客が値ごろと感じる価格にできるかが、製品化の絶対条件となっているname\""mag2\""。業界最大手の企業であるが、会社法上の大会社の要件である「資本金5億円以上」「負債200億円以上」は満たしておらず、税法上も中小企業者に分類される会社である。ただし有限責任監査法人トーマツによる任意監査は実施されている。仙台市に本拠を構えるプロスポーツチームと結び付きが強く、2004年よりベガルタ仙台のメインスポンサーとしてユニフォーム胸部分前年までは背中部分に、2009年|2008年からは東北楽天ゴールデンイーグルスのスポンサーとしてユニフォーム左胸部分に、それぞれ企業ロゴを刺繍させている。また、仙台フィルハーモニー管弦楽団も支援している。2012年8月に旧仙台三和ビルディングを全面リニューアルしたアイリス青葉ビルが開業し、5階から8階のオフィスフロアにグループ会社オーヤマの事務所、地下1階にアイリス製品を展示するアンテナショップが2017年2月よりオープンしている。"
3800,"1936年、現在の東京都葛飾区四つ木で洋傘骨メーカー「'''丸定商店'''」として村田啓一（1912年生まれ）により創業name\""ideal\""外部リンク（『なんであるアイデアルホームページ』）。戦後、プロレス中継で見た関節技を参考にして、傘骨にスプリングを付けた折り畳み傘を発売し、売り上げを上昇させたname\""zakzak\""。1952年6月、「'''株式会社丸定商店'''」として法人化name\""tdb\""外部リンク（『帝国データバンク』）を参照。。1963年9月から信和クリエイティブ制作による、植木出演による5秒のテレビCMを放映開始し、知名度を上げていく（1965年8月まで放送）name\""zakzak\""。また、プロ野球球団千葉ロッテマリーンズ|ロッテ・オリオンズの専用球場|本拠地球場である東京スタジアム(野球場)|東京スタジアムのスコアボードにも上記キャッチコピーの入った広告を掲示した参考：雑誌『ベースボールマガジン』2001年夏季号「野球場」大特集（同誌に掲載された、1970年の日本シリーズ当時の写真で確認できる）。。1990年8月、新たに株式会社アイデアルを設立し、丸定商店の事業を引き継いだname\""tdb\""。また、創業から2代目の社長である村田政雄が当時手掛けた信和クリエイティブのスタッフに声をかけ、深夜早朝限定ながら25年ぶりに当時と同じく植木を出演させたテレビCMを制作・放映したname\""zakzak\""。1999年、公式ウェブサイト|サイト「なんであるアイデアルホームページ」を開設（翌2000年2月より、自社サーバー「www.kasa.co.jp」に新ウェブサイトを開設）name\""ideal\""。2006年、安価な外国製の傘の流入などの影響もあり売り上げは低迷（1991年8月期の約24億円をピークとし、2005年|前年8月期には約5億円まで減少）し、6月9日に事業停止、自己破産を申請したname\""tdb\""。2017年現在、倒産した洋傘メーカーの社名を踏襲して現在は貸しビルとなっている。"
3800,1924年「東京スタンダード靴株式会社」として後に運輸大臣になる宮沢胤勇|宮澤胤勇によって創業される。1927年に野村合名会社（後の野村ホールディングス）の援助を受け野村傘下に入る。1928年6月より商号を「スタンダード靴株式会社」と改称。第二次世界大戦下は敵性語禁止により一時的に「野村製靴」と名称を変更したが、終戦後の1946年2月にスタンダード靴株式会社に再び社名を戻す。本社は東京都足立区興野(足立区)|興野。東武バスのバス停に「スタンダード前」（現興本センター前）も存在していた。戦前も戦後もマシンメイドの紳士靴5大メーカーの一角をなしており大日本帝国陸軍のブーツ|編上靴及び自衛隊の短靴納入業者のひとつでもあった。企業内学校として1947年に「スタンダード製靴学校」を開校し、学制改革を経てスタンダード高等学校として1979年まで存続した。1998年2月24日、スタンダード靴株式会社は民事再生法の適用を申請。事業は株式会社スタンダード・ホールディング（代表者:積山洋治）に引き継がれたが、スタンダード・ホールディングは2003年7月9日、破産の申し立てが行われた{{PDFlink|http:www.resona-gr.co.jpholdingsnewsnewsreleasepdf150710_1a.pdf債権の取立不能および取立遅延のおそれの発生について（平成15年7月10日）}}（りそなホールディングスHP）、2010-07-22閲覧。。その後入札により有限会社ニュースタンダードに商標などは移管されたが再び清算。本社と工場は破産後に全て解体撤去され、現在跡地は一般民家と興本地域学習センター、興本体育館の駐車場に転用されている。
3800,1983年春、元モステクノロジーのロバート・ヤーン、ブルース・クロケット、チャールズ・ウィンターブル、デイヴィッド・A・ジンビッキ、アル・カーペンターのコモドール64を設計したチームによって'''ペリフェラルビジョン'''を設立。Atari2600用のキーボード(コンピュータ)|キーボードを設計するプロジェクトが計画されていたが、アタリショックによりキャンセルされた上、コモドール社にプロジェクトが盗用されたと訴えられる。その後、エンソニックと改名。周辺機器の代わりにシンセサイザーを設計する。{{Citejournal|authorワリック・ポール|year1985年|date2009-02|titleContributors|urlhttp:dx.doi.org10.1109mspec.2009.4768854|journalIEEESpectrum|volume46|issue2|page|language英語|doi10.1109mspec.2009.4768854|issn0018-9235}}1998年1月、7700万ドルでクリエイティブテクノロジーに買収され、同じ傘下のE-MUSystems|E-muSystemsと合併し、E-MuEnsoniqとなる。その後、イーミューはMK6PK6、エンソニックはHalokeyboardsを2002年に出した。
3800,創業者で室津出身の泉亀吉が、1919年（大正8年）に大阪市で、播磨国|播磨地方で産出された皮革をもとに、カバンや財布、煙管|キセルなどを製造する会社を設立する。その後戦後の混乱期を経て、本社を御津町(兵庫県)|御津町（現・たつの市）に移転し、1946年（昭和21年）よりランドセルの製造を開始する。そのころからのランドセルの老舗メーカーであったが、2003年（平成15年）に世界で一番軽くて丈夫なランドセルとしてギネス・ワールド・レコーズ|ギネスブックにも登録された「'''天使のはね'''」を開発・上市したことで、一躍西播磨地方からその名を全国に知られるようになる。ランドセルの最大手メーカーであり2016年時点では国内シェア約50％を占めているhttp:toyokeizai.netarticles-112329?page3ランドセルの真実をどれだけ知っていますか東洋経済。また、新たに6年間最も軽く感じる垂直角を維持できるクッション形状「せみね」を開発。さらに、肩ベルトの一部に形状保持プレートを内蔵しフィット感をより向上させた「ひねぴた」も発表した。!--→「せみね」と「ひねぴた」は百科事典に書くほど画期的とは思えないのでコメントアウト。画期的であるという検証可能な資料を要求します。ただし、特許や実用新案の取得はhttp:www.jpo.go.jpshiryoutoukei1402-027.htmの登録件数を見る限り数千件存在し、これをもって画期的であると主張するのは問題があると個人的には考えます。--「天使のはね」とは元来、肩ベルトの付け根に羽根の形をした樹脂を内包させてベルトを立ち上げることにより、背負ったときにランドセル本体の重心を上にあげる効果をもたらす機能の名前であった。いまではランドセルの代表的ブランドとして認識されるになり、ランドセル売り場でも天使のはねを商品名として求める顧客の姿が見られる。元々はケーブルテレビ等のアニメチャンネルより、コマーシャルメッセージ|CM展開を始めた同社であるが、近年では関東地区の民放でも平日にCMが放送されている。2004年（平成16年）より、入学準備需要シーズンの時期（10月から3月まで）には民放各局のゴールデン・プライムタイムに放送される全国ネット向けテレビ番組のナショナルスポンサーとなるのが慣例となっていた。最近ではランドセルの購入需要が前倒しになっている傾向もあり、6月から11月までの間、日曜朝のテレビ朝日系列アニメ番組に提供を行っている。本社と工場は一貫して兵庫県西播磨地方を基盤としており、またナショナルブランド（モデルロイヤルシリーズ、ラブピシリーズ、ワンパシリーズ）の販売については、大阪に事務所を置くグループ会社のスリーアイコーポレーションでおこなっている。その他人工皮革などの材料は人体に悪影響を与えない、燃やしてもダイオキシン類が発生しないもの（エコロジー|エコロジカルランドセル）を選び、肩ベルトには防犯ブザーを取付可能な金具もつけたり等、子供の健康や安全を考える保護者の意見に応えた商品開発を行っている。
