3750,*1896年に日本初の計器製造会社「和田計器製作所」として圧力計の製作を開始。2016年で創業120年を迎えた。*船舶湾港機器事業では、オートパイロットを主力製品とし国内外で圧倒的なシェアを誇る。ジャイロコンパスの商船での世界シェア6割{{Citeweb|urlhttp:v4.eir-parts.netv4ContentsView.aspx?cattdnet&sid1255490|title東京計器決算説明会資料|accessdate2018-04-15}}。世界でも有数の総合舶用機器メーカー{{Citeweb|urlhttp:v4.eir-parts.netv4ContentsView.aspx?cattdnet&sid1255490|title東京計器決算説明会資料|accessdate2018-04-15}}。*油空圧事業では、国内プラスチック加工機械向けに高シェア。建設現場にて使用するラジオリモコン等の電子機器の開発も行う{{Citeweb|urlhttp:v4.eir-parts.netv4ContentsView.aspx?cattdnet&sid1255490|title東京計器決算説明会資料|accessdate2018-04-15}}。*流体機器事業では、1963年に超音波流量計を世界で初めて実用化。国内上下水道、農業用水市場にてトップシェア{{Citeweb|urlhttp:v4.eir-parts.netv4ContentsView.aspx?cattdnet&sid1255490|title東京計器決算説明会資料|accessdate2018-04-15}}。*防衛・通信機器事業では、防衛省に各種航法装置、電子戦機器を提供。放送用ヘリコプターテレビ中継システム|ヘリコプター中継システムなど民間市場にも展開{{Citeweb|urlhttp:v4.eir-parts.netv4ContentsView.aspx?cattdnet&sid1255490|title東京計器決算説明会資料|accessdate2018-04-15}}。*検品機器、防災機器も提供。また超音波レール探傷車など、鉄道レール保線機器国内トップシェア(東京計器レールテクノ提供){{Citeweb|urlhttp:v4.eir-parts.netv4ContentsView.aspx?cattdnet&sid1255490|title東京計器決算説明会資料|accessdate2018-04-15}}。
3750,戦後、レンズシャッター専門メーカーとして創業。セイコープレシジョン|セイコー、シチズンホールディングス|シチズン、MSK、NKSなど国内のメーカー、海外のコンパー、プロンターなどと争った。倒産、撤退したメーカーも少なくなかったが、トップシェアを達成し、現在まで維持している。また、カメラメーカーと協力して、OEM用フォーカルプレーンシャッターのコパルスクエアを商品化。ユニット化を実現するためには容積を減らす必要があり、製造が困難な縦走りの金属幕を採用した。結果として、故障が少なく、長期間に渡って高精度が維持される優れたシャッターとして評価された（基本設計をおこなったのはエフシー製作所の茶谷薫重）。現在は従来の銀塩カメラ|フィルムカメラ用シャッターだけでなく、デジタルカメラ用シャッターも生産している。また、デジタルカメラの筐体金型、光学部品も設計、生産し、電気メーカーに供給している。シャッターと平行して、8mm映写機、ミニラボ（小規模DPE）、置時計（いわゆる「パタパタ時計」）、電子部品（トリマ、スイッチ、圧力センサなど）などの製造にも進出。電子部品は営業部門をコパル電子（現在の日本電産コパル電子）として独立させるほど成功したが、他の主な製品からは撤退した。富士通と資本提携したことにより、一時期は磁気ディスク製品も生産していたが、これも撤退した。1990年代に入り、不安定な経営状況に陥っていたが、日本電産の傘下に入り、再建を図った。その後、完全子会社化が実施された。現在は、これまでに培った光学、モーター、センサー、精密金型などの基礎技術を応用し、自動車、医療機器、家電、モバイル機器、デジタルカメラなどの分野で、各メーカーに製品を供給している。
3750,*2001年（平成13年）4月2日に株式会社ニコンより望遠鏡事業を分社・独立し株式会社ニコンビジョンを設立。
3750,創業時から理化学、及び医療用ガラス器具の製造・販売を行なってきており、現在もフラスコや瓶|試薬びん等の化学向けのガラス機器や、残留農薬|残留農薬分析器や真空ポンプ等の研究室向け機器、更に電子材料合成装置やピペット|分注器、環境測定機器など、科学に特化した製品の製造、販売を主事業としている。
3750,1975年（昭和50年）に大都商事(株)現ダイトロン|ダイトエレクトロン(株)の電装事業部としてハーネス事業を開始し、1994年（平成6年）にダイトデンソー株式会社として独立。ワイヤーハーネスの製造、販売だけでなく、電子機器・電源機器の開発設計から製造、ハーメチックコネクタの開発設計および製造を行う。
3750,家庭用時計（掛時計、置時計、目覚し時計|めざまし時計）・自動車用時計の製造販売、電子部品・アミューズメント関連機器・映像関連機器・産業用機械の製造販売、装身具|宝飾品の製造販売を行っている。シチズンホールディングスから出資を受ける他、商標のクロスライセンス|相互使用契約を締結しており、国内向けクロック（業界では時計を「ウオッチ」と「クロック」に大別している）に商標「CITIZEN」を使用している。第二次世界大戦後の1946年（昭和21年）に精工舎の南桜井村|南桜井工場を引き継ぎ設立された'''株式会社農村時計製作所'''が1950年（昭和25年）10月で解散。その事業を引き継いで別会社として設立された。農村時計が生産していた時計のブランド「RHYTHM（リズム）」が社名の由来となっている。2014年（平成26年）に国内向け商品で45年振りに「RHYTHM」ブランドを復活させた。
3750,各種医療ガスのほか、酸素濃縮器、パルスオキシメーターなどの医療機器を幅広く生産・販売している。主力製品は医療ガスであり、その配管・設備業務も遂行している。群馬県伊勢崎市と、千葉県白井市に工場を持つ。
3750,赤尾佳泰が群馬県藤岡市大戸町5番地の村岡製麺所跡にて藤工業製作所として創業、2年後の1972年5月20日に藤工業有限会社を法人登記する。その後、藤岡工業団地内に土地を取得し、藤岡市下栗須380-3に拡大移転した。
3750,"|資本金32百万円name\""概要\""|発行済株式総数|売上高|営業利益|経常利益|純利益|純資産|総資産|従業員数140名（2019年1月現在）name\""概要\""|支店舗数|決算期|会計監査人|所有者|主要株主|主要部門|主要子会社|関係する人物|外部リンクhttp:www.sun-con.com|特記事項}}'''株式会社サンコンタクトレンズ'''は、京都市中京区に本社と工場を持つコンタクトレンズメーカー。カスタムメイドのハードレンズを主力商品としておりname\""kyoto2004\""{{citeweb|urlhttp:www.kyoto-keizai.co.jpmoduleswordpressindex.php?p1163|title世界にひとつだけのレンズ|publisher京都経済新聞|date2004-04-19|accessdate2014-07-06}}、コンタクトレンズ#ソフトコンタクトレンズ|使い捨てコンタクトレンズについては「目の生理を無視している」と強く批判しているname\""kyoto2000\""{{citeweb|urlhttp:www.kyoto-keizai.co.jpmoduleswordpressindex.php?p169|titleレンズの汚れ見せつけマス|publisher京都経済新聞|date2000-02-21|accessdate2014-07-06}}。1971年10月設立。1977年、京都府立医科大学より角膜検査機器の開発を依頼された{{citeweb|urlhttp:www.kyoto-np.co.jpkpenterprisewaza070318.php|titleここに技あり京滋の中小企業|publisher京都新聞|date2007-03-18|accessdate2014-07-06}}。1979年、同大学の糸井素一の協力により、角膜の形状を解析・記録する装置を開発したname\""kyoto2004\""。2000年、洗浄しても落ちないハードレンズの汚れを検査する個人用の「みるケアチェッカー」を発売したname\""kyoto2000\""。角膜形状測定装置で角膜を撮影して角膜形状をコンピュータ解析し、眼の形状に合わせたデザインのコンタクトレンズを受注生産する。円錐角膜name\""kyoto2004\""や白内障術後、レーシック術後用の特殊なハードコンタクトレンズにも対応できる技術を有する。2016年、難病スティーヴンス・ジョンソン症候群（ＳＪＳ）及び中毒性表皮壊死症（ＴＥＮ）の眼後遺症用のコンタクトレンズを発売した。{{Citeweb|title難病情報センター{{!}}スティーヴンス・ジョンソン症候群（指定難病３８）|urlhttp:www.nanbyou.or.jpentry4074|websitewww.nanbyou.or.jp|accessdate2019-03-25}}"
3750,ニデックは1971年（昭和46年）7月7日に従業員7名で設立された。創業当初は「目」という分野に絞って事業展開してきたが、近年では「目と身体」というように、「目」とそれ以外の新しい分野に積極的に取り組むことになった。1996年（平成8年）には「目と身体（からだ）」ということで新しいスタートを切ることとなり、「'''Eye&HealthCare'''」を制定して、事業領域の展開を図っている。販売拠点は日本国内のみならず海外へも展開しているにもかかわらず、製造・開発拠点は事務機能を除き、地方都市の愛知県蒲郡市に集中している。なお、輸出比率は60％を超えておりニデックの製品は世界中のドクター、眼鏡店等で見ることができる。有名な機器は「気球の見える機械」こと自動視力測定器（オートレフケラトメーター、ARK-１等）がある。また、眼科専用電子カルテ「NAVIS（ネイビス）」も多くの眼科医で利用されている。
3750,"医療機器|医療事業・科学事業・映像事業の3つの分野で、内視鏡、顕微鏡、デジタルカメラ、録音機|小型録音機などの光学機器、電子機器を製造・販売している。事業分野別にみたオリンパスグループの売上比率は、医療が73.0%、科学が13.6%、映像が11.0%など（2015年3月期group\""広報\""http:www.olympus.co.jpjpirsummarysector5yearindex.jsp投資家情報：分野別売上高（年間5年）オリンパス株式会社）。内視鏡分野では世界シェア75%程度を占めるなど、医療用の光学機器や顕微鏡分野では世界最大手となっている。カメラ部門ではニコン、キヤノンに次ぐ事業規模、ICレコーダーは、かつてのマイクロカセットレコーダー時代からのブランド力があり、日本国外で70%以上・国内でも50%近い高いシェアを占めている。オリンパスの社名は、ギリシャ神話で神々が住む山とされるオリンポス山にちなむ。これは創業時の社名である「高千穂製作所」の由来である高千穂峰が、日本神話において神々が集う山とされているためでgroup\""広報\""http:www.olympus.co.jpjpcorchistoryaboutオリンパスの歩み：VOL.1　社名の由来オリンパス株式会社、顕微鏡などのブランドネームに使用したことに由来している。コーポレートスローガンは「{{en|YourVisionOurFuture.}}」。最大の事業分野である医療事業では、1950年（昭和25年）、胃カメラの試作1号機の製品化に初めて成功した。オリンパスの医療事業は、2004年（平成16年）に分社化されたオリンパスメディカルシステムズを中心とする医療事業グループ各社に大部分が移管されていたが、2015年（平成27年）にオリンパスメディカルシステムズの主要事業を会社分割によりオリンパス本体に戻し、再び集約している。2011年に、過去十数年にわたる巨額の損失隠しが発覚しname\""facta201108\""http:facta.co.jparticle201108021002.htmlオリンパス「無謀M&A」巨額損失の怪零細企業3社の買収に700億円も投じて減損処理。連結自己資本が吹っ飛びかねない菊川体制の仮面を剥ぐ。月刊FACTA2011年8月号COVERSTORY、日本における企業統治（コーポレート・ガバナンス）の不備についての問題も含めて世界中で大々的に報道された。"
3750,鉄道シミュレータ、航空用電波事業、パーキングシステム事業を行っている。三菱電機グループの企業で、三菱グループ#主要会社|三菱広報委員会の会員会社であるhttp:www.mitsubishi.commpacjcompanies三菱広報委員会-会員会社紹介。
3750,"モバイルクリエイトは、2002年の設立以来、タクシー関連機器の製造・販売や、沖縄本島内の路線バスの総合案内サイトバスなび沖縄の運営などを行い、2016年には、後工程向け半導体製造装置メーカーである石井工作研究所を連結子会社化した。モバイルクリエイトと石井工作研究所は2018年6月1日に、同年7月2日付で両社の共同株式移転方式によって、FIG株式会社を設立することを発表name\""mobi20180601\""http:file.swcms.netfilemcincjairnewsauto_20180601455000pdfFile.pdf「ＦＩＧ株式会社」の新規上場承認に関するお知らせモバイルクリエイト・石井工作研究所2018年6月1日。2018年7月2日付で持株会社となるFIG株式会社を設立し、モバイルクリエイトと石井工作製作所はFIGの完全子会社となった。"
3750,それまで首都圏(日本)|首都圏のJR東日本および旧日本国有鉄道の機械区に属した出改札機の設置工事・保守部門を分社化する形で1992年（平成4年）に設立され、その後の取扱エリア拡大に伴い東北地方・信越地方にも支店等の拠点を開設している。その後他社IC乗車券をサポートするため、札幌市|札幌、福岡市|福岡等、地方主要都市にも展開している。初代社長は現在JR東日本相談役の松田昌士であり、当時JR東日本の取締役副社長と兼任した。また、JR東日本の東日本旅客鉄道秋田支社|秋田・（初代）東日本旅客鉄道横浜支社|横浜支社長などを歴任した植田哲也が1998年（平成10年）から2006年（平成18年）まで、東日本旅客鉄道千葉支社|千葉・東日本旅客鉄道仙台支社|仙台支社長を歴任した鈴木俊一が2013年（平成25年）まで社長を務めた。現在の社長は、元JR東日本IT・Suica事業本部副本部長兼企画部長で、Suicaの開発に関わった椎橋章夫である。*なお、JREMと同じくJR東日本グループのシステムインテグレータであるJR東日本情報システム(JEIS)は、広範囲にソフトウェアの開発や運用を全面的に担うが、JREMは出改札機器とSuica関係に特化して、主にハード面を担う企業である。以前は、現在と同じ読みの「ジェイアール東日本メカトロニクス株式会社」という商号であったが、2012年（平成24年）4月1日にJR東日本のグループ内での事業の再編成により東日本トランスポーテック|東日本トランスポーテック株式会社、東北交通機械|東北交通機械株式会社、東日本旅客鉄道新潟支社#新潟交通機械|新潟交通機械株式会社の3社の機械設備（ホームドア、エレベーター|昇降機、消雪パイプ|消融雪装置等）部門に係わる事業がJREMに移管され、この再編に合わせ商号を'''JR東日本メカトロニクス株式会社'''に変更した{{PDFlink|http:www.jreast.co.jppress201120120221.pdfJR東日本グループ事業の再編成について-JR東日本2012年2月28日}}。
3750,手術用の針|縫合針、リーマ、ファイル_(歯科)|ファイルなどを手がけ、業界シェアを90%近く占める。殆どの商品は針金が原材料であり、売価の材料比率はわずか1%である。2008年度の営業利益率40%は任天堂の37%を上回る。
3750,1939年に、並木精密宝石が創業。創業当時の製品は、電気メーターの軸受宝石だった。1960年代に時計用の軸受宝石を製造販売開始した時に、当時の商習慣であった系列制度のため、（販売先の棲み分けのため）1957年に並木精密宝石からアダマンド商事が分離独立。その後、並木精密宝石は、工業用宝石部品、ＤＣコアレスモーター、医療機器を中心に事業を展開。一方アダマンド商事（1959年にアダマンド工業株式会社、2014年にアダマンド株式会社に商号変更）は、光通信部品を中心に事業展開を行ったが、2017年に、工業用宝石屋としてのお互いのスペシャリティを統合によって更に伸ばしていくという考えのもと、合併の合意・承認がなされ、2018年1月1日に、並木精密宝石を存続会社として、”アダマンド並木精密宝石株式会社”　が誕生した。
3750,rlhttps:www.elephantech.co.jpabout#about_info|accessdate2019-04-10}}|発行済株式総数|売上高|営業利益|経常利益|純利益|純資産|総資産|従業員数24名（2019年3月現在）|支店舗数|決算期|主要株主|主要子会社|関係する人物|外部リンクhttps:www.elephantech.co.jpエレファンテック株式会社|特記事項}}'''エレファンテック株式会社'''（旧:AgIC）は、東京都中央区(東京都)|中央区に本社および工場を置く、プリンテッド・エレクトロニクス技術を手がけるスタートアップ企業{{Citeweb|titleエレファンテック株式会社会社概要|publisherエレファンテック|date2017-09-05|urlhttps:www.elephantech.co.jpabout|accessdate2018-02-04}}。独自の製造方法で、フレキシブルプリント基板|フレキシブル基板を製造および販売をしている。
3750,"1993年にマイクロ波応用製品の研究{{Citeweb|urlhttp:www.rfsystemlab.comcompanyhistorycompany_his.html|title会社の歩み|workアールエフ年表|publisherアールエフ|language日本語|accessdate2013-02-19}}と世界最小のCCDイメージセンサ|CCDカメラの開発name\""asahi20030205\""{{citenews|newspaper朝日新聞（長野1）|date2003-02-05|page27|title売る技術も教えます「飲む胃カメラ」成功で長野のメーカー長野|language日本語}}-聞蔵IIビジュアルにて2013年1月20日閲覧。を目的として、代表取締役の丸山次郎とその妻の2名により'''アールエフシステム研究所'''として創業name\""asahi20050614\""{{citenews|newspaper朝日新聞（長野全県、2地方）|date2005-06-14|page34|titleアールエフ苦痛なくすカプセル内視鏡長野県（ものづくり人づくり企業探検）|language日本語}}-聞蔵IIビジュアルにて2013年1月20日閲覧。。1998年に株式会社アールエフを設立name\""asahi20050614\""。創業当初は放送用の小型無線カメラを主力としていたがname\""jnet21\""、日系アメリカ人|日系米国人歯科医師|歯科医の要望によりname\""jnet21\""1997年に開発した世界初name\""chusho\""{{Citeweb|year2009|urlhttp:www.chusho.meti.go.jpkeieisapoinmono2009pdfinnovationnagano.pdf|titleCCD技術で医療・工業界を変革する研究開発型メーカー株式会社アールエフ|formatPDF|work元気なモノ作り中小企業300社2009|publisher中小企業庁|page1|language日本語|accessdate2013-02-19}}のワイヤレス口腔内カメラが現地でヒットしたことを皮切りに、デジタルX線撮影|X線センサーやカプセル内視鏡などの医療用機器を主力とするようになったname\""jnet21\""。そのほか工業用X線センサーや工業用内視鏡も手がけているname\""chusho\""。CCDカメラの関連技術に強みを持つname\""nikkei20100623\""{{citenews|newspaper日本経済新聞（朝刊）|date2010-06-23|page14|titleデジタルX線撮影装置、アールエフ、中国で販売—伊藤忠と協力、需要を開拓|language日本語}}-日経テレコンにて2013年1月20日閲覧。。歯科医向けの口腔内カメラでは世界市場占有率|シェア8割name\""nikkei20100623\""name\""nikkei20030120\""{{citenews|newspaper日本経済新聞（朝刊）|date2003-01-20|page20|title内視鏡開発のアールエフ、医療機器分野の起業家を育成—大学院大学設立へ|language日本語}}-日経テレコンにて2013年1月20日閲覧。、デジタルX線センサーでは国内シェア6割を占めているname\""nikkei20100623\""。ワイヤレス口腔内カメラ自体の日本国内での普及率は2割程度だが、その中でのアールエフのシェアは9割近いとされるname\""asahi20050614\""。社名の\""RF\""は、「無線」を意味する\"":en:Radiofrequency|'''R'''adio'''F'''requency\""の頭文字が由来である\""RadioFrequency\""の本来の意味は「高周波」である。{{Citeweb|urlhttp:www.rfsystemlab.comrecruitprofile.html|titleアールエフについて|work採用情報|publisherアールエフ|language日本語|accessdate2013-02-19|quote無線という意味のRadioFrequency（ラジオフリークエンシー）}}。2005年を目処に医療機器分野の起業家を育成する大学院大学（先端医療機器大学院大学{{Citeweb|urlhttp:www.rfsystemlab.comrecruitspRecruit_faqRecruit_faq2.html#q11|titleQ11:「先端医療機器大学院大学」って?|work採用情報長野生まれのアールエフ!に関する30の質問+WEB20|publisherアールエフ|language日本語|accessdate2013-02-19}}）の設立name\""asahi20030205\""name\""nikkei20030120\""、及び東証マザーズに上場予定と報じられていたname\""asahi20050614\""がその後の動向は不明である。自社製品、純国産を謳っているが国内生産は組み立てのみで、各部品は一部の重要パーツを除きほぼ中国製部品を使用し組み立てている。そこから圧倒的な低価格を実現している。"
3750,2000年（平成12年）に創業された精密機械メーカーである。創業以来、「安心と信頼」および「品質は経営の基盤」の2つを重要な要素と考え、常に高品質かつ安全・安心な製品をつくることを心がけ、ファクトリーオートメーション|FA用製品を中心に製品を開発・販売し続けている。2004年（平成16年）4月1日には、東京都内に出張所（現：東京営業所）を開設させ、その2か月後にはテクノステージ和泉に存在する現在の所在地に本社を移転させた。手がけている業務はそのほとんどがOEMである。なお、東京都千代田区に存在するコンテンツメーカーの株式会社姫屋ソフトがシーズウェア|同名のブランドを扱っているが、無関係である。
3750,細http:www.vtec.co.jpcorporateoutline.html}}'''株式会社ブイ・テクノロジー'''（{{Lang-en-short|''VTechnologyCo.Ltd.''}}）は、神奈川県横浜市保土ケ谷区に本社を置く精密機器メーカーである。主に1.フラットパネルディスプレイ用、製造装置、検査装置、測定装置、観察装置及び修正装置の開発・製造・販売・サービスならびに、2.太陽電池・LED向け装置の開発・販売を行っている。近年はスマートフォン用パネルの性能向上に貢献する「http:www.vtec.co.jpproductp_01aegis-pi.html光配向露光装置」の開発にも力を入れている。
