5200,仙台空港ターミナルビル西の近隣に位置する。仙台空港の航空貨物取扱施設の整備、運営体制の確立、航空による物流拠点の形成を目的に、宮城県が中心となって設立した。仙台空港民営化に伴い、2016年2月に民間企業である仙台国際空港株式会社の完全子会社となりhttp:www.kahoku.co.jptohokunews20160220160202_12013.html仙台空港民営化ビルと貨物　子会社化河北新報（2016年2月2日）、同年6月に同社に吸収合併され解散した{{PDFlink|http:www.tokyu.co.jpsiackoukoku160428SIACsonzoku_koukoku.pdf吸収合併公告}}仙台国際空港株式会社（2016年4月28日）。
5200,南満州鉄道の子会社として日満倉庫を設立し創業。満州で倉庫・物流業を手がけ、親会社の鉄道資材の保管業務も併営していた。終戦後の南満州鉄道の解体に伴い子会社の日満倉庫も解体対象となり、事業は東洋埠頭商事に全面譲渡された。その後社名を現在の東洋埠頭に変更した。埠頭会社では規模・売上ともにトップである。
5200,1909年創業の三井グループの物流企業。倉庫事業、港湾運送事業、国際輸送などの物流事業のほか、都市部の所有地を活用した不動産賃貸業|不動産賃貸事業をおこなっている。近年はBPOや3PLも展開。国内24都道府県、世界20カ国30海外現地法人のネットワークを持つ。二木会{{PDFlink|https:doors.doshisha.ac.jpduarrepositoryir1598117064050004.pdf六大企業集団の無機能化}}-同志社大学学術情報検索システム内のページ。筆者は経済学者の田中彰_(経済学者)|田中彰。・月曜会・三井広報委員会http:www.mitsuipr.com三井広報委員会・三井業際研究所http:www.mitsui-gyoosai.comkaisha.html会員会社-三井業際研究所・綱町三井倶楽部http:tsunamachimitsuiclub.co.jpmembers綱町三井倶楽部会員会社一覧の会員会社であり、三井文庫の賛助会社でもあるhttp:www.mitsui-bunko.or.jpfoundationsupport.html公益財団法人三井文庫【賛助会社】。ビジョン「物流から価値を。」ミッション「革新と安心をユニバーサルに提供すること。」
5200,新興のサード・パーティー・ロジスティクス（3PL）業者であるが、かつては子会社を通じ、人材派遣業や納品代行事業など幅広く展開していた。2004年12月には大阪証券取引所|大証ヘラクレス(有価証券市場)|ヘラクレスに上場、2006年12月に東京美装興業と資本・業務提携を結んだ。2007年4月2日、会計監査人が辞任したことに伴って、半期報告書の提出が遅延したことから、大証は当社株式を監理ポストへと割当てることを発表した（4月25日に解除）。2009年以降、3PL事業を中心とするコア事業に経営資源を集中するべく、子会社の売却等の事業再構築を進めたが、2009年6月期以降継続して純損失を計上。2012年6月期には大阪フルフィルメントセンターでの事業大幅縮小などで60億余りの連結純損失を計上し、債務超過に陥った。2013年3月、単独での再建は困難として金融支援を求め、事業再生ADR手続の利用を申請したhttp:world-logi.co.jpirnews2013-post-47.html事業再生ＡＤＲ手続の利用申請及び受理に関するお知らせ。アセット・グロース・インターナショナル傘下のファンドと株式会社ナカノ商会に第三者割当増資を行うhttp:world-logi.co.jpirnews2013-post-62.html第三者割当による新株式の発行に関するお知らせとともに、取引先金融機関に約64億円の債務免除等を求める事業再生計画案を策定http:world-logi.co.jpirnews2013-post-65.html事業再生ＡＤＲ手続における第２回債権者会議の開催及び「事業再生計画案」策定に関するお知らせしたが、金融機関との調整がつかず、2013年6月に事業再生ADR手続を終了し、第三者割当増資も実施されないこととなったhttp:world-logi.co.jpirnews2013-post-72.html事業再生ＡＤＲ手続の終了、第三者割当による新株式発行の中止及び臨時株主総会の開催中止に関するお知らせ。2013年8月、大阪地方裁判所に破産手続開始を申し立て、倒産したhttp:world-logi.co.jpirnews2013-post-76.html破産手続開始の申立に関するお知らせhttp:www.tsr-net.co.jpnewstsr20130830_01.htmlTSR速報ワールド・ロジ（株）東京商工リサーチ2013年8月30日。そして2016年4月27日に法人格が消滅したhttp:www.houjin-bangou.nta.go.jphenkorireki-johoto.html?selHouzinNo9120001022130ワールド・ロジ国税庁法人番号公表サイト。
5200,三井物産の一事業部門が独立して創業された経緯から、三井グループの一員として営業されてきたが、1998年には株式市場を通しての株買占めに遭い、経営権を掌握されるに至った。偽手形の流通による信用低下で会社更生法を適用し、倒産した。その後、取引関係のある太平洋セメントの支援を受けて再建中である。2013年現在も社名に三井の名称を使用しているが、かつての親会社・三井物産からは完全に分離されているただし、2013年現在の親会社である太平洋セメントは三井財閥|二木会・月曜会・三井業際研究所・綱町三井倶楽部に加盟している三井系のセメント会社であるため、三井グループとは完全に切れたわけではない。。
5200,包装業務の統合・拠点化を目的に、いすゞ自動車が当時の川崎工場内にスピンオフとして当社を設立。その後、日本梱包運輸倉庫|日本梱包運輸倉庫株式会社も資本参加したが、現在はいすゞ自動車の完全子会社となり新規取引事業の展開を図っている。
5200,2007年10月1日に株式会社ジェイアイティーを存続会社とし、旧NYKロジスティックスジャパン株式会社と合併し、新生NYKロジスティックスジャパン株式会社が誕生。株式会社ジェイアイティーは、1983年12月にジャパン・インターモーダル・トランスポート株式会社として設立され、2001年6月に株式会社ジェイアイティーと社名変更してNVOCC事業を展開。一方、旧NYKロジスティックスジャパン株式会社は、2004年4月30日に日本郵船グループの海外物流ネットワークと連携したインターモーダル輸送|一貫輸送物流および国内のサード・パーティー・ロジスティクス(3PL)を主な事業として設立された。日系の物流業者としては随一の海外ネットワークを誇る。
5200,貨物自動車運送事業を主体とし、倉庫業を手がける総合物流企業として関西圏を商圏に物流サービスを提供している。センコーグループホールディングスの主要子会社であるセンコー株式会社(大阪市北区)の100%出資子会社であり、同社の運送事業部門を担う一方で独自の事業展開も行う。本社事務所をLED照明化したりhttp:www.weekly-net.co.jplogisticspost-5008.php　ＬＥＤ照明で環境に注力　大阪センコー運輸整備　ＣＯ２削減や労働災害防止に『物流ウィークリー』2010年4月16日付。、全日本トラック協会|近畿トラック協会が主催する電気自動車|EVトラックの実証実験に参加するhttps:lnews.jp20110239521.html　センコー電気貨物トラック実用化に向け試験運用『LNEWS』2011年2月3日付。など、センコーグループの一員として環境に配慮した先進的な試みにも取り組んでいる。
5200,"ケイラインロジスティックス（KLL）は、川崎汽船グループの物流中核企業である。元々は飯野海運の子会社「飯野航空サービス」として発足、後に川崎汽船グループとなって1969年に「'''川崎航空サービス'''」（\""K\""LINEAIRSERVICE　略称：KLAS）に改称した。このため、飯野ビル建替え前までは飯野海運の本社と同じ場所が登記上の本店所在地であった。その後航空貨物の取扱を主力業務に成長し、2006年7月には同じ川崎汽船グループの海上貨物フォワーダー・株式会社ケイロジスティックス（川崎汽船系の港湾運送業者ダイトーコーポレーションおよび日東物流の海上貨物フォワーダー部門を分離・統合して設立された会社）を吸収合併して現社名に変更、海上貨物・総合物流の強化拡大を図っている。2009年3月18日に、同業11社と共に、独占禁止法第3条（不当な取引制限）の規定に違反する行為（航空貨物カルテル）を行ったとして、公正取引委員会より排除措置命令および課徴金納付命令を受けた。2015年5月29日に、東京税関よりAEO(AuthorizedEconomicOperator)制度に基づく「認定通関業者」の認定を受けたが、不祥事により2018年12月26日に自主返納し、失効している。"
5200,1968年(昭和43年)創業の倉庫会社。https:kotobank.jpword%E6%94%BF%E5%BA%9C%E7%B1%B3-546303政府米の保管業務から始まった。貨物保管業務（常温倉庫、低温倉庫）、運輸事業、通販物流事業など物流事業のほか、主に千葉県、埼玉県、茨城県の主要エリアを活用した倉庫賃借事業、物流システム構築事業を行っている。
5200,埼玉県南部を中心として首都圏(日本)|首都圏に展開する総合物流企業。三温度帯共同配送によるネットワーク網を構築し日本物流大賞を受賞している。戸田市、和光市、さいたま市岩槻区、所沢市、入間郡三芳町など埼玉県内に大規模倉庫を開設していたことから、2015年に本社をさいたま市の副都心として整備が進む南区の武蔵浦和駅至近に移転した。普通倉庫を61棟、冷凍冷蔵倉庫を23棟所有している。
5200,大日本倉庫の前進は、江戸時代中期、河内木綿を取り扱う問屋として髙井徳平が創設する。その後、綿種油の製油業も開設し、中河内を中心に事業を展開する。昭和のはじめ頃、現本社・八尾営業所の土地を取得する際、当初は製油工場の建設を予定していたが、旧国鉄線路沿いという輸送に適した土地であったため、当時の大日本帝国海軍の意向もあり倉庫として開設した経緯がある。はじめは八尾倉庫として開設したが、その後大日本帝国海軍の軍事物資拠点となり、社名も大日本倉庫へと改名した。
5200,1950年10月に創業。美術品、映像・音楽媒体メディア、ワインなどのデリケートな品の保存保管を基幹事業としている。また、BtoC事業としてwebと写真を活用した新たな収納サービス「minikura」を積極的に展開しており、さらに「MINIKURA」のプラットフォームを使ったアート作品のレンタル事業や、月額課金制の衣料品レンタルなどwebを使った新事業を展開するベンチャー企業との資本・業務提携にも着手している。一方で、寺田倉庫の本拠地となる天王洲アイル地区の活性化に注力しており、新規事業を数多く展開。天王洲の倉庫街からの文化発信に注力し、本社内にイベントホール、音楽スタジオ、茶室などを開設し同品川区の施設にギャラリーを誘致している。また、ASIANARTAWARDsupportedbyTERRADAの開催や海外のアートイベントの招致など、天王洲アイルの地域活性化を目的とした文化・芸術の支援育成に取り組んでいる。2018年8月には、法人格では初となる、モンブラン国際文化賞を受賞。アート関連事業に注力していることや、伝統芸能のサポートなど芸術文化活動への積極的な支援などが評価された。
5200,1999年夏、インターネットや携帯電話|携帯を使った、誰でも簡単に参加できるネットワークがトラック運送業界には無かったため、東京都足立区にある運送会社の若手経営者が集まり、個人運営でシステム開発を開始。2013年8月に株式会社ガラパゴスと合併し、クレープの製造・販売を行う食品事業部をスタートさせる。2014年にはサービスを利用する会員社数33000社を超え、登録トラック台数は418000台に達している。https:www.trabox.jppubwebapp.phptopparams参照元また、日本経済新聞、日経産業新聞、東京新聞、物流専門誌の物流ウィークリー、物流ニッポンなどで事業の展開を紹介され、新聞掲載数は2014年1月の段階で500回を超えている。http:www.trabox.ne.jpcorporatenewspaper.html参照元
5200,八幡製鐵所の構内輸送や、日本国内における貨物自動車運送業・港湾運送業、国際物流事業（利用運送事業|貨物利用運送業）を行う企業である。八幡製鐵所の新日鐵住金八幡製鐵所くろがね線|専用鉄道・構内鉄道の機関車の運転及び整備を行っているため、第三セクター鉄道の鉄道車両|車両整備なども受託している。
5200,*創立　1972年7月**社名は創業当初、栗太郡栗東町（現栗東市）手原地区に創業したことに由来。*従業員　約960人*主要業種　営業倉庫、貨物自動車運送、倉庫コンサルタント*事業所　野洲市（本社）、横浜市、大阪市、北九州市
5200,エイミーストリートジャパンは、インディーズアーティストの楽曲を配信する音楽配信サービス「エイミーストリートジャパン」を展開していた。
5200,社名の由来は、アイデアを光り輝かせるという意味をこめて。それぞれに個性を持って光り、周りもクリエイティブで光り輝かせるというところから。資生堂、アクロン、カルビーじゃがりこなどのCMを制作している。
5200,''ネイバージャパン株式会社（NAVERJapanCorporation）'''は、かつて存在した、日本語版検索サービス（検索エンジン）を運営していた日本の会社。資本的には、韓国最大手の検索サービス・ネイバー|NAVERを運営するNHNの日本法人であるNHNJapan傘下になる。2007年11月に設立され、2009年6月15日より人数限定でサービスの先行体験版、7月1日よりオープンベータ版を開始した。サービスコンセプトは「探しあう検索」。2012年1月1日付でNHNJapanとの経営統合により、消滅した。
