資生堂ホネケーキ工業株式会社,"[[化粧品]]・[[石鹸]]および雑貨類、[[医薬部外品]]の製造販売および輸出入や、動物用医薬部外品の製造販売および輸出入を目的としている。生産された化粧品・石鹸は資生堂のもとで販売されている。同社が製造し、資生堂から発売されている「ホネケーキ」は、[[1958年]]から発売され続けるロングセラー製品であり、近年では生産量は少なくなったものの、英語のHoneyとCakeを合成して出来た造語で、製造段階で原料に[[ハチミツ蜂蜜]]が使われていることから、その名がついたものである。また同社が製造する化粧品・石鹸などのブランドの総称でもある。資生堂は、[[1948年]]から[[大阪市]][[東淀川区]]に大阪資生堂（現・資生堂大阪工場、元々は資生堂の子会社）を置いているが、[[1990年代]]後期以降、所有ブランドの集約化が図られたため、トイレタリー類の生産については、関西へ集約しつつある。{{DEFAULTSORT:しせいとうほねえけきこうきよう}}[[Category:資生堂ほねけえきこうきよう]][[Category:茨木市の企業]]{{company-stub}}</text><sha1>aejkcmghxhk5u142k3elmpajd92yfjy</sha1></revision></page><page><title>Category:福島テレビ</title><ns>14</ns><id>1387397</id><revision><id>70950880</id><parentid>69327485</parentid><timestamp>2018-12-14T10:02:01Z</timestamp><contributor><username>Ihimutefu</username><id>310759</id></contributor><minor/><comment>体裁を調整。</comment><model>wikitext</model><format>text/x-wiki</format><textxml:space""preserve"">{{Commonscat}}{{Catmore}}{{DEFAULTSORT:ふくしまてれひ}}[[Category:日本の放送事業者カテゴリ]][[Category:福島県の企業別のカテゴリ]][[category:フジテレビ系列]][[Category:東北地方のテレビ局]][[Category:過去の日本テレビ系列局]][[Category:過去のTBS系列局]]</text><sha1>52t2sjwxxki61r0s27tdx989olrkb4z</sha1></revision></page><page><title>ホネケーキ</title><ns>0</ns><id>1387398</id><redirecttitle""資生堂ホネケーキ工業""/><revision><id>18713625</id><timestamp>2008-03-21T09:36:26Z</timestamp><contributor><username>Whity</username><id>13629</id></contributor><comment>[[WP:AES←]][[資生堂ホネケーキ工業]]へのリダイレクト</comment><model>wikitext</model><format>text/x-wiki</format><textxml:space""preserve"">#REDIRECT[[資生堂ホネケーキ工業]]</text><sha1>624llyaxczfky733rqcwnajd5a9rpf4</sha1></revision></page><page><title>Category:三毛猫ホームズシリーズ</title><ns>14</ns><id>1387399</id><revision><id>62060054</id><parentid>32849271</parentid><timestamp>2016-11-25T03:35:52Z</timestamp><contributor><username>タスケコロカナ</username><id>1137403</id></contributor><model>wikitext</model><format>text/x-wiki</format><textxml:space""preserve"">{{Catmore}}{{DEFAULTSORT:みけねこほおむす}}[[Category:赤川次郎の小説]][[Category:日本の推理小説のシリーズ]][[Category:ネコを主人公にした物語]][[Category:日本の小説のカテゴリ]]</text><sha1>iib5ksdipi294djnzh2sgjsom4il2x4</sha1></revision></page><page><title>福岡ヤフードーム</title><ns>0</ns><id>1387402</id><redirecttitle""福岡ドーム""/><revision><id>18713686</id><timestamp>2008-03-21T09:39:14Z</timestamp><contributor><username>ISSHIE</username><id>63943</id></contributor><comment>[[WP:AES←]][[福岡ドーム]]へのリダイレクト</comment><model>wikitext</model><format>text/x-wiki</format><textxml:space""preserve"">#REDIRECT[[福岡ドーム]]</text><sha1>6y38hwuf2el1lz61kdjnw42kxyechrx</sha1></revision></page><page><title>ファイル:RMSQE2atosaka2008stern.JPG</title><ns>6</ns><id>1387405</id><revision><id>38159924</id><parentid>18714181</parentid><timestamp>2011-06-26T21:22:07Z</timestamp><contributor><username>MGA73bot</username><id>366911</id></contributor><minor/><comment>FileisavailableonWikimediaCommons.</comment><model>wikitext</model><format>text/x-wiki</format><textxml:space""preserve"">{{NowCommonsFile:RMSGE2atosaka2008stern.JPG}}{{InformationDescriptionクイーン・エリザベス2号を右舷船尾方向よりのぞむ。大阪港天保山岸壁にて撮影。Source投稿者本人による撮影DateMar192008LocationAuthordorin1979Permissionother_versions}}{{PD-self}}</text><sha1>9lrmizbpnow5p1yzpgzq6f0tc8ej6p3</sha1></revision></page><page><title>ニャンザ州</title><ns>0</ns><id>1387406</id><revision><id>66636670</id><parentid>63529891</parentid><timestamp>2017-12-15T21:52:45Z</timestamp><contributor><username>Cewbot</username><id>1094317</id></contributor><minor/><comment>bot:解消済み仮リンク[[ボンド(ケニア)ボンド]]を内部リンクに置き換えます</comment><model>wikitext</model><format>text/x-wiki</format><textxml:space""preserve"">[[File:KenyaProvincesNyanza.svgright175pxニャンザ州の位置]]'''ニャンザ州'''([[スワヒリ語]]：MkoawaNyanza)は[[ケニア]]南西部の州。州都は同国第三の都市、[[キスム]]。面積は1万2613km2で、[[2009年]]の人口は544万2711人、人口密度は431.5人/km2&lt;ref&gt;[https://www.citypopulation.de/php/kenya-admin.phptitleCityPopulation閲覧日：2016年11月10日]&lt;/ref&gt;。「ニャンザ」は[[バントゥー語群]]で「湖」を表す。"
日本パーカライジング株式会社,[[鉄]]・[[アルミ]]・[[ステンレス]]・[[亜鉛]]などの素材表面の強度向上をはじめ塗装品質性能アップなどはもちろん耐久消費財の美観の保護まで、多角的な経営展開と付加価値の高い製品開発を推進している。海外では、[[米国]]・[[中国]]・[[韓国]]・[[台湾]]・[[タイ王国タイ]]などをはじめ世界11カ国に合弁企業または当社現地企業が稼働している。
フタムラ化学株式会社,[[1947年]]（[[昭和]]22年）、[[二村冨久]]が二村化学研究所を創設&lt;refname&quot;沿革&quot;/&gt;。[[1950年]]（昭和25年）二村化学工業株式会社を設立&lt;refname&quot;沿革&quot;/&gt;。代表者は長江泰雄。主な製品は、[[タバコ]]や菓子などの各種包装用[[フィルム]]、[[セロファン]]および[[活性炭]]で、特に包装用セロファンでは日本でのシェアを[[レンゴー]]と二分する。
帝人化成株式会社,『[[12人の優しい殺し屋12人の優しい殺し屋CROSSBORDER]]』（月刊「[[アニメージュ]]」連載小説）の主人公・フリージャーナリストの仙道夏騎役の杉田智和が、登場するキャラクターの声優をゲストに招くラジオ番組。それぞれのキャラクターに関する設定をリスナーから募集する。
ヘキストAG,FCSNetworkでネットワーク化された部隊は、無人[[偵察機偵察ヘリコプター]]や持ち運び可能な無人偵察車両、[[グローバル・ポジショニング・システムGPS]]などを駆使して収集した敵の情報を、兵士のヘルメットの前に装着された小型画面や戦闘車両にリアルタイムで送信し、双方向にて情報を共有することにより最小限の人員で敵に有効な打撃を与えることを目指している。また、車両の軽量化などにより[[有事]]即応態勢が高まり、紛争地域への投入・実戦展開に要する時間が従来の3割も短縮できるとされる。
藤倉化成株式会社,藤倉化成は、コーティング・建材塗装・電子材料・化成品の4事業を柱として展開する化学工業メーカーである。資本的には株式会社フジクラを頂点とするフジクラグループの一員で、[[藤倉コンポジット]]とは兄弟会社である。自動車・電子・建築に主要顧客を持つ。
シーアイ化成株式会社,[[テルコムSA]]の通信事業のために建設された。1981年以降、観光客の入場は認められていない。
エスケー化研株式会社,建築用塗料の大手メーカー。特に外装用に強く、建築仕上げ塗材で国内最大手&lt;ref&gt;[[会社四季報]]2013年秋号&lt;/ref&gt;。装飾用、内装用でも高いシェアを持つ。その他耐火被覆材、断熱材などにも展開している。塗料メーカーの中では、[[日本ペイント]]や[[関西ペイント]]と並び、海外展開に積極的な企業としても、その名を知られている。
フジプレアム株式会社,光学機能性[[フィルム]]の主要メーカー。元々は包装材としてのフィルムが殆どだったが、[[1991年]]には光学機能性フィルム加工に参入、独自の精密貼合技術で高い技術力を持つ企業として知られる。[[2000年]]から[[太陽電池]]の製造に本格参入、自由度の高いモジュール用太陽電池を開発するなど、業界では高い技術力を持つ。国内唯一の放射光施設、[[SPring-8]]を擁することで知られる[[播磨科学公園都市]]の高度産業科学技術研究所（ニュースバル）に研究所を持ち、現在は[[ナノテクノロジー]]を利用した新規事業を模索中である。
ライオンハイジーン株式会社,ライオンの業務用製品事業は旧・ライオン油脂だった昭和31年、開発に着手。その後新規事業の挑戦に向け、ライオンの全額出資のもとに設立された。当初は食器洗浄機用洗浄剤や関連する業務用洗浄剤の製造・販売を行っていたが、同じグループ会社の[[ライオン商事]]から業務用厨房事業・クリーニング用品を譲り受けたことにより、ライオンブランドの業務用製品のほとんどを同社が展開している。
日東エフシー株式会社,1952年（昭和27年）1月18日、日東肥糧株式会社として設立。化学肥料の製造・販売のほか、工業用原材料および肥料の輸入・販売や、[[不動産賃貸業不動産賃貸事業]]も行う。また、不動産賃貸事業では金山プラザホテルの運営も行っている。
旭化学工業株式会社,論文の様式、データベースのフォーマットなど、様々な標準が規定されている。[[1969年]]に科学技術情報の全国的流通システム（NationalInformationSystemforScienceandTechnology、略称'''NIST'''）の計画が作成され、学術情報データの標準化、共通化を行う必要があることが指摘された。それを受けて[[1973年]]に旧科学技術庁に科学技術情報流通技術基準検討会が設置され、具体的な基準の検討が始められた。[[1980年]]にはSIST01、02、03が制定され、その後も順次基準が追加が行われている。[[2001年]]には電子出版物や電子投稿の形式や方法について定められたSIST14の基準が制定された。また[[2007年]]には、昨今の情報流通の電子化に対応するためSIST02、05、06の改訂が行われた。普及についても科学技術振興機構が担当し、SISTセミナーが年1回程度開催されている。
日本デコラックス株式会社,1990年の対戦は、[[ナショナルリーグ東地区東地区]]の[[ピッツバーグ・パイレーツ]]と、[[ナショナルリーグ西地区西地区]]の[[シンシナティ・レッズ]]との対戦となった。結果は、4勝2敗でシンシナティ・レッズが14年ぶり9回目のリーグ優勝。[[1990年のワールドシリーズワールドシリーズ]]へ進出した。[[最優秀選手(MLB)#リーグチャンピオンシップシリーズMVPMVP]]は0勝0敗1セーブ、防御率0.00、10奪三振の成績を残した[[ロブ・ディッブル]]と、0勝0敗3セーブ、防御率0.00、7奪三振の成績を残した[[ランディ・マイヤーズ]]が同時受賞。
株式会社バスクリン,株式会社バスクリンの主事業である入浴剤は、[[1897年]]に津村順天堂（現・[[ツムラ]]）が発売した日本初の入浴剤「浴剤中将湯」が起源である。ツムラ漢方記念館（[[阿見町茨城県阿見町]]）館長の田村素子によると、婦人薬の製造で余った[[生薬]]を社員が[[風呂]]に入れたところ、身体が温まったことがヒントになって開発されたという&lt;ref&gt;「【一語一会】漢方の歴史伝える／もったいない精神今も」『[[日経産業新聞]]』2017年6月8日&lt;/ref&gt;。その後、[[1930年]]に「浴剤中将湯」をベースに温泉成分と芳香を加えた芳香浴剤「バスクリン」を発売する。「バスクリン」は、当初、発汗性に優れ夏季の浴用に適さなかった「浴剤中将湯」に対して、夏用入浴剤として発売された&lt;ref&gt;[http://www.bathclin.co.jp/happybath/nyuyoku/history/index2.htm入浴の歴史はぴばす]株式会社バスクリン&lt;/ref&gt;。[[太平洋戦争]]末期の[[1945年]]には原料・資材・人材等の不足による生産中止に至ったものの、[[1950年]]に生産を再開&lt;ref&gt;[https://web.archive.org/web/20130821091321/http://www.dreammail.jp/magazine/seishun/20080113/【バスクリン】昭和初期からの長い歴史（男の浪漫伝説Vol.34)ドリームメール]-（2013年8月21日時点の[[インターネットアーカイブアーカイブ]]）&lt;/ref&gt;。[[2010年]]で発売80周年を迎え、ロングセラーブランドとなっている。また、[[1972年]]には日本初の浴槽洗浄剤「バスピカ」を発売。手軽さが支持されてヒットした。しかし、ツムラが[[バブル経済]]期までに多角的な経営をしていたことが災いして業績が悪化し、さらに[[1997年]]に創業一家による[[特別背任]]事件が起きたことでピンチに陥る。1995年に第一製薬（現：[[第一三共]]）から風間八左衛門、[[芳井順一]]らが招聘され、それまでの事業を整理し、医療用[[漢方]]製剤を中心とする事業へのシフトを開始した。家庭用品事業についても黒字化を達成すべく努力が続けられ、[[2006年]]3月期に営業黒字化が達成された。営業黒字化を受け、家庭用品事業の継続と自立をより強力に進めるため、家庭用品事業の分社化が決定した&lt;ref&gt;[http://www.tsumura.co.jp/corporate/release/2006/pdf/20060629ls.pdf家庭用品事業の分社化に伴う新会社の概要について]株式会社ツムラ・[[2006年]][[6月29日]]プレスリリース&lt;/ref&gt;。[[2006年]]6月にツムラの完全子会社である（旧）ツムラライフサイエンス株式会社が設立され、[[2006年]][[10月]]に家庭用品事業がツムラから（旧）ツムラライフサイエンス株式会社へ継承された。[[2008年]][[7月]]に、医薬品事業と家庭用品事業に[[シナジー効果]]が少ないことから、企業価値を高めるために投資ファンドのWISEPARTNERSの支援を受け、自社株取得([[マネジメント・バイアウトMBO]])によりツムラグループから独立することになった&lt;ref&gt;[http://www.bathclin.co.jp/news/2008/0715_news.htm株主交代に関するお知らせ]株式会社バスクリン・[[2008年]][[7月15日]]プレスリリース&lt;/ref&gt;。[[2008年]][[8月]]に（旧）ツムラライフサイエンス株式会社の全株式が、WISEPARTNERSが新規に設立した株式会社プルメリアへ売却された。[[2009年]][[1月]]に株式会社プルメリアが（旧）ツムラライフサイエンス株式会社を吸収合併し、商号を（新）ツムラライフサイエンス株式会社に変更し、ツムラから完全に独立及び離脱した。この時は「t」のマークと「ツムラ」の従来ロゴは引き続き使用されていたが、[[2010年]][[9月]]に株式会社バスクリンに商号変更し、ロゴも一新された。分社化後はツムラとの人的・資本関係は一切なく完全に距離を置いており、入浴剤のパッケージ裏面には「株式会社バスクリンは、株式会社ツムラから独立した会社です。」の表記がある。ただし、津村順天堂時代からの商品である「バスハーブ」（液体薬用入浴剤）は、バスクリンが製造販売承認を保有しており、ツムラへのOEM供給により、分社化後もツムラで販売されている。[[2012年]][[2月29日]]、[[アース製薬]]が、バスクリンの株式・新株予約権を取得し、完全子会社化した&lt;ref&gt;[http://www.earth-chem.co.jp/ir/news/pdf/20111227_01_01.pdf株式会社バスクリンの株式等の取得（子会社化）のお知らせ]（アース製薬株式会社、2011年12月27日閲覧）&lt;/ref&gt;&lt;ref&gt;[http://www.bathclin.co.jp/news/2011/1228.htm当社株式の異動に関するお知らせ]株式会社バスクリン・2011年[[12月28日]]プレスリリース&lt;/ref&gt;。なお、親会社となったアース製薬や、当社と同じアース製薬傘下で2014年9月1日に株式会社[[白元]]からの譲渡により事業を開始した[[白元アース]]株式会社でも、当社と同じように入浴剤を扱っている（アース製薬では「バスロマン」ブランド製品、白元アースでは社名変更後に発売された「HERSバスラボ」ブランド製品が中心）。2018年8月にはアース製薬の「バスロマン」との大型リニューアルに伴って「バスクリン」で採用されている紙製[[楕円]]形容器が「バスロマン（プレミアム・薬泉を除く）」にも採用され、当社静岡工場製造となった&lt;ref&gt;{{Citepressreleasetitle入浴剤文化を創造してきた2大ブランド「バスロマン」「バスクリン」を『REBORN』、アースグループ入浴剤商談会にて今後の方針を発表publisherアース製薬株式会社date2018-06-01formatPDFurlhttps://corp.earth.jp/jp/event-report/2018/pdf/0601-01.pdfaccessdate2019-01-23}}&lt;/ref&gt;。
メネデール株式会社,主に園芸用植物の活力剤として知られる「メネデール」の製造販売を中心におこなう。その他液体肥料なども製造している。製品名ならびに社名の「メネデール」はその名の通り、「植物にとって一番の活力源である、芽と根が出る」ことに因んだものである。「メネデール」は植物活力剤のパイオニア的製品であり、主に園芸用の[[ホームセンター]]を中心に広く取り扱いがなされており、近年ではその植物への高い活力を取り戻す効能を買われて、都市部での[[緑化計画]]などに一役買うことも多くなっている。
上野製薬株式会社,食品の保存技術に強みを持つ。2代目社長の上野隆三が[[コルベ・シュミット反応]]の反応機構を解明し、パラヒドロキシ安息香酸などの芳香族ヒドロキシカルボン酸の工業化に成功させたのを機に、そのプロセスを発展させ、現在は各種化学薬品を製造している。近年では[[液晶ポリマー]]や[[有機顔料]]などのウェートが高くなっており、また[[液晶ポリエステル樹脂]]の分野でも世界的シェアを誇る。以前は[[眼科]]用[[医薬品]]（レスキュラ点眼液）の製造を行っていたが、2001年に、医薬品の開発者であり、かつ、上野隆三の息子でもある上野隆司が創業したアールテック・ウエノに医薬品を移管し、現在は医薬品の取扱いはない。初代及び2代目社長の上野政次郎と上野隆三は[[紫綬褒章]]と勲四等[[瑞宝章]]を受章している&lt;ref&gt;[http://www.ueno-fc.co.jp/company05.html上野製薬株式会社沿革]&lt;/ref&gt;。
日弘ビックス株式会社,学園を舞台にしたスポーツドラマ。[[バスケットボール]]部に所属する由美はひたすらバスケの練習に打ち込むが、思いもよらぬアクシデントに見まわれる。{{要出典範囲ロケ地は[[宝塚市宝塚]]、[[西宮市西宮]]、[[芦屋市芦屋]]の学校が中心であったdate2017年11月15日(水)14:30(UTC)}}。
株式会社寺岡製作所,*[[2004年]][[3月]]設立。*主にパーティーなどで使われるコスチュームや関連のグッズ製品の企画・製造・卸を中心に行っており、[[ハロウィーン]]や[[クリスマス]]のシーズンにはその関連商品も多数取り扱う。*これらは大手[[量販店]]、[[バラエティーショップ]]などのパーティーグッズコーナーなどに多数納入し、販売されている。*ブランドとして「GoodLuck」、「トキメキグラフィティ」、「LunaticLemonyLollipop」、「TeensEver」がある。*オリジナル商品の他、[[でんぱ組.inc]]や[[AMO]]などアーティストコラボを積極的に行っている。*2015年3月よりPRユニット「[[LADYBABY]]」を結成。
コープケミカル株式会社,本系列は[[1974年]]に発注された[[韓国鉄道9900系電車9900系電車]]以来、32年ぶりに[[日本]]の[[日立製作所]]が製作受注したことから、HEMU(HitachiElectricMultipleUnit)とも呼ばれている。[[2009年]][[1月9日]]に第1編成が出場、甲種[[輸送]]され、[[2月6日]]から[[試運転]]を開始した。[[2009年]][[6月1日]]より[[京釜線]]と[[長項線]]の[[ソウル駅ソウル]]-[[新昌駅新昌]]間を[[ヌリロ]]として運行を開始した。当面、[[ムグンファ号]]と同等の運賃を適用。現在は、[[龍山駅(ソウル特別市)龍山]]発着の[[湖南線]]のヌリロ以外にも、週末臨時列車としても使用されている（詳細は、[[ヌリロ]]記事を参照）。また、[[2012年]]5月から開催の[[麗水国際博覧会]]訪問客に対応するための[[全羅線]][[順天駅順天]]-[[麗水エキスポ駅麗水エキスポ]]間のシャトル列車としても運行されていた。
淀川ヒューテック株式会社,フッ素樹脂の加工技術を軸に、各種分野に様々な製品を開発・製造している。特に[[半導体]]製造関連分野を中心とする情報通信分野で高いシェアを誇る。その他、食品・バイオ等の分野などで、耐食性、化学抵抗性、耐熱性に強い精密加工品が要求されることから、同社の製品が多数使用されている。創業から今日までフッ素樹脂加工一筋で来た企業として、同分野ではパイオニア的存在であり、高い技術力で国内5ヶ所に生産拠点を持つ。また海外では[[上海]]に事業拠点を置いている。
鶴見曹達株式会社,*当中継局は、高崎市倉渕町川浦字小倉の[[高崎市立中央小学校中央小学校]]北方に置かれ、市内倉渕町の一部地域へ電波を発射していた。*なお、かつては[[日本放送協会NHK]]も中継局を置いていた。詳細は、[[NHK高崎川浦中継局]]に記述する。
平尾賛平商店,*桐生中継局は、群馬県の両毛地域をカバーしている。*当中継局は、デジタル・アナログ共、桐生市広沢町3丁目の茶臼山に置かれている。
日本ポリプロ株式会社,*[[テレビ朝日]]系アニメ『[[地獄先生ぬ〜べ〜]]』オープニングテーマに起用された。*サビの部分は[[ルートヴィヒ・ヴァン・ベートーヴェンベートーヴェン]]の[[交響曲第9番(ベートーヴェン)交響曲第9番]]「[[歓喜の歌]]」をモチーフにしている&lt;ref&gt;『地獄先生ぬ〜べ〜』単行本21巻196ページ&lt;/ref&gt;。*FEELSOBAD最大のヒット[[シングル]]である。*オリコンTOP100入りを果たしたシングルは本作が最後である。*[[オリックスバファローズ]]、[[福田周平]]の登場ソングである（2019年）。
三井化学東セロ株式会社,日本国内で使用する[[鉄道車両鉄道]]・[[軌道法軌道]]車両のうち、[[1983年]][[1月1日]]から[[12月31日]]までの間に日本国内で営業運転に就いた新形式車両またはそれとみなせる車両&lt;ref&gt;従来からある形式であっても設計変更を行い新規に製造された車両は、選考委員会の判断によって選定候補車両となるか否かが決定される。また、[[改造]]車両についても、選考委員会が選定候補とするか否かを決定する。&lt;/ref&gt;で、候補車両決定の時点で現に営業をしていることを概ねの要件とする選定候補車両19車種のなかから、ブルーリボン賞1形式、[[ローレル賞]]1形式が選定された。
