株式会社三菱ケミカルホールディングス,[[三菱グループ]]の化学系メーカーである三菱ケミカル株式会社（三菱化学・三菱樹脂・三菱レイヨンの統合）と、その[[子会社]]で[[医薬品]]メーカーの[[三菱ウェルファーマ]]（当時、田辺三菱製薬株式会社）と[[2005年]]会社設立。子会社に[[大陽日酸]]。コーポレートスローガンは「''Good'''Chemistry'''forTomorrow''」。日本最大の総合化学企業として、[[ダウケミカル]]・[[BASF]]・[[デュポン]]・[[バイエル(企業)バイエル]]などの大手に続く。[[2017年]]の世界の化学業界の業績「グローバルトップ50」では、263億4200万ドルで11位（田辺三菱製薬を除く）&lt;ref&gt;{{citenewsurlhttp://www.kagakukogyonippo.com/headline/2015/08/14-21405.htmldate2015-8-14newspaper化学工業日報title世界の化学トップ50社利益率高い欧米アジアと差開く}}&lt;/ref&gt;。[[株式公開買付け]]により、[[2007年]]（平成19年）[[10月1日]]に「三菱樹脂株式会社」、（[[2010年]]（平成22年）[[4月1日]]には[[三菱レイヨン]]を、[[2014年]]（平成26年）11月12日には[[大陽日酸]]をそれぞれ子会社化し、傘下におさめた。[[2007年]]（平成19年）[[10月1日]]には三菱ウェルファーマが田辺製薬株式会社と企業合併して、「田辺三菱製薬株式会社」となったが、存続会社を「旧:田辺製薬株式会社」として[[東京証券取引所東証]]・[[大阪証券取引所大証]]への上場を維持したため、完全子会社でなくなった。[[2025年]]のビジョンとして、「&quot;''GoodChemistry''&quot;を基盤として&quot;KAITEKI&quot;を実現する企業を目指す」と掲げる。[[営業利益]]やROAなどの基礎的経営指標のほかに、MOS指標と呼ばれるSustainability(Green)、Health、Comfortにより、総合的な企業価値を定量化する&lt;ref&gt;{{citewebaccessdate2015-9-30date2015page52title5.成果（分野別事業概況）:MOS指標の進捗urlhttp://www.mitsubishichem-hd.co.jp/csr/download/pdf/15_05-4.pdfwork三菱ケミカルホールディングスKAITEKIレポート2015publisher三菱ケミカルホールディングス}}&lt;/ref&gt;。三菱金曜会&lt;ref&gt;[http://www.mitsubishi.com/kinyokai/三菱金曜会]&lt;/ref&gt;及び三菱広報委員会&lt;ref&gt;[http://www.mitsubishi.com/mpac/j/三菱広報委員会]&lt;/ref&gt;の会員企業である&lt;ref&gt;[http://www.mitsubishi.com/kinyokai/syoukai.html三菱金曜会会員会社紹介]&lt;/ref&gt;&lt;ref&gt;[http://www.mitsubishi.com/mpac/j/companies/三菱広報委員会-会員会社紹介]&lt;/ref&gt;。
ファインケミカルジャパン株式会社,「麻将」とは金銭を賭けない純粋な競技としての[[麻雀]]を意味する語（[[中国]]で麻雀のことを「麻将」というが、この場合は関係がない）であり、麻雀と同じく「マージャン」と発音する。そのような麻雀を意味する言葉としては「[[競技麻雀]]」という言葉もあるが、あえて「麻雀」と同音の言葉を使用している。団体の目的は当然、「麻将」の普及にある。[[機関誌]]「麻将新世紀」を年3回発行していた。多くのプロ団体において「プロテスト」と銘打たれた選手採用テストが行われるのに対し、ミューにおいてはまず「ツアー試験」によって選手（ツアー選手）を採用し、そこから一定の要件を満たした者をプロ（認定プロ）に認定するという厳格な2段階方式を採用している。また、ツアー試験もプロ認定も「絶対評価」であり、及第点に達するものがいなければ「合格者無し」となる。
東名化成株式会社,[[1824年]]2月から3月にかけて作曲され、[[作品番号作品29-1]]として出版された&lt;ref&gt;本作とほぼ同時期に[[弦楽四重奏曲第14番(シューベルト)第14番『死と乙女』]]も作曲が着手された。&lt;/ref&gt;。シューベルトの弦楽四重奏曲への試みは、未完成に終わった前作[[弦楽四重奏曲第12番(シューベルト)第12番（四重奏断章）]]の作曲開始から数えて4年ぶりである。作曲者の存命中に出版された唯一の弦楽四重奏曲でもある。[[1824年]][[3月14日]]に、[[ルートヴィヒ・ヴァン・ベートーヴェンベートーヴェン]]最晩年の弦楽四重奏曲の初演者として歴史に名を残したシュパンツィヒ弦楽四重奏団によって初演された。初演の際、第3楽章は好評で、聴衆の求めに応じてもう一度繰り返して演奏せねばならなかったと言われる。しかし、シューベルトは初演のできに満足しなかったと伝えられる&lt;refname&quot;seido&quot;&gt;音楽の手帖シューベルト、青土社、1980年、巻末年表による。&lt;/ref&gt;。楽譜は1824年9月7日ザウアー・ウント・ライデスドルフより出版され、シュパンツィヒに献呈された&lt;refname&quot;seido&quot;&gt;&lt;/ref&gt;。
株式会社エフピコ,[[岡山県]][[井原市]]出身&lt;ref&gt;宗宮正行「[[興譲館高等学校興譲館高]]の新男子寮完成——運動部以外も利用可能」『山陽新聞』2013年（平成25年）3月22日付朝刊、笠岡・井原32面、山陽新聞社。&lt;/ref&gt;の小松安弘が「福山パール紙工株式会社」として設立し、株式会社エフピコに社名を変更して、現在に至る。主な商品はスーパーマーケット、食料品店などで使用される簡易食品容器（いわゆるトレー）の製造・販売を専業とするメーカーであり、[[東京証券取引所]]の一部上場企業（[[証券コード]]:7947）である。広島県における有力企業のひとつで、本社は広島県福山市曙町一丁目にあるが、そのほかの多くの上場企業と同様に東京本社として[[東京都]][[新宿区]]西新宿6丁目にある[[新宿オークタワー]]内に設置している。エフピコはトレーのリサイクルも行っており、自社で販売したトレーを回収し、再び「エコトレー」として販売を行っている。
日本カーリット株式会社,[[File:DowntownSkyline(39960025320).jpgthumb300pxleftニューヨーク中心部]]ニューヨーク市はアメリカ合衆国北東部の大西洋に面し、巨大な[[ニューヨーク港]]を持つ。市は[[ブロンクス区ブロンクス]]、[[ブルックリン区ブルックリン]]、[[マンハッタン]]、[[クイーンズ区クイーンズ]]、[[スタテンアイランド]]という5つの[[行政区(ニューヨーク市)行政区]]（バロウ、ボロウ）に分けられる。2010年の国勢調査における市域人口は8175133人を数え&lt;refname&quot;FactFinder&quot;/&gt;、陸地面積は790km&lt;sup&gt;2&lt;/sup&gt;&lt;refname&quot;NYCLandEstimate&quot;&gt;{{citewebpublisherNewYorkCityDepartmentofCityPlanningtitleNYCProfileurlhttp://home2.nyc.gov/html/dcp/pdf/lucds/nycprofile.pdfaccessdate2008-05-22formatPDF}}&lt;/ref&gt;&lt;refname&quot;NYTLandEstimate&quot;&gt;{{citewebpublisherTheNewYorkTimesdate2008-05-22titleIt’sStillaBigCityJustNotQuiteSoBigfirstSamlastRobertsurlhttp://www.nytimes.com/2008/05/22/nyregion/22shrink.htmlaccessdate2008-05-22}}&lt;/ref&gt;、人口密度はアメリカ国内の主要都市の中で2位である&lt;ref&gt;{{citeweburlhttp://www.demographia.com/db-2000city50kdens.htmtitle2000Census:USMunicipalitiesOver50000:Rankedby2000DensitypublisherDemographiaaccessdate2008-09-01}}&lt;/ref&gt;。ニューヨーク都市圏の人口もまた国内最大であり、[[ハドソン川]]対岸の[[ニュージャージー州]][[ニューアーク(ニュージャージー州)ニューアーク]]や[[ジャージーシティ]]、本土側の[[ヨンカーズ]]や[[ニューロシェル(ニューヨーク州)ニューロシェル]]、および[[ロングアイランド]]等を含む都市圏は18897109人、[[コネチカット州]]の[[スタンフォード(コネチカット州)スタンフォード]]、[[ブリッジポート(コネチカット州)ブリッジポート]]、[[ニューヘイブン(コネチカット州)ニューヘイブン]]やニュージャージー州の州都[[トレントン(ニュージャージー州)トレントン]]、内陸のポキプシー等を含む広域都市圏は22085649人（いずれも2010年国勢調査）の人口を抱えている&lt;refname&quot;FactFinder&quot;/&gt;。アメリカ合衆国の都市の中では[[公共交通機関]]が際立って多く利用されており、多くの交通機関が24時間運行している。また人口密度の高さと、その多様性も著しい。2005年の調査によれば、市内では170近くの言語が話され、人口の36%がアメリカ合衆国の外で生まれた人であった&lt;refname&quot;languagesinNYC&quot;&gt;{{citewebpublisherNewYorkStateOfficeoftheStateComptrollertitleQueens:EconomicDevelopmentandtheStateoftheBoroughEconomydate2006-06urlhttp://www.osc.state.ny.us/osdc/rpt3-2007queens.pdfformatPDFaccessdate2008-09-01}}&lt;/ref&gt;&lt;refname&quot;NYCimmigration&quot;&gt;{{citewebtitleTheNewestNewYorkers:2000publisherNewYorkCityDepartmentofCityPlanningyear2005urlhttp://www.nyc.gov/html/dcp/pdf/census/nny_briefing_booklet.pdfformatPDFaccessdate2008-09-01}}&lt;/ref&gt;。ニューヨークは「眠らない街」とも呼ばれ&lt;ref&gt;[http://got.net/~landauer/lists/CityOf.html]Citynicknames&lt;/ref&gt;、そのほかにも「[[ビッグ・アップル(ニューヨーク市)ビッグ・アップル]]」&lt;ref&gt;[http://www.gothamcenter.org/faq.shtmlNicknamesforManhattan]&lt;/ref&gt;、「[[ゴッサム]]」&lt;ref&gt;Irving'smocking''SalmagundiPapers''1807notedbyEdwinG.BurrowsandMikeWallace''Gotham:AHistoryofNewYorkto1898''(Oxford)1999:xii.&lt;/ref&gt;といったニックネームがある。ニューヨークは1624年に[[オランダ人]]の手によって交易場として築かれた町である。この入植地は1664年まで[[ニューアムステルダム]]と呼ばれていたが、同年イギリス人の支配が始まって現在の名称になった&lt;ref&gt;{{citebooklastShortofirstRusselltitleTheIslandattheCenterofTheWorld1stEditionyear2005publisherVintageBookslocationNewYorkisbn1-4000-7867-9pages30}}&lt;/ref&gt;。1785年から1790年まではアメリカ合衆国の首都としての役割を担った&lt;refnamesenate&gt;{{citeweburlhttp://www.senate.gov/reference/reference_item/Nine_Capitals_of_the_United_States.htmtitleTheNineCapitalsoftheUnitedStatespublisher[[アメリカ合衆国上院]]accessdate2008-09-07}}&lt;/ref&gt;。市内には世界的に知られた地区やランドマークが数多くある。[[自由の女神像(ニューヨーク)自由の女神像]]は、19世紀末から20世紀初めにかけて、アメリカへ渡ってきた何百万人もの[[移民]]を出迎えていた。[[ロウアー・マンハッタン]]の[[ウォール街]]は[[第二次世界大戦]]以来金融の国際的中心地であり、[[ニューヨーク証券取引所]]が置かれている。[[エンパイア・ステート・ビルディング]]や[[1ワールドトレードセンター]]など[[超高層建築物超高層ビル]]も多く建ち並び、[[ワールドトレードセンター(ニューヨーク)ワールドトレードセンター]]もその一つであった。[[国際連合本部ビル]]もあり、国際政治の中心でもある。またニューヨークでは[[ハーレム・ルネサンス]]、絵画の[[抽象表現主義]]、[[ポップアート]]や、[[ヒップホップ]]&lt;refname&quot;Toop-RapAttack2&quot;&gt;{{citebookfirstDavidlastTooptitleRapAttack2:AfricanRaptoGlobalHipHoppublisherSerpentsTailyear1992isbn1852422432}}&lt;/ref&gt;、[[パンク・ロック]]&lt;ref&gt;{{citeweburlhttp://www.scaruffi.com/politics/american.htmlaccessdate2008-09-01titleAtimelineoftheUSAfirstPierolastScaruffi}}&lt;/ref&gt;、[[ロフト・ジャズ]]、[[サルサ(音楽)サルサ]]、[[ディスコ(音楽)ディスコ]]、[[ティン・パン・アレー]]などの音楽ジャンルが生まれた。[[ブロードウェイ・シアターブロードウェイ劇場]]も有名である。アメリカの[[シンクタンク]]が[[2017年]]に発表した総合的な[[世界都市]]ランキングにおいて、[[ロンドン]]に次ぐ世界2位の都市と評価された&lt;ref&gt;[http://www.joneslanglasalle.co.jp/japan/ja-jp/Documents/New%20Release/20171023-JLL-DecodingCityPerformance.pdfJLL、世界の都市比較インデックスを分析「都市パフォーマンスの解読」を発表]JLL2017年10月26日閲覧。&lt;/ref&gt;。また、[[2017年]]に[[日本]]の民間[[研究所]]が発表した「世界の都市総合力ランキング」においても、ロンドンに次ぐ世界2位の都市と評価された&lt;ref&gt;[http://www.mori-m-foundation.or.jp/ius/gpci/世界の都市総合力ランキング(GPCI)2017]森記念財団都市戦略研究所2017年10月26日閲覧。&lt;/ref&gt;。一方、[[アメリカ合衆国国勢調査局国勢調査局]]と[[アメリカ疾病予防管理センター疾病予防管理センター]]のデータを使って、[[ハーバード大学]]と[[カナダ]]の[[ブリティッシュコロンビア大学]]が調査をしたところ、ニューヨークは全米で最も不幸だと感じる都市とする結果となった&lt;ref&gt;{{citenewstitle米国人が不幸な5つの理由newspaper[[ウォール・ストリート・ジャーナル]]date2014-08-22urlhttp://jp.wsj.com/news/articles/SB10001424052970203403704580106752201910386accessdate2014-08-23authorQuentinFottrell}}&lt;/ref&gt;。[[エコノミスト]]の兄弟会社で調査業務を行っている[[エコノミスト・インテリジェンス・ユニット]]によれば、2016年9月時点で生活費の世界ランキングで第9位と報じられ、ニューヨークの生活費が世界的に見て高いことが報じられている&lt;ref&gt;[https://www.economist.com/blogs/graphicdetail/2017/03/daily-chart-13Measuringthecostoflivingworldwide]TheEconomist2017年3月21日&lt;/ref&gt;。
株式会社ADEKA,『[[週刊少年チャンピオン]]』（[[秋田書店]]）に連載（[[1969年]]-[[1973年]]）。「亜馬尻（あばしり）」という苗字の一家全員犯罪者という、とんでもない家族が織り成すギャグ・エロ・暴力のドタバタを描くピカレスク・ギャグ・アクション。映画のように良く練られたストーリーが特徴。アクションシーンでは血が飛び散り、腕が飛び、木っ端微塵に爆殺など、従来の漫画表現では控えられていたリアリティ、エロ、猟奇すらギャグとして笑い飛ばす豪放磊落さ、主人公が極悪人であるためモラルの壁が存在しない自由なストーリー展開など、やりたい放題描いたらどれほど面白くなるか、という挑戦的な作品でもあった。作風はとても能天気で明るく、陰惨さが微塵もない快作に仕上がっており、現在でも永井豪作品の中でも非常に人気の高い作品である。基本的に[[ギャグ漫画]]であるが、血生臭い殺傷・暴力シーンや少年誌の範囲を超えるようなエロティックな場面が多数現れ、ジャンルの分類しにくい漫画である。数回分の中篇で一つのまとまった形で話を完結させ、連載を続けていく方式をとり、「[[読み切り]]」と「[[続き物]]」との中間に位置する（現在で言う所のシリーズ連載）形式と言える。あばしり一家が出演すれば「なんでもあり」といった作風で、[[西部劇]]風、[[SF]]風、[[怪談]]、悪人オリンピック編など、様々なエピソードが存在する。『ゴーモン族』の巻では、同じ作者の『[[デビルマン]]』のセルフパロディを行った他、『[[キッカイくん]]』のドクター・ゲルペゾルテが登場した。
ミツワ石鹸株式会社,旧会社は[[1975年]]に業績不振に陥って倒産し、事業は同社が[[ADEKA旭電化工業]]、[[第一工業製薬]]と共同で設立した日本サンホームの後身である[[プロクター・アンド・ギャンブル・ジャパンプロクター・アンド・ギャンブル・サンホーム（P&amp;Gサンホーム、現・P&amp;Gジャパン）]]に継承された。2007年に[[玉の肌石鹸]]が「ミツワ石鹸」の[[商標]]権を取得、[[2008年]][[4月1日]]に、同社が全額を出資し、[[子会社]]として「'''ミツワ石鹸株式会社'''」を設立した&lt;!--出典：洗剤新報HP「蘇る国民的ブランド『ミツワ石鹸』復活へ」--&gt;が、2014年12月31日をもって事業の一部を玉の肌石鹸に譲渡して業務を終了した。
クミアイ化学工業株式会社,*住所：岐阜県岐阜市梅林南町*駐車場：なし（岐阜市内の有料駐車場を利用）
タイガースポリマー株式会社,以前は、工業高校として知られていたが、現在は普通科のみになっている。制服は、[[1991年]]までいわゆる[[学生服学ラン]]であったが、当時流行っていた[[長ラン]]・[[短ラン]]が問題になったことや、工業に関する学科の募集を停止することに伴い、制服を変更することになり、結果、デザイナーによるスーツスタイルの制服になった。しかし、[[1992年]]から[[1998年]]までという7年間の短い期間によるものであった。[[1999年]]には、高校創立50周年という節目を迎えて、同年制服が再び改定された。現在は紺色のスーツスタイルである。なお、女子生徒はスカートの他にパンツスーツも選べる。なお、2019年度から新制服になる。カリキュラムは3学期制で週6日制を採用している。共学化以降は男女とも同じ教室で授業を受けているが、一部クラスは選択科目などの関係で男子のみで構成されていることもある。また、2015年度から、中学に「ハイブリッド特進理数コース」「ハイブリッド特進コース」「ハイブリッドインタークラス」を設け、それぞれ特色ある教育プログラムを実施。また2018年度から高校に「ハイブリッド文理先進コース」「ハイブリッド文理コース」「ハイブリッドサイエンスコース」「ハイブリッドインターナショナルコース」を設けた。工学院大学内の[[大学生協生協]]を利用できる。全国でもいち早く、中学・高校・大学が同時に環境マネジメントシステム（[[ISO14001]]）を取得している。
ロレアル,[[File:1986-9-hankai251.jpgthumbモ251&lt;br/&gt;1986年9月大和川車両区]]本形式が譲受された1970年代後半当時、大阪軌道線では11m級2扉車の[[阪堺電気軌道205形電車モ205形]]が40両以上在籍し、大阪市営地下鉄2号線（[[大阪市営地下鉄谷町線谷町線]]）の延伸計画の影響で近い将来の廃止が予定されていた[[南海平野線平野線]]を中心に、車掌の乗務するツーマンカーとして運用されていた。このモ205形については、その過半数について、平野線廃止に合わせて廃車とすることが計画されていたが、それでもラッシュ時の予備や年始の住吉神社参詣客輸送時の増発用として一定数の残存が求められる状況にあった。しかし、同形式は元々中形木造車のモ1形・モ50形の車体を鋼体化して製作された車両であり、1970年代後半の時点で既に主要機器の老朽化が著しくなっていた。しかも、車体についても両端に乗降用扉を設置する構造上の問題からワンマン化改造工事を実施する場合、客用扉の移設をはじめ大改造が必要となり、多大なコストが必要と見なされていた。そこで、経年の若いワンマン車を他社局から譲受してこれらを代替することが計画され、折良く京都市電の全廃で余剰となっていた、11950mm車体を備えるワンマン車の1800形を譲受し、南海仕様に改造の上で運用することとした。各車の前歴は以下の通り。;モ251::元京都市電844→1844。[[1950年]][[近畿車輛]]製。;モ252-モ256:元京都市電866-870→1866-1870。[[1953年]][[中島飛行機愛知富士産業]]製。譲受に際しては極力経年が若く、主電動機として45kW級のSS-60を新造当初から搭載していた後期車を中心に、保守の容易な鋳鋼製軸ばね式台車である[[住友金属工業扶桑金属工業]]KS-40J&lt;ref&gt;モ252-モ256については社名変更後のため、住友金属工業名義での製造となる。&lt;/ref&gt;を装着する車両が選定されている。譲受に際しては、[[集電装置]]を京都市標準のビューゲルから菱形パンタグラフへ交換、前照灯を前面上部の旧ワンマンカー表示部へ移設してシールドビーム1灯化、加えて旧前照灯取付位置に尾灯を移設したため、京都時代とはやや異なった印象の前面形状となった。また、室内灯の白熱灯から蛍光灯への交換も併せて実施されており、塗装を当時の阪堺電軌の標準色であった濃緑色に変更の上で竣工した。
日鉄エポキシ製造株式会社,[[1957年]]（昭和32年）4月に発足。[[1995年]]（平成7年）8月に新日鐵化学（現・日鉄ケミカル&amp;マテリアル）の子会社となり、[[2003年]]（平成15年）3月に完全子会社となった。[[2010年]]（平成22年）4月1日付で、'''東都化成株式会社'''（とうとかせい、英文社名''TohtoKaseiCo.Ltd.''）より'''新日化エポキシ製造株式会社'''に社名を変更。同時に製造機能以外の事業を親会社の新日鐵化学に移管した。[[2018年]]（平成30年）10月1日付で現社名に変更している。
エイボン・プロダクツ株式会社,
アイカ工業株式会社,ベートーヴェンが最も情熱を注いだピアノなどとは異なり、チェロには格別の演奏技術はなかった。しかしチェロの名手との交流があり、デュポール兄弟などとの親交が動機となっている。チェロソナタ作曲史上「チェロの[[新約聖書]]」とされ、多くのチェロ奏者にとって大切なレパートリーとなっている。ベートーヴェンはOp.5の2曲、Op.69、[[チェロソナタ第5番(ベートーヴェン)Op.102]]の2曲のチェロソナタ5曲を作曲している。初期に作品が集中した[[ヴァイオリンソナタ第3番(ベートーヴェン)ヴァイオリンソナタ]]とは異なり、チェロソナタに初期、中期、後期の各形式を代表するような傑作を遺している。ベートーヴェン作の[[室内楽曲]]の中で、この5曲は[[弦楽四重奏曲]]に次ぐ成功を収めたと評価され、室内楽作品全体を理解する上でこの5曲は重要である。5曲のチェロソナタのうち、最も広く知られているのがこのOp.69の第3番である。[[交響曲第5番(ベートーヴェン)第5交響曲]]、[[交響曲第6番(ベートーヴェン)第6交響曲]]、[[ピアノ協奏曲第5番(ベートーヴェン)第5ピアノ協奏曲]]などと同時期に作曲されたこの曲は、ベートーヴェン中期の「傑作の森」を代表する室内楽曲であり、大変充実した内容を持つ。遺品のスケッチにより、この第3番は元々は[[ト長調]]の「ピアノと[[ヴァイオリン]]のための大ソナタ」として構想されていた。以前のチェロとピアノのためのソナタは、実質的には「チェロ伴奏付きの[[ピアノソナタ]]」であった。歴史的に初めてチェロはピアノと対等な役割を与えられたといえる。チェロの取り扱いは以前のOp.5に比べ飛躍的に大胆になり、チェロ本来の低音と[[wikt:cantabileカンタービレ]]の能力を生かしながら、高音なども積極的に用いていて、従来のチェロ作品よりもチェロの持つ可能性を大きく拡張したものになっている。一方でピアノも[[オクターヴ奏法オクターブ]]重複など豪快かつ自由な歌いをしながらも、チェロの進行を乱すことはない。作曲技法においても、チェロとピアノの両手による精緻な[[対位法]]的処理が随所に用いられるなど、この時期のベートーヴェンの作曲技法の高さを示している。全5曲中この作品を含めて4曲が緩徐楽章を欠いているが、ベートーヴェンにはよく見られるものであり、ピアノソナタや交響曲にも登場する。
