三菱ケミカルメディア株式会社,2018年現在、マクセル（[[マクセルホールディングス]]、旧・日立マクセル）と並ぶ記録メディアの大手製造メーカーであり、[[CD-R]]の製造時から、記録色素に[[アゾ]]色素を採用し、耐久性と保存性の高さで好評を博している。最新の[[Blu-rayDisc]]メディアのほか、[[DVD-RAM]]を除く記録型[[DVD]]メディア各種（DVD-RAMは販売はしているが、他社からOEM供給を受ける立場。これは同じ三菱グループの[[三菱電機]]が元々は[[DVD-RW]]陣営であったことが考えられる）、CD-Rおよび[[CD-RW]]、[[光磁気ディスクMO]]の生産を手掛け、またDVDメディアの生産においては、記録色素の外販などを行っている。日本（[[岡山県]][[倉敷市]]の水島工場）でのBlu-rayメディアとMOの生産のほか、海外では[[シンガポール]]に自社工場を構え、また[[台湾]]や[[インド]]の工場に、記録色素と製造ラインを持ち込みの上で、メディア生産を委託している。記録メディアの製造拠点を早くから海外に移したことでも広く知られている。2008年辺りから極端な円高の影響や、ブランド戦略の見直しなどにより、生産拠点を海外に移す動きもみられる。2017年4月1日に親会社だった[[三菱化学]]が[[三菱樹脂]]、[[三菱レイヨン]]と合併して[[三菱ケミカル]]が発足したことに伴い、当社も三菱ケミカルメディア株式会社に商号変更した。
クラシエホールディングス株式会社,
ライオン株式会社,1891年（明治24年）10月に[[小林富次郎]]によって設立された。化粧石鹸、洗濯用石鹸を出発点として、[[1896年]]（明治29年）に粉ハミガキ「獅子印ライオン歯磨」を発売した。現在、東京証券取引所第一部に[[株式公開上場]]、本社は東京都墨田区本所一丁目3番7号にある。また、[[みずほグループ]]（旧・[[第一勧銀グループ三金会]]←十五社（日本勧業銀行系）会）の一員でもある。事業分野的に[[花王]]が最大の競争相手企業になる。競合するほとんどの商品シェアは花王に次ぐ第2位であるが、創業品目の歯磨きは現在でもトップシェアを誇る。商品開発力はかなり高く、[[1966年]]（昭和41年）に発売されたローションタイプの台所用洗剤「ママレモン」が、台所用洗剤の代名詞としてあまりにも有名な存在である。さらに、「[[ライポンF]]」（現在は業務用のみ）は、世界初の台所用洗剤であると[[社史]]に記されている。尚、欧米諸国では、台所洗剤というと、台所用液体洗剤を指すため、液体洗剤としては、世界初の米国、世界第2位及び第3位の欧州諸国に次いで、液体[[ライポンF]]がアジア初ならびに世界第4位となる。[[戦前]]の一時期、[[プロ野球]]「[[松竹ロビンスライオン軍]]」（現在の[[横浜DeNAベイスターズ]]の系譜の前身）のスポンサーとなり、[[戦後]]は[[パシフィック・リーグ]]（パ・リーグ）を中心に[[野球]]との関わりが強い時期があった。ちなみに戦後パ・リーグ発足とともに設立された[[埼玉西武ライオンズ西鉄ライオンズ]]（設立当初は西鉄クリッパース）とは資本上の関係はないが、「ライオン」で共通することから宣伝面でのタイアップを申し出て球団歌「[[西鉄ライオンズの歌]]」を贈呈している。
アキレス株式会社,
株式会社コーセー,有理化をすることで計算がしやすくなったりする。例えば:&lt;math&gt;¥frac{1}{2+¥sqrt{3}}¥frac{1(2-¥sqrt{3})}{(2+¥sqrt{3})(2-¥sqrt{3})}¥frac{2-¥sqrt{3}}{4-3}{2-¥sqrt{3}}&lt;/math&gt;などがあげられる。抽象[[代数学]]的にはこの例は、'''Q'''を有理数体、''d''&amp;isin;'''Q'''が有理数の[[冪乗平方]]ではないとしたとき:&lt;math&gt;¥mathbb{Q}(¥sqrt{d})¥left¥{¥frac{a+b¥sqrt{d}}{a'+b'¥sqrt{d}}¥¥Big¥aa'bb'¥in¥mathbb{Q}¥right¥}&lt;/math&gt;という'''Q'''の二次拡大体を考えると、:&lt;math&gt;¥mathbb{Q}(¥sqrt{d})¥mathbb{Q}[¥sqrt{d}](¥{a+b¥sqrt{d}¥midab¥in¥mathbb{Q}¥})&lt;/math&gt;が成り立つ、という主張に一般化できる。これは''K'''''Q'''({{sqrt''d''}})の各元''a''+''b''{{sqrt''d''}}に対し、その拡大''K''/'''Q'''に関する共役元''a''−''b''{{sqrt''d''}}を掛ければ:&lt;math&gt;N(a+b¥sqrt{d}):(a+b¥sqrt{d})(a-b¥sqrt{d})a^2-b^2d&lt;/math&gt;（この''N''(''a''+''b''{{sqrt''d''}})は''a''+''b''{{sqrt''d''}}の（拡大''K''/'''Q'''に関する）[[ノルム(体論)ノルム]]と呼ばれる。）が'''Q'''に属すということから''まさに有理化によって''証明されるわけである。一般に、体''K''の（有限次ガロア）拡大体''L''の元に対し、その元の拡大''L''/''K''に関する共役元（二次拡大ではただ一つだが、一般には複数ある）をすべて掛け合わせたものを、その元のノルムとよぶが、ノルムは下の体''K''に属する。したがって同様のこと、つまり有理化は共役元が全て計算できるならば、二次拡大に限らず行える。
グラクソ・スミスクライン株式会社,[[ステロイド]]吸入剤などの[[気管支喘息]]治療薬や[[ヒスタミンH2受容体拮抗薬]]「[[ザンタック]]」などを開発・発売していたグラクソと、[[ゾビラックス]]（抗[[ヘルペスウィルス]]剤）や[[ジドブジンレトロビル]]（抗[[HIV]]薬）など世界で初めて[[抗ウイルス薬]]の開発に成功したバローズ・ウェルカムが[[1995年]]に合併（日本法人は1998年に合併）して'''グラクソ・ウエルカム'''となった。その後、世界初の[[ヒスタミンH2受容体拮抗薬H2ブロッカー薬]][[シメチジンタガメット]]や、オーグメンチン（[[ペニシリン]]系[[抗生物質]]）、[[パキシル]]([[選択的セロトニン再取り込み阻害薬SSRI]])など世界的売上規模を誇る製品を開発・発売してきた'''スミスクライン・ビーチャム'''とグラクソ・ウエルカムが[[2000年]]に合併（日本法人は2001年1月に合併）して発足した。ザンタックとタガメットは同薬理をもつ同効の競合品であり、自社品同士での競合を避けるために、タガメットは他社販売へ移管している。日本では、タガメットは[[大日本住友製薬]]が販売、ザンタックは[[第一三共]]との&lt;!--コプロモーションという形で--&gt;共同販売活動を行っていたが、[[2008年]][[4月1日]]から自社流通のみに変更した。なお、グラクソ・ウエルカム、グラクソ・スミスクラインそれぞれの合併時に売上規模などで世界1位となったが、その後[[ファイザー]]が[[ワーナー・ランバート]]（2000年）、[[ファルマシア]]（2003年）などを買収して世界1位となっている。[[ルコゼード]]、[[ライビーナ]]とその事業基盤を[[サントリー食品インターナショナル]]に2106億円で譲渡した&lt;ref&gt;{{citenewslanguageauthorurlhttp://www.zaikei.co.jp/article/20130909/150438.htmltitleサントリーBF:英グラクソの飲料ブランド「ルコゼード」「ライビーナ」事業を2106億円で譲受publisherdate2013-9-9accessdate2014-5-17}}&lt;/ref&gt;。日本では、2002年に[[アース製薬]]と米国のブロックドラッグが提携していた「ブロックドラッグジャパン」（旧・小林ブロック（[[小林製薬]]の子会社））の経営を統合し、ブロック社製造の商品もグラクソ・スミスクラインが受け持つようになる。2005年11月より[[アラガン]]株式会社が輸入販売していた[[ボトックス]]を扱うこととなった。また、2015年3月には、コンシューマーヘルスケア事業本部が[[ノバルティスノバルティスファーマ]]株式会社のOTC事業部と統合し、両社の合弁事業として、グラクソ・スミスクライン・コンシューマー・ヘルスケア・ジャパン株式会社が新たに設立された（詳細は後述）。
サンスター株式会社,創業者の[[金田邦夫]]が、[[1932年]]に大阪で金田兄弟商会を設立し[[自転車]]部品の販売を始め、のちに自転車用ゴム糊を製造したのが始まり。その後、戦後に設立した会社でゴム糊を充填した[[チューブ(容器)金属チューブ]]を開発し、その中身に[[歯磨剤]]を充填したことがきっかけで、自転車部品の販売から、[[歯磨剤]]や[[歯ブラシ]]等の製造を開始する会社へと転身し、現在ではオーラルケア用品を中心として、[[シャンプー]]、[[整髪料ヘアースプレー]]、[[洗剤]]等の製造・販売を行っている。オーラルケア用品市場は[[ライオン(企業)ライオン]]、[[花王]]とシェアを争っている。自転車関連事業からは撤退したがグループ会社の[[サンスター技研]]が[[オートバイ]]用の[[スプロケット]]や[[ディスクブレーキ]]の製造を行っている。
ユニリーバ・ジャパン株式会社,[[花王]]、[[ライオン(企業)ライオン]]、[[プロクター・アンド・ギャンブル・ジャパンP&amp;G]]、[[資生堂]]などが主な競合メーカーで、髪や肌の手入れなどの身繕いに関する商品、[[台所]]用[[クレンザー]]等の住居用[[洗剤]]、更に食品市場には[[紅茶]]商品を展開している。特に身繕い関する商品で高い[[マーケットシェア]]を持っており、とりわけ「[[ラックス(ビューティケア)Lux（ラックス）]]」、「&lt;!--[[ダヴ(トイレタリー)--&gt;Dove（ダヴ）」「&lt;!--理美容店名と判断しましたのでリンクさせます--&gt;[[モッズ・ヘアmod'shair（モッズ・ヘア）]]」などのブランドを持つシャンプー部門では{{要出典範囲date2011年8月1998年以来日本国内でトップ}}を誇っている。2006年（平成18年）には各社がヘアケア事業の強化に乗り出し競争激化と報道されたが、ヘアケアでの{{要出典範囲date2011年8月年間トップシェアを維持}}した。また、住居用洗剤の「ジフ&lt;ref&gt;外国名はCif(シフ)またはJif&lt;/ref&gt;&lt;!--アルファベット名が有名ではないので後ろにおきます--&gt;」「ドメスト（Domestos）」も{{要出典範囲date2011年8月長年トップシェア}}のブランドである。さらに、2007年（平成19年）には男性用の香水「[[AXEAXE（アックス）]]」の販売を開始した。紅茶「[[リプトンLipton（リプトン）]]」も販売している。
株式会社クレハ,[[2005年]][[9月30日9月末日]]までの旧商号は、'''呉羽化学工業株式会社'''（くれはかがくこうぎょう）であった。商号については、かつての母体であった'''[[呉羽紡績]]'''（現[[東洋紡]]）の創業地である[[富山県]][[婦負郡]][[西呉羽村]]（現[[富山市]]呉羽町）にちなむものであるが、クレハ自体は富山県との直接の関係はない。同社のコーポレートスローガンは、「どこにも無ければ、創ればいい。ナケレバ、ツ'''クレバ'''。」である。[[2011年]][[3月11日]]に発生した[[東北地方太平洋沖地震]]（[[東日本大震災]]）により、同社のいわき事業所などが甚大な被害を受け、「クレラップ」などの製造・供給が滞ったことがあった。同社では、いわき事業所等の復旧後、被災地となった[[東北地方東北]]3県（[[福島県福島]]・[[宮城県宮城]]・[[岩手県岩手]]の各県）の農業・農地・食生活の再生を目的として、翌2012年より向こう3年間にわたり、「NEWクレラップ」シリーズの売り上げの一部を該当プロジェクトに寄付し復興支援を行う、「'''いっしょに笑顔。東日本応援プロジェクト'''」を行った。
三井化学株式会社,[[化学メーカー総合化学]]3位、石油化学の比率が高い。[[ペットボトル]]の原料であるPETペレットや[[ポリエチレン]]、[[ポリプロピレン]]の[[触媒]]など日常品の様々な原材料を市場に供給している大手総合化学メーカー。千葉と大阪にエチレンセンターを持つ。本社は東京の[[汐留シティセンター]]内にある。
NSファーファ・ジャパン株式会社,[[ファイル:NissanSoap.jpgthumb250pxright旧ニッサン石鹸大阪本社工場（[[大阪市]][[鶴見区(大阪市)鶴見区]]横堤2丁目）]]東京に本社を置き（営業本部・支店併設）&lt;ref&gt;かつては大阪との2本社体制をとっていた。&lt;/ref&gt;、現在は大阪に支社、[[兵庫県]][[加東市]]と[[茨城県]][[神栖市]]にそれぞれ工場を持つ&lt;ref&gt;かつては[[愛知県]][[名古屋市]]にも工場があった。&lt;/ref&gt;。[[2012年]]（[[平成]]24年）まで同社は旧日産コンツェルン系企業が再結集した[[日産コンツェルン#日産・日立（春光）グループ日産・日立グループ]]（春光グループ）の日立グループに属する[[日油]]（旧・日本油脂）のグループ会社の一社であった。[[2006年]]（平成18年）[[12月]]に[[ユニリーバ]]が事業撤退を表明した柔軟剤「[[ファーファ]]」ブランドを譲受した。なお、マスコットキャラクターの[[テディベア]]「[[スナッグル]]」に対するライセンス料は同社が支払っている。
牛乳石共進社株式会社,「'''カウブランド(COWBRAND)'''」の石鹸でその名を知られる日用品メーカー。その他にも[[シャンプー]]、[[リンス]]、[[入浴剤]]なども販売している。CMソングの「'''牛乳石鹸良い石鹸'''」（作詞・作曲[[三木鶏郎]]）で知られる「牛乳石鹸」。元々は佐藤貞次郎商店の商品であったが、同店から受託して生産・発売することとなり、[[1928年]]（現在、本社のある土地に）工場を建設。その後、佐藤貞次郎商店から商標を譲り受け、自社ブランドとして生産・発売を開始した。当時の大阪は日本の石鹸産業の中心地でもあり、今でも複数のメーカー工場が存在している。&lt;!--出典：牛乳石鹸ホームページモーモーワールド・牛乳石鹸の歴史第1部（創業から60年間）--&gt;主力商品の化粧石鹸「'''赤箱'''（あかばこ）」は、昔ながらの「釜炊き製法」（釜に原料を入れて加熱し、上層部に集まった成分で製造）による。職人の目と技に依存する所が大きく手間がかかるため、一時期は他の製造方法も模索したものの、結果的に変更はせず、現在まで「釜だき製法」を維持し続けている。なお「'''赤箱'''」の英名は最初は「トイレット・ソープ(ToiletSoap)」だったが、[[1967年]]からは「ビューティ・ソープ(BeautySoap)」と名前が変わっている。ちなみに旧社名と現社名にある「共進社」とは、「社員及び社会と'''共'''に'''進'''む」という意味である。現在「牛乳石鹸」は'''赤箱'''と'''青箱'''が発売されているが、かつては全国向けの'''白箱'''と、[[九州九州地方]]限定で'''緑箱'''も発売されていた。商標に「[[ウシ牛]]」を使用しているのも、「'''商ひは牛の歩みの如く'''」という格言から採っている。これは、前へ進んでも後ろへ退くな、粘り強く前進せよという意味で、堅実な経営のもと、誰からも愛され喜ばれる製品を提供しようという企業理念から、牛が真面目で親しみのある動物であることから採用された。&lt;!--牛乳石鹸のホームページより--&gt;[[みどり会]]の会員企業であり[[三和グループ]]に属している&lt;ref&gt;[http://www.midorikai.co.jp/member.htmlメンバー会社一覧-みどり会]&lt;/ref&gt;。
株式会社カネボウ化粧品,一代一事業という豊田家のモットーに則り[[豊田章一郎]]（現[[トヨタ自動車]]名誉会長）の発案で、1975年（昭和50年）[[トヨタ自動車]]（当時はトヨタ自動車工業）で建売住宅・マンション分譲を中心とした[[デベロッパー(開発業者)不動産開発]]部門と[[注文住宅]]部門を興した。「自動車で養ったノウハウを活用した工業化住宅」（いわゆる[[プレハブ住宅]]の効率生産）をうたい文句に展開したものの、長年に亘り赤字が続いたため一時は存続が懸念されたが、地元愛知県を中心に販売力を着実に強め、黒字転換したのを機に[[2003年]]（平成15年）に注文住宅部門を分社化し、[[ハウスメーカー]]となった。[[トヨタグループ]]に属し、トヨタグループ内では「'''THC'''」の略称で表記される。[[2005年]]（平成17年）に[[不良債権]]問題のため[[産業再生機構]]案件となった[[ミサワホーム]]の支援スポンサーに[[トヨタ自動車]]が内定し、[[2006年]]（平成18年）3月にトヨタ自動車・当社・野村プリンシパル・ファイナンスがミサワホームの出資を引き受けた。以降、[[ミサワホーム]]の技術提携や共同分譲を開始し、一層のシェア拡大を目指している。2006年（平成18年）度の住宅販売戸数が、創業以来初となる5000戸突破を達成。[[2010年]]（平成22年）[[10月1日]]をもって、トヨタ自動車の住宅事業（[[デベロッパー(開発業者)デベロッパー]]部門）を統合した。2013年（平成25年）リフォーム事業の新会社「トヨタホームリフォーム株式会社」を設立。[[2015年]]（平成27年）トヨタすまいるライフ株式会社リフォーム部門とトヨタホームリフォーム株式会社が事業統合した。[[2016年]]（平成28年）[[ミサワホーム]]を連結子会社化。
BASFジャパン株式会社,[[135年]]、[[ローマ帝国]]の[[皇帝]]でいわゆる「[[五賢帝]]」のひとり[[ハドリアヌス]]が自らの[[霊廟]]として建設を開始し、[[アントニヌス・ピウス]]治世の[[139年]]に完成した&lt;ref&gt;{{Citeweburlhttps://kotobank.jp/word/サンタンジェロ城-514237titleデジタル大辞泉の解説publisherコトバンクaccessdate2018-03-04}}&lt;/ref&gt;。霊廟はきれいな円形平面をなし、[[太陽]]を象徴したハドリアヌスが[[戦車]]を引く像が頂上に設置された。しばらくすると軍事施設として使用されはじめ、[[403年]]には[[アウレリアヌスの城壁]]の一部に組み入れられた。[[14世紀]]以降は歴代のローマ教皇によって[[要塞]]として強化され、また、同時に[[牢獄]]や[[避難所]]としても使用された。&lt;!--([[BenvenutoCellini]]visarebbestatorinchiusonel[[XVIsecolo]])--&gt;[[16世紀]]前半の教皇[[クレメンス7世(ローマ教皇)クレメンス7世]]は、ローマが[[神聖ローマ皇帝]]軍により恐ろしい略奪（[[ローマ略奪]]）を受けている間、皇帝[[カール5世(神聖ローマ皇帝)カール5世]]率いるドイツ人[[傭兵]]（[[:it:LanzichenecchiLanzichenecchi]]）の包囲に抵抗するため、この機能を使用した。[[17世紀]]前半には教皇[[ウルバヌス8世(ローマ教皇)ウルバヌス8世]]がサンタンジェロ城の強化に努め、[[1667年]]に教皇となった[[クレメンス9世(ローマ教皇)クレメンス9世]]は、[[バロック様式バロック芸術]]の大家で旧友の[[ジャン・ロレンツォ・ベルニーニ]]にサンタンジェロ橋の装飾を依頼しており、[[橋]]はベルニーニ自作の2体ふくむ10体の[[天使]]像の[[彫刻]]で飾られている&lt;refgroup&quot;注釈&quot;&gt;クレメンス9世は、教皇となる以前の名をジュリオ・ロスピリオネージといい、学識豊かなウルバヌス8世が教皇だったとき文人として教皇ウルバヌスの周辺に集まった人びとのなかのひとりであった。また、ジャン・ロレンツォ・ベルニーニは教皇ウルバヌス8世にサン・ピエトロ大聖堂の大改装を任された大芸術家であった。[[#ラルース2『ラルース図説世界人物百科II』（2004）pp.260-262]]&lt;/ref&gt;。サンタンジェロ城の名称は、[[590年]]にローマで[[ペスト]]が大流行した際、時の教皇[[グレゴリウス1世(ローマ教皇)グレゴリウス1世]]が城の頂上で[[剣]]を鞘に収める大天使[[ミカエル]]を見て、[[ペスト]]流行の終焉を意味するとしたことに由来する。その故事を記念して、16世紀にラファエッロ・ダ・モンテルーポ（[[:it:RaffaellodaMontelupoRaffaellodaMontelupo]]）による[[大理石]]製の天使の像を城の頂上に設置した。[[1753年]]からは[[:it:PierrevanVerschaffeltPierrevanVerschaffelt]]による[[青銅]]製の像が設置してある。なお、サンタンジェロ城は、[[1933年]]以降は[[博物館]]として利用されている。
シャボン玉石けん株式会社,洗濯用粉石鹸、化粧用固形石鹸、液体石鹸を製造・販売している。製造されている石けんは、酸化防止剤、蛍光増白剤、[[香料]]、色素などの化学物質・添加物を一切使わず、特に牛脂は'''地元である[[九州]]のものにこだわって使用'''しているとしている&lt;ref&gt;[http://www.shabon.com/media/pdf/activities_report.pdf2010年2月1日に迎えた100周年にあたっての企業活動報告書6ページ・原料へのこだわり]「新鮮さが必要とされる牛脂は九州各地から取り寄せ、-」&lt;/ref&gt;。天然油脂を原料にした純石けん分（99%脂肪酸ナトリウム）の『'''無添加石けん'''』である。「'''青いお空がほしいのね…'''」で始まるCMソングでも知られる。当初は[[合成洗剤]]を中心に製造・販売していたが、[[日本国有鉄道国鉄]]から列車洗浄用の洗剤の開発を依頼され、高純度の無添加石鹸を開発。その石鹸を創業者が自ら使った所、長期間悩まされていた湿疹が治ったという&lt;ref&gt;[http://www.demand.co.jp/owner/index.php?itemid5335周年企画トップインタービュー第5回シャボン玉石けん株式会社様]（[[不動産中央情報センター]]）&lt;/ref&gt;。このため、[[1970年代]]から'''無添加石けん'''一筋の石けん会社として、環境問題にも積極的に取り組んでいる。「シャボン玉」の商標登録は、シャボン玉石けんが1975年に出願し、1981年に登録されている（第1478302号）。なお、1970年代まで「[[シャボン玉ホリデー]]」「[[シャボン玉プレゼント]]」などの番組に提供していた[[牛乳石鹸共進社]]とは資本・人材などの関係はない。
エステー株式会社,
