レック株式会社,単なるノベライズではなくゲーム版のキャラクター・ブラックローズ速水晶良を主人公とし、彼女の弟が意識不明に陥ってからゲーム終了後までを速水晶良の現実面での出来事と黄昏の碑文の謎についての言及を交えて書いている。本編の主人公であるカイトからブラックローズへ視点を変更するにあたって、*必ずしもブラックローズを連れて行かなくても良い場面でブラックローズがパーティに加わっていたり、カイトのパーティが参加するイベントと同時進行でブラックローズが同じイベントに参加していたりする。*ミアがブラックローズにカイトの過去の映像を見せるイベントの追加。*一部のイベントの直後の出来事がブラックローズの視点での追加。*ミストラル黒川真由美と親密になりオフで会ったり電話などで連絡をとる場面。*一部キャラクターが関連する本編中であまり重要でないイベントの割愛。などの変更点・追加点がある。
荒川化学工業株式会社,*「[[かすみ(曲)かすみ]]」以来となる新曲2曲と初音源化となるライブSEを収録。*2曲とも、この作品が発売になる前のツアー「'''THECODEOFVULGAR[ism]'''」で先行披露されていた。また、[[Shinya]]はこの時期ドラムセットを新調しており、その新しいドラムセットでの最初のレコーディングとなった。*1曲目が「Machiavellism」から始まり、タイトル曲である「朔-saku-」が2曲目に連なるという構成になっているが、これはどちらかがカップリングという扱いをされたくなかったことと、「Machiavellism」から始まり、「朔-saku-」に雪崩れ込む感じの方が流れ的にも良かったためであるとメンバーが語っている。*今作品にはライブSEである「G.D.S.」も収録されている。これはリミックスをいつものように入れるのも違うかなと感じたことと、以前から音源化が望まれていたことから、作業後半になって収録を決定した。*「朔-saku-」のPVは[[団地]]に暮らす家族を題材にした[[少年犯罪]]がテーマになっており、そのあまりの内容や残酷さ、リアルさ、演出が物議を醸し、PV集「'''[[AVERAGEFURY]]'''」発売の際には内容を一部制限して出さなければならなくなった。この作品のノーカットバージョンは[[フリーウィル]]から[[インディーズ]]流通で直接発売されたPV集「'''[[AVERAGEPSYCHO]]'''」で見ることが出来る。*2006年11月に大手音楽専門チャンネル[[MTV]]の人気番組「[[MTVHeadbangersBallヘッドバンガーズ・ボール]]」で、2005年に新設された視聴者が選定するPV音楽賞(''HEADBANGERSBALLPV2006'')に、この「朔-saku-」のビデオクリップが日本のロックバンドの作品として初めてノミネートされ、グランプリを獲得した&lt;ref&gt;{{Citeweburlhttp://www.zakzak.co.jp/gei/2007_01/g2007010506.htmltitle初快挙…日本のロックグループのＰＶがＭＴＶで戴冠accessdate2007-02-14date2007-01-05publisherZAKZAK}}&lt;/ref&gt;。
サンケイ化学株式会社,[[裏原宿]]の[[古着]][[ファッション]]や[[スニーカー]]を中心に取り上げており、[[美容師]]、[[在学生学生]]などがモデルになっている。増刊号に[[渋谷系]]ファッションを取り上げた[[WolfAsh]]がある。
東京応化工業株式会社,明治、大正時代は軍人、官吏、会社社長、頭取などが子弟を通わし、校風は山の手風であったとされる。2000年に御田小学校が[[港区立南海小学校南海小学校]]を吸収統合し、現在に至る。[[国道15号]]と[[桜田通り]]に挟まれた台地上にあり、周囲は[[住宅地]]や寺町の寺院に囲まれている。登下校には校舎側にある御田門、明治時代から残る煉瓦造りの岬門、この両方が利用されている。港区で唯一、'''教科別担任制'''を実施するモデル校に選定されている。このため入学時から越境通学する児童も見られる。2010年、校庭がゴムだったのを人工芝に取り替えた。「放課GO」を実施しており、登録した児童は、5時まで学校で過ごすことが可能である。
群栄化学工業株式会社,[[三原川(兵庫県)三原川]]とその支流を中心とする[[沖積平野]]。横に広がらずに南のほうに広がった形をしている。[[タマネギ]]の[[栽培]]が盛ん。*三原平野の範囲**旧[[三原町]]のほぼ全域**旧[[西淡町]]湊・松帆・志知地区**旧[[緑町]]倭文地区**旧[[南淡町]]賀集・北阿万地区
ムトー精工株式会社,15世紀から17世紀の間に一般庶民に徐々に浸透し、1840年代に現代的な鼻眼鏡が登場した。1880年から1900年にかけて大流行した。初期は金属製のリム（眼鏡の枠）だったが、次第に枠無し(Rimless)のもの、さらに[[セルロイド]]製のものが登場してきた。銀（[[スターリングシルバー]]）製のもの、[[鼈甲]]製のものも存在した。1879年のカタログでは、鉄製、鼈甲製、ゴム製、金メッキ、銀製、金製の順に鼻眼鏡が紹介され、金メッキ以降が際立って高く値付けられていた。鼈甲製は鉄製やゴム製と並んで安価であった&lt;ref&gt;{{CitebookauthorGoldbacherErnestitle1851-1878illustratedcatalogueandpricelistofopticalmeteorologicalandmathematicalinstrumentsmanufacturedandimporteddate1879page31-41publisherNewYork:E.Goldbacherurlhttps://archive.org/details/04331200R.nlm.nih.gov/page/n35}}&lt;/ref&gt;。鼻パッドは、初期はブリッジと一体化された金属製のもの、あるいはコルクを貼り付けたものだったが、後年にはセルロイドを添付したものや落下を防ぐために粘着性にしたのもの&lt;ref&gt;{{Citeweburlhttps://www.college-optometrists.org/the-college/museum/online-exhibitions/virtual-spectacles-gallery/pince-nez.htmlpublishertheCollegeofOptometriststitlePince-nez-Theeyewearthatgotagrip.accessdate2018-06-23}}&lt;/ref&gt;が作られた。鼻眼鏡の流行していた当時から、レンズを眼の前に固定する手段としては鼻眼鏡より耳掛眼鏡のほうがずっと優れていることが知られていた&lt;!--Byfarthemostgenerallyusefulmethodofplacingglassesbeforetheeyesisbyspectacleframesというそのままの記述が出典にあります。--&gt;&lt;ref&gt;{{CitebookauthorPhillipsRichardJonestitleSpectaclesandeyeglassestheirformsmountingandproperadjustmentdate1892page26publisherPhiladelphiaP.Blakistonson&amp;co.urlhttps://archive.org/details/spectacleseyeg00phil}}&lt;/ref&gt;。鼻眼鏡の長所として当時言われていたことは、掛け外しの手軽さ、見た目が良く洒落ている&lt;!--見た目が良いも洒落ているも主観ですが、出典にそう書いてあります。当時言われたこととしての紹介です--&gt;こと、外見を極力変えずに視力を矯正できることであった。短所として指摘されていたことは、長時間の装用が耳掛眼鏡ほど快適になりがたいこと、顔つきによっては掛けられないこと、そして光学上の問題点であった。19世紀末にはすでに[[近視]]・[[遠視]]・[[老視]]のみならず[[乱視]]や[[斜位]]の矯正法も知られていたが、乱視や斜位の矯正では処方どおりの角度でレンズを眼前に固定することが求められるため、レンズが回転してしまいやすい鼻眼鏡はこれらの矯正に適さないことが指摘されていた&lt;ref&gt;{{CitebookauthorPhillipsRichardJonestitleSpectaclesandeyeglassestheirformsmountingandproperadjustmentdate1892page26publisherPhiladelphiaP.Blakistonson&amp;co.urlhttps://archive.org/details/spectacleseyeg00phil}}&lt;/ref&gt;。レンズが回転しやすい短所は、[[#C-ブリッジC-ブリッジ]]型の、ブリッジ自体がバネを兼ねる構造によるものであり、それを解消するために[[#スプリング・ブリッジスプリング・ブリッジ]]型を始めとするブリッジとバネを分離した形式が作られたが、重く不恰好であることが嫌われてなかなか一般化しなかった。鼻の上の落ち着きやすいところに置いただけではレンズと眼との間隔が正しくなるとは限らないことも光学上の問題点として指摘され、当初レンズと同一平面上にあった鼻当てを後方に片寄せ&lt;!--いつの間にかここに「し」が挿入されて「片寄せた」が「片寄せした」になっていましたが、青空文庫内をグーグル検索すると&quot;片寄せた&quot;39件に対して&quot;片寄せした&quot;0件、ウェブサイト全般を検索しても&quot;片寄せた&quot;2220件に対して&quot;片寄せした&quot;727件。明治大正の文学作品でも現代のウェブサイトでも「片寄せした」よりも「片寄せた」が一般的なようです。--&gt;たオフセット・ガードも工夫された。19世紀末の書籍では、プリズムが不要で乱視もないか軽い人が適切に調整されたオフセット・ガードつきのものを掛けるならばとの条件つきで、縁無しの鼻眼鏡がもっとも「現代的」で端麗な眼鏡として推薦されていた&lt;ref&gt;{{CitebookauthorPhillipsRichardJonestitleSpectaclesandeyeglassestheirformsmountingandproperadjustmentdate1892page42publisherPhiladelphiaP.Blakistonson&amp;co.urlhttps://archive.org/details/spectacleseyeg00phil}}&lt;/ref&gt;。右のレンズ脇の金具は英語でハンドルhandleと呼ばれた&lt;ref&gt;{{CitebookauthorAmericanOpticalCompanytitle(Catalog)AmericanOpticalCompanydate1912page156-157publisherAmericanOpticalCompanyurlhttps://archive.org/details/109550Watermarked/page/n145}}&lt;/ref&gt;&lt;ref&gt;{{CitebookauthorPhillipsRichardJonestitleSpectaclesandeyeglassestheirformsmountingandproperadjustmentdate1892page28publisherPhiladelphiaP.Blakistonson&amp;co.urlhttps://archive.org/details/spectacleseyeg00phil/page/28}}&lt;/ref&gt;。[[拡大鏡]]、いわゆる虫眼鏡の持ち手と同じ呼び名である&lt;ref&gt;{{CitebookauthorAmericanOpticalCompanytitle(Catalog)AmericanOpticalCompanydate1912page138publisherAmericanOpticalCompanyurlhttps://archive.org/details/109550Watermarked/page/n131}}&lt;/ref&gt;。日本語ではつまみと呼ばれた&lt;ref&gt;{{Citebookauthor宇山安夫title眼鏡士読本date1968page123publisher医学書房}}&lt;/ref&gt;。ただし、つまみの語は他の部品の訳語に当てられることもある。1912年のアメリカン・オプティカル・カンパニーのカタログには、今日(1912年)の良質な鼻眼鏡のハンドルは紐を取り付けるための輪&lt;!--ringforcord--&gt;と化したものや極端に小型化されたものが一般的になってきており、装飾的&lt;!--fancy--&gt;なハンドルはその分減ってきたと記されている。カタログのイラストに描かれた標準的なハンドルの他に、注文時に指定すれば好みのハンドルを取り付けることができたが、製造の始めの段階に関わるので納期が遅れるとしている。金製の眼鏡では、注文に応じてハンドルに装飾の彫刻を施すこともあった。縁なしの鼻眼鏡ではハンドルは注文なきかぎり省略されたが、右レンズの脇に紐などを取り付けるための穴(holeforcord)&lt;ref&gt;{{CitebookauthorPettetRobertDtitleThemechanicsoffittingglassesdate1913page57-58publisherChicago:Topaz&amp;Kaemerleurlhttps://archive.org/details/mechanicsoffitti00pettrich}}&lt;/ref&gt;を空けることがあった。{{右&lt;gallerywidths&quot;180px&quot;heights&quot;150px&quot;&gt;JamesWhitcombRiley1913Cincinnati.jpg右のレンズ脇の「ハンドル」に紐を取り付けた鼻眼鏡(1913年)Fritz_Haber.png鎖などを付けない装着例（化学者[[フリッツ・ハーバー]]）&lt;/gallery&gt;}}ハンドルに鎖や紐を取り付けてかける人（[[:ファイル:JamesWhitcombRiley1913Cincinnati.jpg参考右写真]]）もおり、1879年のカタログには鼻眼鏡には標準でケースと絹紐が付属するとある&lt;ref&gt;{{CitebookauthorGoldbacherErnestitle1851-1878illustratedcatalogueandpricelistofopticalmeteorologicalandmathematicalinstrumentsmanufacturedandimporteddate1879page15publisherNewYork:E.Goldbacherurlhttps://archive.org/details/04331200R.nlm.nih.gov/page/n17}}&lt;/ref&gt;が、鎖などを付けずにかける人々（[[:ファイル:Fritz_Haber.png参考右写真]]）も多かった。鎖などを付けても鼻眼鏡が鼻から外れること自体は防げないが、外れた後に地面まで落下して破損したり紛失したりすることを防ぐことができる。鎖などの他端を固定する手段として、1912年のアメリカン・オプティカル・カンパニーのカタログ&lt;!--表題にはカタログと謳っていないが、archive.orgでカタログと補っているし、本文でもp.24でthiscatalogueと自称している。--&gt;では、耳かけ、服に留めるホック、[[ヘアピン]]の3通りを紹介し&lt;ref&gt;{{CitebookauthorAmericanOpticalCompanytitle(Catalog)AmericanOpticalCompanydate1912page288-302publisherAmericanOpticalCompanyurlhttps://archive.org/details/109550Watermarked/page/n271}}&lt;/ref&gt;、標準的な鎖の長さを*ヘアピン用で229mm（9インチ）*ホック用で330mm（13インチ）*短いヘアピン用で203mm（8インチ）*耳かけ用で102mm（4インチ）&lt;!--インチ法で区切りがよくメートル法で半端な数字なので、インチ法で作られた製品をカタログ上メートル表記にしているものと思われる。そこで本項でも出典どおりインチ数を併記した--&gt;と記載している&lt;ref&gt;{{CitebookauthorAmericanOpticalCompanytitle(Catalog)AmericanOpticalCompanydate1912page290publisherAmericanOpticalCompanyurlhttps://archive.org/details/109550Watermarked/page/n271}}&lt;/ref&gt;。鎖も紐もヘアピンなどの金具と組み合わされ個装されて販売された他、金具なしの紐のみは個装のみならず、半ダースや1ダースの包装でも販売された&lt;!--個人がまとめ買いするほど消耗の速いものとも思えませんし、出典自体が卸カタログに見えますから、ダース単位の販売は、小売店でばらして鼻眼鏡を購入した顧客へ無料の付属品として渡すことを想定しているのでしょうか。--&gt;&lt;ref&gt;{{CitebookauthorAmericanOpticalCompanytitle(Catalog)AmericanOpticalCompanydate1912page298publisherAmericanOpticalCompanyurlhttps://archive.org/details/109550Watermarked/page/n279}}&lt;/ref&gt;。鎖・紐を環状にして[[ネックレス]]のように首からかけている写真も多く見られる。アニメ『[[アルプスの少女ハイジ]]』に登場するロッテンマイヤーは、鼻眼鏡に付けた紐か鎖を襟の後ろに留めているように描写されている。また、鎖をいったん耳にひっかけてから髪に留めている写真も見られる&lt;ref&gt;http://www.wright-brothers.org/Information_Desk/Just_the_Facts/Wright_Family/Katharine_Wright/Katharine_Wright.htm&lt;/ref&gt;&lt;!--ライト兄弟の妹という有名人ですし、この項目には女性の画像がないので問題なければ転載したいですが、画像の扱いについてのウィキペディアの方針を不勉強です。--&gt;。[[補聴器]]や[[人工内耳]]体外装置の落下防止策としては今日でも被服や頭髪へ紐で留められることがある。特に耳にかけない型の人工内耳体外装置では、紐で被服や頭髪に留めることが取扱説明書で紹介され、装置にも予め紐を取り付ける穴または窪みが用意されている&lt;ref&gt;{{CitebookauthorCochleartitleCochlearKansoUserGuidedate2016page18-21publisherCochlearurlhttps://cochlearimplanthelp.files.wordpress.com/2016/09/cochlear-kanso-user-guide.pdf}}&lt;/ref&gt;&lt;ref&gt;{{CitebookauthorMED-ELtitleROND2Single-UnitAudioProcessorQuickGuidepage12-13publisherMED-ELurlhttps://www.medel.com/docs/default-source/support-downloads/aw35356_r1_0-rondo2quickguidebr-web.pdf?sfvrsn9ab0f245_4}}&lt;/ref&gt;&lt;ref&gt;{{Citeweburlhttps://www.youtube.com/watch?vmqBKj4ji58UtitleKanso-AttachaSafetyLinepublisherCochlearIndiaaccessdate2018-11-13}}&lt;/ref&gt;。眼鏡レンズを縁なし眼鏡用に穴空け加工する際、穴の数はレンズ一組あたりの穴の個数で指定された。つまり、穴2つとは、2枚のレンズに穴をひとつずつ空けるという意味であった。穴の数の選択肢は、縁なしの耳掛け眼鏡用の四つ穴、縁なしの鼻眼鏡に紐などを取り付けない場合の二つ穴、そして縁なしの鼻眼鏡に紐を取り付けるための穴を加えた三つ穴の3通りであった&lt;ref&gt;{{CitebookauthorAmericanOpticalCompanytitle(Catalog)AmericanOpticalCompanydate1912page219publisherAmericanOpticalCompanyurlhttps://archive.org/details/109550Watermarked/page/n203}}&lt;/ref&gt;&lt;ref&gt;{{CitebookauthorPettetRobertDtitleThemechanicsoffittingglassesdate1913page57-58publisherChicago:Topaz&amp;Kaemerleurlhttps://archive.org/details/mechanicsoffitti00pettrich}}&lt;/ref&gt;。当時の眼鏡処方箋の書式には、丸で囲むだけで指定できるようにあらかじめこの3つの選択肢が記されていた&lt;ref&gt;{{CitebookauthorPettetRobertDtitleThemechanicsoffittingglassesdate1913page55publisherChicago:Topaz&amp;Kaemerleurlhttps://archive.org/details/mechanicsoffitti00pettrich}}&lt;/ref&gt;。レンズの大きさには下のような規格があった。レンズの形は縦横比3:4ほどの横長の楕円が一般的だったが、近業の多い者には真円に近づけ縦方向の視野を拡げた短楕円が勧められた。短楕円はまた、PDすなわち両の瞳の間隔の狭い者にも勧められた。当時の眼鏡はレンズの大きさを変えることでレンズ中心の間隔と瞳の間隔を合わせたため、横長の楕円形のまま狭いPDに合わせて小さなレンズにすると縦方向の視野が狭くなりすぎたからである。楕円と短楕円以外の形は奇妙でグロテスクであるとして好まれなかったが、眉骨の飛び出た者のために短楕円の上辺を切り落とした木の葉型などもあった&lt;ref&gt;{{CitebookauthorPettetRobertDtitleThemechanicsoffittingglassesdate1913page18-19publisherChicago:Topaz&amp;Kaemerleurlhttps://archive.org/details/mechanicsoffitti00pettrich}}&lt;/ref&gt;。{class&quot;wikitable&quot;+1913年当時のレンズ規格!呼び!!縁あり用楕円!!縁なし用楕円!!短楕円-!ジャンボ46×3846×3844.5×39.5-!000044.3×3644×3642.5×37.5-!00040.9×31.941×3239.5×33.5-!0039.7×30.740×3138.3×32.5-!037.8×28.838.5×29.537×31-!136.5×27.537×2835.5×29.5-!235×25.5---!334×25---!433×24---!A39×25---!B40×26---!C37×21--}{{右&lt;gallerywidths&quot;180px&quot;heights&quot;150px&quot;&gt;Shigeru_Yoshida_suit.jpgHard-Bridge型の鼻眼鏡を着用している[[吉田茂]]Haruo_Sato_01.jpgHard-Bridge型の鼻眼鏡を着用している[[佐藤春夫]]&lt;/gallery&gt;}}日本では[[吉田茂]]や[[後藤新平]]、[[佐藤春夫]]らが愛用していたことでも有名である。現代でもハード・ブリッジ型の鼻眼鏡を復刻させて製造・販売することがある。映画『[[マトリックス(映画)マトリックス]]』において登場人物の一人であるモーフィアスが掛けていた鼻眼鏡を模したものも販売された。今日の日本でも吉田茂を題材にしたテレビドラマの小道具として当時の様式のものを製作した眼鏡店や、多彩なバリエーションを揃えたフチなし眼鏡のシリーズの一環としてツルなし眼鏡&lt;!--メーカーの眼鏡店向けサイトでは究極の鼻眼鏡、英語版サイトではpince-nezと紹介している。粘着パッドも昔からあった。--&gt;との売り文句で販売している眼鏡店がある。
フクビ化学工業株式会社,敷地[[面積]]は約22000[[平方メートル]]。建物は[[鉄筋コンクリート]]造りで、建築面積が約4800平方メートル、延床面積が約10000平方メートル。市民会館部分は1000人以上を収容する大きな[[ホール]]で、様々な[[イベント]]の会場として利用されている。また地域住民の間では「'''小牧市民会館'''」と略されて呼ばれることもある。公民館部分は地上4階・地下1階の構造になっており、会議室などの様々な用途に対応した部屋がある他、小牧市を拠点に活動するいくつかの[[団体]]の事務局が置かれている。市民会館・公民館の共同[[駐車場]]はとても広く、[[小牧平成夏まつり]]や[[小牧市民まつり]]の会場としても利用されている。施設は小牧市が所有し、[[指定管理者]]の（一財）こまき市民文化財団が管理・運営を行っている&lt;ref&gt;[http://www.city.komaki.aichi.jp/shiteikanrisha/003245.html小牧市の指定管理者導入施設]&lt;/ref&gt;。
クノー工業株式会社,[[1947年]]9月に工業用ヘルメット製造メーカーとして設立される。主に官公庁向けとして[[警視庁]]や各府県の[[警察]]用の二輪乗務員用や消防署の救急隊員用安全帽や[[海上保安庁]]用安全帽を製造していた。その後は自動二輪の全国的普及により、同社の社長である瀬田孝明の名を取ってブランド名を「セタ（''Seta''）」とし、ハーフカップタイプからフルフェイスまで、またスポーツ用など様々なタイプのヘルメットを量産してゆくことになる。デザインが非常に特徴的で、戦闘機の[[パイロット(航空)パイロット]]が被るタイプのもの、同社が公官庁向けに製造していたものをアレンジした[[ハイウェイ]]パトロールタイプや、ジェットタイプのものはアメリカンタイプを基調とした帽体の小柄なもの、フルフェイスタイプでも顎の部分が鋭利になっているものなど、風防用シールドでもそのデザインは話題になっていた。しかしその一方で1990年代以降になるとヘルメットの安全性の他に、徐々に他のメーカーが取り入れつつあった帽体の内装洗浄が可能になった快適性を謳い文句にする製品が現れ出すと、従来の旧式デザイン一辺倒で勝負してきた同社に対する逆風が強まり始め、売れ行きが徐々に下降線をたどり始める。次第に業績が悪化し、[[2004年]][[9月13日]]、東京地裁に自己破産を申し立てし、受理され自主廃業となった。
日本製紙ケミカル株式会社,千歳市内の主要施設を8の字型に循環運行する。Aコースは&quot;30&quot;、Bコースは&quot;31&quot;の系統番号が付けられている。市内のバス路線再編に伴い、2016年9月末をもって運行を終了した&lt;refname&quot;ビーバス廃止&quot;&gt;{{citeweburlhttps://www.city.chitose.hokkaido.jp/index.cfm/9521809165865htmlarchiveurlhttps://web.archive.org/web/20161006032214/https://www.city.chitose.hokkaido.jp/index.cfm/9521809165865htmlarchivedate2016年10月6日title「ビーバス」及び「市内路線バス」work千歳市公式ホームページaccessdate2016-10-15deadlinkdate2017年9月}}&lt;/ref&gt;。
株式会社アルテコ,*社名：株式会社アルテコ*本社所在地：大阪府茨木市西駅前町5番8号*創立：1965年9月1日*法人設立：1969年7月1日*資本金：9000万円*従業員：46名
モルトベーネグループ株式会社,
