古河サーキットフォイル株式会社,[[戦後]]、[[佐藤進一]]や[[永原慶二]]らによって大名領国制の理論形成が図られたが、歴史学者間でもその定義に関しては様々な見解がある。大名とは本来は単一の[[名田名]]を支配する[[名主]]を小名と呼んだのに対して、こうした複数の小名を従えた非地域的な名主を指した。彼らは[[権門]]の中でも弱小なそれに過ぎず、中には[[鎌倉幕府]]によって[[守護]]・[[地頭]]に任じられる者もあったが、[[大犯三箇条]]の行使などその権限は限定的なものであった。[[室町幕府]]のもとで守護は[[南北朝時代(日本)南北朝の内乱]]による危機克服の名目のもとに、[[闕所]]処分・[[半済]]執行・[[段銭]]収取の権限を獲得して[[国衙]]機構及びその権限を接収し、更には国内の小名・大名の後身である[[国人]]を[[被官]]化して、その地域（一国）唯一の大名としての地位を形成した。この時期の大名領国制を特に守護領国制と呼ばれるが、この体制を大名領国制の初期の形態と見るか、大名領国制が成立する以前の段階の体制と見るかで意見が分かれている。これは守護大名の権力はあくまでも室町幕府の権威の存在を前提にしており、大名自らに由来する権威に基づく支配ではないこと、国内には守護大名から自立した[[荘園]]及び国人の存在が見られ、その地域（一国）唯一の大名としての地位を確立したとまでは言えないという考えに由来している。守護大名の中には[[応仁の乱]]あるいは[[明応の政変]]以後に室町幕府に依存した領国支配を改めて、[[知行制]]による国人領主の家臣化と土地・人民支配の一元化を実現させて戦国大名となった大名も存在したが、大名家の有力な分家や国内の有力国人領主による[[下克上]]による守護権力の排除と領国支配の確立を行って戦国大名化したものも少なからずおり、また守護大名は原則として[[令制国]]単位で任命されていた（複数国や半国単位の例外も有したが）のに対して、戦国大名の領国は既存の行政区域に限定される性格のものではなかった。彼らは諸領内に自らの軍事力と裁判権に裏打ちされた独自の領地高権を確立して、その保障（安堵）があってはじめて土地の所有と支配が認められることとなり、それを維持するためには土地の所有・支配者は戦国大名の家臣となるしかなかった。そもそも、この時期には有力農民の領主化や国人の階層分化、庶子・[[譜代]]家臣の自立の動きなど、既存の権力では十分に対応できない事態も生じるようになった。こうした中で守護大名などの既存の支配者と上昇を目指す新興の支配者との政治抗争・軍事衝突が頻発し、その勝者が領地高権を有した戦国大名としての地位を確保したのである。戦国大名は[[検地]]の実施と[[分国法]]の制定、[[軍役]]の確立を通じて独自の支配体制を強化して家臣・人民を支配し、更に領国支配の安定化のために周囲に更なる土地を求めるようになった。かくして全国の戦国大名が各地で衝突し、弱小大名は領国支配から排除されるか家臣として編入されるようになり、有力な大名ばかりが残るようになっていった。そうした中で全国規模に適用される（事によっては海外とも対峙可能な）領地高権を有した支配者、すなわち[[天下人]]の登場が求められるようになり、「[[織田信長#天下布武天下布武]]」を掲げた[[織田政権]]、続いて「[[惣無事令惣無事]]」を掲げた[[豊臣政権]]によって全国統一が進められ、次いで「[[元和偃武]]」を実現させた[[徳川政権]]（[[江戸幕府]]）が成立することになる。江戸幕府の元でも各地の藩を統治した大名たちは独自の[[藩法]]と一定の完結性を持った経済圏の形成によって一定範囲内での独自の領内支配が認められていたが、これを大名領国制の延長とみるか、それとも封建的な主従関係を有した地方官僚による統治に過ぎないと捉えるか意見が分かれる。
FCM株式会社,学校名は、[[津市]]の中心を流れる[[志登茂川]]と、[[安濃川]]([[塔世川]])のうち、安濃川の北側に位置していることから名付けられた。大部分の生徒が[[津市立西が丘小学校]]、[[津市立南立誠小学校]]、[[津市立北立誠小学校]]、まれに[[津市立養成小学校]]から進学している。
プランゼージャパン株式会社,東京都内の[[教育]]に関する事務を所掌する[[行政委員会]]であり、6人の委員で構成される。それまでの[[教育委員長]]は[[木村孟]]（2004年10月20日-2015年3月31日）であった。広義では、教育委員会の事務を担当する[[教育庁]]（OfficeofEducation）を含めて、教育委員会と呼ぶこともある。教育委員会の事務の執行責任者であり、事務局の長である[[教育長]]は、教育委員会の委員を兼任していた。2015年（平成27年）4月1日から施行された[[地方教育行政の組織及び運営に関する法律]]の改正により、教育委員長と教育長を一本化した新「教育長」が設置された&lt;refname&quot;kyoik&quot;&gt;[http://www.kyoiku.metro.tokyo.jp/gaiyo/shikumi.html教育委員会の制度・委員・しごと東京都教育委員会平成28年1月22日更新]&lt;/ref&gt;[[石原慎太郎]][[東京都知事都知事]]時代から木村孟ら歴代教育委員長及び[[横山洋吉]]、[[中村正彦]]、[[大原正行]]、[[比留間英人]]ら歴代教育長の下、[[都立高等学校]]の学力向上などの高校改革に見られる大幅な教育改革に取り組んでいたことが知られている。但し、石原都知事辞任以降は、都立高校の独自化の動きは、[[進学指導重点校]]や[[進学指導特別推進校]]入試における[[独自入試自校作成問題]]が原則、グループ作成問題に移行するなど変化が見られる。2015年4月1日以降の新「教育長」は[[中井敬三]]。同様に2016年9月現在の教育委員は木村孟、[[山口香]]、[[遠藤勝裕]]、[[宮崎緑]]、[[大杉覚]]となっている&lt;refname&quot;kyoik&quot;/&gt;。
株式会社ジェイ・パワーシステムズ,[[SO207]]以来3年ぶりとなる、ソニーの20Xシリーズ。この機種からソニーの端末も「DoCoMoByシリーズ」から「デジタル・ムーバ」シリーズになった。折りたたみ型としてはかなり軽い89[[グラムg]]であった。[[入力予測予測変換]]には[[POBox]]が採用され、[[メール]]検索機能も付いていた。[[着信メロディ]]は[[SO503i]]と同じ24和音。
プリズミアン,創設100年以上の歴史を持ち、[[農業]]・[[園芸]]・[[動物科学]]・[[食品科学]]・[[農業環境工学]]・[[造園]]・[[生物工学]]の7学科があり、三年次にさらに三つの類型のいずれかを履修する（後述する学科名の後ろのアルファベットは略称）。;学科:*1クラスは学科の定員40人。:*農業科・園芸科のみ[[1997年]]から同時入試の形を取り、進級時に選択制を敷いている。このため、一年次は「農業園芸科」として合同2学級（略称はAH1・AH2）となり、二年進級時に農業科・園芸科へ分科となる&lt;ref&gt;例えば農業科を選択した場合、2年は2A、3年は3Aと表記される&lt;/ref&gt;。:*学科の途中変更は希望すれば可能。しかし各学科の独自科目があるため再履修が発生する場合がある。:*夜間[[定時制]]課程を併置している。修了年限4年。ただし、三修制課程を選択すれば3年で卒業することが可能。;同窓会:*組織名は「社団法人'''錦江会'''」。名称の由来は、[[明石城]]の別名が錦江城であった為で、現在地である加古川への移転前の明石城内時代の名残。[[明石公園]]内に「県農発祥の地」と銘打った石碑がある。:*なお鹿児島県の[[錦江湾]]とは全く関係は無い。
JX金属敦賀リサイクル株式会社,C型アルドラーゼ([[英]]AldolaseC[[EC番号EC]]4.1.2.13*[http://www.genome.jp/dbget-bin/www_bget?enzyme+4.1.2.13])はフルクトース-16-ビスリン酸アルドラーゼ（A型アルドラーゼ）のアイソザイムである。脳に局在し、[[小脳]]に最も多い。
株式会社アーレスティ,主に自動車の[[エンジン]]・[[トランスミッション]]・足回り・ボディなどに用いられる[[アルミニウムアルミ]][[ダイカスト]]製品を製造・販売している。自動車以外では[[産業機械]]・[[コンピュータ]]・[[家電]]向けなど。自社開発製品は「モバフロア」と呼ばれる[[アルミニウムアルミ]][[ダイカスト]]製[[OAフロアフリーアクセスフロア]]がある。
株式会社三ッ星,:『[[ザ・ドラえもんズ]]』を題材にした作品。『[[月刊コロコロコミック]]』、『[[別冊コロコロコミック]]』（[[小学館]]）にて連載された。単行本は全6巻。劇場版よりコメディ要素が強く、ドラえもんズの性格もコミカルになっている。また、ドラえもんズ結成の経緯やドラパンとミミミの出会いなど、劇場版では詳細には描かれなかった設定も描写されている。:劇場版作品『[[ドラミ&amp;ドラえもんズロボット学校七不思議!?]]』から『[[ドラミ&amp;ドラえもんズ宇宙ランド危機イッパツ!]]』までのコミカライズも実施されているが、『[[ザ☆ドラえもんズドキドキ機関車大爆走!]]』のみ単行本未収録となっている。
古河メタルリソース株式会社,[[古河機械金属]]の金属事業の生産部門を[[会社分割]]し、[[2004年]]（平成16年）に設立された。その後、事業毎に分社化し[[古河機械金属]]グループの企業価値の最大化を図る方針により、[[2005年]]（平成17年）に[[古河機械金属]]の金属事業の販売部門を[[吸収合併]]し製造・販売一体の自立した体制となり、現在に至る。現在は、海外から銅鉱石を輸入し、銅をはじめとして金・銀・硫酸などを生産・販売。製錬については資本参加している[[小名浜製錬]]、[[日比共同製錬]]などに委託するなど、最適生産体制を構築している。また、原料となる銅鉱石を長期間安定的に確保するため、カナダのハックルベリー鉱山、インドネシアのバツ・ヒジャウ鉱山などに[[古河機械金属]]を通して出資するなど、海外での鉱山事業にも積極的に取り組んでいる。
日本軽金属ホールディングス株式会社,[[2012年]]に日本軽金属が単独[[株式移転]]により設立した持株会社。同時にグループ再編を行い、直接の子会社は日本軽金属、押出関連事業を統括する中間持株会社の日軽金加工開発ホールディングス、箔・粉末製品事業を営む東洋アルミニウム、トレーラ（被けん引車）・自動車車体等の製造業を営む日本フルハーフの4社となっている。
三菱アルミニウム株式会社,山域は[[揖斐関ヶ原養老国定公園]]の指定を受けている&lt;refname&quot;コンサイス日本山名辞典(1992)、117頁&quot;/&gt;&lt;refname&quot;kokutei&quot;&gt;{{Citeweburlhttp://www.pref.gifu.lg.jp/kankyo/koen-hodo/koen/kokutei.htmltitle揖斐関ヶ原養老国定公園publisher岐阜県環境生活部自然環境保全課accessdate2014-10-28}}&lt;/ref&gt;。東西に連なる尾根上に2つのピークがあり、西側が[[最高峰]]の本貝月、東側が小貝月（前貝月、標高1226m）と呼ばれている&lt;refname&quot;村田(2005)、1231頁&quot;/&gt;。全山[[花崗岩]]からなる&lt;refname&quot;コンサイス日本山名辞典(1992)、117頁&quot;/&gt;&lt;refname&quot;吉川(2005)、73-75頁&quot;&gt;[[#岐阜の山旅吉川(2005)、73-75頁]]&lt;/ref&gt;。貝月山を中心とする貝月山岩体と鍋倉山の三田倉谷の三田倉谷岩体は、'''貝月山花崗岩'''（東西約14km、南北約14km）と呼ばれている&lt;refname&quot;gifu-chigaku&quot;&gt;{{Citeweburlhttp://gakuen.gifu-net.ed.jp/~contents/kou_chigaku/ganseki/rock/kaizuki/kaizuki.htmtitle貝月山花崗岩publisher岐阜県教育委員会accessdate2014-10-28}}&lt;/ref&gt;。その生成-固結年代は1億年-9千万年前（[[中生代]][[白亜紀]]）と推定されている&lt;refname&quot;gifu-chigaku&quot;/&gt;。貝月山岩体は、粗粒、等粒状、一部斑状の[[角閃石]]含有[[黒雲母花崗岩]]と[[花崗閃緑岩]]などで構成されている&lt;refname&quot;gifu-chigaku&quot;/&gt;。[[ぎふ百山]]&lt;ref&gt;[[#ぎふ百山岐阜県山岳連盟(1987)]]&lt;/ref&gt;の一つに選定されている。東山麓には長者平[[キャンプ場]]があり、「森の文化博物館」が併設されている&lt;ref&gt;{{Citeweburlhttp://www.town.ibigawa.gifu.jp/kankoujyouhou/history/morinobunka.htmltitle森の文化博物館publisher揖斐川町accessdate2014-10-31}}&lt;/ref&gt;。山麓周辺の山中ではかつて[[炭]]焼が行われていて、多くのその窯跡が残されている&lt;refname&quot;余呉(2010)、270-271頁&quot;&gt;[[#名古屋周辺の山余呉(2010)、270-271頁]]&lt;/ref&gt;。南東山麓の揖斐川町春日美束種本にある「熊野神社の[[アラカシ]]」は、[[1977年]]（昭和52年）11月18日に県の[[天然記念物]]の指定を受けた&lt;ref&gt;{{Citeweburlhttp://www.pref.gifu.lg.jp/kyoiku-bunka-sports/bunka-geijutsu/bunkazai-zuroku/bunkazai-zuroku/tenki/ibigawachou/arakashi.htmltitle熊野神社のアラカシpublisher岐阜県accessdate2014-10-29}}&lt;/ref&gt;。[[1985年]]に北側の山域で[[久瀬村]]により、[[ハイキング]]、[[キャンプ]]、[[スキー]]（揖斐高原スキー場）、[[パラグライダー]]などの[[アウトドア]]のフィールドとして「揖斐高原貝月[[リゾート]]」が開設された&lt;ref&gt;{{Citeweburlhttp://www3.pref.gifu.lg.jp/shougai/smileInstitutionDetail.do;jsessionid4E9645426C9F368DB0ABAC9A0E3D3A4C?action%8F%C6%89%EF&amp;referenceSeiriNo00032968&amp;sclassCd&amp;mclassCdtitle揖斐高原貝月リゾートpublisher岐阜県accessdate2014-10-29}}&lt;/ref&gt;。[[1993年]]に北西山腹の品又川上流部（揖斐川町[[坂内村坂内]]坂本字品又）に、岐阜県により「揖斐高原坂内の森」が整備された&lt;ref&gt;{{Citeweburlhttp://www.pref.gifu.lg.jp/sangyo-koyo/ringyo-mokuzai-sangyo/yutakanamori/seikan/seikatukankyo/sakauchino-mori.htmltitleいび高原坂内の森publisher岐阜県林政部治山課accessdate2014-10-29}}&lt;/ref&gt;。山頂部の北東面は[[鳥獣保護区]]、特別保護地区の指定を受けている&lt;ref&gt;{{Citeweburlhttp://www.pref.gifu.lg.jp/kankyo/shizen/hanter-mapitiran.htmltitle圏域別鳥獣保護区等一覧publisher岐阜県環境生活部自然環境保全課accessdate2014-10-30}}&lt;/ref&gt;。