三研マイクロホン株式会社,[[1993年]]、初代編集長の[[赤田祐一]]が[[飛鳥新社]]を退社後に創刊準備号を自費出版。翌94年に[[太田プロダクション]]系列の[[太田出版]]から正式に創刊された&lt;ref&gt;[http://takekuma.cocolog-nifty.com/blog/2005/03/post_2.htmlたけくまメモ]2005年3月3日「『共犯者』としての編集者」より&lt;/ref&gt;。初期は一般誌が取り上げないマイナーな題材が中心だったが、現在はお笑い、テレビ番組、音楽、映画など[[サブカルチャー]]全般を扱っている。特集記事では芸人やタレント、アーティスト、文化人など、様々な分野で活躍する人物の長文インタビュー&lt;ref&gt;インタビュー記事は時には十数ページにおよぶことがある。&lt;/ref&gt;と、アーカイブや辞典、年表などの膨大な関連データを掲載するのが特徴である。方向転換して非サブカル誌となった『[[宝島(雑誌)宝島]]』（[[宝島社]]）と入れ替わりで登場したこともあり、1990年代中盤から2000年代前半に至るまで、サブカル誌の雄として名を馳せた。ただし、赤田編集長（当時）が「サブカルチャー」「サブカル」という言葉を嫌っていたため、サブカル雑誌と自称したことは一度もない。北尾編集長時代から雑誌名の上に「Newsmagazineforyouthculture」というコピーが付いており、自称は一貫してユースカルチャー誌である。近年は、テレビ番組や人気お笑い芸人、グループアイドルといったメジャーなものを特集することも多く、以前に比べてサブカル色は薄くなっている。101号でリニューアル新装刊して以来、藤井編集長時代は26号（増刊含む）中13号の表紙・巻頭特集が[[ももいろクローバーZ]]とそのメンバーで、ほぼももクロの専門誌状態だった。雑誌名は、創刊から一貫して「QuickJapan」だが、編集長が森山裕之に交代した51号から表紙のタイトルロゴが「QJ」に変更された。その後、藤井直樹の編集長就任で73号より「QuickJapan」に戻されている。また、雑誌名とは別に、編集方針を示唆したキャッチコピーが付けられている。遍歴は以下の通り。*「AlltheSTREETNEWSThat'sFittoPrint」創刊号-22号*「Newsmagazineforyouthculture」23号-72号*「CAUSETOBENOWHERE.」73号-100号*「ForYourNextAction」101号-123号*「AVOICEOFNEWGENERATION」124号-サブカル誌としては異例の速さで「[[新世紀エヴァンゲリオン]]」に注目したり（1996年）、全国メディアではほとんど知られていなかった「[[水曜どうでしょう]]」を50ページ以上に渡って特集（2004年）。ブレイク前の[[クレイジーケンバンド]]（2002年）、[[菊地成孔]]（2001年）、[[Perfume]]（2007年）、[[ももいろクローバー]]（2011年）を表紙・巻頭特集で大々的に取り上げるといったように、ネタ選びの嗅覚があった。かつては、相方の死について語った[[竹山隆範カンニング竹山]]のインタビューや、[[千原ジュニア]]の入院写真を独占公開するなど、メジャーな対象に独自のテーマで深く切り込んだ特集が目立っていた。関連書籍も数多く出版しており、特に赤田編集長時代の[[大泉実成]]らによる「消えたマンガ家」から端を発したQJマンガ選書」（[[徳南晴一郎]]作の「人間時計」などの[[貸本劇画]]の復刻本を出版）や、後に映画化され社会現象となった小説「[[バトル・ロワイアル]]」は、各方面に大きな反響を与えた。1995年には「別冊QuickJapan」と称した単行本がシリーズ化されている。現在も、「[[たのしい中央線]]」や「日本国憲法」（[[森達也]]）、「[[まんカス]]」（[[漫☆画太郎]]）などを出版している。出版以外の活動としては、2004年11月27日に[[新木場STUDIOCOAST]]で、[[スチャダラパー]]や[[NathalieWise]]、[[川辺ヒロシ]]、[[DEVLARGE]]、[[AFRA]]、[[Dokaka]]、[[シロー・ザ・グッドマン]]、[[モニユジュモ]]（[[イルリメ]]）、[[オールタイチ]]、[[劇団ひとり]]、[[ダンディ坂野]]、[[カンニング(お笑いコンビ)カンニング]]、[[タケイグッドマン]]などを集めたイベント「QJFQuickJapanFIVALvol.0012004WINTER」を開催。また、2006年9月1日には、渋谷7thFLOORで、[[星野源]]（[[SAKEROCK]]）と[[寺尾紗穂]]によるライブ「クイック・ジャパンな夜QJNvol.001」を開催した。2005年には、自主レーベル「QuickJapanRecords」を立ち上げ、[[茂木淳一]]のアルバム「MOGY-TV」をリリース。関連企画として、同年9月25日に[[エフエム東京TOKYOFM]]で茂木淳一をDJにラジオ番組「QJFM」を放送した。ラジオ番組では、他にも2006年4月16日に「QJFMvol.002カウントダウン・[[サンボマスター]]100」を企画・放送している。
朝日乾電池株式会社,発明家の松本亀太郎が[[1914年]]（大正3年）に設立した朝日乾電池製作所（松本朝日乾電池、松本乾電池製造所などという表記も見られる）として創業、松本のアイデア、技術もあり、当初は業績を伸ばしていたが、ほどなく行き詰まり&lt;ref&gt;[http://oohara.mt.tama.hosei.ac.jp/kyochokai/k096/r096.html法政大学大原社会問題研究所協調会史料-松本朝日乾電池争議解決ノ件]&lt;/ref&gt;&lt;ref&gt;[http://www.ipm.jp/ipmj/int/tomatsu.htmlInternetPhotoMagazineJapan-東松照明]-「昔は朝日乾電池といって、大阪が本社でうちは名古屋工場の下請町工場で‥‥&lt;/ref&gt;、[[パナソニック]]の傘下入りとなった。最盛期の宣伝活動は、当時の雑誌広告や、地方に残る[[ホーロー看板]]で確認することもできる。:[[松下幸之助]]の右腕とも、番頭とも言われた[[高橋荒太郎]]は、当時の勤務先から朝日乾電池の救済のために出向しており、朝日乾電池ごと松下電器に吸収された形。松下電器からみれば途中入社とも言える。その後、[[1942年]]（昭和17年）に吸収され、企業として独立した朝日乾電池は消滅する。戦後、再び松下電器が同名で設立しているが、住所は[[守口市]]松下町1番1号である。また、合併前から続くSUNRISEブランドは現在でも使用されているが、すべての製品の販売は企業間取り引きに限定されており&lt;ref&gt;[http://www.mitsuboshi-boeki.co.jp/company.html三ツ星貿易会社概要]&lt;/ref&gt;、市販されてはいない。玩具、雑貨品などの販売時に添付されている電池として見かけることがある。市販されていた頃は一般的な電池よりも、真空管ラジオ用のB電池、トランジスタラジオ用の積層電池、通信用電池等の特殊電池を多く生産していた。
キヤノンメディカルシステムズ株式会社,2016年3月までは東芝グループの企業であり、東芝グループでの社会・インフラ部門の中核をなしていた。医療機器関係では、X線[[コンピュータ断層撮影CT]]などの医用機器の世界的メーカーで、数多くの医療機器を展開している。単純[[X線写真X線撮影]]診断装置、X線TV装置、CT、[[核磁気共鳴画像法MRI]]、[[超音波検査超音波画像診断装置]]（いわゆるエコー）、RI（核医学）などを手掛ける。[[内視鏡]]の販売は[[富士フイルムホールディングスフジノン]]との合弁で設立した、[[フジノン東芝ESシステム]]に移管した。その他、[[レセプト]]コンピューター、[[電子カルテ]]、PACS、検診システム、[[血管造影アンギオ]]装置、検体検査システムなども扱う。医療機器の製造販売では日本1位、世界4位。日本のCTシェア60%、エコーシェア35%ともに1位。同業の[[日本光電工業]]と業務提携している。[[1975年]]、CTを発明した[[EMI]]のいわゆるEMIスキャナを[[EMIミュージック・ジャパン東芝EMI]]の縁で輸入し、[[東京女子医科大学]]などに設置。日本で初めて稼動したCTとなる。その後、CTを自社開発。[[ヘリカルスキャン]]、マルチスライスを導入してスキャン時間を短縮した。[[2012年]]にイングランド・[[プレミアリーグ]]のサッカークラブである[[マンチェスター・ユナイテッドFC]]と5年間の医療機器による協賛契約を結び公式パートナー（OfficialMedicalSystemsPartner）となった。[[2015年]]に医療機器事業として100周年を迎えた&lt;ref&gt;[http://www.toshiba-medical.co.jp/tmd/products/100th_anniversary/index.html100thAnniversaryOurPromise〜東芝ヘルスケア事業100周年]東芝メディカルシステムズ株式会社&lt;/ref&gt;。2015年[[12月21日]]に当時の親会社であった[[東芝]]が発表した「新生東芝アクションプラン」では、当社に外部資本を受入れることとされた&lt;ref&gt;[http://www.toshiba-medical.co.jp/tmd/company/news/151221.html「新生東芝アクションプラン」の実施に伴う当社の外部資本受け入れについて]東芝メディカルシステムズ株式会社、2015年12月21日&lt;/ref&gt;。[[2016年]][[3月17日]]に、東芝から[[キヤノン]]に全株式が譲渡され、東芝の子会社でなくなった。ただし主要各国の競争法規制がクリアされるまでは、一時的に第三者であるMSホールディング株式会社が議決権を保有し、クリアされた時点でキヤノンの子会社となった&lt;ref&gt;[http://www.jiji.com/jc/c?geco_30&amp;k2016031700593医療子会社、６６５５億円で売却東芝、キヤノンと契約−白物家電は中国・美的に]時事通信、2016年3月17日&lt;/ref&gt;&lt;ref&gt;[http://www.toshiba.co.jp/about/ir/jp/news/20160317_3.pdf東芝メディカルシステムズ株式会社の売却について]株式会社東芝、2016年3月17日&lt;/ref&gt;。[[重粒子線がん治療]]装置は事業再編の対象とはならずに引き続き東芝本体(東芝エネルギーシステムズ株式会社)が担当する&lt;ref&gt;[http://techon.nikkeibp.co.jp/atcl/feature/15/327441/011100028/?STndh東芝が見せた意地、原子力技術を医療へ]&lt;/ref&gt;。[[2016年]][[4月14日]]に[[熊本地震(2016年)熊本地震]]が発生した際は、[[熊本市]]中央区にある熊本支店が影響を受けたが、社員の安否確認はとれている&lt;ref&gt;{{Citenewstitle4月15日16時30分更新【熊本地震・企業動静】ソニー半導体工場、被害なしnewspaperニュースイッチdate2016-04-15urlhttps://newswitch.jp/p/4347accessdate2016-04-21}}&lt;/ref&gt;。本社に災害対策本部を20人態勢で設置し、被災地の病院等にある同社製の医療器具の復旧の支援に向けて情報収集を行った&lt;ref&gt;{{Citenewstitle熊本地震、栃木県の企業も被害支援活動も本格化newspaper下野新聞date2016-04-19urlhttp://www.shimotsuke.co.jp/news/tochigi/top/news/20160419/2299214accessdate2016-04-21}}&lt;/ref&gt;。2016年12月、スペインの[[リーガ・エスパニョーラ]]所属のサッカークラブ、[[レアル・マドリード]]とオフィシャルメディカルスポンサー契約を締結。期間は2020年6月末まで&lt;ref&gt;[http://www.shimotsuke.co.jp/news/tochigi/economics/news/20161201/2526348レアル・マドリードとメディカルスポンサー契約大田原の東芝メディカル]-下野新聞、2016年12月1日&lt;/ref&gt;。2016年12月19日、主要各国の競争法規制当局からのクリアランス取得の審査が完了したことをうけ、キヤノンがMSホールディングから当社の全株式を取得。キヤノンの完全子会社となる&lt;ref&gt;[http://web.canon.jp/pressrelease/2016/p2016dec19j.html東芝メディカルシステムズ株式会社の株式取得（子会社化）に関するお知らせ]キヤノン株式会社&lt;/ref&gt;。2018年1月4日付で、社名を東芝メディカルシステムズ株式会社から「キヤノンメディカルシステムズ株式会社」へ商号を変更した&lt;ref&gt;[http://www.toshiba-medical.co.jp/tmd/company/news/170130.html新社名決定のお知らせ]東芝メディカルシステムズ2017年1月30日&lt;/ref&gt;&lt;ref&gt;[http://www.e-radfan.com/product/60920/東芝メディカルシステムズ、社名変更日を決定]RadFanONLINE2017年10月2日&lt;/ref&gt;。商号変更後は、キヤノンの画像処理技術を組み合わせたソフトを2018年春に発売する他、製造工程においても、キヤノンの技術を導入して生産効率を高める&lt;ref&gt;[https://www.nikkei.com/article/DGXMZO25303870U8A100C1X20000/キヤノンメディカルに社名変更、20年売上高6000億円弱に]日本経済新聞2018年1月4日&lt;/ref&gt;。ただし、元東芝グループ故に英文社名はキヤノングループの「Canon（略）'''Inc.'''」ではなく東芝グループの「CANONMEDICALSYSTEMS'''CORPORATION'''」のままである。
株式会社GSユアサエナジー,[[パナソニックグループ]]は戦前から蓄電池製造を手掛けており歴史のある事業であるが、最初からスムーズに事業化できたわけではない。社内や、買収した電池メーカーは乾電池についてのノウハウを持っていたが鉛蓄電池は経験がなく、当初は大学の研究者から指導を受けるなどしてノウハウを蓄積しながら事業を立ち上げていった。グループの電池メーカー、松下電池工業から蓄電池部門が独立。自動車用蓄電池は生産量の多くが[[OEM]]向けであるため、一般に広く知られているわけではないが国内シェアは20%以上。また、[[電気自動車EV]]向け蓄電池も手掛けており、EVのフォークリフトにも採用された&lt;ref&gt;[http://panasonic.co.jp/ec/psb/news/2007/20070216.htmlパナソニックストレージバッテリー-EV用制御弁式鉛蓄電池をフォークリフト業界に初納入]&lt;/ref&gt;。2016年10月3日付でPSBの株式の大半を[[GSユアサ]]に売却し、パナソニックグループから離脱した&lt;ref&gt;[http://www.gs-yuasa.com/gye/jp/nr_pdf/20161003.pdfパナソニック株式会社の鉛蓄電池事業譲受に関する株式取得完了のお知らせ]&lt;/ref&gt;。ただし、パナソニックブランドの自動車用蓄電池（およびそのOEMである[[出光興産出光]][[ZAXIA]]）は引き続きGSユアサエナジーで製造される。
アキュートロジック株式会社,[[高度成長期]]以降、温泉の利用が大型[[旅館]]や[[日帰り入浴施設]]などの近代的施設中心になり、また大浴場での[[循環風呂]]での温泉提供が中心となっていた。そのような流れに対して昔ながらの旅館、温泉利用文化、源泉での風呂提供施設を残していくための支援として、温泉評論家の[[野口悦男]]が主宰となって日本温泉遺産を守る会が設立された。日本温泉遺産を守る会では、会独自の温泉遺産の基準が設けられ、それに合致する[[温泉宿]]、温泉地を温泉遺産として指定している。温泉遺産は3つの指定分野が存在する。それぞれの分野について指定条件が個別に存在する。#[http://www.onsen-isan.com/tatemono/index.html建造物]#[http://www.onsen-isan.com/fuuzoku/index.html温泉文化・風俗]#[http://www.onsen-isan.com/gensen/index.html風呂への源泉利用]
アロン電機株式会社,本作以前の『[[おジャ魔女どれみ]]』シリーズのPlayStation用ゲームは、「キッズステーション」シリーズの幼児向け知育ゲームであったが、本作は[[すごろく]]式のパーティーゲームとなっている。
バイ・デザイン株式会社,[[2003年]]にデルコンピュータ株式会社（現・[[デル]]株式会社）や[[パソコン]]メーカーの[[アキア]]の[[社長]]をしていた[[飯塚克美]]が立ち上げた。自社での製造工場を持たず（[[ファブレス]]）、[[アジア]]各地の協力メーカーに生産を委託し、また広告[[宣伝]]を自社[[ウェブサイト]]のみとすることでコストを削減している。製品の多くは中国製。大手テレビメーカーの垂直統合型に対し、水平分業型の[[ビジネスモデル]]が特徴。取扱い製品は[[液晶テレビ]]、[[プラズマテレビ]]、[[DVDプレーヤー]]、一体型液晶テレビがメイン。サイズは10.2型から50型まであった。大手家電メーカーがすべて[[デジタルチューナー]]になるなかで、[[アナログ]]チューナーの製品を長らく販売していた。ハイビジョン対応でないものの、[[BtoB]]市場、主に[[カラオケ]]、[[病院]]、[[店頭]]用[[インフォメーション]]ディスプレーに活用されていた。[[2007年]][[6月15日]]に業界最多[[HDMI]]端子を4つ搭載した地上・BS・110度CS[[デジタル放送]]に対応した42型フル[[ハイビジョン]]液晶テレビを発売。当初[[総務省]]が定めた「2011年アナログテレビ放送終了」[[マーク]]を使用していなかったが、[[2008年]]から同マークを使用した。破産時には24型〜16インチの液晶テレビを販売していた。最後の製品は、[[2010年]]6月に発売した22型TVであった&lt;ref&gt;[http://kakaku.com/item/K0000119500/feature/#tab価格.comバイ・デザイン、49800円の22V型フルHD液晶TV]&lt;/ref&gt;。
ピーディーシー株式会社,[[2003年]]（[[平成]]15年）に閉鎖した[[サッポロビール]]札幌工場（札幌第2製造所）跡地を[[再開発]]し&lt;refname&quot;コミュニケーションスペース&quot;&gt;{{Citeweburlhttp://www.sapporoholdings.jp/csr/foundation/space_2.htmltitleコミュニケーションスペースとして（サッポロガーデンパーク）publisher[[サッポロビール]]accessdate2017-04-23}}&lt;/ref&gt;、[[開拓使]]の一事業として[[ビール]]造りが始まった歴史を守りながら未来へ繋ぐことを目的とした施設&lt;ref&gt;{{Citepressreleaseurlhttp://www.sapporobeer.jp/news_release/0000021166/pdf/20150817sgprn.pdftitleサッポロビール140周年記念2016年春『サッポロガーデンパーク』をリニューアルdate2015-08-17formatPDFpublisherサッポロビールaccessdate2017-04-23}}&lt;/ref&gt;。開発に当たって赤レンガ建築や[[原生林]]を保存し、[[北海道]]らしい都市空間づくりを目指した&lt;refname&quot;コミュニケーションスペース&quot;/&gt;。日本国内唯一のビール博物館「[[サッポロビール博物館]]」は「札幌苗穂地区の工場・記念館群」の1施設として「[[北海道遺産]]」に選定されており&lt;ref&gt;{{Citeweburlhttp://www.hokkaidoisan.org/heritage/015.htmltitle札幌苗穂地区の工場・記念館群publisher北海道遺産協議会事務局accessdate2017-04-22}}&lt;/ref&gt;、札幌の[[観光資源]]の1つになっている。サッポロガーデンパークは地域に開かれた緑豊かなオープンスペースづくりが評価されており、『第30回緑の都市賞』奨励賞&lt;ref&gt;{{Citeweburlhttps://urbangreen.or.jp/cfgreencity/gc30-09titleサッポロビール株式会社サッポロガーデンパークpublisher[[都市緑化機構]]accessdate2017-04-22}}&lt;/ref&gt;、『第21回全国花のまちづくりコンクール』国土交通大臣賞を受賞している&lt;ref&gt;{{Citeweburlhttp://www.hananokai.or.jp/c/c4211.htmltitle第21回全国花のまちづくりコンクール花のまちづくり大賞publisher日本花の会accessdate2017-04-23}}&lt;/ref&gt;。[[都市再開発]]による新たな[[まちづくり]]「苗穂駅周辺地区まちづくり計画」の策定範囲になっており、札幌市や「苗穂駅周辺まちづくり協議会」が[[苗穂駅]]移転を含む駅周辺の再開発を進めている&lt;ref&gt;{{Citeweburlhttp://www.city.sapporo.jp/keikaku/partnership/naebo/p_naebo.htmltitle苗穂駅周辺地区のまちづくりpublisher[[札幌市]]accessdate2017-04-22}}&lt;/ref&gt;&lt;ref&gt;{{Citeweburlhttp://www.naebo.comtitleはばたく苗穂publisher苗穂駅周辺まちづくり協議会accessdate2017-04-22}}&lt;/ref&gt;。
株式会社日本抵抗器製作所,ウバウオは[[太平洋]]北西部に分布し、[[日本]]では[[青森県]]から[[沖縄諸島沖縄]]にかけての海域に生息する。水深10mまでの浅い岩礁域に住み、[[アラメ]]など[[褐藻]]に吸着している姿がしばしば観察される。[[吻]]から眼を横切って走行する褐色の縦縞が特徴で、体長は6cm程度。頬や体部には斑点状の模様があるが、色彩や大きさは個体によってさまざまである。
株式会社イースタン,旧[[司法省]]庁舎として[[1895年]]に竣工したドイツ・ネオバロック様式の[[歴史主義建築]]である。基本設計は建築顧問官を務めていた[[お雇い外国人]]のドイツ人[[建築家]][[ヘルマン・エンデ]](HermannGustavLouisEnde)と[[ヴィルヘルム・ベックマン]](WilhelmBckmann)で、実施設計と工事監理は[[河合浩蔵]]が行った。[[官庁集中計画]]は頓挫したが、旧[[大審院]]（最高裁判所）庁舎とともに明治の近代公共建築を象徴する建物となった。[[1923年]]の[[関東大震災]]では煉瓦外壁が鉄材補強されていたことでほぼ無傷で乗り切ったものの、[[1945年]]の[[日本本土空襲空襲]]により内装の大部分と屋根を焼失した。[[1950年]]に[[法務府]]庁舎（1952年からは[[法務省]]本館）として再利用されることになるが、それにあたっての改修工事では屋根材（[[雄勝石]]の[[スレート]]から[[瓦]]）等に変更が加えられた。しかし[[1994年]]の改修工事では文化財としての観点から創建時の外観に戻され、法務総合研究所及び法務図書館として利用されるようになった。同年12月27日には国の[[重要文化財]]に内装を除いて指定されている&lt;ref&gt;{{国指定文化財等データベース102508法務省旧本館}}&lt;/ref&gt;。この敷地は[[江戸時代]]に[[米沢藩]][[上杉家]]藩邸（[[上屋敷]]）として使われており、その記念碑も建立されている&lt;ref&gt;{{Citewebtitle米沢藩上杉家江戸屋敷跡地urlhttp://www.pref.yamagata.jp/ou/379001/metropolitan_area01/aria01/page11.htmlpublisher[[山形県]]accessdate2018-05-26}}&lt;/ref&gt;。近代史をテーマにした映画・ドラマのロケに使用されることが多い。
ヴイストン株式会社,ヴイストンは当時[[和歌山大学]]システム工学部[[教授]]であった[[石黒浩]]の技術特許を事業化する目的で日本LSIカード、システクアカザワ、島屋ビジネスインキュベータらの出資で設立された。&lt;ref&gt;{{citeweburlhttp://robot.watch.impress.co.jp/cda/column/2006/05/30/8.htmltitleロボット事業の解は明確〜ヴイストン株式会社publisherロボットWatchdate2006-05-30accessdate2015-12-20}}&lt;/ref&gt;&lt;ref&gt;{{citeweburlhttp://www.vstone.co.jp/news/news2002.2.18.htmltitle新産業を招く！中堅企業主導で技術を移転大学発ベンチャーpublisher産業新聞date2002-02-18accessdate2015-12-20}}&lt;/ref&gt;当初はセンサー技術を中心としていたが現在はロボット関連技術を中心としている。*本社：[[大阪市]][[西淀川区]]御幣島2-15-28*設立：[[2000年]][[8月4日]]*資本金：5000万円*代表者：大和信夫
本多通信工業株式会社,通信機器や電子機器で使用されるコネクタの製造、販売を行う。特定分野でのNo.1を複数持つ「SegmentsNo.1」を戦略として掲げている。&lt;br/&gt;グループの認知度向上に向けてブランドを'''HTK'''に統一。グループは同社と連結子会社8社（国内2社、海外6社）の計9社で構成される。&lt;br/&gt;大株主として、[[パナソニック]]が20％（[[持分法]]適用会社）保有している。&lt;br/&gt;2010年に代表取締役社長に佐谷紳一郎氏が就任。構造改革により赤字から脱却し、その後事業は順調に拡大。&lt;br/&gt;現在の中期経営計画“GC20”では、「よい会社」＆「過去最高業績(2020年：売上250億、利益25億円)」を目指している。&lt;br/&gt;
昭和KDE株式会社,ソロとしては『[[主義-ism:]]』以来16年振りのオリジナルフルアルバム。このアルバムでは、製作されたオリジナル楽曲の作詞のほとんどを外部に委託しており、レコーディングに参加したミュージシャンとコラボレーションしている。
