株式会社ネクス,[[ウィルコム]]の[[AIR-EDGE]]用データ通信カードや[[W-SIM]]料金前払い式の[[b-mobile]]（[[日本通信]]）などの通信端末を製造している。また最近{{いつdate2017-11}}では[[電力線搬送通信]]用のモデムなどの開発も手がけている。[[2009年]]9月、アスモ（現・[[オーパス(企業)オーパス]]）のPHS端末の開発・保守事業を譲受。これに伴い、[[2009年]]11月1日付で、同社製PHS端末である[[WS009KE]]および[[WS018KE]]のサポート先が当社に移行されている。しかし、携帯電話通信事業者各社による高速データ通信サービスの提供、データ通信カード製品の市場の縮小などにより今後加入者の急激な減少が予測されるとして、コンシューマ向けPHSデータ通信端末事業から[[2010年]]10月末をもって撤退した。なお、PHS音声サービス向け端末、M2Mサービス向け端末、W-SIM及びその接続アダプター、ウィルコムが提供する3Gデータ通信サービス向け端末等などについては従来どおりの事業を行うとしている。2012年2月にLTEモバイルルータの提供開始を発表し、その後PHS端末についても防災用PHS電話機「[[防災だフォン]]＜WX01NX-DE＞」を発売するなど、PHSや3Gデータ通信サービス向け端末に加えてLTEデータ通信サービス向けのモバイルルータなども手がけている。[[2010年]]8月1日にリニューアルした[[ビッグアイ(郡山市)#MOLTIウィルコムプラザ郡山]]を皮切りに、[[東北地方]]の[[ウィルコムプラザ]]など、同地域のウィルコム[[キャリアショップ専売店]]に関する販売・営業等のサポート業務を[[2010年]]8月以降順次開始し、旧直営を継承の上で中心駅至近に移転させた拠点（山形市のみ旧支店の位置のまま展開）を手始めに段階的に全国展開する方針であった（ただし、代理店として直接店舗を運営するわけではない）。その後、モバイルショップ事業は主力事業であるデバイス事業とのシナジーが少なく、また大手事業者との競合も厳しいことから、見直しを図ることとなり2012年2月に携帯電話販売事業を全国的に展開する[[コスモネット]]へ事業譲渡を行い、デバイス事業へ経営資源を集中させている。コスモネット移行、そしてY!mobileブランドの店舗となってからは、駅ビルないしは駅至近の店舗は[[2016年]]4月末までに、[[ヒューモス仙台駅前]]を除いて、すべて閉鎖ないしは郊外へ移転。フェザンに所在したワイモバイル盛岡は、ワイモバイル盛岡月が丘として同市北端部に移転。おしゃれかんアルスに所在したワイモバイル秋田は、ワイモバイルイオンモール秋田として、イオンモール秋田に移転（ただし公開されていたPHS番号はコスモネットがウィルコムプラザとして開業したワイモバイル秋田卸町が継承）。郡山と青森ラビナは、郊外に展開する既存店に統合。このあおりで、同じくコスモネットが運営していたことにより、ワンストップ利用が可能となっていたソフトバンク仙台おおまちも同時に閉鎖された。駅至近の位置ではなかったものの、ウィルコムの支店の位置をそのまま継承していた山形もこの流れで閉店し、郊外に所在する既存のワイモバイル山形南に統合された。仙台駅前は、逆に同店の近隣に所在したワイモバイル仙台おおまちを閉鎖している。2012年7月に株式会社フィスコグループ入り、同時に[[イー旅ネットグループ]]を子会社化しインターネット旅行事業を開始。中核となるデバイス事業ではM2M分野における事業ドメインの拡大に注力。2013年3月に新規事業として農業ICT事業([[NCXXFARM]])を開始。同年5月に第12回岩手農商工連携ファンド地域活性化支援事業に採択された。農業ICTを活用したきのこの栽培管理システムの研究開発を開始。2013年10月末、株式会社[[エイビット]]と資本業務提携、株式会社[[エイビットホールディングス]]に対する第三者割当を実施、両社それぞれが保有している通信関連コア技術と新たな共同研究開発による最先端技術を共有すること、およびM2M製品に関する部品の調達・提供に関して協力することに加え、双方の顧客基盤の活用によるM2M市場における両社のさらなる販売拡大に資するシナジーを実現することを目的としている。2013年11月にはNCXXFARMにて[[宮沢賢治]]の童話を同梱した「[[黄いろのトマト]]」を新発売。2013年12月には株式会社[[SJI(企業)SJI]]と子会社である株式会社[[ネクスソリューションズ]]との間でシステム開発事業に関して吸収分割契約を締結、デバイス製品の提供だけにとどまらず、サーバーアプリなどのソフトウェア開発をおこなうことで、M2Mマーケットの垂直統合を目指す。さらにケアオンライン株式会社（現・株式会社[[ケア・ダイナミクス]]）を子会社化、介護サービスと通信技術資産を組み合わせる形でM2M分野における事業拡大を目指す。2014年4月には[[ヴィストン]]株式会社と[[介護ロボット]]の共同開発を発表するなど、これまで培ってきた通信技術資産を生かしさまざまな産業へ応用、M2M分野としての市場拡大を行っている。2015年4月1日付で、商号を株式会社ネクスグループに変更すると同時に、持株会社制へ移行。デバイス部門を株式会社ネクス（2代目）として新設分割で設立した&lt;ref&gt;[http://www.ncxx.co.jp/wp/wp-content/uploads/2015/01/b78aefc4926233c377b01f7dddfcdb82.pdf会社分割による持株会社体制への移行並びに定款変更（商号及び目的の変更）に関するお知らせ]ネクス2015年1月26日&lt;/ref&gt;。
サンワサプライ株式会社,
昭和建産株式会社,鹿児島県中央部、霧島市の国分市街地北部の南に開けた微高地上に位置する。[[聖武天皇]]の詔で創建された国分僧寺の遺構に比定され、付近では国分尼寺跡も想定される（所在地未詳：[[隼人塚]]付近説{{Sfn中世諸国一宮制2000pp639-640}}や府中石園付近説{{Sfn大隅国分寺跡（鹿児島県）}}）{{Sfn大隅国分寺跡-遺構編-2010}}。近世以来の開発等で遺構の多くが失われているため、寺域・伽藍は未だ詳らかでない。現在は層塔・仁王像等のみを遺存し、これらや出土古瓦の様相から国分寺跡であることは確かとされる。寺域の想定中心域は[[1921年]]（[[大正]]10年）に国の[[史跡]]に指定されている&lt;refname&quot;国指定&quot;/&gt;。なお付近では大隅国府跡の存在も推定される。
大崎電気工業株式会社,[[電力量計]]を主力製品とする日本の計測制御機器メーカーの1社である。国内の電力量計を取り扱う同業他社には、[[東光東芝メーターシステムズ]]、[[三菱電機]]、[[富士電機メーター]]、[[北海道計器工業]]、[[東北計器工業]]、[[中部精機]]、[[北陸計器工業]]、[[四国計測工業]]、[[中国計器工業]]、[[埼広エンジニヤリング]]、[[九電テクノシステムズ]]、[[沖縄電機工業]]があり、大崎電気工業はこの業界で1位に位置している。&lt;ref&gt;大崎電気ブランド（あるいは子会社であるエネゲートブランド）として提供しているのは北海道電力、東京電力、北陸電力、四国電力、関西電力、中国電力、九州電力、沖縄電力である。東北電力と中部電力に関しては、東北計器工業および中部精機に対してＯＤＭに近いかたちで設計からサブアセンブリ品の供給までを対応し、各々のブランドにて製品供給が為されており、大崎電気工業は当該２社分も自社のシェアとして換算した上で業界１位との認識を示している。また、大崎電気ブランドにて供給している北海道電力、九州電力、沖縄電力に関しても、北海道計器工業、九電テクノシステムズ、沖縄電機工業に対してＯＤＭに近いかたちでのサブアセンブリ品供給を行い、各ブランドにて製品供給が為されている。&lt;/ref&gt;西澤弘祐の個人会社であった弘業製作所が計器用変成器メーカーの大崎工業を吸収合併して設立した会社である。弘業製作所の名称が「興業」製作所と誤認されやすいことから、吸収合併された大崎工業の名称を引き継ぎ、大崎電気工業とした。なお、当初は大崎電機工業の案もあったが、同名の企業がすでに存在していたため、現社名となった。国内グループ会社9社ならびに海外グループ会社2社を傘下に持つ（連結ベース）。1960年に創設したハンドボール部は[[大崎オーソル大崎OSOL]]の名で知られ、日本代表選手を多く輩出し、[[宮崎大輔]]や[[永島英明]]など著名な選手が現在も所属している（2012年現在）。
京急電機株式会社,1946年に総合設備工事会社としてスタートした。事業としては鉄道部門、電設部門、空調衛生部門、発変電部門の４つとなっている。実績としては、[[京浜急行電鉄]]関連、[[マンション]]・[[ビル]]の空調、[[東京電力]][[変電所]]の整備などがある。
株式会社京セラディスプレイ研究所,*本社所在地：[[滋賀県]][[野洲市]]市三宅656*設立：[[2003年]][[12月25日]]*資本金：1000万円*代表取締役会長：中村昇*代表取締役社長：宮田秀典
株式会社野田スクリーン,1979年（昭和54年）創業。主な事業はスクリーン印刷法を用いた[[プリント基板プリント配線板]]の加工や[[フッ素]][[化学品化成品]]（コーティング剤）の開発・製造・販売を行なっている。2013年（平成25年）には、野田スクリーンの創業者が代表を務める株式会社TNCが行った[[株式公開買付けTOB]]([[マネジメント・バイアウトMBO]])が成立したため&lt;ref&gt;{{Citewebdate2013-02-05urlhttp://ir.104site.net/6790-20130205.pdftitle株式会社ＴＮＣによる当社株式に対する公開買付けの結果並びに親会社、親会社以外の支配株主及び主要株主である筆頭株主の異動に関するお知らせformatPDFpublisher野田スクリーンaccessdate2013-04-24}}&lt;/ref&gt;、[[上場廃止]]した。
NECディスプレイソリューションズ株式会社,2000年1月18日に[[日本電気]]と[[三菱電機]]のディスプレイ部門の[[合弁事業合弁]]により設立され、設立当初の従業員700名については旧[[日本電気ホームエレクトロニクス]]と三菱電機の双方から出向していた&lt;ref&gt;{{CitepressreleasetitleＮＥＣと三菱電機、ディスプレイモニター合弁会社を設立urlhttp://www.nec.co.jp/press/ja/0001/2802.htmlpublisher日本電気株式会社date2000-01-28accessdate2019-02-10}}&lt;/ref&gt;。2005年3月31日をもって三菱電機との合弁を解消するも両社の協力関係は維持されると発表した&lt;ref&gt;{{Citepressreleasetitleディスプレイモニタ合弁事業の発展的解消についてurlhttp://www.nec.co.jp/press/ja/0502/2104.htmlpublisher日本電気株式会社date2005-02-21accessdate2019-02-10}}&lt;/ref&gt;。翌日4月1日付で「NECディスプレイソリューションズ株式会社」へ社名変更した。2007年1月26日、同年4月1日付でのNECグループのプロジェクター製造会社であるNECビューテクノロジーとの合併が発表された&lt;ref&gt;{{Citepressreleasetitle映像表示事業会社の合併についてurlhttp://www.nec.co.jp/press/ja/0701/2603.htmlpublisher日本電気株式会社date2007-01-26accessdate2019-02-10}}&lt;/ref&gt;。登記上はNVTにNDSが吸収される形での合併であり、旧NDSは解散となるが、合併と同時にNVTが以前と同じ「NECディスプレイソリューションズ株式会社」（2代）に社名を変更したため、社名が残ることとなった。
新日本無線株式会社,
株式会社ワコム,[[パーソナルコンピュータパソコン]]の[[周辺機器]]、特に[[ペンタブレット]]・[[CAD]]関連の製品を得意としており、2018年ペンタブレット業界では日本国内で98.8%（[[BCN]]発表データ）を占めるNo.1企業である&lt;ref&gt;{{citeweburlhttps://www.bcnaward.jp/award/section/detail/contents_type249titleペンタブレットBCNAWARD・BCNITジュニア賞publisherBCNaccessdate2019-01-14}}&lt;/ref&gt;。ペンタブレット関係製品で多数の[[特許]]を保有している。また、特許戦略に強みを持ち、一部の特許が期限切れになった際も関連技術の特許を持ち防衛体制の整備につとめている。
川崎マイクロエレクトロニクス株式会社,競技では男子14カ国、女子8カ国が参加して行われた。男子ではシードの6カ国と非シードの8カ国に分け、最初に非シード国が4カ国ごとに2つのグループに分かれ総当りの予選を行った。予選リーグの1位チームのみがシードとの決勝ラウンドに進出し、予選リーグ2位以下はそれぞれ9位決定戦、11位決定戦、13位決定戦に進んだ。決勝ラウンドは4カ国ごとに2つのグループに分かれ総当りの予備選を行い、予備予選の順位に応じて準々決勝へ進んだ。準々決勝以降は[[トーナメント方式]]で行われ、最終順位を決定した。女子では4カ国ごとに2つのグループに分かれ総当りの予選を行った。リーグ戦の上位2チームが準決勝へ進出し、3位以下は5-8位決定戦へ進んだ。準々決勝および5-8位決定戦以降は男子と同じようにトーナメント方式で行われ、最終順位を決定した。
株式会社高岳製作所,[[豊原市]]と[[大泊郡]][[大泊町]]との中間に位置する。村内には[[南樺鉄道]]の始点があり、[[樺太東線]]との乗換駅でもある[[新場駅]]が存在した。[[1945年]]8月の[[ソビエト連邦]]による侵攻・占領後まもなく、村立三の沢[[国民学校]]の[[校長]]がソ連兵に惨殺されると言う事件が発生している。
宮崎エプソン株式会社,山形県南部、[[米沢盆地]]北縁で[[吉野川(山形県)吉野川]]右岸の長岡丘陵上において、孤立丘の丘尾を切断して築造された大型前方後円墳である{{Sfn佐藤鎮雄2004}}。大型古墳としては日本海側内陸部で最北に位置する{{Sfn佐藤鎮雄2004}}&lt;refgroup&quot;注&quot;&gt;前方後円墳（大型古墳に限らない）の日本海側内陸部最北は[[坊主窪古墳群]]（山形県[[東村山郡]][[山辺町]]大寺）の坊主窪1号墳になる。&lt;/ref&gt;。これまでに数次の調査が実施されている。墳形は前方後円形で、前方部を南南西方に向ける&lt;refname&quot;国指定&quot;/&gt;。墳丘は後円部が3段築成、前方部が1段築成で{{Sfn稲荷森古墳（平凡社）1990}}、旧状を良好に遺存する。墳丘長は約96メートルを測り、山形県では最大、[[東北地方]]では第7位の規模になる&lt;refgroup&quot;注&quot;name&quot;規模&quot;/&gt;。墳丘表面で[[葺石]]・[[埴輪]]は検出されていないが、墳丘内部から[[土師器]]が出土している{{Sfn稲荷森古墳（平凡社）1990}}。また周濠も存在していないが、墳丘の周囲一定範囲にテラス帯が認められている{{Sfn佐藤鎮雄2004}}。主体部となる埋葬施設は未確認で明らかでないが、一説には石室を持たない[[木棺]]直葬と推測される&lt;refname&quot;説明板&quot;/&gt;。この稲荷森古墳では、年代観を正確にする埴輪等の資料が出土していないものの、墳形および出土土師器を基に[[4世紀]]末頃（[[古墳時代]]中期初頭）の築造と推定されている{{Sfn佐藤鎮雄2004}}。本古墳の築造以前には[[米沢市]]域・[[川西町(山形県)川西町]]域・南陽市域の3地域で[[前方後方墳]]を主とする古墳（[[天神森古墳]]・宝領塚古墳など）が営まれていたが、稲荷森古墳によってそれら3地域が統合された様相を示すため、稲荷森古墳はそれらを統合した首長（置賜地方の王）により記念碑（象徴）的に築造されたものと考えられている{{Sfn佐藤鎮雄2004}}。しかし稲荷森古墳に続く首長墓はなく、置賜地方の中心地は米沢市域に移ったとされる{{Sfn佐藤鎮雄2004}}。そのほか、稲荷森古墳と大塚山古墳（[[宮城県]][[名取市]]）・念南寺古墳（宮城県[[色麻町]]）・[[堂の森古墳]]（[[福島県]][[浪江町]]）などとの墳形の類似性を指摘する説や、稲荷森古墳の被葬者が[[東北地方]]最大の[[雷神山古墳]]（宮城県名取市）の被葬者と同盟関係にあったとする説もある{{Sfn山形県の歴史1998pp28-29}}。古墳域は[[1980年]]（[[昭和]]55年）に国の[[史跡]]に指定された&lt;refname&quot;国指定&quot;/&gt;。その後現在までに、墳丘を基本的に維持したままで史跡整備がなされている{{Sfn佐藤鎮雄2004}}。
株式会社オーディオテクニカ,[[ブリヂストン美術館]]のスタッフとしてレコードコンサート（所蔵品レコードの鑑賞会）の運営などをしていた松下秀雄&lt;ref&gt;1919年（大正8年）生まれ。1993年からは会長、2013年死去。[http://news.livedoor.com/article/detail/7490918/「訃報オーディオテクニカ創業者の松下秀雄代表取締役相談役が死去」]（LivedoorNEWS2013年3月12日）&lt;/ref&gt;が、[[レコードプレーヤー]]用の自作カートリッジを製作販売するため独立、創業。[[1962年]]（[[昭和]]37年）に資本金100万円で設立。MM型ステレオ・カートリッジ「AT-1」、「AT-3」が最初期の製品である。当初はカートリッジの専業メーカーとして、オーディオマニア向けの自社ブランド製品、[[日本放送協会NHK]]をはじめとした各放送局向けの業務用製品、民生用では国内メーカーのステレオセットやレコードプレーヤーの標準添付品または[[OEM相手先ブランド]]での純正カートリッジの納入まで幅広く手掛ける。[[1967年]]（[[昭和]]42年）には独特な形状のマグネットを内蔵したVM型カートリッジを開発し独自の特許を取得。欧米メーカーが持つMM型カートリッジの高額な特許使用料を回避できる事から、国内メーカーの輸出用セットや一部の海外メーカーにも採用され、自社および相手先ブランドにて製品を輸出する。[[1972年]]（[[昭和]]47年）には、自社ブランド製品の販売会社Audio-TechnicaU.S.Inc.をアメリカに設立するなど業容を拡大。[[1974年]]（[[昭和]]49年）に[[ヘッドフォン]]市場に参入、[[1978年]]（[[昭和]]53年）には[[マイクロフォン]]にも参入した。ピーク時には月産100万個のカートリッジを生産していたが[[1982年]]（[[昭和]]57年）の[[コンパクトディスクCD]]の登場によりカートリッジ製品の市場は縮小、現在の主な一般向け製品はヘッドフォン、マイクロフォン、AVアクセサリーである。[[2012年]]（[[平成]]24年）4月17日に創立50周年を迎えた。[[2016年]]（平成28年）1月に建替中だった新社屋（町田市西成瀬、[[竹中工務店]]施工）が完成した&lt;ref&gt;[http://machida.keizai.biz/headline/2102/「カートリッジみたい？」オーディオテクニカ新本社が完成]町田経済新聞&lt;/ref&gt;。ヘッドフォンは、廉価機から高級機まで幅広いラインナップを展開すると共に、オープンエア構造やウイングサポート構造など音質・装着感を向上させるための機構を積極的に取り入れる進取の姿勢で知られ、[[BCN(企業)BCNランキング]]に基づくヘッドホン販売台数国内第1位を7年連続で獲得&lt;ref&gt;[http://www.audio-technica.co.jp/release/release_detail.php?releaseId148オーディオテクニカニュースリリース]2016年01月29日&lt;/ref&gt;している。マイクロフォンはオリンピックやグラミー賞、サマーソニックなど国内外のイベントで採用実績を持つ。設備音響用のデジタルワイヤレスから手軽な赤外線コードレスまで無線マイクシステムも多数。AVアクセサリー分野では、ヘッドフォンアンプやアクティブスピーカー、創業品目であるカートリッジやフォノイコライザーなどのレコードプレーヤー関連機器、[[無酸素銅]]線材など素材にこだわった接続ケーブル、「クリニカ」の商品名を冠したクリーニングキットなどメンテナンス用品を中心とする。競合するソニーなどと比較すると小規模な会社であるが、全国各地の[[家電量販店]]でヘッドフォンの試聴機やAVアクセサリーの展示を目にすることができる。業務用製品としては[http://www.audio-technica.co.jp/autec/index.html'''AUTEC''']（オーテック）ブランドによる（[[寿司]]シャリ玉、[[海苔巻き]]、[[おにぎり]]等）製造機などの食品加工機器が知られ&lt;ref&gt;{{Citenewstitle【あの有名企業の異分野進出】音響メーカーのオーディオテクニカが『寿司』で成功した理由newspaperリクナビNEXTジャーナルdate2015-01-09author伊藤理子urlhttp://next.rikunabi.com/journal/entry/20150109accessdate2015-05-17}}&lt;/ref&gt;、[[寿司屋]]の愛称で呼ばれる事もある。「テクニクリーン」ブランドの除塵装置など産業用防塵装置も展開する。かつて中心であった光ピックアップなどの半導体レーザー機器は縮小傾向である。[[グッドデザイン賞]]受賞製品を数多く生み出すなど[[プロダクトデザイン]]に長ける一方、製品だけでなく外箱のパッケージデザインの美しさにも長年取り組んでおり[[1980年]]（[[昭和]]55年）に東京アートディレクターズクラブADC賞を受賞している。
キヤノン電子株式会社,ビジネス向けのドキュメントスキャナー、携帯情報端末の開発・生産を行いキヤノンの各国販売会社に卸しているほか、独自事業としてITサービス事業にも注力。自社で[[情報セキュリティ]]分野に取り組むとともに[[キヤノンエスキースシステム]]グループおよび[[キヤノン電子テクノロジー]]グループを傘下に持ち、[[顧客関係管理CRM]]や業種向けSIを手掛けている。会社のオフィスから[[椅子]]をなくし業績を向上させたことでも知られる。これは酒巻久社長&lt;ref&gt;『椅子とパソコンをなくせば会社は伸びる！』（[[祥伝社]]）の著者でもある&lt;/ref&gt;の発案によるもので、生産部門だけでなく管理部門や社長室からも椅子をなくした。酒巻によれば、立つことで社員同士の[[コミュニケーション]]力が高まり、問題解決の速度や精度が劇的に改善したという（ただし、社長室には椅子があるとする社員の証言もある）&lt;refname&quot;ITpro&quot;&gt;[http://itpro.nikkeibp.co.jp/article/OPINION/20090518/330168/ITpro日経BP社「本当に「いす」がなかったキヤノン電子のオフィス2009/05/19」]&lt;/ref&gt;。また工場の廊下に青く塗られたゾーンがあり、「5m3.6秒」よりも遅く歩いているとセンサーが感知し、警報音が鳴る&lt;refname&quot;ITpro&quot;&gt;&lt;/ref&gt;。青いゾーンには「急ごう、さもないと会社も地球も滅びてしまう」という[[スローガン]]が書かれている{{要出典date2018年9月}}。
芝浦メカトロニクス株式会社,[[東芝]]・芝浦製作所・[[徳田製作所]]・東芝精機の4社の合併企業である。設立当初は、重電だったが、芝浦メカトロニクスに改名後、事業基軸を「デジタル時代のインフラプロバイダー」と定め、[[半導体]]・[[薄型テレビFPD]]・[[光ディスク]]など、エレクトロニクスコンポーネンツの製造装置メーカーとなる。液晶製造用洗浄装置やDVD成膜装置・同貼り合わせ装置で世界首位の精密機械メーカーで、半導体製造装置を育成中。
