株式会社ナイキ,[[鳥山石燕]]の『[[今昔画図続百鬼]]』によると、老いたツバキの木に[[精霊]]が宿り、怪木と化して人をたぶらかすとある。こうしたツバキの怪は[[文化(元号)文化]]時代から[[文政]]時代にかけての[[怪談]]流行時において広く知られており、民間伝承が多く残されている&lt;refname&quot;murakami&quot;&gt;{{Citebook和書author[[村上健司]]編著title妖怪事典year2000publisher[[毎日新聞社]]isbn978-4-620-31428-0page300}}&lt;/ref&gt;。現代においても、ツバキは花の落ちる様子が人の死を連想させるため、入院患者への見舞いの花には禁物とされている。このように花につきまとう怪しげなイメージが、妖怪伝承の生まれるもととなったとの説がある。;[[山形県]]の怪談「椿女」&lt;ref&gt;{{Citebook和書author[[山田野理夫]]title東北怪談の旅year1974publisher[[自由国民社]]pages42-43NCIDBA42139725}}&lt;/ref&gt;:[[天明]]時代、山形の城下を2人の商人が歩いていた。町を過ぎて峠道にさしかかった頃、片方の商人のそばにいつしか女が歩いていた。女がその商人に息を吹きかけると、商人の姿が[[ハチ]]に変わってしまった。:女は横道で毒々しく咲いているツバキの木の中へ姿を消すと、商人が変化したハチもそのツバキの花に吸い込まれた。やがて花がポトリと落ちた。もう1人の商人がその花を拾うと、ハチは既に死んでいた。:商人は花を持って寺へ寄り、和尚に事情を話した。和尚が言うには、以前から街道を行く者が姿を消す話があり、その女の仕業に違いないということであった。和尚はハチにされた商人を生き返らせるために一心に経文を唱えたが、生き返ることはなかったため、ハチをツバキの花と一緒に土に埋めたという。;[[秋田県]]の伝承&lt;ref&gt;{{Citebook和書author[[山口敏太郎]]titleとうほく妖怪図鑑year2003publisher[[無明舎出版]]seriesんだんだブックスisbn978-4-89544-344-9page86}}&lt;/ref&gt;:[[にかほ市]][[象潟]]の[[蚶満寺]]の怪異。ある者が深夜に寺付近を歩いていたところ、境内にあるツバキの木が悲しげな声を発し、通日後に寺に不幸があった。以降も同様の怪異が続き、いつしかそのツバキは寺の凶事を告げる「夜泣き椿」と呼ばれた。このツバキは現存しており、樹齢700年におよび、寺の[[蚶満寺#蚶満寺七不思議七不思議]]にも数えられている&lt;ref&gt;{{Citeweburlhttp://www.akitafan.com/promotion/sightseeing/detail.html?id510title蚶満寺work[http://www.akitafan.com/index.htmlあきたファンドットコム]publisher秋田県観光連盟accessdate2014-11-28&lt;!--archiveurlhttp://megalodon.jp/2014-1128-0542-01/www.akitafan.com/promotion/sightseeing/detail.html?id510archivedate2014-11-28--&gt;}}&lt;/ref&gt;。;[[岐阜県]]の伝承&lt;refname&quot;murakami&quot;/&gt;:岐阜県[[不破郡]]青墓村（現・[[大垣市]]）でのこと。同村の[[古墳円墳]]を発掘した際、古い鏡や骨などが発見されたが、発掘者は祟りを受けて死んでしまった。付近の者たちは円墳を元通りにして、その上にツバキを植えた。:以来、夜にその円墳のそばを通ると、ツバキが美女に化けて路傍で光っていると言われ、後にそのツバキは化け椿と呼ばれるようになったという。;[[肥後国]]（現・[[熊本県]]）の妖怪「{{Anchor木心坊}}」:肥後国に伝わる妖怪。ツバキの木を材料にしてすりこぎを作ると、ツバキの木が変化して生まれるといわれる&lt;refname&quot;murakami&quot;/&gt;。
株式会社アムジー,主にキッズゲーム機やメダルゲーム機の開発を行っている。またアミューズメント施設事業も手掛けており、関東でキッズゲームやクレーンゲームに特化した「キッズトレイン」、[[札幌市]]で[[ゲームセンター]]「MAXIMHERO」をそれぞれ展開している。
株式会社エトワール,*[[江戸時代]]-[[明治時代]]、[[美濃国]][[飛騨国]]（[[岐阜県]]）では、地元の人々による芝居が盛んに行なわれており、数多くの芝居小屋が建てられた。この村国座もその一つである。*構造は、2階建ての白壁の[[切妻造]]である。小規模な芝居小屋とはいえ、回り[[舞台]]、仮[[花道]]、[[太夫座]]、[[奈落]]を備えている。桟敷席は1階と2階にある。劇場形式の農村舞台である。*村国神社奉納歌舞伎は、現在、子供歌舞伎として存続している。*村国座は大規模な改修がされておらず、江戸時代〜明治時代の地方の芝居小屋として貴重である事から、重要有形民俗文化財に指定されている。*[[2006年]]（平成18年）より、耐震補強、回り舞台の復元などの大修理が行われ、[[2009年]]（平成21年）3月に竣工する。
アップリカ・チルドレンズプロダクツ合同会社,ナンセンスなストーリー展開と実験的な演出のテレビドラマ。番組内で結成されたグループ、ガールズplus1は、実際に1枚のシングルCDを発売し、レコード店で記念イベントを行った。『[[ギフト(テレビドラマ)ギフト]]』や『[[きらきらひかる(漫画)きらきらひかる]]』で知られるフジテレビプロデューサー[[山口雅俊]]が手掛けた連続テレビドラマ第1作であり、山口の思い入れも強く、自身のプロフィールには必ず記載されている。メインキャストには、[[ルー大柴]]以外、当時無名に近いタレントが起用された。脇役や端役に、[[浅井企画]]や[[大人計画]]の所属俳優が多数出演した。
株式会社タカラトミーアーツ,[[カプセルトイカプセル玩具]]、キャラクター玩具、[[フィギュア]]、[[食玩玩具菓子]]、雑貨等の企画、製造、販売を主な業務とする。カプセル玩具を指す種々の呼び名の一つ・'''ガチャ（Gacha）'''はユージン時代からの[[商標登録商標]]である。[[食玩]]事業は旧[[ナガサキヤ]]の廃業時に前身の1社であるすばる堂が譲渡を受けたものがベースとなっている。[[2012年]]より親会社のタカラトミーから[[コンピュータゲーム]]関連事業が順次、タカラトミーアーツへ移管された他、[[2015年]]4月には[[タカラトミーマーケティング]]からライフ事業、催事菓子事業、特注・OEM事業が移管された。
株式会社ミッチェル,*前作「[[夏を待ちきれなくて]]」に続き[[オリコンチャート]]1位を獲得した楽曲であり、[[日本中央競馬会JRA]]のCMソング。本作はオリジナルアルバム未収録の楽曲である。*売り上げ的にも伸び続けており今作も推計70万枚のセールスの記録。*[[1991年]]からTUBEは5月に迎夏シングル、7月に盛夏シングルをリリースしており、本作は1993年の盛夏シングルである。&lt;ref&gt;「迎夏シングル」及び「盛夏シングル」の呼称は正式名称ではないが、メディアではよく使用される言葉である。&lt;/ref&gt;
東京リスマチック株式会社,印刷物のオフセット製版を目的に1972年に会社設立、その後、[[1986年]]に東京、[[1987年]]に大阪で写研出力業務を開始、[[1992年]]にサービスビューロー事業（顧客からデジタル原稿を預かり一定の加工を施した上、印画紙、フィルムを出力する[[DTP]]出力サービスなど）を開始。他にも[[オンデマンド印刷]]や[[オフセット印刷]]、サインディスプレイといったあらゆるプリント（印刷）を取り扱っている。また、[[2012年]]に高精細の[[3Dプリンタ]]を使用した立体造形出力サービスを開始し、名目上2D、3D問わずあらゆるデータの出力が行えるようになった。[[1998年]]にジャスダック市場へ上場。[[2015年]]1月5日に単独[[株式移転]]により[[持株会社]]'''株式会社日本創発グループ'''を設立し、持株会社体制に移行した&lt;ref&gt;[http://www.lithmatic.co.jp/pdf/news/2014/ir_20140814-04.pdf単独株式移転による純粋持株会社体制への移行について]&lt;/ref&gt;。これに伴い東京リスマチックに代わり、日本創発グループがジャスダック上場企業となった&lt;ref&gt;[http://www.lithmatic.co.jp/pdf/news/2014/ir_20141201-01.pdf株式会社日本創発グループの新規上場承認に関するお知らせ]&lt;/ref&gt;。[[2018年]]、本社を荒川区から港区に移転。日本創発も台東区に移転。
永大産業株式会社,創業者の[[深尾茂]]が[[1946年]]に大阪で、敗戦からの復興を目的として設立された[[合板]]製造業が始まり。[[1950年]]には日本で最初の[[プリント合板]]を製造し、戦災で住宅を失った人々に、新たな住宅を普及させた。このため同社は木材製品に強いことでもその名を知られる。その後[[1960年代]]には事業を拡大、組み立てハウス事業（この分野ではいち早く[[大和ハウス工業]]が足を踏み入れていたため、のちに撤退せざるを得なくなる）や[[モーターボート]]販売などの事業に乗り出す。当時地震に強い住宅「永大ED工法ハウス」を発売してヒット商品となるが、不採算事業を多数抱えていたことや、撤退するタイミングを逃す間に経営状況が悪化、[[1978年]]に[[会社更生法]]を申請、1800億円の負債を抱えて倒産。以後は[[フローリング床材]]や[[システムキッチン]]などの製造・販売を軸に事業を進める。[[1970年代]]には[[TBSテレビTBS]]系の「[[時事放談]]」の番組スポンサーをつとめていたこともある。なお、かつて存在した玩具メーカー「永大（現在は倒産）」とは資本・人材を通じて、関連性は一切ない。2011年12月28日、33年ぶりに東証一部に指定された。
プラチナ萬年筆株式会社,元来、発酵液に漬けて作る臭豆腐は[[湖南省]]の[[郷土料理郷土食]]であったが、近世中国各地に伝播した。中国南部、台湾、香港などの地域では広く食べられているが、独特の臭い[[匂い]]があるため、人によって好みが分かれ地元民であっても食べられない者もいる。台湾では[[外省人]]が戦後広めた&lt;ref&gt;[[1949年]]に湖南省の李名傳が広めたという説がある。&lt;/ref&gt;。元は野菜などと一緒に[[豆腐]]を1週間ほど漬け込んで作っていたが、発酵の制御が難しく今はほとんど行われていない。台湾、香港で市販されているものは[[植物]]の汁と[[石灰]]等を混合し、[[納豆菌]]と[[酪酸酪酸菌]]によって[[発酵]]させた漬け汁に豆腐を一晩程度つけ込んだ物。豆腐自体の発酵はほとんどしていないが、豆腐表面の植物性[[タンパク質]]が、漬け汁の作用で一部[[アミノ酸]]に変化し、独特の風味と強烈な[[匂い]]を発するようになる。豆腐を乾燥保存する過程で発酵を伴う食品は中華文化の影響を受けた諸地域に広くみられるため、臭豆腐はこの系統の食品と考えられる。また、華南には[[なれずし]]を作る文化があったため、その影響も考えられる。
株式会社TMP,[[清教徒革命]]（[[1642年]]-[[1660年]]）と[[排除法危機]]（[[1680年]]前後）の間は、イングランド近世史上の保守反動の時期にあたる。このうち前半がクラレンドン伯を軸とする時期、後半が[[cabalCABAL]]とよばれた5人の政治家による支配の時期である。クレランドン法典は、保守反動前半の象徴的存在である。クラレンドン法典は王政復古後の[[反動]]的な[[イギリスの議会議会]]により制定された[[非国教徒(イギリス)非国教徒]]を抑圧する内容の一連の法令で、当初は[[長老派]]を対象に、後に王権が[[カトリック教会カトリック]]に接近すると、カトリック教徒を対象とした。一連の法令で、イングランド国内には[[ディセンター]]（&quot;''dissenter''&quot;）と呼ばれる異端的な非国教徒が出現することとなった。
前田工繊株式会社,この道路は途中、豊川市内の一部区間が未整備で、豊川市中心部から蒲郡市にこの道で自動車を使用して通り抜けることはできない。未整備区間にも道はあるが、特に御油町側は人が何とか歩ける程度のごく細い未舗装の急な坂道である。但し道路管理者が標識により通行止めとしている。起点の豊川市御油町は、住宅地となっており、多くの家が建ち並んでいる。坂道を上がっていくと、県営都市公園の[[東三河ふるさと公園]]が見えてくる。この道路は東三河ふるさと公園へのアクセス道路にもなっている。ふるさと公園を過ぎると、すぐに通行止めとなる。ここから山を越えた御津町金野地区までは未完成で、整備工事は長い間行われていない。灰野坂（灰野峠）と呼ばれるこの区間には金野側に旧灰野集落の神社や寺があり軽自動車なら峠付近まで通行可能だが、地元住民がまれに通行する程度である。御津町の金野地区では為当町から通じて実質的に一本化している[[愛知県道373号金野豊川線]]と合流する。山の中の道を走り、国坂峠を越える。ここには[[五井山]]への登山口があり、頂上まで車で行くことができる。ここから蒲郡市に入り、坂道を下ってしばらく走ると田畑や民家が見えてくる。国道247号中央バイパスと交差した後、豊岡町内で右に折れて民家や商店が並ぶ道を西へ走り、[[東海道新幹線]]を斜めにくぐると蒲郡市の市街地に入って、国道473号が南北に走る堀込交差点に到着する。ここから先は市道となるが、蒲郡市街地の北方を直進のみで[[愛知県道323号芦谷蒲郡線]]交点に達することができる。
宝印刷株式会社,*会場・新潟市東区新松崎1丁目2番6号（[[ジャスコ]]新潟東店近く）*営業時間・午前10時から午後6時まで
キコエ補聴器株式会社,明治4年7月（[[1871年]]8月）に[[廃藩置県]]により旧[[豊岡藩]]が[[豊岡県]]となったときに開設された医局を基とする。[[がん診療連携拠点病院]]、[[救命救急センター]]、[[周産期母子医療センター]]設置病院、[[エイズ治療拠点病院]]、[[医師]]の卒後[[臨床研修指定病院]]、[[兵庫県災害拠点病院]]でもある。新豊岡県医局、兵庫県病院、但馬の国8郡立豊岡病院、2郡（[[城崎郡城崎]]・[[美方郡美方]]）立豊岡病院、公立豊岡病院を経て公立豊岡病院組合立豊岡病院となる。正式略称は「公立豊岡病院」、その他の略称は「豊岡病院」、「豊病」（とよびょう）。[[2010年]]（[[平成]]22年）4月17日から[[ドクターヘリ]]の運用を開始した。現在は[[関西広域連合]]が運行をしている。豊岡病院のドクターヘリは2010年の運航開始以降から日本一の出動回数を誇る。
ムラテックKDS株式会社,例年6月に開催されていたベルリン国際映画祭であったが、1978年から2月に開催されることになった。また、青少年のための部門&quot;CinemaforPeopleSixandup&quot;が新たに設立された。
株式会社ハタケヤマ,鉾田市から鹿嶋市を結ぶ道路としては、[[鹿島灘]]海岸沿いを通る[[国道51号]]と[[北浦]]湖岸沿いを通る[[茨城県道18号茨城鹿島線]]に挟まれた中間位置にある[[一般県道]]で、それぞれのパイパス機能も果たす道路でもある。
株式会社フード・プラネット,[[持株会社]]として、傘下に株式会社チキン・プラネットやセルフサービス型ソフトクリームショップなど飲食事業部門の会社を持っていた。[[CD-ROM]]不正コピー防止技術の商品化から音楽レーベルなどへ事業領域を拡大し、2006年の持株会社制移行後は[[沖縄]]関連事業も展開していた。
三省堂印刷株式会社,三省堂の印刷所を引き継ぎ、辞書の製造を中心として事業を展開。実際、当初から、辞書の組版、印刷、製本の一貫生産をおこなう。近年は並製本の製本もおこなうようになったため、一部の一般書も一貫生産が可能となっている。印刷・製本業界は分業体制が確立されており、このような一貫生産は珍しい。また、社外からの受注もおこなっており、[[日本聖書協会]]の発行する[[聖書]]の印刷のほとんどと製本の一部を受注している。そのほか、学習参考書や、[[秋田書店]]のマンガ雑誌、大学や自治体からの受注もある。また、[[三省堂書店]]の子会社である創英社（直接の資本関係はない）からの受注もある。近年の[[オフセット]]輪転機は高性能になり、技術者の運用次第で辞書や聖書で用いられる薄い[[インディア紙]]にも印刷できるため、ほとんど万能といえるのだが、製本設備はそうもいかないため、それぞれ別の設備が必要となる。だが、本来、得意としている上製本で作られる書籍は限られており、社外からのそれの受注は聖書と一部の他社辞書などに限られている。逆にいえば、辞書や聖書のような上製本が製本できる製本所はそう多くない。なお、[[大辞林]]の物理的な厚みは、製本設備の上限に達しているため、単純にページ数を増やすことはできない。そのため、二版の机上版から二分冊とせざるを得なくなっている。上製本の製本設備は限られていることから、[[広辞苑]]も同じジレンマに陥っており、大辞林の後を追うように六版の机上版を二分冊とした。
福島印刷株式会社,IBA指定の基準は以下の通り。#世界的な絶滅危惧種の生息地#世界規模で生息地が限定している固有種の生息地#大規模な野鳥の生息地もしくは渡り鳥の中継地・越冬地、また世界的重要な森林
SANEI株式会社,家庭用を中心とした水栓を中心に水周り製品の企画から販売までを行う。その他[[シャワー]]のヘッドや[[便所トイレ]]用[[温水洗浄便座]]や、[[造園ガーデニング]]用[[散水ノズル]]なども製造している。同社の製品である「Kiwitap」は[[2007年]]グッドデザイン賞を受賞している。また日本国内及び国外の[[バー(酒場)バー]]や[[レストラン]]の店内の内装を手掛けていることで知られる[[森田恭通]]とのコラボレーション製品も存在する。
株式会社イワコー,[[2006年]][[3月15日]]に発売された。作詞は渡辺愛未、作曲は出羽良彰、編曲は出羽良彰・[[渡辺善太郎]]。[[SISTUSRECORDS]]所属第2弾アーティストの樹海にとってデビューシングルとなる作品。初回プレス盤にはアニメ『[[Fate/staynight(アニメ)Fate/staynight]]』キャラクターカードが封入されている。
株式会社デビカ,*[[2000年]]-設立。*[[2002年]]-東京支店/物流センター移転。*[[2010年]]-東京支店/商品企画室を東京都墨田区に移転。小学生向けを中心とした文具・クラフト用品の「debika(デビカ)」と、主に家庭用品・事務用品の「axis(アクシス)」の２ブランドを持つ。
林ベニヤ産業株式会社,南洋材丸太の入手難からいち早く北洋材針葉樹合板への移行を果たした。さらに、当初、[[2009年]][[1月]]とされていた(1年延期となった)北洋材丸太の輸出[[関税]]の税率アップ(税率が25％から80％となり事実上の丸太の輸出禁止)に向けて、国産材丸太の利用も手がけ、国産材利用を進める[[林野庁]]の補助金も利用して国産材に対応した施設導入も行っている。;工場*舞鶴工場-[[京都府]][[舞鶴市]]*七尾工場-[[石川県]][[七尾市]]{{節stub}}
株式会社ウェーブ,[[プラモデル]]、[[ガレージキット]]、[[フィギュア]]の製造、卸売、小売販売会社。そのほか[[エアブラシ]]、[[レジンキャスト]]、[[シリコーンゴム]]などといった工具や造形材料の製造販売も行っている。「WAVE」と表記されることも多い&lt;ref&gt;旧ロゴは「WaVE」という小文字とも大文字とも付かないデザインで、現ロゴは「wave」と小文字表記になっているが、そういった事情とは無関係にこう呼ばれる。&lt;/ref&gt;。ガレージキットメーカとして初のインジェクションキット（いわゆる普通のプラモデル）の製造を行っている。完成品キャラクターフィギュアとして「トレジャーフィギュアシリーズ」と「TFCBEACHQUEENSシリーズ」の2種類を展開しており、方針として[[コレクション]]に適したサイズ（主に1/10サイズ）と価格（主に4000円前後）で提供している。特に、「TFCBEACHQUEENSシリーズ」は水着の美少女フィギュアに特化したシリーズで、ヒロインの水着姿が登場した作品（『[[けいおん!]]』など）はもちろん、水着とは全く縁がない作品（『[[魔法少女まどか☆マギカ]]』など）まで製作されている。
ハンマーキャスター株式会社,運搬用カートから、家具、電気機器、事務機器など多岐にわたるキャスターの製造販売を手掛ける。知名度はさして高くはないものの、シェアは抜群の高さを誇る。これまで[[鋳物]]により製造されて来たキャスターを、現在は、耐久性や環境に対する配慮や[[ナイロン]]、[[フェノール]]製のモノに替え始めている。元々は建築に関連した金物製造業から事業が始まるも、のちに運搬用カートの製造を切っ掛けにキャスターの製造へと移行しており、この他、目を離したすきにカートが動かないように、フットペダルで固定するハンマーロックも同社が開発した製品として知られている。
FDKトワイセル株式会社,国内唯一となる民生用ニッケル水素電池の生産拠点&lt;ref&gt;{{CitewebtitleＦＤＫトワイセル会社概要publisherFDKトワイセルurlhttp://www.fdk-twicell.com/company/infomation/infomation.htmlaccessdate2011-10-08}}&lt;/ref&gt;。[[パナソニック]]による[[三洋電機]]の子会社化に際して、両社が[[二次電池]]において高いシェアを占めることから[[独占禁止法独占禁止（反トラスト）法]]上の手続が長期化したことにより、関係当局からの承認を得るための手続きとして、三洋電機からFDKへのニッケル水素電池部門の一部売却が行われた。三洋電機の家庭用ニッケル水素蓄電池「[[eneloop]]」の製造元であったが、売却後も引き続きFDKトワイセルが製造を行い、三洋電機のブランドとして販売されている（[[2013年]][[4月26日]]以降は、Panasonicブランドに変更、販売元もパナソニックに変更されたが、製造は引き続きFDKトワイセルが担当。なお[[富士通]]ブランドでも2012年から「富士通充電池」として発売されている）。
岡屋株式会社,&lt;!--英語版にも出典なき翻訳文章多くの場合ビール・ゴーグル効果は性的行為が終わった後で性的接触を後悔する場合に、ビール・ゴーグル効果が容認出来ないスキャンダル、またはあまり親しくない相手に対する性的行為の結果の見通しを酔いが醒めるまでの間低下させたと考えられる。これと同様に、ビール・ゴーグル効果には普段はつまらないと感じる事象が非常に楽しく見えるか、多少魅力的に映る効果も含まれる。{{要出典date2008年7月1日}}
