株式会社コトブキ,1942年、[[10.5cmleFH1810.5cm軽野戦榴弾砲]]を搭載・運搬や射撃が可能な歩兵支援用の兵器として、兵器局第6課によってヴァッフェントレーガーの開発が命ぜられた。これにより'''[[ホイシュレッケ]]'''や'''[[IV号b型自走榴弾砲]]'''が計画されたが、仕様要求が複雑化して開発が難航していた。このため新たに兵器局第4課による、対戦車戦闘向けに要求を絞ったヴァッフェントレーガーが開発されることとなった。ホイシュレッケなど以前の武器運搬車では、砲を地上に降ろして使えるようにすることも要求されており、ドイツ軍の開発・使用した他のオープントップ式対戦車自走砲が「自走砲架(Selbstfahrlafette)」や「自走砲({{langdeGeschtzwagen}})」、「戦車駆逐車({{langdePanzerjger}})」といった種別名であるのに対し、「武器運搬車({{langdeWaffentrger}})」との種別名が与えられたものであった。しかし本車では要求が変更され、車上射撃が前提&lt;ref&gt;シュタイアー社による試作車では、砲塔バスケットと支持架が頑丈に作られており、そのまま地上に降ろしての使用も可能だった。&lt;/ref&gt;となっており、単純に機動力の無いPaK43を簡易自走砲化したものとなっている。兵器局第4課より要求された仕様は以下の通りである。*武装：8.8cmPaK43対戦車砲、360度全周囲射撃が可能*砲弾：即応弾6発と車内に24発を搭載*乗員：4名、操縦、砲手、装填手2名*エンジン：[[MTUフリードリヒスハーフェンマイバッハ]]社の100馬力エンジン*最高速度：時速25キロ*装甲：20ミリから10ミリ*重量：11.2トンこれに対し、シュタイアー／クルップ社共同による試作車と、アルデルト社とラインメタル社共同による試作車が完成した。これらはどちらもオープントップの砲塔に[[8.8cmPaK43]]対戦車砲を搭載していたが、前者は試験でいくつもの問題点が指摘され、後者は完成度は高いものの、コストや製造にかかる日数という点で問題があった。そこで今度はアルデルト社とラインメタル社が共同でより簡易な試作車を開発、シュタイアー＋クルップ案よりも高い開発優先度が与えられ、“Geschtzwagen638/18SFPAK.43ArdeltWaffentrger”として量産化されることとなった。量産型に選定されたArdeltWaffentrgerは、コストと製造工程の削減のために足回りは[[軽駆逐戦車ヘッツァーヘッツァー]]から部品が流用された大型転綸とリーフスプリング式サスペンションの組み合わせとされたが、ヘッツァーのものと比べると、転綸の外周にゴム製のリムが付いていないという差異がある。開発したのはアルデルト社の社長であるギュンター・アルデルト（GuntherArdelt）博士で、この“ヴァッフェントレーガー（アルデルト型）”は100輌が発注されていたが、全て完成できるような状況ではなく、実際の生産数は不明であるが、完成したのは10輌程度ではないかと思われる。アルデルト博士は[[ドイツ国防軍]]に[[中尉]]に任命され、[[1945年]]2月に完成していた7輌のヴァッフェントレーガーを率い、アルデルト社の社員と共に[[ブランデンブルク]]市のエダースヴァルデ地区で[[赤軍ソビエト軍]]との戦闘に参加して戦死したと言われている。この時の一台が[[ソビエト連邦ソビエト]]に鹵獲されて[[クビンカ戦車博物館]]に展示されている。他にも3輌が納入され[[ベルリン]]防衛部隊で使用されていたと言われており、その時のものと思われる写真が残っている。設計者のアルデルト博士、そしてアルデルト社自体も第二次世界大戦末期に社長以下主な社員が戦死したために消滅してしまい、その後、活動拠点であった[[ブランデンブルク]]州が[[ドイツ民主共和国東ドイツ]]であったことからも現存する資料は少ない。そのため、現存する資料のほとんどはクビンカ軍事博物館に依存している。{{-}}
デ・ラ・ルー公開有限会社,*GOINGSTEADYの4枚目シングルである。*それぞれ新曲を1曲ずつとお互いの曲をカバ-している。*4曲目の駆け抜けて性春は後に青春時代でライブバージョンで収録されている。
As-meエステール株式会社,{{節スタブ}}町村が行政サービスや財政の状況、経済効果などを勘案して、他の市町村との合併を選択せず、単独で市への移行を検討・実施する場合のことをいう。特に1970年の前半は単独市制した自治体が多かった。日本で単独市制施行をする要件は[[地方自治法]]第8条第1項で5万人以上と決まっており、{{要出典範囲世界の中では破格に高い基準であるdate2017-12-26}}。単独市制のメリットとして、首長の交代を伴わないことが挙げられる。新設合併で市制する場合は合併時に市長職務執行者を置き、その後の選挙で市長を選出することがほとんどである。ただし、合併せずして[[郡郡部]]の単独町村による市制の施行は中々容易ではなく、更に近年では[[ドーナツ化現象]]や[[高齢化社会]]等による多様な問題に対応しきれていない自治体も多く、特に[[北海道]]・[[高知県]]&lt;ref&gt;特に[[室戸市]]・[[土佐清水市]]の両市は人口の漸減が激しい。&lt;/ref&gt;などのいくつかの道県では人口低下が著しい地域もある。
川上産業株式会社,1968年（昭和43年）創業&lt;refname&quot;沿革&quot;/&gt;。[[気泡緩衝材]]（通称「'''プチプチ'''」&lt;ref&gt;プチプチは同社の[[登録商標]]（登録番号第2622392号）&lt;/ref&gt;）や気泡ボード、その他梱包資材の製造・販売を行っており、この分野では国内最大手である&lt;refname&quot;概要&quot;/&gt;。近年では梱包以外の用途に使用できる製品の開発も行っており、玩具メーカーの[[バンダイ]]の開発に協力した「[[∞にできるシリーズ#∞プチプチ∞プチプチ]]」&lt;ref&gt;{{citeweburlhttp://www.bandai.co.jp/releases/J2007062201.htmltitle〜何回つぶしてもなくならない！？無限につぶせる「プチプチ」が登場！〜『∞プチプチ』９月下旬発売date2007-06-22accessdate2018-12-03workバンダイ}}&lt;/ref&gt;、{{要出典範囲date2018年12月03日[[暇潰し暇つぶし]]用の「プッチンスカット」や[[iPod]]ケースやペンケースなどのプチグッズ、などが発売されている。}}
株式会社ヤサカ,モーツァルトはオルガン曲も作曲しているが、そのほとんどが自動オルガンのための作品である。この小さい自動オルガンのための幻想曲（アレグロとアンダンテ）は、[[1791年]]の[[3月3日]]に[[ウィーン]]で作曲され、作品の注文主は美術収集家のヨーゼフ・ダイム伯爵（ミュラーとも呼ばれている）という人物で、伯爵は蝋人形館を開いて機械仕掛けの楽器のコレクションを展示し、楽器の自動演奏を聴かせていたという。4声のために書かれたこの作品は、現在でも演奏されることが多く、のちにモーツァルトによって[[連弾4手ピアノ]]用に編曲された形で楽譜が出版された。また、オリジナルの楽器は現在行方不明となっているが、[[1991年]]に[[ベルリン]]の音楽家の手によって復元された。
菊水化学工業株式会社,セーヴルバビロヌ駅は、[[パリ]]の[[地下鉄]][[メトロ(パリ)メトロ]]の駅。[[パリメトロ10号線10号線]]と[[パリメトロ12号線12号線]]が利用可能である。パリ中央部のやや南寄り、[[6区(パリ)6区]]と[[7区(パリ)7区]]の境にあり、[[ラスパイユ大通り]]、[[セーヴル通り]]及び[[バビロヌ通り]]が交わる[[ル・コルビュジエ広場]]に位置している。[[1910年]][[11月5日]]、12号線の駅として開業した。駅名は、付近のセーヴル通りとバビロヌ通りにちなんで名付けられた。
松勘工業株式会社,[[1907年]]（明治40年）3月、創業者の松本勘四郎は埼玉県北部が武州織物の原料となる[[木綿]]の産地であることに着目して「松勘武道具」を設立し、[[剣道]]具や[[柔道]]衣などの製造を開始した&lt;refname&quot;剣日200704&quot;/&gt;&lt;refname&quot;創業&quot;&gt;{{Citeweburlhttp://www.matsukan.jp/history/index.htmltitle創業明治40年publisher松勘工業株式会社accessdate2015年10月10日}}&lt;/ref&gt;&lt;refname&quot;市報かぞ&quot;&gt;{{Citeweburlhttp://www.city.kazo.lg.jp/ct/other000007900/2010051520.pdftitle市報かぞ平成22年5月15日号publisher[[加須市]]formatPDFaccessdate2015年10月11日}}&lt;/ref&gt;。[[1945年]]（昭和20年）、[[太平洋戦争]]の終結後に日本に進駐した[[連合国軍最高司令官総司令部連合軍総司令部]]の指示により剣道を始めとした武道が禁止されると、皮革加工の技術を応用し[[野球]]用の硬式ボール「パイン」の製造を開始した&lt;refname&quot;剣日200704&quot;/&gt;&lt;refname&quot;パイン&quot;&gt;{{Citeweburlhttp://www.matsukan.jp/goods/ball/index.htmltitleパイン硬式ボールpublisher松勘工業株式会社accessdate2015年10月10日}}&lt;/ref&gt;。[[1950年]]（昭和25年）1月に「松勘工業株式会社」へ改組すると、[[1955年]]（昭和30年）5月には[[アメリカ合衆国アメリカ]]向けの[[グラブ(野球)グラブ]]や[[ミット]]の輸出を開始した&lt;refname&quot;創業&quot;/&gt;。武道の禁止措置が解除されると、[[防衛省防衛庁]]や[[警察]]機関に[[銃剣術]]用の防具を納入&lt;refname&quot;創業&quot;/&gt;。さらに販路を国外にも広げ、[[1968年]]（昭和43年）には[[ヨーロッパ柔道連盟]]より指定柔道衣メーカーに選ばれ&lt;refname&quot;創業&quot;/&gt;、[[オランダ]]の[[アントン・ヘーシンク]]の柔道着を手掛けると&lt;refname&quot;剣日200704&quot;/&gt;、[[1974年]]（昭和43年）には西ドイツ柔道連盟より公認推薦メーカーに選ばれた&lt;refname&quot;創業&quot;/&gt;。創業以来、剣道や[[なぎなた]]で使用する[[防具(剣道)防具]]を中心に、剣道衣・袴ほか柔道衣や畳など各種武道用品の製造を続けている&lt;refname&quot;剣日200704&quot;/&gt;。剣道具に関しては加須周辺が剣道の盛んな土地柄だったこともあり順調に生産量を伸ばし&lt;refname&quot;市報かぞ&quot;/&gt;、耐久性に定評があったが&lt;refname&quot;剣日200704&quot;/&gt;、[[2007年]]（平成19年）に創業100周年を迎えるにあたり、競技者のニーズに合わせ柔らかさや使いやすさといった実用性を意識した防具の開発、防具特有の匂い対策のため吸汗性や速乾性に優れた素材の導入などが行われている&lt;refname&quot;剣日200704&quot;/&gt;。野球用品に関しては[[2015年]]（平成27年）の時点ではグラブやミットの取り扱いを行っていないが&lt;ref&gt;{{Citeweburlhttp://www.matsukan.jp/goods/index.htmltitle取り扱い商品publisher松勘工業株式会社accessdate2015年10月10日}}&lt;/ref&gt;、硬式ボールは[[日本の高校野球高校野球]]や[[都市対抗野球大会都市対抗野球]]の公式球として使用されている&lt;refname&quot;剣日200704&quot;/&gt;&lt;refname&quot;パイン&quot;/&gt;。また、[[2010年]]（平成22年）以前は[[日本プロ野球]](NPB)の公式球製造メーカーの一つとなっていた&lt;ref&gt;{{Citeweburlhttp://www.excite.co.jp/News/reviewmov/20130612/E1370980465196.htmltitle球界大揺れ、統一球問題を徹底解説publisherエキサイトレビューdate2013年6月12日accessdate2015年10月11日}}&lt;/ref&gt;。
株式会社シーエムズコーポレーション,かつてユージン（現：[[タカラトミーアーツ]]）の社員であった宮崎隆博と関連会社代表であった中鉢秀樹が立ち上げる。2009年8月に中鉢が急逝し、同年10月宮崎は退職。社長は宮崎の妻の和子が継いだ。[[サンライズ(アニメ制作会社)サンライズ]]や[[東映アニメーション]]など、キャラクター商品を企画・発売していた。&lt;br&gt;代表商品は「グッとくるフィギュアコレクション」や「BRAVE合金」。&lt;br&gt;資金繰りの逼迫から4億円の負債を抱え、2014年3月3日、東京地裁へ自己破産を申請した&lt;ref&gt;[http://newsbiz.yahoo.co.jp/detail?a20140306-00010001-teikokudb-nb『YAHOOニュースBUSINESS』]2014年3月6日閲覧&lt;/ref&gt;。
ハーティング株式会社,*産業に特化した製品として戦後早くから標準規格に準拠した製品を多く製造。ファミリー企業であることから製品ラインの中止が突然発生することなく、製品寿命の長い生産体制を整えている。**社名：ハーティング株式会社/HARTINGK.K.**所在地：[[神奈川県]][[横浜市]][[港北区]][[新横浜]]1-7-9友泉新横浜一丁目ビル2F**設立：[[1985年]][[12月4日]]**代表者：代表取締役：フィリップハルティング
榮製機株式会社,
キヤノンプリントスクエア株式会社,本作は[[ファイナルファンタジーシリーズ]]（以下、FFシリーズ）の外伝的位置付けで、「古き良き時代のRPGを最新技術で創り出す」ことをコンセプトに開発されている。「ファイナルファンタジー外伝」の名が付けられたゲームソフトとしては、1991年の[[ゲームボーイ]]用ソフト『[[聖剣伝説〜ファイナルファンタジー外伝〜]]』以来となる。要素としてはFFシリーズだけではなく、昼夜の移り変わりの概念や仲間を引き連れて歩くなど、同社の[[ドラゴンクエストシリーズ]]の要素が受け継がれている部分もある。
株式会社オーワ,'オムニバス全体については[[ベトナムから遠く離れて]]を参照。''本作は、ドキュメンタリー映画作家の[[クリス・マルケル]]とゴダールの密接な関係から生まれた。本作のあとのマルケルとゴダールは、「[[メドヴドキン集団]]」（1967年-1973年）の設立と活動、1968年2月の「[[シネマテーク擁護委員会]]」の結成、短編映画シリーズ『[[シネトラクト]]』（1968年5月-6月）の製作・普及と行動をともにする。ゴダールは、本作に出演し、ヴェトナムに行けなかったこと、そのことでアイデアを捨てざるをえなかったことをミッチェル撮影機を覗きながら語り、ヴェトナムを侵略するのを止め、逆にわれわれをヴェトナムに侵略させるべきだと語る&lt;refname&quot;キネマ&quot;&gt;[[キネマ旬報キネマ旬報DB]]サイト内の「[http://www.kinejun.jp/cinema/id/13912ベトナムから遠く離れて]」の項の記述を参照。&lt;/ref&gt;。[[対称性]]を欠いた戦争に対して、対称性の回復を訴えるこのゴダールの考え方は、[[パレスチナ]]と[[パリ]]をひたすら並列する『[[ヒア&amp;ゼアこことよそ]]』（1974年-1976年）、[[サラエヴォ]]でまさに[[非対称戦争]]を「[[クロスカッティング切り返しのショット]]」で捉えなおそうと語る『[[アワーミュージック]]』（2004年）まで一貫している。撮影の[[アラン・ルヴァン]]は、ゴダールが出演している[[アニエス・ヴァルダ]]監督の『[[5時から7時までのクレオ]]』や[[ジャンダニエル・ポレ]]作品のカメラマンであり、もうひとりのカメラマンの[[アルマン・マルコ]]は本作の翌年の1968年、ゴダールと[[ジャンピエール・ゴラン]]、[[アンヌ・ヴィアゼムスキー]]らによる「[[ジガ・ヴェルトフ集団]]」の結成に参加していく。本作を織り込んだ『ベトナムから遠く離れて』は、[[1967年]]夏には完成し、同年[[8月27日]]&lt;refname&quot;MacCabe&quot;/&gt;、[[カナダ]]の[[モントリオール]]で開かれた[[モントリオール世界映画祭]]でプレミア上映され、反響を呼んだ&lt;refname&quot;キネマ&quot;/&gt;。
竹野株式会社,[[インテリア]]用の壁紙を中心に、[[アルバム]]や台紙、その他[[ホルダー]]や[[手帳]]、[[見本帳]]、[[証書]]入れなどの[[事務用品]]や[[ノベルティ]]などを製造している。主に紙に類する製品や、紙の応用による製品の取り扱いが多く、またオフィス向けの事務製品も多数を占めている。近年では、紙類製品の製造販売の他、業務用の大型[[シュレッダー]]や飲料容器処理機（[[ペットボトル]]、缶、紙容器いずれも）などの業務用機器の開発に加え、同社が特許を取得し、[[漆喰]]のひび割れを抑止させ質感を保持しつつ、多目的汎用シートとしての役割を持つ「イーシックイ」などのアイデア製品などの販売も多い。
青山ハープ株式会社,[[狩野英孝]]が王道を極めたキングを目指すという設定の下、毎回お題として出される[[ことわざ]]を狩野流に解釈し、それらを[[コント]]で表現していた。狩野以外にも、毎回アシスタント的な役割の女性2人が出演していた。放送当時は狩野唯一の[[冠番組]]で、狩野は当時[[キング観光]]のイメージキャラクターを務めていたことから主演に起用された。番組タイトルはキング観光に因んでおり、タイトルロゴの中に同チェーン店のロゴの一部が使われていた。
河本産業株式会社,業務用防塵マスク販売会社であったが、[[2000年代]]に入ってから元[[ヒューマン(ゲーム会社)ヒューマン]]の戸川浩明が同社を買い取り、ゲームソフトウェア開発主体に事業転換した&lt;ref&gt;{{Citejournal和書year2009month8title『風雲!大籠城』開発者インタビューjournalゲームサイドvolume6issue4pages56publisherマイクロマガジン社accessdate2009-11-04}}&lt;/ref&gt;。[[コンシューマーゲーム]]版[[恋愛ゲーム(ゲームジャンル)恋愛アドベンチャーゲーム]]等の開発下請けを経て、[[2009年]]にゲームブランド・'''nn.system'''（エヌエヌドットシステム）を立ち上げ、パブリッシャー（販売）にも進出した。子会社として[[クロン]]を設立、2013年時点ではフラッシュ暗算や[[タワーディフェンス]]のソフトもクロンに移行している。
クレトイシ株式会社,仙台市宮城野区東仙台に所在した[[日本たばこ産業]]仙台工場とJT球場（後の[[東仙台球場]]）の跡地を[[大和ハウス工業]]が[[競争入札]]によって落札。同社が総事業費約95億円を投じ&lt;refnameyomiuri/&gt;、整備した商業区画である[[フォレオせんだい宮の杜]]、住宅区画であるブルームスクエアせんだい宮の杜、マンション区画のプレミストせんだい宮の杜からなる複合団地である。当初、JTは当地に[[イトーヨーカドー]]を核とした[[アリオ]]形式によって東北最大級の大型[[ショッピングセンター]]の建設を検討していた。しかし、[[イオン仙台幸町ショッピングセンター]]が近隣にあるため商圏で衝突すること、また従来からの住宅地が近接しているため、交通渋滞の頻発が予想された。このため、仙台市が敷地の[[用途変更]]を拒否し、[[梅原克彦]]市長も「住宅主体の土地利用が望ましい」と求めたこともあって、JTはSC建設を断念した経緯がある&lt;ref&gt;「住宅1000戸開発へ大和ハウスJT仙台工場跡を落札東北最大規模に」『朝日新聞』宮城版2007年8月24日&lt;/ref&gt;。その後計画変更され、大和ハウス工業が複合団地造営の方向で土地を落札し、現在の形で造成された。フォレオせんだい宮の杜は、[[2009年]]11月20日に完全開業した。また同日には住宅分譲も開始し、入居は街開きとなる翌年から順次始まった。また不況によってマンションの着工は見合わせていたが&lt;refnameyomiuri&gt;「仙台のJT工場跡に複合施設大和ハウス商業施設と戸建て整備」『読売新聞』宮城版2009年6月19日&lt;/ref&gt;、[[2012年]]3月、1棟目のプレミストせんだい宮の杜が完成し、翌年3月、2棟目のプレミストせんだい宮の杜FORESTIAGEが完成している。
株式会社シナノ,[[承久の乱]]で名を馳せた[[山田重忠]]の息子である[[山田重継]]が築城した。山田重継は父と同様に[[京都]]の[[嵯峨野]]で戦死した。
有限会社キュー・ゲームス,元[[アルゴノートゲームス]]社員であり、[[スターフォックス]]および[[スターフォックス2]]、[[X(ゲーム)X]]、[[サルゲッチュピポサル2001]]などのプログラマだった[[ディラン・カスバート]]らによって設立。ディランは、アルゴノートと任天堂との契約により、17歳から任天堂で働くことになった。その経緯から、キュー・ゲームスは[[任天堂]]および[[ソニー・コンピュータエンタテインメント]]のゲームやシステム開発（[[PlayStation3]]の起動画面のグラフィック等）に携わっている&lt;ref&gt;{{citeweburlhttp://www.accumu.jp/back_numbers/vol16/Q-GAMES%E3%80%80%E3%82%AD%E3%83%A5%E3%83%BC%E3%82%B2%E3%83%BC%E3%83%A0%E3%82%B9%EF%BC%8D%E4%BC%9A%E7%A4%BE%E7%B4%B9%E4%BB%8B.htmltitleAccumuVol.16Q-GAMESキューゲームス−会社紹介workAccumupublisher京都コンピュータ学院accessdate2014-09-03}}&lt;/ref&gt;。
有限会社津久井火工,主演の[[前田敦子]]をはじめとする[[AKB48]]のメンバー、さらに姉妹グループの[[SKE48]]や[[SDN48]]のメンバーも多く出演する、多人数のドラマ。企画・原作を201務めた総合プロデューサー・[[秋元康]]は「AKB48をアイドルっぽく見せないドラマを作りたい、そしてこの人数の多さと各メンバーの個性を生かしたい。そう思ってこのドラマを企画しました」と語っていた。出演メンバーの多くにとって本作がドラマ初出演となったため、開始時にピンポーンという効果音とともに「'''このドラマは、学芸会の延長であり、登場人物の一部に、お見苦しい（?）演技がございますが、温かく見守ってご覧いただければ幸いです'''」といった断り文や、予告編では「'''大根役者勢揃い、成長中'''」のテロップが挿入されていた。最終話では、「'''御礼学芸会の延長みたいなドラマにお付き合い頂き、ありがとうございます。おかげさまで彼女たちの演技がほんの少し成長できたと思います。最後にもう少しお付き合いください'''」、「'''大根役者、卒業'''」に変更された。個々のメンバーがピンで活躍しているため、オンエア上は数分のシーンでも出演者同士のスケジュールを抑えるのが非常に大変だったという。また、出演者は皆アクションシーンを相当本気で挑んだため、拳や蹴りが思い切り当たり、病院に何度も運ばれたメンバーもいた&lt;ref&gt;[[QuickJapan]]vol.89秋元康インタビューより&lt;/ref&gt;。特徴として、出演者のグループ内での現実の立場（実際の劇場やコンサートなどでのステージ上のポジショニングや個々のキャラクター）&lt;ref&gt;[http://news24.jp/entertainment/news/1636619.html「マジすか学園4」1月から日テレで放送]（日テレNEWS242014年11月26日11月27日閲覧）&lt;/ref&gt;やエピソードを匂わせる[[メタフィクション]]的な台詞がたびたび登場し、AKB48のファンでなければわからないような内容のものも多い。その傾向は続編『[[マジすか学園2]]』で一層顕著となり、チーム内で伸び悩んでいる状況をシニカルに揶揄されたり（内田眞由美）、スキャンダル等を自虐的に表現する台詞（菊地あやか）が非常に目立つようになった。また、AKBについても「'''握手会のないAKB'''」「'''バカ受けする[[高橋みなみたかみな]]'''」などの自虐的な台詞がある。
