高島屋クレジット株式会社,高島屋企業グループの業容拡大への貢献を目的に、クレジット業務を分業させる形で発足。当初は百貨店本体発行であった[[ハウスカード]]の事務代行から始まり、既存クレジットカード会社（[[ジェーシービー]]及び[[三井住友カード住友クレジットサービス]]）との提携カードを手掛ける。1990年代に入ってからは独立したカード会社として再スタートを切り、加盟店開放形式で国際ブランドを付帯した「タカシマヤカード」の自社発行を開始した。[[2004年]][[4月]]に高島屋とクレディセゾン（以下、セゾン）間で戦略的提携が締結され、高島屋クレジットにセゾンが資本参加する。また、同年の新規募集分より与信・請求・カード発行業務をセゾン（プロセシングは[[キュービタス]]）への[[アウトソーシング業務委託]]に移行し、セゾンの国際ブランド発行権を使用した新「タカシマヤカード」（赤いバラ）の発行を開始した。また、高島屋店内に設けられた営業窓口の「クレジットカウンター」をセゾン運営による「タカシマヤセゾンカウンター」へ移行し、同時に年会費無料の《セゾン》[[提携カード]]として「タカシマヤ《セゾン》カード」（白いバラ）の新規募集もクレディセゾンによって開始された。従来のタカシマヤカード既存会員は2007年春までに順次、セゾン仕様版へ更改となった&lt;ref&gt;同様の先行事例としては[[出光クレジット]]がある。&lt;/ref&gt;。また同年には「タカシマヤカード《[[ゴールドカードゴールド]]》」の募集を開始した。
株式会社セゾンファンデックス,[[豊臣秀吉]]配下の[[武将]]のうち、豊臣政権で[[軍事軍務]]を担った諸将を指す。武断派の武将としては[[加藤清正]]&lt;ref&gt;ただし、清正の武勇の将とみなすのは没後に記された伝記や軍記物による影響が大きく、実際は賤ヶ岳の戦い以降朝鮮出兵が始まる以前は、蔵入地の代官や闕所地の保全など文治派と並んで政務を担当しており、肥後北半分を与えられたのも政務による功績であった。清正が文治派と対立関係に入るのは朝鮮出兵での意見対立によるところが大きい（こうした清正像の見直しについては、山田貴司編著『シリーズ・織豊大名の研究第二巻加藤清正』（戒光祥出版、2014年）所収の諸論文を参考のこと）。&lt;/ref&gt;、[[福島正則]]らが挙げられる。武断派に対し、政務を担った武将を総称して[[文治派]]と呼ぶ。
SMBCファイナンスサービス株式会社,旧[[住友銀行]]系の[[ベンチャーキャピタル]]「日本ベンチャーキャピタル」として設立したが、程なく業務をベンチャーキャピタル部門から[[ファクタリング]]部門にシフトし（現在は[[大和SMBCキャピタル]]から分割したSMBCベンチャーキャピタルが同部門を担っている）、旧[[太陽神戸銀行]]系の債権回収会社「太陽神戸ファクター」を創業とする「さくらファイナンスサービス」との合併により現在に至る。現在はファクタリング部門のほか、[[口座自動振替]]代行、[[コンビニエンスストア]]での各種料金[[収納代行]]、[[電子商取引]]（eコマース）における決済代行、[[デビットカード]]による決済ソリューションの提供などが事業の主軸となっている。特にコンビニエンスストアでの料金収納代行は、日本国内大手・中堅のほとんどのコンビニエンスストアと提携を結んでおり、同社との提携により、収納元が発行する一枚の払込票で、全国のコンビニエンスストアでの料金支払を可能とさせている。
マーシュ・アンド・マクレナン・カンパニーズ・インク,HTCDreamは、米[[Google]]社が開発した[[携帯電話]]向け[[モバイルプラットフォームプラットフォーム]]である[[Android]]を搭載した多機能電話機（[[スマートフォン]]）として世界最初に販売された携帯端末である。[[台湾]]の[[HTC(企業)HTC]]社が製造したこの携帯端末機は、北米では携帯電話キャリアのT-モバイルUSAへ供給され、2008年10月22日より2年契約時の価格：179.99米ドルで販売されている&lt;ref&gt;Tech-on!日経エレクトロニクス2008年10月6日号Page151&lt;/ref&gt;。[[イギリス]]では2008年11月、その他欧州各国では2009年第1四半期に発売が予定されている&lt;ref&gt;[http://japanese.engadget.com/2008/09/23/t-mobile-google-android/engadget日本版速報：T-Mobile・GoogleAndroidイベント]&lt;/ref&gt;&lt;ref&gt;[http://japanese.engadget.com/2008/09/23/android-t-mobile-g1-gmail/engadget日本版Android携帯T-MobileG1正式発表、マルチタスク＆プッシュ同期サポート]&lt;/ref&gt;。代表的な企業用メールサーバーである[[MicrosoftExchangeServer]]には対応していないため、ビジネス用途には制約がある。
株式会社日本政策金融公庫,前身は、[[国民生活金融公庫]]、[[農林漁業金融公庫]]、[[中小企業金融公庫]]である。[[沖縄県]]を除く46都道府県を営業エリアとする（沖縄県は、[[沖縄振興開発金融公庫]]が、実質的に機能するため）。略称については、当初は「政策公庫」（せいさくこうこ）とされていたが、2009年1月から「'''日本公庫'''」（にっぽんこうこ）に変更されている&lt;ref&gt;[http://www.jfc.go.jp/c_news/info210123.html日本政策金融公庫の略称が「日本公庫」に変わりました。]日本政策金融公庫・ご案内{{webarchiveurlhttps://web.archive.org/web/20090302091716/http://www.jfc.go.jp/c_news/info210123.htmldate2009年3月2日}}&lt;/ref&gt;&lt;ref&gt;[http://www.jfc.go.jp/c_news/news_bn/info210123.html日本政策金融公庫の略称が「日本公庫」に変わりました。]&lt;/ref&gt;。なお、政府系金融機関の株式会社[[日本政策投資銀行]]（DBJ）とは全く別個の法人である。
地方公共団体金融機構,
株式会社SMFGカード&amp;クレジット,株式会社三井住友フィナンシャルグループ（SMFG）傘下のカード会社としては、以前から株式会社[[三井住友銀行]]（SMBC）子会社&lt;ref&gt;持株会社化に伴い、三井住友カード株式会社は、2003年2月以降は株式会社三井住友フィナンシャルグループの子会社である。&lt;/ref&gt;の[[三井住友カード]]株式会社（SMCC）があった&lt;ref&gt;三井住友カード株式会社のほかに、[[さくらカード]]株式会社も三井住友銀行の子会社であるが、同社は[[JCB]]との提携カードの発行会社であり、[[VisaVISA]]・[[マスターカード]]ブランドのカード（三井住友VISAカード・三井住友マスターカード）を発行している三井住友カードとは統合されず、2014年6月2日、2016年を目途にセディナと合併することが決まった。これに伴い、三井住友銀行のキャッシャカード一体型クレジットカードもJCBブランドは2014年7月発行分からセディナの発行となる。&lt;/ref&gt;。2007年4月に、株式会社[[セントラルファイナンス]]（CF）および同社が筆頭株主の株式会社[[クオーク(信販)クオーク]]と提携。翌5月には、CFが[[三菱UFJフィナンシャルグループ]]（MUFG）を離脱し、三井住友フィナンシャルグループ入りした。2008年2月には、株式会社[[オーエムシーカード]]（OMC）株式を筆頭株主の[[ダイエー]]から取得し、グループ会社化した。SMFGは傘下に4社のカード会社を抱えることとなったことから、グループのカード事業について統一的戦略およびスケールメリット（規模の利益）を図るために、中間持株会社の株式会社SMFGカード&amp;クレジット（FGCC）を設立して、同社の下で統合することにした。
株式会社東京証券取引所グループ,韓国で2000年に公開され、大ヒットとなった映画『[[リメンバー・ミー(2000年の映画)リメンバー・ミー]]』をタン・ファータオ監督によって香港でリメイクした作品。主演は今作品で映画デビューとなったケン・チュウと、2003年公開の香港映画『[[ターンレフト・ターンライト]]』のジジ・リョン。
ニューヨーク・マーカンタイル取引所,ニューヨーク・マーカンタイル取引所と商品取引所(COMEX)が、2つの主要な部門である。かつて別々であったが合併された。かつて、親会社であるNYMEXHoldingsIncは、[[2006年]][[11月17日]]から[[ニューヨーク証券取引所]]に上場していたが、[[2008年]][[8月22日]]に、[[シカゴ・マーカンタイル取引所]]の運営会社である[[:en:CMEGroupCMEGroup]](CME)によって買収され、上場廃止となった。
株式会社オーシー,大分県在住者に対して&lt;ref&gt;[http://www.occard.jp/qa/index.api?QCAT4&amp;QSUB0Q&amp;A（よくある質問）入会方法]株式会社オーシー&lt;/ref&gt;、OC[[VisaVISA]]カード・OC[[マスターカードMaster]]カードとキャッシング専用カード「natula」等の発行を行っている&lt;ref&gt;[http://www.occard.jp/card/index.htmlカードラインナップ]株式会社オーシー&lt;/ref&gt;ほか、地元百貨店[[トキハ]]との提携によるトキハカードなども取り扱っている&lt;ref&gt;[http://www.occard.co.jp/card/tokiwa/index.htmlトキハカード]株式会社オーシー&lt;/ref&gt;。2017年3月期の売上高は68502百万円で、大分県内の企業で7位に位置する&lt;refname&quot;oita-press_20171006&quot;/&gt;。[[現金自動預け払い機ATM]]ネットワークによるキャッシング提携は、大分県及び隣県の銀行・信用金庫・信用組合（大分県内に本店を置く金融機関については全て提携）や全国の[[ゆうちょ銀行]]（郵便局）、[[コンビニATM]]で、大分県内を中心としている&lt;ref&gt;[http://www.occard.jp/service_spot/index.htmlATMコーナー]株式会社オーシー&lt;/ref&gt;。
株式会社日専連ファイナンス,熊本県内在住者を中心に「日専連カード（DC[[VISA]]・DC[[マスターカードマスター]]・[[JCB]]）」の発行を行っている。また、県内の大型専門店や企業等を中心に、日専連カードの機能を搭載した提携カードも取り扱っている。
トヨタアセットマネジメント株式会社,[[太平洋戦争]]において、[[ドワイト・D・アイゼンハワー]]とともに設置された[[第8軍(アメリカ軍)合衆国陸軍第8軍]]の初代司令官となり、第8軍による対日戦および日本占領を指揮する。離任前には日本の再武装を主張し、[[民政局]]や[[極東委員会]]と対立。在任中には再武装には至らなかったものの、[[海上保安庁]]の設置を実現させる。直属上官である最高司令官[[ダグラス・マッカーサー]]と表立っては対立しなかったものの、マッカーサーを辛辣に批判する日記が遺されている。[[1947年]]、[[昭和天皇の戦後の巡幸都道府県一覧地方巡幸]]中の[[昭和天皇]]を乗せた[[お召し列車]]と、アイケルバーガー中将を乗せた[[連合軍専用列車]]が[[碓氷峠]]で行き違いをすることになり、RTO（RailwayTransportationOffice）の命令により、お召し列車側が5分間退避させられたというエピソードがある。
みずほキャピタルパートナーズ株式会社,[[富士銀行]]系の[[ベンチャーファンド]]であった'''富士キャピタルマネジメント株式会社'''が、富士銀行のみずほフィナンシャルグループへの統合によって名称が変更されたもの&lt;ref&gt;{{PDFlink[https://www.mizuho-fg.co.jp/investors/financial/report/yuho_200303/pdf/501005-200209-60.pdf半期報告書]}}-[[みずほコーポレート銀行]]2003年3月期有価証券報告書&lt;/ref&gt;。会社の創設は2000年2月22日&lt;ref&gt;{{PDFlink[https://www.mizuho-fg.co.jp/investors/financial/disclosure/data0103d_fbk/pdf/2001-c17.pdf富士銀行の概要]}}-富士銀行2001年ディスクロージャー誌2017年1月27日閲覧&lt;/ref&gt;。[[バイアウトファンド]]、[[メザニンファンド]]による投資を行っている。
三井住友トラスト・アセットマネジメント株式会社,[[福岡県]]第五学区を通学区とし、[[全日制課程]][[普通科(学校)普通科]]のみを有する福岡県立の[[高等学校]]である。同時期に開校した普通科課程を有する[[高等学校]]には[[福岡県立春日高等学校]]などがある。学校名の「武蔵台」は、本校南側に位置する[[天拝山]]の麓にある[[武蔵寺]]（ぶぞうじ）及び所在地付近一帯の旧地名である武蔵村（むさしむら）に由来する。校歌の作詞・作曲は、本校第一期生による&lt;ref&gt;補作者として本職の作詞家・作曲家の修正あり。&lt;/ref&gt;。歌唱時、男子生徒は発声可能な音域に対し曲の音域が高めであるためか歌い辛さを感じる者が少なくないと言われている。本校は最寄の鉄道駅から距離が遠いためか、鉄道を利用して通学する生徒は少ないと思われ、大多数の生徒の通学手段は徒歩または自転車である。ちなみに、校門前の坂道は自転車に乗車したまま下ることが禁止されており、降車の上自転車を押して通行することが義務付けられている&lt;ref&gt;原動機付自転車及び自動二輪車による通学は禁止されている。また、免許取得も禁止されている。&lt;/ref&gt;。頭髪に関する規定や紺色の学生服と相まって、本校生徒である旨一目瞭然であることから、風紀に関しては比較的厳しい学校であると受け止められている&lt;ref&gt;従来の頭髪に関する規定は、男子は短めの所謂「スポーツ刈り」、女子は基本的に肩までの長さで、それ以上の場合は後ろで結ばなければならないというものであった。学生服の紺色については、通常の黒の学生服のように、容易に改造できなくするためとの理由がある。なお、本校をモデルとして開校した同じ県立の[[福岡県立柏陵高等学校柏陵高等学校]]の学生服も、同様に紺色である。&lt;/ref&gt;。学校のシンボルカラーはウルトラマリンブルーであり、生徒昇降口の前にあるコモンホールに敷かれた絨毯や、セカンドバッグなどに使用されている。
あおぞら債権回収株式会社,[[ヨーロッパ]]側・[[ロシア]]側から見ると「コーカサス山脈のこちら側」にあたるため、英語ではシスコーカサス(Ciscaucasus)、シスコーカシア(Ciscaucasia)とも呼ばれる。一方で大コーカサス山脈の南側（[[南コーカサス]]）は、「コーカサス山脈の向こう側」を意味する「ザカフカジエ」（{{LangruЗакавказье}}、ザカフカスとも）、英語では「トランスコーカシア」(Transcaucasia)または「トランスコーカサス」(Transcaucasus)とも呼ばれる。[[ジョージア(国)ジョージア]]と[[アゼルバイジャン]]の一部が北コーカサスに属するが、北コーカサスの大部分はロシア連邦領であり、行政的には[[北カフカース連邦管区]]（2010年に[[南部連邦管区]]より分離）に、[[ロシアの経済地区経済地区]]では[[北カフカース経済地区]]に属している。北コーカサスにある[[ロシア連邦の地方区分連邦構成主体]]は、[[クラスノダール地方]]と[[スタヴロポリ地方]]の二つの「[[ロシアの地方地方]]」のほかに、西から東の順に、[[アディゲ共和国]]、[[カラチャイ・チェルケス共和国]]、[[カバルダ・バルカル共和国]]、[[北オセチア共和国]]、[[イングーシ共和国]]、[[チェチェン共和国]]、[[ダゲスタン共和国]]などの「[[ロシアの共和国共和国]]」からなる&lt;ref&gt;Asmallschematicmapoftheregionscanbeseenathttp://www.rferl.org/featuresarticle/2004/11/3ac7d840-6775-433f-8e5a-f948950dd53a.html&lt;/ref&gt;。
大阪証券金融株式会社,ミニアルバム「[[メロンジュース(アルバム)メロンジュース]]」からシングルカット。メロン記念日名義かつメジャーレーベルからの最後のシングル。
イー・ギャランティ株式会社,事業法人向け保証サービスでは、売掛債権保証サービスを中心として通常に加え特殊な売掛債権を幅広く保証するサービスを提供している。金融法人向け保証サービスでは、金融機関が保有する債権におけるクレジットリスクを保証することで、金融機関の新たな収益機会を提供するサービスを行っている。
NECキャピタルソリューション株式会社,[[NECグループ]]の金融会社として[[1978年]]に創業。メーカー系[[リース]]会社として事業を拡大し、[[2005年]]に[[東証2部]]、[[2006年]]に[[東証1部]]上場を果たす。[[2008年]]には、[[リース]]事業に限らない総合的[[ファイナンス]]会社を目指し、創業30周年を機に商号を'''NECリース株式会社'''から'''NECキャピタルソリューション株式会社'''に変更した。
株式会社九州リースサービス,[[九州]]トップの地場リース会社でリース事業のほか、[[融資]]事業、[[不動産]]事業、フィービジネス事業なども行っている。元は福岡相互銀行（現・[[西日本シティ銀行]]）と日本リース（後の日本アセットマネジメント、2010年4月清算）によって設立された会社だが、現在の筆頭株主は[[福岡地所]]となっている。
株式会社京阪カード,京阪グループ共通のクレジットカードであり、ポイントカードである「e-kenetカード」（イー・ケネットカード）を発行している。従来、グループ各社が個々に提携クレジットカードやポイントカードを発行していた&lt;ref&gt;例えば、京阪百貨店と[[JCB]]・三井住友カードとが提携して発行されていたクレジットカード「KENETカード」や京阪百貨店のポイントカード「きれいクラブ」、[[フレスト]]のポイントカードなどが発行されていた。&lt;/ref&gt;が、[[京阪電気鉄道]]による[[PiTaPa]]の導入に合わせて、これらを集約したカードを発行することになり、その発行・運営会社として設立された。クレジットカードの入会審査・請求業務などは[[三菱UFJニコス]]（発行開始時点の[[日本信販]]）に、ポイントシステムの運営業務は[[富士通]]にそれぞれ委託されている。
株式会社ゴールドポイントマーケティング,[[ソニーファイナンスインターナショナル]]の[[ソニーカード]][[提携カード]]「'''ヨドバシゴールドポイントICeLIO'''」の提携終了に伴い、[[2010年]]（[[平成]]22年）[[11月1日]]に同[[クレジットカード(日本)クレジットカード]]事業を継承し、クレジットカード名称を「'''ゴールドポイントカード・プラス'''」に変更した。クレジットカード事業全般について、[[三井住友カード]]と業務提携を行なっており&lt;ref&gt;[http://www.smbc-card.com/mem/company/news/news0000792.jsp三井住友カード、ヨドバシカメラのクレジットカード事業における業務提携を開始]三井住友カード2010年10月29日&lt;/ref&gt;、カード入会審査業務をプロセントに業務委託している。
株式会社ディ・ティ・エスインベストメント,[[東京都]][[中央区(東京都)中央区]][[京橋(東京都中央区)京橋]]にて、株式会社メディ・ファイナンスの商号で、医療分野における総合金融ソリューションサービスの事業展開を提供する目的で設立された民間金融機関の事業者系ノンバンクである。設立当初は、[[消費者金融]]中堅業者の株式会社アルコとの保証業務を締結し業務を行っていたが、平成12年6月の金利引下げの法改正の影響に伴い事業内容を変更し、商号を現在の株式会社ディ・ティ・エスインベストメントに変更。現在は不動産担保ローン事業と売掛債権の買取をメインに総合ファイナンス事業を行っている。
