3250,当社は日本初となるリウマチと整形外科領域に特化した製薬会社で、参天製薬株式会社から抗リウマチ薬事業を、昭和薬品化工株式会社から医薬品事業をそれぞれ承継している。
3250,1853年（嘉永6年）創業。創業当初は「鎰長」（いっちょう）という名前であったが、1917年（大正6年）に「荒川長太郎合名会社」と社名を変更している。1990年（平成2年）7月5日に同合名会社から独立して新会社として設立された。社名は荒川長太郎合名会社の「ARA」（荒）と未知への挑戦を意味する「X」を合成した造語で、同合名会社とニチエー（名古屋市・連結子会社）、シーエス薬品の各社が出資した。同社では看板商品の頭痛薬「ノーシン」シリーズを中心に妊娠検査薬（チェックワン）、便秘薬（カイベールC）を主力商品としたセルフメディケーション（家庭用医薬品）商品を展開している。テレビ番組での提供クレジットは、株式会社アラクスが設立された1990年（平成2年）7月以降は「'''アラクス'''（現在は「'''ARAX'''」のロゴマーク）」で、それ以前は「'''ノーシン'''」だった。
3250,1922年（大正11年）大阪市にて創業。有機・無機試薬の合成事業から出発。1953年に写真印画紙用薬品（カラーカプラー、増感色素など）の合成事業を開始する。1980年に医薬品受託製造事業に進出し、以来、数多くの医薬品原薬中間体製造に取り組む。2015年4月には中間体の製造能力強化のため、富山工場の第3製造棟の建設に着手し「【北陸】片山製薬所第3製造棟が着工施工は三菱化学エンジニアリング」.『建設通信新聞』.2015年4月23日付朝刊、8面。、2016年4月に完成「片山製薬所中間体能力5割増富山工場に新製造棟」.『北日本新聞』.2016年4月27日付朝刊、5面。「片山製薬所、富山工場に新製造棟が完成」.『日刊薬業』.2016年5月9日付朝刊、4面。。同年6月に試運転を開始した「北陸化学産業特集北陸地域域内ものづくり支える化学企業有力各社の戦略片山製薬所」.『化学工業日報』.2016年8月4日付朝刊、10面。。医薬品医療機器総合機構|PMDA、アメリカ食品医薬品局|FDA、欧州医薬品庁|EMAによるGMP査察をクリアしており「中原慎治片山製薬所社長に聞く堺化学買収機に受託製造拡大優れた有機合成技術など期待」.『化学工業日報』.2012年6月28日付朝刊、10面。、日米欧3極対応の受託製造が可能namenikkeisangyou。自社製品としてアゼチジン誘導体の開発にも注力している。
3250,ノーベル賞の礎を築いたアルフレッド・ノーベル（'':de:AlfredNobel|AlfredNobel''）が1870年に''NobelIndusrtriesLimited''を設立。やがて合併による多角化が進められ、世界有数の総合化学会社ICI『インペリアル・ケミカル・インダストリーズ』（'':de:ImperialChemicalIndustries|ImperialChemicalIndustries''）へと発展、事業部門”''ICINobel''”を稲畑産業が2002年に買収し現在の''NobelEnterprisesIndustriesInc.''となる。グループ企業の一員としてノーベルファーマが誕生した。アンメットニーズの高い医薬品を開発し、その薬剤を必要とする患者の手もとに届けることを使命として、2003年に設立された。オーファンドラッグ、効能・効果の適応外で使用されている医薬品、小児用医薬品などアンメットニーズの高い医薬品の研究開発に鋭意取り組み、必要とされる現場に届けることにより医療へ貢献している。
3250,*創業は1917年（大正6年）2月12日。*1949年（昭和24年）に現在の社名に変更されたが、創業当初から一貫して、乳酸菌胃腸薬|整腸薬「ビオフェルミン」を中心として企業経営を成り立たせている。*長く「'''ビオフェルミン'''」の販売を武田薬品工業に委託しており、武田薬品グループの販売、製造会社の一社だったが、2008年（平成20年）3月より大正製薬傘下となっている{{Wikinews-inline|ビオフェルミン、大正製薬がTOBで子会社化へ}}。国内販売は2014年（平成26年）より、輸出は2016年（平成28年）より、それぞれ大正製薬に移管された{{Citenews|urlhttp:jp.reuters.comarticlebusinessNewsidJPTYE96U05A20130731|titleビオフェルミン、大正製薬に製品の販売・輸出契約を武田薬から移管|publisherロイター・ジャパン|accessdate2013年7月31日}}。国内販売に関しては大正製薬や大正富山医薬品からの販売権付与により武田薬品工業が引き続き販売を行ってきたが、OTC医薬品・指定医薬部外品に関しては2017年（平成29年）10月から大正製薬での販売に移行した。
3250,2002年、東京証券取引所マザーズにアンジエスMGが創薬バイオベンチャーとしてはじめて上場。創薬ブームの火付け役となり長い間時価総額トップを維持していた。2004年、ブームにのって同社も上場。アンジェスに次ぐ有望なバイオベンチャーの2番手として注目された。しかし、主力パイプラインのシーブリ、ウルディブロの開発は計画通り進まず、臨床試験は遅延を繰り返し赤字が続いた。研究開発が思うように進まず、長期間株価低迷が続きその間、巨額増資が何度も繰り返され、田村は賞与を2000万円近く会社に返納するほどに至る。その後、臨床試験を何とか順調にパスしノバルティスから着実にマイルストーンを取得できた。上市に至ると市場が想定する以上の売り上げを世界で弾き出し、毎年倍々の売り上げを達成。一気に財務内容は改善した。加えて緊急避妊薬ノルレボ錠も販売開始された。パイプライン全滅のアンジェスを一気に巻き返しマザーズトップに返り咲いた。黒字化を実現してからPOを実施、2015年リスクを取って英国のバイオベンチャー、ヘプタレス・セラピュティクス社を総額480億円で買収。日本の創薬企業の買収金額では過去最大。ヘプタレスの研究開発能力は高く、マイルストーンを着実に取得。そーせいの売り上げをさらに押し上げ市場の注目は一気に高まる。一時は東証一部トップのトヨタ、みずほを超える売買出来高を数か月記録するに至る。IPO当時の80万円を一気に超え2倍以上の株価で現在推移している。この買収により会社側では2019年、収益が3倍に膨らむと予想。
3250,2003年に愛媛大学工学部と医学部の研究者らが設立した愛媛大学発のベンチャーである。高周波誘導原理を応用し、腫瘍部に配置した発熱体に体外から高周波磁場を当て、局所的に患部を60℃以上に加熱してがん組織を焼灼する装置およびシステムを開発しているhttp:www.vaa.jpdaigaku001.html大学発ベンチャー支援ネットワーク形成事業-大学発ベンチャー支援ネットワーク形成事業、2013年8月16日閲覧。。会社名は「AdvancedMedicalTechnology」の略で、「一歩進んだ医工連携」を意味しているhttp:www.jiji.comjczc?k2013082013082700422アドメテック、9月4日に東京プロ上場がん治療の研究開発-時事ドットコム（2013年8月27日）、2013年8月31日閲覧。。
3250,救急箱（常備配置薬、保健品の一部、栄養ドリンク|ドリンクの一部）を各家庭に配置して、使用分を販売する配置販売業|配置販売を行い、関連商品（保健品の一部、ドリンクの一部、医療品、日用雑貨およびギフトその他）は主として営業員が配置顧客に販売している。また、加盟店を中心とする同業他社や一般流通市場に対し、当社の取扱商品を卸売り販売している。さらにアクアマジックブランドにおいて「RO（逆浸透）膜方式」による水の精製プラントを自社所有し売水事業を展開している。「赤い箱の中京医薬品」とも呼ばれている。
3250,*2005年（平成17年）10月1日に、「帝国臓器製薬株式会社」と「グレラン製薬株式会社」が合併(企業)|合併して誕生した。*化粧品・健康食品企業のアスカコーポレーションも同じく「ASKA」という英字表記を用いているが、あすか製薬との関連性は無い。*他社製品のOEM受託製造や後発医薬品の委託製造も行っている。
3250,処方箋医薬品|医療用医薬品の開発、製造、販売を業務とする。後発医薬品を扱う事業者の一つ。富山県富山市水橋に工場、研究所を有し、札幌、東京、富山、名古屋、大阪、広島、福岡に支店がある。
3250,関西地区では断トツの知名度を誇る同社であるが、それ以外の地域では「樋屋奇応丸」が発売されておらず、関東地区でしか知名度のない宇津救命丸と同じく対比的なニュアンスを持つ、ローカル製薬企業としてその名を知られている。販売部門は1985年に樋屋製薬販売株式会社として分社化、1994年に'''樋屋奇応丸株式会社'''となる。2011年5月24日、販売子会社の樋屋奇応丸が持つ樋屋奇応丸の国内販売権を大幸薬品に譲渡することで合意、8月にも大幸薬品のシンボルマーク「ラッパのマーク」が付いた樋屋奇応丸が市場に流通し始める。全国に販路を持つ大幸薬品との提携により、特に知名度の低い東日本での販売力強化を図る。2016年3月23日、同年5月18日を以って大幸薬品との独占国内販売権契約が満了するのに伴い、翌19日より樋屋奇応丸の発売元を再び樋屋奇応丸に戻し、同時に製品をリニューアルする予定であることが樋屋製薬ホームページ上で発表された。
3250,創業者の鈴木由太郎が、1901年（明治34年）に東京・本所(墨田区)|本所にて医薬品製造をおこなう「'''鈴木日本堂'''」を創業する。当時はかぜ薬「オピトリン」、頭痛膏「乙女桜」、萬金膏「シカマン」などを製造ならびに販売していたが、1933年（昭和8年）に、室町時代後期から江戸時代初期にかけて活動した医師で、「医聖」の異名を取る永田徳本から名を取った「トクホン」を発売。これがロングセラーとなったことで、外用消炎剤分野での地位を確立させると共に、1948年（昭和23年）には株式会社へと改組する。「トクホン」はライバル会社の久光製薬が製造・販売する「サロンパス」と並ぶ外用消炎剤のトップブランドとして広く親しまれている。長年にわたり、外用消炎剤での地位を維持する一方、1989年（平成元年）には現社名に改めると共に、一時内服液分野にも進出したことがあるが、こちらは業績的に振るわず、1993年（平成5年）に撤退。以後は外用消炎剤一本で同社の経営を維持している。2012年（平成24年）7月2日に、株式交換により大正製薬の子会社|完全子会社となった{{PDFlink|http:www.tokuhon.co.jppdf120427_pressinformation.pdf当社株主の異動と株式交換契約締結に関するお知らせ|株式会社トクホン、2012年4月27日}}。
3250,2005年1月に日本調剤100%出資子会社として東京都中央区(東京都)|中央区八重洲に設立された日本調剤の完全子会社である{{citenews|title子会社設立に関するお知らせ|agency|publisher日本調剤株式会社|date2004-12-20|urlhttp:v4.eir-parts.netv4ContentsView.aspx?cattdnet&sid217052|accessdate2014-1-14}}日本調剤株式会社有価証券報告書‐第33期。ジェネリック医薬品に特化した医療用医薬品の製造販売及び研究開発を行う。2013年4月より、親会社である日本調剤の長生堂製薬買収に伴い同社は長生堂製薬の販売部門を担当している。親会社である日本調剤の薬局に加え、全国の医療機関・薬局へジェネリック医薬品の製造・販売、供給を行っている。少子高齢化問題や医療費増大などの社会的背景によりジェネリック医薬品への関心が高まっている中、2015年に茨城県つくば市に第二工場建設を決定しジェネリック医薬品の急速な需要拡大に向けた生産設備の増強を行っている。2018年4月の第二工場稼働により年間最大生産能力は100億錠超となる見通し。また、札幌、茨城、埼玉、大阪に物流センターを開設しニーズに合わせた安定した供給体制を実現。
3250,1902年創業。元は大阪道修町から仕入れた薬品原料を富山県内の漢方薬会社へ卸す薬種問屋が個人企業として創業したものの、経営破綻。1925年、当時三番番頭だった笹山林蔵が事業を継承した「http:www.naigai-ph.co.jpspecialmedicinehtmlp08_09.html第一章創業のあとさき」内外薬品の歩みメデシン・ロード。同年、林蔵の長男で薬剤師の順蔵がアスピリンを配合した鎮痛剤「ケロリン」を開発。銭湯の風呂桶の広告（ケロリン桶）で広く知られている。2004年に製造部門の株式会社内外薬品商会と販売部門の旧・内外薬品株式会社が合併して現在の内外薬品株式会社となる。
3250,この会社の主力は「ジェネリック医薬品」。ジェネリック医薬品を中心に、200品目以上の医薬品の製造・販売をおこなっている。
3250,創業者の森平兵衛が、1894年（明治27年）に大阪・心斎橋にて医薬品の製造販売をおこなう「丹平商会」を設立する。社名は当時流行していた屋号「丹波屋」と、自身の苗字から「平」を取って命名された。過去には、同社が写真関連の薬品、写真用品などを扱っていたことから、1924年（大正13年）に、当時同社が本社を置いていた心斎橋2丁目に「丹平ハウス」を建設し、ここから上田備山、安井仲治などの才能が集まり「丹平写真倶楽部」を結成するなど、難波・心斎橋間のモダニズムに貢献した。虫歯用痛み止め薬の「新今治水」や、便秘薬「健のう丸」現在は便秘薬として発売されているが、当時は「健脳丸」と表記され、その名の通り、脳神経系の薬品として販売されていた。現在はこのような向神経系の薬品は、薬事法の定めで市販は禁止されている。に加え、水虫・たむし用の塗り薬の「アスター軟膏」などの医薬品を取り扱っている。この他にも育児用品やトイレタリー分野では、「アトピタ」シリーズのベビーソープ、ベビーシャンプーなどを発売している。
3250,ublisherDelta-FlyPharma|accessdate2018-12-30}}
3250,江戸時代後期から御嶽信仰（参考：御嶽神社）の普寛行者と覚明行者から伝承された「百草」の販売に携わっていた「日野屋」が、1947年（昭和22年）に製薬会社を設立。現在長野県木祖村に本社を置き、御嶽山麓の王滝店・里宮店、木曽福島道の駅木曽市場店、中山道奈良井宿の奈良井店に直営店舗をもつ。br生薬配合の「日野百草丸」「普導丸」「百草」「百草錠」などの医薬品を製造販売している。
3250,1894年に創業を開始した歴史を持つ大手医薬品メーカー。後発医薬品の製造を主力としている。日本製薬団体連合会、関西医薬品協会、日本ジェネリック製薬協会、徳島県製薬協会に所属している。2013年4月2日、日本調剤が買収により過半数の株式を取得し、同社の子会社となる{{citenews|title長生堂製薬株式会社の株式取得（子会社化）に関するお知らせ|agency|publisher日本調剤株式会社|date2013-04-02|urlhttp:v4.eir-parts.netv4ContentsView.aspx?cattdnet&sid1048247|accessdate2014-01-13}}{{citenews|title日本調剤、後発薬中堅の買収額は32億円|agency|publisher日本経済新聞|date2013-04-02|urlhttp:www.nikkei.comarticleDGXNASDD020IR_S3A400C1TJ1000|accessdate2014-01-13}}{{citenews|title日本調剤、後発薬メーカー買収　取扱品目を拡充|agency|publisher日本経済新聞|date2012-10-26|urlhttp:www.nikkei.comarticleDGXNASDD260FN_W2A021C1TJ1000|accessdate2014-01-13}}。同時に自社製造分の販売部門をグループ会社の日本ジェネリックへ移管。その後2015年3月に日本調剤が全ての株式を取得し、同社の完全子会社となる。主要取引先はグループ会社の日本ジェネリック株式会社に加え、アルフレッサファーマ株式会社、大塚製薬株式会社、大鵬薬品工業株式会社、武田薬品工業株式会社、田辺三菱製薬株式会社、東和薬品株式会社、日医工株式会社、マイラン製薬株式会社などであり、自社ブランドのジェネリック医薬品だけではなく他製薬メーカーからの受託製造も行っている。徳島市川内町にある川内工場ではセフェム系抗生物質製剤専用工場として、内服固形剤の製造ラインを有し国内トップシェアを誇る。
3250,社名は、江戸時代の熊本藩に建てられた医学校再春館(学校)|再春館に因んでいる。*1980年代|1980～1990年代|90年代に'''再春館薬業'''や'''再春館製薬'''といった名称を用いた事もあり、提供クレジットも2つの名称が用いられていた。*一般的な化粧品と異なり店舗販売は行なっておらず、基本的に「テレビ通販」などに特化しており、「客が納得するまで売らない」「買うまで売らない」など独自の商売倫理に立ったCM作りで有名である。
3250,アメリカを本拠とする世界的な医薬品|製薬企業であり、世界140カ国以上で事業を展開している。2011年の売上高は480億アメリカ合衆国ドル|ドル。従業員数は約86000名（2011年12月現在）。株式がダウ平均株価の構成銘柄に選ばれている。1990年代までは医薬品業での世界売上高が断続的にトップであったが、2000年代はM&Aによる業界の再編に伴ってサノフィ・アベンティス、ファイザー、グラクソ・スミスクラインなどに抜かれた。しかし米国メルクは2009年11月に米同業大手のシェリング・プラウを買収、売り上げ規模においてはファイザーに次ぐ世界2位に復している。
3250,日本のノバルティスグループの後発医薬品部門を担当する企業。
3250,社名のUMNファーマは、UnmetMedicalNeeds（有効な治療法や薬剤がない疾患領域における医療ニーズ）を満たす研究開発に全精力を注ぎたい、との創業者の強い想いから命名された。目的遺伝子を導入したバキュロウイルスを株化昆虫細胞に感染させて大量培養した後、目的タンパクだけを高度に純化する技術(BaculovirusExpressionVectorSystem:BEVS)を、コアプラットフォームとして有する。インフルエンザに対する次世代組み換え型サブユニットワクチンと、ノロウイルスやロタウイルスに対する新規組み換え型ワクチンの研究開発に注力している。
3250,創業から今日まで発売され続けているカルシウム剤「'''ワダカルシューム錠'''」の製造販売元としてその名を知られる。また創業当初から、一貫して関西を地盤としていたが、2008年にピップグループの一企業になったことで、関西以外の地域への営業も徐々に強まっている。過去には植物性鎮静剤「'''山鹿子'''」（さんろくし）といった薬品も取り扱っていたが、現在は製造中止になっており、かつてのように創業当時の原点に立ち返り、骨とカルシウムの分野に一貫して重点を置きつつ、医薬品の他に健康食品の製造販売もおこなう。頻繁ではないが、MBSラジオ(1179kHz)やABCラジオ(1008kHz)でCMが放送されている。
3250,創業者の森下博が1893年（明治26年）2月11日に、大阪市東区(大阪市)|東区（現・中央区(大阪市)|中央区）にて、薬種商「森下南陽堂」を創業したのが発祥である。1905年（明治38年）から今日まで発売され続けている仁丹の製造元としてその名を知られている。上部に人物が描かれている「仁丹」の商標で知られているが、描かれている人物は軍人ではなく、大礼服姿の外交官であるhttp:www.jintan.co.jpmuseumlogoindex.html仁丹商標森下仁丹歴史博物館。商標の外交官は「健康を世界に運ぶ外交官に」という創業者の思いが込められている。現在はかつての主力商品「銀粒仁丹」のコーティング技法を発展させることで開発した最先端のシームレスカプセル（継ぎ目のないカプセル）を用いた食品会社からの受託製造と、ビフィズス菌を使用した食品・化粧品、植物エキスを主成分とするダイエット食品・健康食品（栄養補助食品）の製造・販売を主な事業内容としている。銀粒仁丹の原料でもある生薬成分の研究にも力を入れており、それを生かした食品会社への原料の供給等も行い、最近では日本コカ・コーラへのローズヒップ|ローズヒップ・エキス供給のほか、デンマーク産ホットドッグ「ホールドバケット」の販売事業等もおこなっている。
3250,後発医薬品|ジェネリックを主に卸す企業である。最近は官公立病院にも取引を開始し、地場卸から、特徴あるジェネリック専門卸として、成長が著しい。平成20年には、東大阪営業所が支店へと格上げされ、大阪府下はもちろんの事、東は京都市、西は明石市、更に奈良県へも進出している。平成20年4月の処方箋様式変更に伴い、問い合わせが殺到する事が予想される。また大阪府泉北ニュータウンに南大阪支店を開設する計画がある（用地は取得済み）。取り扱いジェネリック医薬品メーカーは沢井製薬、大洋薬品（現・武田テバファーマ）、日医工（旧マルコ、旧テイコクメディックスのみ）マイラン製薬（旧メルク製薬）、共和薬品、大正薬品（現・武田テバ薬品）、長生堂薬品、太虎精堂、建林松鶴堂と多種多様であり、今後の躍進が注目される。黎明期にはエーザイ、塩野義製薬、武田薬品工業などを主に取り扱っていた。初代代表取締役榎本明は沢井製薬現相談役澤井次郎に直販から卸・販社ルートへの販路切替を提言した。その際に「大阪澤井薬品」を名乗る様、澤井次郎から榎本明へ要望が出されたが「榎本薬品は何れの製薬会社からも影響を受けない独立した一医薬品卸である」との考えから謝辞したとされ、現在に至る。沢井製薬本社で各地方を代表する沢井製薬販社が出席する会議が開催される際に榎本薬品も出席しているのは上記の様な経緯からであると推察される。
3250,医療用医薬品の製造及び販売を手がけ、注射用医薬品の受託販売を行っている薬品メーカーである。「純良医薬品の製造販売により社会のお役に立つ」という企業理念のもと製造設備の充実化を図り、アンプル・バイアルの注射剤の製造販売をコア事業としている。かつては動物用医薬品の製造販売もおこなっていた。
3250,本社は東京に、営業拠点は大阪にあるが、岐阜市内に岐阜本部と開発センター、3カ所の工場を構えている。岐阜県岐阜市の本部にお客様相談室を置いている。元々本家本元は岐阜県岐阜市で成り立った東海地区最大手の製薬会社である。なお、アルフレッサの前身企業である福神(医薬品)|福神が営業権を取得した小林薬品とは無関係である。東海地区の大手民放各社のスポットCMとして東海地区でよく流れていたことがあった。小林薬品工業と表記されたりドリンク剤の蓋にはKBYSIと省略して表記されてある。
3250,納豆菌及び乳酸菌（医薬品、健康食品、飼料添加物等）の製造販売および輸出入。*本社所在地：大阪府大阪市中央区伏見町二丁目6-4*加西工場：兵庫県加西市繁昌町字小谷ノ上乙318-1
