3250,"大和国（現在の奈良県）に生まれた初代津村重舎が上京し、日本橋(東京都中央区)|日本橋に漢方薬局を開いたのが始まり。津村が故郷から受け継いだ秘薬を元に改良され、創業と同時に、婦人保健薬「中将湯」を発売する。その他にも1907年（明治40年）に胃腸薬「ヘルプ」を発売する。1900年（明治33年）、中将湯を精製する過程で出るくずを従業員が持ち帰り風呂に入れたところ、夏のあせもが消え、冬には体がよく温まるという経験をヒントに、「くすり湯中将湯」を発売する。さらにこれを改良・研究の結果を得て「バスクリン」となる。1936年（昭和11年）に改組。当初の社名は'''株式会社津村順天堂'''だったが、1988年（昭和63年）10月1日に「'''ツムラ'''」に変更するname\""社名変更\""「津村順天堂」から「ツムラ」に社名を変更した際のキャッチコピーは「ツムラ君、おめでとう。」になる予定だったが、その当時に昭和天皇が闘病（重篤）中であったことを配慮し、「ツムラ君をよろしく。」に差し替えた。このコピーを手掛けたのは、後にツムラの入浴剤のCMにも出演する伊丹十三である。その後も、「中将湯」のパッケージには「中将姫」マークが引き続き使用される。。なお「順天堂」と名乗っていたが、順天堂大学やホームセンターのジュンテンドー（本社・島根県益田市かつては薬局を運営していた。）とは無関係である。1980年代に入ってからは、雑貨販売、美術品の輸入・販売、米国での日用品製造・販売、化粧品販売を展開するなど、事業の多角化を進めていった。この多角化の一環としてフジサンケイグループが主催したサーカスの冠スポンサーとなり、「ツムライリュージョン」という名称で興行が行われた。これらの多角化事業は、バブル景気の崩壊以降多くが赤字に転落し、経営を圧迫した。1995年（平成7年）に、第一製薬（現：第一三共）から芳井順一が取締役として招聘され、それまでの多角化した事業を集約し、医療用漢方製剤を中心とする事業へのシフトを行った。現在では、医療用漢方薬で日本国内シェアの8割以上を占める（2007年（平成19年）9月末現在）http:www.tsumura.co.jpzaimubusiness01.htmlツムラのビジネス-製品。また、一般用医薬品(OTC)の漢方部門でもクラシエ薬品などとシェアを寡占する（業界3位）。こうした改革が進行している1997年（平成9年）、創業者一族で元社長の津村昭が総額70億円の不正債務保証により商法の特別背任罪で逮捕・起訴され、一審・二審ともに有罪判決を受けている。入浴剤「バスクリン」シリーズ、ヘア・ケア商品「バスクリン#育毛剤|モウガ」シリーズをはじめとする家庭用品部門については、2006年（平成18年）10月よりツムラの100%子会社であるツムラライフサイエンス株式会社（現在は、ツムラから完全独立し、バスクリン|株式会社バスクリンとなっている）に引き継がれた。"
3250,"現在、当社の子会社となっている大正製薬株式会社は、2001年（平成13年）9月17日に田辺三菱製薬|田辺製薬株式会社（現:田辺三菱製薬株式会社）と2002年（平成14年）4月1日を目途に両社の株式移転により共同持株会社「'''大正田辺ファルマグループ株式会社'''」を会社設立して事業統合することで基本合意し、「共同株式移転に関する覚書」を締結したことを発表した{{Citepressrelease|title株式移転による事業統合に関するお知らせ|publisher大正製薬、田辺製薬（2社連名）|date2001-09-17|formatPDF|urlhttps:www.taisho.co.jpcompanyrelease2001091701.pdf|accessdate2018-11-14}}。しかしながら、経営統合による相互補完的なメリットや利益は存在するものの、事業再編の方針による相違や人事・組織体制など基本的なインフラストラクチャーの相違があり、両社の特質と優位性を最大限に発揮することが難しいとの結論に至り、同年12月3日に事業統合が見送られた。{{Citepressrelease|title株式移転による事業統合見送りのお知らせ|publisher大正製薬株式会社|date2001-12-03|formatPDF|urlhttps:www.taisho.co.jpcompanyrelease2001120301.pdf|accessdate2018-11-14}}。その後、大正製薬は2011年（平成23年）5月2日にグループ経営資源の効果的な配分と競争力強化を可能とするグループ体制の整備を図ることを目的に、単独株式移転による持株会社制に移行することを発表し、同年10月に大正製薬の単独株式移転により、持株会社となる当社が会社設立されたname\""n110513\""{{Citepressrelease|title単独株式移転による持株会社の設立に関するお知らせ|publisher大正製薬株式会社|date2011-05-13|formatPDF|urlhttps:www.taisho.co.jpcompanyrelease20112011051301.pdf|accessdate2018-11-14}}。"
3250,当社は、富士フイルムグループで診断薬などの放射性医薬品を担う'''富士フイルムRIファーマ株式会社'''と低分子医薬品を担う'''富山化学工業株式会社'''が統合し、診断薬や治療薬を担う医薬品メーカーとして新たに発足したものである。なお、旧富山化学工業が製造販売承認や販売権を取得した製品は、同社が大正製薬株式会社との合弁会社として設立された大正富山医薬品株式会社（現在は大正製薬ホールディングス株式会社の子会社で、大正ファーマ株式会社）を通じて販売していたが、2019年4月1日付で当社での直販体制へ移行された。
3250,当社は、これまで武田薬品工業における日本国内向けコンシューマーヘルスケア事業を担っていた「ジャパンコンシューマーヘルスケアビジネスユニット」を分社化する形で設立された一般用医薬品や健康食品などを主に取り扱う事業子会社である。なお、当社が取り扱う製品は、「アリナミン」や「ベンザ(風邪薬)|ベンザ」など自社で製造・販売する製品に加え、千寿製薬が製造する「マイティア」、天藤製薬が製造する「ボラギノール」、ジョンソン・エンド・ジョンソンが製造する「アネトン」・「バイシン」・「ニコレット」なども含まれる。登記上の本店は武田薬品工業の本社がある大阪府大阪市中央区道修町四丁目1番1号に置いているが、本社機能は、ジャパンコンシューマーヘルスケアビジネスユニットの本部が置かれていた東京都千代田区丸の内一丁目8番2号に置かれている。
3250,*現在はOTC（市販向け）医薬品の製造販売に特化した企業である。*かつて行っていた処方箋医薬品|医療用医薬品事業は、2005年4月1日に撤退（久光製薬に譲渡）した。*社名のエスエスとはS&Sであり、Science&Societypharmaceuticalの略で、創業者である白井正助(初代)|白井正助のイニシャル（'''S'''hosuke'''S'''hirai）の意味もある。*1952年以来、現在までウサギのマーク（1998年1月1日にリニューアル）で広く知られる。*マスコットキャラクターはウサギの「'''ピョンちゃん'''」で因幡の白兎がモデルである。かつては薬局の店頭に、電動遊具なども設置されていた。*香港では、「白虎隊」として知られている。現在のキャッチコピーは「'''人にいいこと。'''」2011年4月3日放送開始の『ホンネ日和』（CBCテレビ|CBC）での筆頭提供による提供読みで使われている。であるが、1980年代から1990年代にかけては「'''ヒト・夢・健康'''」が使われていた。
3250,*1863年、ドイツに「フリードリヒ・バイエル社」が創立。*1888年、バイエル医薬品「フェナセチン」が日本に紹介される。*1911年、「フリードリヒ・バイエル合名会社」を設立。*1973年4月、バイエル・吉富・武田の3社による日独合弁にて創立された。*処方箋医薬品|医療用医薬品事業を中心に、動物用医薬品・医療機器・ヘルスケア事業を行っている。*2007年7月、「日本シエーリング株式会社」と事業統合し、新生「バイエル薬品株式会社」となった。
3250,*1992年3月、アサヒビール株式会社（旧法人）の食品事業部を分社化、「アサヒビール食品株式会社」設立。*1994年3月14日、アサヒビールの医薬品事業部を分社化、「'''アサヒビール薬品株式会社'''」設立。*1995年1月、アサヒビール薬品がアサヒビール漢方製薬株式会社（株式会社千葉実母散の営業権を継承し設立された株式会社千葉漢方医薬研究所が起源）と順興薬品工業株式会社（アサヒビールの子会社）を吸収合併。*2002年3月、アサヒビール薬品が、株式会社ポーラ化粧品本舗（現ポーラ(企業)|ポーラ）の食品部門子会社「ポーラフーズ株式会社」の全株式を取得し完全子会社化。「ミンティア」などポーラフーズが発売していた全商品の権利を獲得。*2002年7月1日、アサヒビール薬品を存続会社としてアサヒビール食品と合併、「'''アサヒフードアンドヘルスケア株式会社'''」に商号変更。*2003年1月1日、ポーラフーズを吸収合併し、ポーラフーズ全商品の権利を直接保有。*2008年9月、株式会社サンウェルを吸収合併。*2010年1月、アサヒビールグループの統一コーポレートスローガン「'''その感動を、わかちあう。'''」を制定。アサヒビール・アサヒ飲料・アサヒフードアンドヘルスケアの3社でこのスローガンを使用する。*2011年7月、親会社のアサヒビール株式会社（旧法人）が持株会社移行により「'''アサヒグループホールディングス株式会社'''」に商号を変更し、アサヒフードアンドヘルスケアは同社の事業子会社となる。*2015年7月、グループ内の食品事業再編に際し、グループ会社の和光堂株式会社及び天野実業株式会社との共同株式移転により、アサヒグループホールディングスが同社の完全子会社として「'''アサヒグループ食品株式会社'''」を設立。*2016年1月、グループ内の食品事業再編に伴い、営業・マーケティング・研究開発・SCM・管理などの各部門を吸収分割によりアサヒグループ食品株式会社に移管し、同社傘下の製造部門における子会社となる。*2017年7月1日、和光堂株式会社及び天野実業株式会社とともにアサヒグループ食品株式会社に吸収合併{{Citepressrelease|titleアサヒグループ食品製造3社　吸収合併のお知らせ|publisher|date2017-04-03|urlhttp:www.asahi-gf.co.jpcompanynewsrelease20170403|accessdate2017-05-27}}。なお、一時期アサヒビールの出資子会社だった鳥居薬品とは、製品や販売・流通上の関係は一切無かった。
3250,1987年10月8日に創業する。「ニッポンを若くする」として、頭皮ケアシャンプー「スカルプD」、女性まつ毛美容液の「スカルプDボーテ　ピュアフリーアイラッシュ」、食事によるエイジングケアを目指した「フレッシュデリ」などの商品を開発・販売している。2015年8月1日から、「予防医学」を目指してキャッチコピーを「予防医学のアンファー」に改め、企業CMにビートたけしを起用する。
3250,"1983年に設立され、当初は5つの製品を取り扱っていた。!--1996年にICNハンガリーやアメリカのキャラコ製薬http:www.soka.ac.jpsokacommonpdf20_keizai1.pdfインドにおけるM&A（PDF文章）{{リンク切れ|date2014年4月}}など--世界各国で製薬会社の買収を重ねる成長拡大路線により、現在ではムンバイに本社を置く国際的製薬会社として知られ、後発医薬品|ジェネリック医薬品やノーブランド医薬品を中心に、精神薬、神経薬、心臓薬、糖尿病薬、胃腸薬、呼吸器系薬、形成外科薬!--整形外科の可能性あり（英語版記事より）--などを製造name\""製造している薬\""{{citeweb|urlhttp:www.colorofeast.comNews%20&%20UpdatesIndian%20BioPharmaceuticals%20Companies%20Ranking%202012.pdf|titleインドの主な医薬品メーカー|publisherColorofeastConsulting|accessdate2014-04-25}}。アメリカ合衆国やヨーロッパおよびアジアなど世界40カ国!--公式サイトトップページより--に輸出するまでに成長している。2014年時点では26箇所の製造拠点、4箇所の研究センターを持つname\""DSランバクシー1\""。2014年、第一三共の子会社で同業のランバクシー・ラボラトリーズを株式交換により買収しname\""DSランバクシー1\""、同社を年内に吸収合併する事が発表されたname\""DSランバクシー2\""{{citeweb|urlhttp:www.daiichisankyo.co.jpnewsdetail006110.html|titleサン・ファーマと当社子会社のランバクシーの合併およびこれに伴う子会社の異動について|publisher第一三共|date2014-4-11|accessdate2014-04-25}}。これにより、ジェネリック医薬品で世界5位になるname\""DSランバクシー1\""。"
3250,"1937年、シン兄弟により塩野義製薬の代理店|販売代理店として始まる。1961年に製薬会社として設立され、現在では8カ国に製造工場を有し、150カ国以上で販売されている!--出所→ランバクシー公式サイト（'14年4月27日閲覧時点）http:www.ranbaxy.comabout-usoverview--、インド最大級name\""インド最大級\""{{citeweb|urlhttp:www.colorofeast.comNews%20&%20UpdatesIndian%20BioPharmaceuticals%20Companies%20Ranking%202012.pdf|titleインドの製薬会社ランキング2012|publisherColorofeastConsulting|accessdate2014-04-27}}の製薬会社に成長している。また後発医薬品|ジェネリック医薬品では世界トップ10に入っている。1973年に株式が公開された。"
3250,動物用医薬品を中心として事業を展開している。また、「人間と動物の健康づくり」をテーマにして、お客様に感謝してもらうことを目標として取り組んでいる。
3250,"|代表者松森浩士（代表取締役社長兼最高経営責任者|CEO）name\""概要\""|資本金1億円name\""概要\""|売上高468億円（2009年度）|総資産|従業員数810名（2010年3月現在）|決算期12月31日name\""概要\""|主要株主テバホールディングス:51%br武田薬品工業:49%name\""概要\""|主要子会社武田テバ薬品株式会社:100%|関係する人物|外部リンクhttp:www.takeda-teva.com|特記事項2012年4月に大洋薬品工業株式会社と興和テバ株式会社の合併により設立、2016年10月に現社名に変更。}}'''武田テバファーマ株式会社'''（たけだテバファーマ、{{lang-en|TevaTakedaPharmaLtd.}}）は、愛知県名古屋市中村区に本社を置く製薬会社。テバ・ファーマシューティカル・インダストリーズと武田薬品工業の合弁事業|合弁会社である。テバ・ファーマシューティカル・インダストリーズが、後発医薬品（ジェネリック医薬品）の製造メーカーである'''大洋薬品工業株式会社'''（たいようやくひんこうぎょう）を子会社とし、後に大洋薬品工業株式会社と興和テバを統合再編成する形でテバ製薬として設立。売上高468億円（2009年度実績）で後発薬国内3位の企業である。かつては大衆薬も扱っていたが、大洋薬品時代には撤退している。日本初のプロフットサルチーム「名古屋オーシャンズ（旧・大洋薬品BANFF）」のスポンサーを務めており、ホームアリーナの「武田テバオーシャンアリーナ（旧称：大洋薬品オーシャンアリーナ）」を所有する。__TOC__{{-}}"
3250,*代表者：代表取締役社長　角田礼昭　*所在地**本社：大阪市北区中之島3丁目2番4号中之島フェスティバルタワーウエスト27階**工場：兵庫県三田市テクノパーク11-1・鳥取県鳥取市南吉方3-201-2**研究所：兵庫県三田市ゆりのき台6-7-2
3250,"2002年、スイスの大手医薬品メーカー、'''エフ・ホフマン・ラ・ロシュ（:en:Hoffmann-LaRoche|FritzHoffmann-LaRoche）'''との「戦略的アライアンス」に基づきRocheグループ傘下。Rocheグループの創薬品と、旧来の中外製薬のバイオ医薬による開発力、のシナジー効果による開発パイプラインを有す。なお、実質上ロシュによる買収であるが、永山治最高経営責任者|CEO・最高執行責任者|COOは「買収ではなく戦略的提携」と発言。実際に現在も独立経営、および東証一部上場を維持している。2014年12月1日に新しいスローガンとして、「'''創造で、想像を超える。'''（英文:''INNOVATIONBEYONDIMAGINATION''）」が策定されたname\""pr141201\""http:www.chugai-pharm.co.jpnewsdetail20141201100000.html「創造で、想像を超える。」～今までにない発想で期待を超えるものづくりを～-中外製薬株式会社ニュースリリース2014年12月1日（2014年12月5日閲覧）。一般大衆薬事業をライオン(企業)|ライオンに営業譲渡するまでの主力商品で著名なものはバルサンや栄養ドリンクのグロモント、中外アルペン、中外胃腸薬等がある。"
3250,"元々富山県で化学薬品の製造・販売・研究を行う会社として1930年に富山化学研究所として創業。1936年に法人化（株式会社化）された。1961年に東京へ本社移転したが、富山県富山市にも事業所が所在する。2002年9月に大正製薬と資本・業務提携を行い、同年10月に同社との合弁で医療用医薬品の販売を行う'''大正富山医薬品'''を設立。2008年には富士フイルムホールディングスを加えた3社で戦略的資本・業務提携を結んだうえで、株式公開買付けにより富士フイルムホールディングスの傘下に入った。その際、富士フイルムホールディングスが保有する株式の一部を大正製薬に譲渡したことにより、富士フイルムホールディングスと大正製薬が出資する企業となった。2018年7月31日付けで富士フイルムホールディングスの完全子会社となったname\""taisho_hd_180514\""{{Citepressrelease|title大正富山医薬品株式会社の株式の取得（完全子会社化）及び富山化学工業株式会社の株式の売却に関するお知らせ|publisher大正製薬ホールディングス株式会社|date2018-05-14|formatPDF|urlhttps:www.taisho-holdings.co.jprelease20182018051401.pdf||access-date2018-10-15}}後、同年9月30日に富士フイルムの完全子会社を経て、翌10月1日付で富士フイルムRIファーマと合併し、解散。存続会社の富士フイルムRIファーマは富士フイルム富山化学へ社名変更した。"
3250,日本の医薬品企業（製薬メーカー）での売上高は1位であり、世界の医薬品企業の売上高順位（2016年）では16位である。アステラス製薬（旧:山之内製薬・旧:藤沢薬品工業、同18位）、第一三共（旧:三共(製薬会社)|三共・旧:第一製薬、同20位）、大塚ホールディングス（大塚製薬・アース製薬・大塚食品・大鵬薬品工業・大塚製薬工場、同21位）、エーザイ（同29位）と共に国内5大医薬品メーカーのひとつである。連結売上高の約9割を処方箋医薬品|医療用医薬品売上が占め、消化性潰瘍治療薬、制癌剤等を主力製品とする。2016年度の製品別の連結売上高の上位は、「エンティビオ」(潰瘍性大腸炎・クローン病治療剤)、「ベルケイド」（多発性骨髄腫治療剤）、「リュープロレリン」(国内製品名:リュープリン)（前立腺癌・乳癌・子宮内膜症治療剤）、「パントプラゾール」（消化性潰瘍治療剤）、「アジルバ」（高血圧症治療剤）、「デクスラント」（逆流性食道炎治療剤）、「アロゴリプチン」(国内製品名:ネシーナ」（糖尿病治療剤）、「ユーロリック」(痛風・高尿酸血症治療剤)、「コルクリス」（痛風治療剤）、「タケキャブ」(酸関連疾患治療剤)の順である。かつては農薬、ポリウレタン|ウレタン樹脂、動物用医薬品、調味料およびビタミン・バルクといった非医薬品事業も手がけていたが、これらは2000年（平成12年）から2007年（平成19年）にかけて、それぞれ、住友化学、三井化学、シェリング・プラウ、麒麟麦酒|キリンビールおよびBASFとの各合弁会社に順次移管し、従業員も転籍させ、現在は、それぞれ合弁相手の完全子会社となっている。活性炭・木材保存剤事業も分社化を経て、大阪ガスに事業譲渡|株式譲渡された。また子会社だった「武田食品工業|武田食品工業株式会社」も、2006年（平成18年）4月3日にハウス食品との共同出資会社による「ハウスウェルネスフーズ|ハウスウェルネスフーズ株式会社」に移行し、飲料部門を含む食品部門からも撤退した。なお、ハウスウェルネスフーズ|同社は2007年（平成19年）10月1日にハウス食品（当時）の完全子会社となったのを経て、2013年（平成25年）10月1日にハウス食品グループ本社の完全子会社に移行し、現在に至る。。これら事業譲渡を反映して、2004年（平成16年）7月1日に英語|英文社名を「TAKEDACHEMICALINDUSTRIESLTD.」から、現在の「TakedaPharmaceuticalCompanyLimited」に商号変更している。2017年のAnswersNewsの医薬品企業の役員報酬ランキングによると、社長のクリストフ・ウェバーが10億4800万円と開示され、従業員平均の103.3倍に上る。研究開発担当のアンドリュー・プランプも4億2500万円、取締役会長で、現在、相談役の長谷川閑史も4億900万円とされ、他企業に比し、役員報酬は高い。また、2016年6月に監査等委員会設置会社となり、取締役13名のうち、8名を社外取締役としている。他社の執行役員に相当するものとして、クリストフ・ウェバー直属幹部でグローバルな事業運営組織の長により構成される「タケダ・エグゼクティブ・チーム」（TET）を設置し、多く、日本人以外の外国人で構成されている。2018年3月、東京・日本橋本町に、武田グローバル本社(東京都中央区日本橋本町二丁目1番1号)が竣工し、7月にグランドオープンを迎える。
3250,創業地富山市での配置販売業|配置薬事業が起源。創業家の同族経営。日本全国に合計308ヶ所の営業所を設置して配置薬の販売を行っており、配置薬の分野では業界1位。テレビ・ラジオのコマーシャルメッセージ|CM（TBSテレビ|TBS系）も配置薬が中心。自社の富山工場でプライベートブランド（配置薬・セイムス等で販売）の一般用医薬品を中心とした製品生産も行っている。風邪薬の「ジキナ」・ビタミンB2・ビタミンB6製剤の「セイムビタン」が主な製品である。近年では医療用医薬品の研究開発や製造販売も行う。ドラッグストア事業は関東地方を中心に'''「ドラッグセイムス」'''の名称で店舗展開しているほか、調剤薬局も運営している。
3250,"|代表者秦　克美(代表取締役社長)group\""広報\""name\""概要\""|資本金21億108万8千円group\""広報\""name\""概要\""|発行済株式総数|売上高522億64百万円（2018年3月期）group\""広報\""name\""概要\""|営業利益|純利益|純資産|総資産|従業員数1219人（2018年3月末現在）group\""広報\""name\""概要\""|決算期|主要株主スズケン|株式会社スズケン100%|主要子会社|関係する人物|外部リンクhttp:www.skk-net.com{{jaicon}}|特記事項}}'''株式会社三和化学研究所'''（さんわかがくけんきゅうしょ）は、糖尿病・腎疾患の治療薬を中心とした医薬品、診断薬の研究開発と製造販売、また医薬品の受託製造を行う名古屋市の企業。医薬品卸大手のスズケンの子会社である。"
