5LINKS,5LINKS（ファイブリンクス ）は、東京都杉並区宮前に本社をおく折り畳み自転車の専業メーカー及びその商品名。5LINKSのネーミングには「5LINKSに乗って走るもよし、携帯するもよし、電車に、自動車に、船に、飛行機にも積んで、世界の5大陸を移動しよう」という願いが込められている。
高田工業,髙田工業株式会社（たかだこうぎょう）は、神奈川県横浜市にある自動車部品製造を主要事業とする株式会社。日産自動車との関係が強く、特殊少量生産やコンパーチブル車への改造等に特色を持つ。1950年 設立、1955年 株式会社に組織変更。資本金3億6千万円。
国瑞汽車,国瑞汽車（こくずい-きしゃ）は、台湾の自動車製造・販売会社。1984年に台北市にて設立。台湾向けにトヨタ車及び日野車を製造する目的で、台湾の和泰汽車と日本の日野自動車との合弁で設立された企業である。
今治造船,今治造船株式会社（いまばりぞうせん）は、愛媛県今治市に本社を置く造船メーカーである。新造船竣工量と造船売上高において、国内トップを誇る。
今仙電機製作所,"株式会社今仙電機製作所（いませんでんきせいさくしょ、英: Imasen Electric Industrial Co., Ltd. ）は、愛知県犬山市に本社を置く独立系自動車部品メーカー。"
佐世保重工業,佐世保重工業株式会社（させぼじゅうこうぎょう）は、長崎県佐世保市に主要拠点を置く重工業を生業とする企業。名村造船所の完全子会社。通称はSSK。設立当初の社名である佐世保船舶工業の頭文字である。
阪神内燃機工業,阪神内燃機工業株式会社（はんしんないねんきこうぎょう）は、兵庫県神戸市に本社を置く舶用機関（ディーゼルエンジン）メーカー。旧小曽根財閥系企業である。
三ヶ島製作所,株式会社三ヶ島製作所（みかしませいさくしょ）は、自転車部品メーカー。
三井造船,三井造船株式会社（みついぞうせん）は、造船、機械、プラントなどを手掛ける三井系の重工業メーカー。
三五,"株式会社三五（さんご、英: SANGO Co., Ltd. ）は、愛知県みよし市に本社を置く自動車部品メーカー。"
三菱ふそうトラック・バス,三菱ふそうトラック・バス株式会社（みつびしふそうトラック・バス、英語：Mitsubishi Fuso Truck and Bus Corporation）は、商用車（トラック・バス等）および産業用エンジンの製造会社である。ドイツの自動車会社ダイムラーの連結子会社である。プレスリリースや経済誌などでは「MFTBC」の略称も用いられている。国内トラック販売シェアは第三位（2011年）。
三菱ふそうバス製造,三菱ふそうバス製造株式会社（みつびしふそうバスせいぞう）は三菱ふそうトラック・バス傘下のバス生産会社である。同社製のバス生産を一手に担当する。本社は富山県富山市婦中町道場にある。また、キャンターなどトラック用バンボディの箱も製造していたが、トラック事業部が2006年（平成18年）3月で廃止（バンボディの製造は2005年（平成17年）11月で終了）されたため、今はバス専業となった。
三菱航空機,三菱航空機株式会社（みつびしこうくうき、英: Mitsubishi Aircraft Corporation）は、日本の航空機メーカー。小型旅客機「MRJ」 (Mitsubishi Regional Jet)を開発・販売する目的で設立された、三菱重工業の子会社。本社は愛知県西春日井郡豊山町 名古屋空港内。
三菱自動車エンジニアリング,"三菱自動車エンジニアリング株式会社（みつびしじどうしゃエンジニアリング、Mitsubishi Automotive Engineering Co.,Ltd.）は、三菱自動車工業系の企業である。三菱自動車工業100%子会社。略称はMAE。主な事業は三菱自動車工業が生産する乗用車部品の計画、設計、試験、販売。また特装車の開発、カスタム用品の開発、自動車生産をする際の技術提供など。"
三菱自動車工業,三菱自動車工業株式会社（みつびしじどうしゃこうぎょう、英語：Mitsubishi Motors Corporation、略称：MMC）は、三菱グループに属する日本の自動車メーカーである。1970年に三菱重工業から独立した。通称は三菱自動車（みつびしじどうしゃ）、または三菱自工（みつびしじこう）。日本国外ではMITSUBISHI MOTORS（ミツビシ モータース）という表記を用いていたが、日本国内でも「MMC 三菱自動車」から「MITSUBISHI MOTORS」というロゴを1999年1月より使用するようになった。グローバルブランドスローガンは「Drive@earth」（ドライブ・アット・アース）。
三陽製作所,株式会社三陽製作所（さんようせいさくしょ）は、愛知県刈谷市井ヶ谷町に本社をおく輸送用機械器具製造メーカー。主にプレス加工による自動車部品の製造を行っている。
四国ドック,"四国ドック株式会社（しこくドック）は、三井造船系の造船会社。香川県高松市に本社及び工場を持つ。22,000 tonの船台を持ち、主に高付加価値中型バルクキャリアの建造に従事している。"
自動車部品工業,"自動車部品工業株式会社（じどうしゃぶひんこうぎょう、英: Jidosha Buhin Kogyo Co., Ltd.）は、神奈川県海老名市に本社を置く産業用ディーゼルエンジン及び各種車両用機能部品の製造、開発設計・実験を行う企業である。近年は、幅広い自動車関連メーカーへの供給実績を重ねている。2013年、同じくいすゞ自動車と関係の深いアイメタルテクノロジー・TDFと経営統合し、持株会社IJTテクノロジーホールディングスの完全子会社となった。"
住江工業,"住江工業株式会社（すみのえこうぎょう、Suminoe Industries Co.,Ltd ）は、京都府京田辺市に本社/工場を置く鉄道車両や乗用車、バス車両、船舶関連の車両座席のメーカーである。"
曙ブレーキ工業,"曙ブレーキ工業株式会社（あけぼのブレーキこうぎょう、Akebono Brake Industry Company, Limited）は、日本の自動車部品メーカーである。"
小川ポンプ工業,小川ポンプ工業株式会社（おがわぽんぷこうぎょう、英称：OGAWA PUMP INDUSTRIAL COMPANY）は、大阪府大阪市に本社がある、消防車両の緊急自動車・特種用途自動車の艤装・販売を行う企業である。特に地元の大阪市消防局に納入されている全長の短いスモールタンク車は、狭い路地の多い大阪市内を機動的に活動できる車両として評判を得ている。また、オフィスやマンション、ホテルなどのビルや工場などの防火・消火設備、そして小型消防ポンプや消火器などの防災用品まで、多岐、多様にわたる「消防」「防災」関連品を製造、販売している。
小田急車両工業,小田急車両工業（おだきゅうしゃりょうこうぎょう）とは、本社を神奈川県小田原市に置く、小田急グループの車両の整備・販売を行う会社である。2013年3月31日を持ち業務を終了した[1]。なお、同年4月1日以降の鉄道車両整備事業は小田急エンジニアリングが引き継いでいる。
小田原機器,株式会社小田原機器（おだわらきき）は、神奈川県小田原市に本社を置くバスの運賃箱や両替機などを製造する会社。
小島プレス工業,小島プレス工業株式会社（こじまプレスこうぎょう、英: KOJIMA INDUSTRIES CORPORATION ）は、愛知県豊田市に本社を置く自動車部品を製造する企業。陸上競技大会に登録している実業団でもある。
小平産業,小平産業株式会社（こだいらさんぎょう、英: Kodaira sangyo Corporation）は、栃木県小山市に本社を置く、輸送機器メーカーである。トレーラー、ダンプトラックボディ、ウィングボディなどの製造・販売を行っている。
昭和飛行機工業,昭和飛行機工業株式会社（しょうわひこうきこうぎょう）は、機械メーカーで三井造船の連結子会社。
湘南ユニテック,株式会社湘南ユニテック（しょうなんゆにてっく）は、神奈川県高座郡寒川町に本社を置く、主に自動車部品や建設機械部品の製造販売を行う自動車・機械部品の製造会社である。
常石造船,"常石造船株式会社（つねいしぞうせん、英語: Tsuneishi Shipbuilding Co., Ltd.）は、日本の大手造船メーカー。通称「つねぞう」。"
信貴造船所,株式会社信貴造船所（しぎぞうせんじょ）は、大阪府堺市堺区に本社をおく小型船舶メーカー。
新トモエ電機工業,新トモエ電機工業株式会社（しんともえでんきこうぎょう）は、蓄電池機関車、無人搬送システム等を製造する日本の輸送用機器メーカーである。本項目では、前身のトモエ電機工業としての沿革、製品等も含めて記述する。
新潟原動機,"新潟原動機（にいがたげんどうき、Niigata Power Systems Co., Ltd.）は、東京都千代田区外神田にある舶用・陸用・車両用のディーゼルエンジン・ガスタービン・Z型推進装置などの製造・販売を行うIHIグループの企業である。旧・新潟鐵工所の原動機部門が前身であり、1919年（大正8年）の新潟鐵工所時代には、国内で初となる産業用ディーゼルエンジンを開発している。"
新潟造船,新潟造船株式会社（にいがたぞうせん）は、新潟県新潟市中央区に本社を置く日本の造船業者。2003年（平成15年）4月1日に三井造船の100%子会社として設立され、会社更生中の新潟鐵工所の造船部門の営業譲渡を受け営業開始。新潟市及び三浦市に工場を持つ。
新幹線エンジニアリング,新幹線エンジニアリング株式会社（しんかんせんエンジニアリング）は新幹線車両の検査・修繕を行なう東海旅客鉄道の子会社。東海道新幹線の客室や台車の点検・整備、超音波探傷試験、空気調和設備の整備などを担当している。また、これらで培った技術を活かしてバスやフォークリフトの整備も行なっている。
新明和工業,"新明和工業株式会社（しんめいわこうぎょう、英: ShinMaywa Industries, Ltd.）は、兵庫県宝塚市に本社を置く日本の輸送機器製造会社である。第二次世界大戦前は川西財閥傘下の航空機製造会社であった。"
新来島どっく,"株式会社新来島どっく（しんくるしまどっく、Shin Kurushima Dockyard CO.,LTD.）は、東京都千代田区に本社を置く造船メーカーである。旧・来島どっく。来島どっく時代には、経営者の坪内寿夫の下、独自のコスト削減などの経営手法により、愛媛県を中心に一大企業グループを築いた。1980年代の造船不況で坪内は経営から退き、新来島どっくとして再発足。グループ会社も複数傘下を離れた。"
新来島豊橋造船,"株式会社新来島豊橋造船（しんくるしまとよはしぞうせん、英語: Shin Kurushima Toyohashi Shipbuilding Co.,LTD.）は、愛知県豊橋市に本社を置く日本の造船会社である。一般社団法人日本造船工業会の会員。"
神戸発動機,"神戸発動機株式会社（こうべはつどうき、英文名称:Kobe Diesel Co., Ltd.）は、兵庫県明石市に本社を置く発動機メーカー。主力製品は主機用大型ディーゼル機関など。"
西日本車体工業,西日本車体工業株式会社（にしにっぽんしゃたいこうぎょう）は、かつて福岡県北九州市小倉北区西港町に本社を置き、バス車両の車体部分を製造していたメーカー（コーチビルダー）。西日本鉄道（西鉄）の連結子会社（議決権100%：間接保有含む）で、略して西工（にしこう）、またはNSKとも呼ばれる。
青島四方機車車輛,"青島四方機車車輛股有限公司（Qingdao Sifang Locomotive & Rolling Stock Co., Ltd. ）は中華人民共和国の山東省青島市にある鉄道車輛の設計、製作を行う中国南車（現中国中車）のグループ企業。"
川崎重工業,川崎重工業株式会社（かわさきじゅうこうぎょう）は、二輪車・航空機・鉄道車両・船舶等の輸送機器、その他機械装置を製造する日本の企業である。
川南工業,川南工業（かわなみこうぎょう）は長崎県西彼杵郡香焼村にあった造船会社。南極観測船「宗谷」建造の造船所として知られる。
浅川造船,"浅川造船株式会社（あさかわぞうせん、英語: ASAKAWA SHIPBUILDING Co.,Ltd.）は、愛媛県今治市に本社を置く造船会社。"
双竜自動車,雙龍自動車（サンヨンじどうしゃ、、そうりゅうじどうしゃ、SsangYong Motor Company）は韓国の準大手自動車メーカー。株式の70%はインドのマヒンドラが保有。朝鮮語での漢字は「雙龍自動車」（「雙」は「双」の旧字体）。日本語では「雙龍」の他、「双龍」とも表記される。国内向けも輸出向けも「雙龍」ブランドを名乗るが、韓国国内では「S」をモチーフにしたCIマークを採用するのに対し、輸出向けは鹿の角を連想させるCIマークを採用する。これは、世界的に見ても珍しいケースである。
総合車両製作所,株式会社総合車両製作所（そうごうしゃりょうせいさくしょ、英称：Japan Transport Engineering Company、英略称：J-TREC）は、鉄道車両メーカーである。東日本旅客鉄道（JR東日本）の完全子会社。
村上開明堂,株式会社村上開明堂（むらかみかいめいどう、英: Murakami Corporation）は、日本の自動車用バックミラーなどを製造する部品メーカーであり自動車用バックミラー製造では国内首位である。本社は静岡県静岡市にある。
村上秀造船,"村上秀造船（むらかみひでぞうせん、英語: Murakami Hide Shipbuilding Co.,Ltd.）は、愛媛県今治市伯方町に本社・工場を置く日本の造船メーカー。"
太平洋工業,"太平洋工業株式会社（たいへいようこうぎょう、英: Pacific Industrial Co., Ltd. ）は、岐阜県大垣市に本社を置く自動車部品や家電製品、電子機器製品を製造・販売する企業である。"
台湾車輌,台湾車輌（たいわんしゃりょう）は台湾の鉄道車両製造メーカーである。
大宇バス,"ザイル大宇バス（だいうバス、ザイルデーウバス、Zyle Daewoo Bus ）は大韓民国の自動車メーカーで、もとは大宇自動車（乗用車部門は韓国GMに事業を移管）のバス部門である。2002年10月設立。本社は釜山広域市。韓国国内での販売は他の旧大宇系自動車メーカー同様、大宇自動車販売が担当する。現行の最高級モデルであるBX212/Hは日本にはじめて輸出された韓国製バス車両である。日本に輸出されている車両は""右ハンドル仕様""の日本専用仕様で、2005年5月にサンデン観光バス（山口県のバス会社サンデン交通の子会社）に初導入された。同クラスの日本製バスに比べて約2/3の低価格を売りに、現在までに観光バス専業事業者を中心に数社での導入実績がある。日本ではウィラー・アライアンス、サンデン交通など複数の代理店によって販売が行われている。"
大宇造船海洋,大宇造船海洋（だいうぞうせんかいよう）は、大韓民国の造船会社。大韓民国の造船ビッグ3の一社でもある。
大原鉄工所,株式会社大原鉄工所 （おおはらてっこうじょ、英語社名:OHARA Corporation) は、新潟県長岡市に本社を置く環境関連機器と日本国内唯一の雪上車メーカーで、スキー場ゲレンデ整備車では日本国内トップシェア45％（日本国内では約1500台が稼働）と南極観測隊用雪上車メーカーとして有名である。
大阪車輌工業,大阪車輌工業株式会社（おおさかしゃりょうこうぎょう）は、鉄道車両、トロリーバス、特装車、大型照明鉄塔、スコアボードの製造を手がける製造会社である。本社は大阪府大阪市住之江区南港東九丁目4番45号にある。
大島造船所,株式会社大島造船所（おおしまぞうせんじょ）は、長崎県西海市に本社を置く日本の造船会社である。かつて炭鉱の島であった大島町が、炭鉱の閉山に際して企業誘致を行った結果として1973年（昭和48年）2月7日にダイゾー、住友商事、住友重機械工業の出資により設立された。
大東プレス工業,"大東プレス工業株式会社（だいとうプレスこうぎょう、英称：DAITO PRESS Mfg. Co., Ltd.）は、大阪市鶴見区横堤に本社を置く、自動車部品及びプレス加工品のの製造販売をおこなう企業である。"
大同メタル工業,"大同メタル工業株式会社（だいどうメタルこうぎょう、Daido Metal Co., Ltd. ） は、愛知県名古屋市中区と東京都品川区に本社を置く軸受メーカーである。"
大同電力機車,"大同電力機車有限責任公司（Datong Electric Locomotive co., Ltd.）は中華人民共和国山西省大同市にある鉄道、軌道車輛の設計、製作を行う中国北車集団のグループ企業。"
大連機車車輛,"大連機車車輛有限公司（Dalian Locomotive and Rolling Stock Co., Ltd. ）は中華人民共和国の遼寧省大連市にある鉄道、軌道車輛の設計、製作を行う以前は中国北車集団、現在は中国中車グループの企業。"
筑水キャニコム,"株式会社筑水キャニコム(ちくすいキャニコム、英称：CHIKUSUI CANYCOM,INC.)は、国内大手の産業機械運搬車（農業機械、建設機械、林業機械等）の不整地運搬車メーカー。"
中央精機,"中央精機株式会社（ちゅうおうせいき、英: CENTRAL MOTOR WHEEL Co., LTD.）は、愛知県安城市に本社を置くトヨタ自動車の子会社で自動車用ホイールメーカーである。スチールホイールやアルミホイールのほか、自動車用LPGボンベの製造を行っている。"
中華汽車,中華汽車（ちゅうかきしゃ、China Motor Corporation; CMC）は台湾の裕隆企業集団に属する自動車メーカー。三菱自動車工業の現地パートナーである。
中京車体工業,中京車体工業株式会社（ちゅうきょうしゃたいこうぎょう）は、愛知県名古屋市緑区鳴海町字下汐田に本社を置く特種用途自動車の設計・製造を手がける架装メーカー。代表者は、代表取締役会長、森博一、代表取締役社長、森孝義。代表取締役会長 森博一は愛知県名古屋市天白区植田西にあるタクシー会社丸八交通株式会社代表取締役会長も務める。
天龍工業,"天龍工業株式会社（てんりゅうこうぎょう、Tenryu Industries Co.,Ltd ）は、富山県富山市に本社を置く鉄道車両・バス・船舶用シートなど製造する企業である。"
田中精密工業,田中精密工業株式会社（たなかせいみつこうぎょう）は、富山県に所在する自動車部品製造メーカーである。本田技研工業の関連会社。社訓は『仕事の鬼となれ』。
唐山軌道客車,"唐山軌道客車有限責任公司（Tangshan Railway Vehicle Co.,Ltd. ）は唐山市豊潤区にある鉄道、軌道車輛の設計、製作を行なう中国北車集団のグループ企業。"
東亜工機,東亜工機（とうあこうき）とは、佐賀県鹿島市に本社を置く船舶部品メーカー。船舶用ディーゼルエンジンシリンダライナー製造のトップメーカーであり、内径600mm以上の大型では世界シェアの40%、日本国内シェア70%を占める。ボロン鋳鉄技術をコア技術としている。2006年に元気なモノ作り中小企業300社に選定された。2009年、社に所属する井手が、海事関係功労者として第3回ものづくり日本大賞内閣総理大臣賞を受賞。
東海マツダ販売,東海マツダ販売株式会社（とうかいマツダはんばい）は、愛知県・岐阜県・三重県を営業エリアとするマツダのカーディーラー。通称「東海マツダ」。
東海交通機械,"東海交通機械株式会社（とうかいこうつうきかい、英: Tokai Rolling Stock & Machinery Co., Ltd.）は、愛知県に本社を置く東海旅客鉄道(JR東海)の子会社（連結子会社）。"
東海理化電機製作所,株式会社東海理化電機製作所（とうかいりかでんきせいさくしょ、略称:東海理化）は愛知県丹羽郡大口町に本社を置くトヨタグループ大手自動車部品メーカー。
東急テクノシステム,"東急テクノシステム株式会社 （とうきゅうテクノシステム、 TOKYU TECHNO SYSTEM CO., LTD ）は、1940年（昭和15年）に設立された東京急行電鉄のグループ会社。同社の鉄道車両改造（他社譲渡用・更新工事）、ビルや高速道路などの建築物保守を行う企業である。"
東急車輛製造,東急車輛製造株式会社（とうきゅうしゃりょうせいぞう、英称:Tokyu car corporation）は、東急グループの企業で東京急行電鉄（東急）の完全子会社である横浜金沢プロパティーズ株式会社の2014年までの商号。1948年（昭和23年）から2012年（平成24年）までは鉄道車両および特装車・立体駐車装置などを取り扱っていた製造業であったが、現在は不動産賃貸業を行う企業として存続しており、2014年に商号を横浜金沢プロパティーズ株式会社に変更した。
東京アールアンドデー,株式会社東京アールアンドデー（とうきょうアールアンドデー、東京R&D）は、東京都千代田区に本社を置く自動車・メカトロニクス・複合材料などの研究開発を行う企業である。量産車・競技用車両・関連部品などの研究開発・設計・試作や、カドウェルなどのレーシングカーの開発、スポーツ用品の開発など幅広い活動を行っている。1998年には、長野オリンピックのスピードスケート・男子500mで、清水宏保が同社製のスケート靴を使用し金メダルを獲得した。また、スポーツカーVEMACの輸入・販売も行っている。なお同社のレース部門の子会社であったR&D SPORTは、2008年3月末に資本関係を解消して独立しており、現在は全く関係はない。
東京ラヂエーター製造,"東京ラヂエーター製造株式会社（とうきょうラヂエーターせいぞう、Tokyo Radiator MFG. Co., Ltd. ）は、ラジエター、オイルクーラー、EGRクーラーを製造する自動車用部品メーカーである。近年では、国内外のディーゼルエンジンの排ガス規制に対応したEGRクーラーを柱とした環境対応製品群を市場に投入し、地球環境の保全に貢献した製品造りを行っている。"
東京特殊車体,東京特殊車体株式会社（とうきょうとくしゅしゃたい）は、後述する特殊車両の設計・製造をする株式会社。京王グループに属する。本社は東京都八王子市長沼町にある。
東京濾器,"東京濾器株式会社（とうきょうろき、Tokyo Roki Co., Ltd. ）は、フィルター（濾過器）の製造を行う企業。自動車用フィルターが事業の中核であるが、複写機や家電製品部品などにも展開している。"
東光産業,東光産業株式会社（とうこうさんぎょう）は、東京都江東区に本社を置く鉄道機器のメーカーである。
東南汽車,東南汽車（英：Soueast Motor、SEM、簡体字：南汽）は、中国の自動車メーカーである。
東風本田汽車,"東風本田汽車有限公司（とうふうほんだきしゃゆうげんこうし、ドンフェンほんだきしゃゆうげんこうし、簡体字：本田汽有限公司、英字：Dongfeng Honda Automobile Co., Ltd.、通称：東風ホンダ）は、本田技研工業が東風汽車との合弁で設立した中国で四輪自動車の製造と販売を行う会社である。"
