5LINKS,5LINKS（ファイブリンクス ）は、東京都杉並区宮前に本社をおく折り畳み自転車の専業メーカー及びその商品名。5LINKSのネーミングには「5LINKSに乗って走るもよし、携帯するもよし、電車に、自動車に、船に、飛行機にも積んで、世界の5大陸を移動しよう」という願いが込められている。
いすゞ車体,いすゞ車体株式会社（いすずしゃたい）は、神奈川県藤沢市に本社を置く、いすゞ自動車が製造する商業車の仕様変更・仕様追加・改造工事を取り扱う架装メーカーである。いすゞ自動車販売（旧称：いすゞネットワーク）の100%子会社である。
イズミ車体製作所,"株式会社イズミ車体製作所（イズミしゃたいせいさくしょ、Izumi Motor Car Co., Ltd. ）は、熊本県菊池郡大津町大字岩坂3258-4に本拠を置く、バスや特殊車両の車体を製造するメーカー（コーチビルダー）。通称「イズミ車体」。"
イヅミ工業,"イヅミ工業株式会社（イヅミこうぎょう、IZUMI MACHINE MFG. Co., Ltd. ）は、愛知県大府市に本社を置く、工作機械および自動車部品メーカー。豊田自動織機の連結子会社。"
イルモア,イルモア・エンジニアリング (Ilmor Engineering) は、イギリスのレース専門のエンジンメーカー。創業者はマリオ・イリエン (Mario Illien) とポール・モーガン (Paul Morgan) 。ともにコスワースで腕を鳴らしたエンジニアであり、また企業名は二人の姓の一部を取って組み合わせたものである。
イワキテック,イワキテック株式会社（いわきてっく）は、船舶部品や大型クレーンなどを製造する日本の企業である。ハッチカバーの生産に強みを持つ。200メートル超級の大型船舶のハッチカバー・リフタブルデッキやブロック製造など船舶設備の製造を手掛けている。
ウルトラ・モーター,ウルトラ・モーター(Ultra Motor ltd)は、英国に本社を置く電動スクーターの生産、販売会社。電動スクーターを欧州の他、アメリカ、インドなどで販売している。
エアバス,エアバス（仏: Airbus S.A.S. フランス語: [bys] (13px 聞く) ドイツ語発音: [bs] 英語発音: [rbs] スペイン語発音: [erβus]）は、ヨーロッパ（欧州連合の内の4カ国）の国際協同会社で、航空宇宙防衛企業のエアバス・グループ傘下にある航空機メーカーである。設立当初の事業体の名称はエアバス・インダストリー G.I.E.（仏: G.I.E. Airbus industrie）であったが、2001年に法人化されて現社名に変更された。本社はフランス・トゥールーズ。
エクスカリバー・アルマース,エクスカリバー・アルマース（英語: Excalibur Almaz）は民間宇宙飛行企業であり、近代化したTKS宇宙船とアルマース宇宙ステーションを利用しての有人宇宙飛行を計画している。これらの宇宙機は、かつて非公表であったソビエトの宇宙計画を基にしている。サービス（ミッション）としては、軌道宇宙旅行と微小重力環境下における実験のためのテストベッドが提供される見通し。2009年の発表では、打ち上げ試験が2012年、商業飛行は早ければ2013年にも開始するとしていたが、2012年の発表では、ミッションに月周回軌道への有人飛行が追加された上で、テスト飛行が2014年へと延期されている。
エクセディ,株式会社エクセディ（英: EXEDY Corporation）は、大阪府寝屋川市に本社を置く自動車部品メーカー。主に自動車のクラッチとトルクコンバータ、二輪車用クラッチ、建設・産業・農業機械用のクラッチ・トランスミッションを製造している。旧社名は「株式会社大金製作所」だが、ダイキン工業の関連会社ではない。
エクリプス・アビエーション,エクリプス・アビエーション (Eclipse Aviation) は、アメリカ合衆国の航空機メーカーで、主に超軽量ジェット機 (VLJ) の製造を行っていた。元マイクロソフトのVern Raburnによって、1998年設立。本社所在地はニューメキシコ州アルバカーキ。他に、ウィリアムズ・インターナショナル等からの出資を受けていた。2009年には会社清算され、現在では再建されるかどうか評価されている。
エッチ・ケー・エス,株式会社エッチ・ケー・エス（HKS）とは、静岡県富士宮市に本社を置く自動車部品製造販売会社である。
エフ・シー・シー,"株式会社エフ・シー・シー（英: F.C.C. Co., Ltd.）は日本のクラッチメーカーである。主な製品は自動車・オートバイ・汎用機のクラッチで二輪では世界首位である。オートバイに関しては国内四大メーカー（ホンダ・ヤマハ・スズキ・カワサキ）のすべてのオートバイにクラッチを供給しており、国内シェアは100%である。自動車に関してはホンダの全車種、スズキ・富士重工業・フォード・モーターの一部車種に供給している。"
エフテック,株式会社エフテックは、埼玉県に本社を置く、本田技研工業系列の大手自動車部品メーカー。主要取引先は、本田技研工業、日産自動車、スズキ、ゼネラルモーターズ、いすゞ自動車、トヨタ自動車、ダイハツ工業、三菱自動車工業など。
エンケイ,エンケイ株式会社（Enkei Corporation ）は日本、北米、中国、タイ、インド、マレーシアなどに拠点を持つ大手自動車部品メーカーである。本社は静岡県浜松市。
エンドレス・アドバンス,"株式会社エンドレスアドバンス（Endless Advance Co., Ltd. ）は、長野県佐久市に本社を置く自動車チューニングパーツメーカー。"
オージ,"株式会社オージ （Oji Co.,ltd.） は、東京都北区に本社を置くバスの方向幕・降車ボタン等を製造する輸送機器メーカーである。1948年8月設立。"
オージーケー技研,"オージーケー技研株式会社（オージーケーぎけん、英称：OGK Co., Ltd. ）は大阪府東大阪市に本社を置く自転車用品ならびに自転車部品の製造ならびに総合的な二輪の乗用に際する製品を開発している企業である。一般的には自転車からスクーター・普通ならびに大型乗用二輪まで多種にわたるヘルメットの製造メーカーとして知られている。"
オーテックジャパン,"株式会社オーテックジャパン（AUTECH JAPAN, INC.）は、日産自動車グループの一社であり、日産の特装車事業などを手がける。"
オートテクニックジャパン,"株式会社オートテクニックジャパン (AutoTechnicJapan CO.,LTD; ATJ) は、4輪、2輪、汎用製品の組立・整備・調整や実装・実機テスト等を行うテストプロデュースカンパニーである。"
オートワークス京都,株式会社オートワークス京都（- きょうと）は、京都府宇治市に本社を置く、自動車の車体製造・架装を行う企業である。もともとは「日産車体京都工場」であり、2001年に同社子会社として分離独立してできた企業である。
オービタル・サイエンシズ,オービタル・サイエンシズ（英: Orbital Sciences Corporation、通称OSC、またはOrbital）は、人工衛星の製造・打ち上げを行うアメリカ合衆国の企業である。バージニア州のダレスに本社を持つ。打ち上げシステムグループはミサイル防衛とも関わっている。かつてはORBIMAGE（現GeoEye）とGPSレシーバーのMagellan lineも有していたが、タレスに売却している。2014年4月29日に、ATK社の航空宇宙・防衛部門と対等合併することで合意し、オービタルATK社（Orbital ATK Inc.）を新社名にすることになった。この合併は、2015年2月10日に実施される。
カーメイト,株式会社カーメイトは、東京都豊島区に本社を置く、カー用品などを製造・販売している企業である。
カキモトレーシング,カキモトレーシングは、大阪府堺市西区にある自動車部品製造会社。とくにマフラーの分野で有名である。ロゴは柿本改。
カナサシ重工,株式会社カナサシ重工（カナサシじゅうこう）は、静岡県静岡市清水区に本社を置く日本の造船会社である。
カモフ,"株式公開会社「カモフ」（ロシア語 ОАО ""Камов"" カーモフ）は、ロシア連邦の航空機メーカーであった。ソ連時代は設計局の企業形態を取っていたが、1992年に株式会社化されている。ニコラーイ・イーリイチ・カーモフ(Николай Ильич Камов)とニコラーイ・キリーロヴィチ・スクルジーンスキイ(Николай Кириллович Скржинский)の結成した航空機開発チーム「KASKR」がもととなって発足した。カモフ会社（Фирма Камов フィールマ・カーモフ）とも呼ばれる。2007年にミルなどと合併し、ロシアン・ヘリコプターズとなった。"
カルソニックカンセイ,カルソニックカンセイ株式会社（英: Calsonic Kansei Corporation）は、日本の大手自動車部品メーカー。1938年創立。東京証券取引所第1部上場。元々日産自動車との関係が非常に深い会社で、2005年1月に日産が同社の株式の第三者割当増資を引き受けたことで、日産の連結子会社に加わっている。
カワサキモータースジャパン,株式会社カワサキモータースジャパンは、川崎重工業の子会社。日本での川崎重工製のオートバイやジェットスキーなどの販売を行う。
カワムラサイクル,株式会社カワムラサイクルは、兵庫県神戸市西区に本社を置く車椅子等介護用品メーカー。2013年3月、マックス株式会社 によるTOBにより同社の完全子会社となり、上場廃止。
キタコ,株式会社キタコは、大阪府東大阪市に本社を置くオートバイパーツの企画・開発、製造・卸販売を行う企業である。
キャノンデール,キャノンデール（英語：Cannondale Bicycle Corporation ）は1971年に創業されたアメリカ合衆国の自転車メーカーであり、社名はコネチカット州の駅の名前から採ったものである。高品質で高性能のアルミ自転車を開発・製造するメーカーとして強みを持つメーカーであり、フレーム以外にも自転車部品、サイクルウェアなどの自転車関連商品も製造販売している。これらはそれぞれ業界で新たな製品カテゴリーを切り開いてきた。自転車ロードレースチームのキャノンデール・プロサイクリングのメインスポンサーである。
グラマン,グラマン（Grumman Aircraft Engineering Corporation、後にGrumman Aerospace Corporation）はアメリカ合衆国の航空機メーカー。1929年に設立され、20世紀の長い期間に亘って軍用機および民間機のトップメーカーの一つであったが、1994年にノースロップ社と合併して、ノースロップ・グラマンになった。
ケーニッグゼグ,ケーニッグゼグ・オートモーティブ（Koenigsegg Automotibe AB ）は、1994年にスウェーデン南部、エンゲルホルムに設立されたスーパーカーメーカーである。
ケーヒン,株式会社ケーヒン（Keihin Corporation ）は、本田技研工業（ホンダ）系最大手の総合システムメーカー。本社は東京都新宿区。なお、アスベスト製品の不正納入で書類送検された京浜バルブ工業とは、一切関係・関連がない。
ゴールドキング,ゴールドキング株式会社は、愛知県名古屋市中川区に本社をおく日本の輸送機器製造メーカーである。
コンチネンタル・オートモーティブ,"コンチネンタル・オートモーティブ株式会社 (Continental Automotive Corporation) は、自動車部品サプライヤーの世界的大手であるドイツのコンチネンタル（以下コンチ社）と、日本国内ブレーキ市場の大手である日清紡の共同出資で設立された合弁企業である。旧名コンチネンタル・テーベス株式会社 (Continental Teves Corporation) 。事業内容は、自動車関連ブレーキシステムの開発・設計・製造・販売。日清紡の生産ラインを生かし、日本での一貫生産体制を構築している。立場的には、コンチネンタル・オートモーティブ・システムズ（コンチ社の自動車関連システム部門）の日本拠点である。コンチネンタル・オートモーティブ・システムズ・ジャパン株式会社（CAJ, 旧名シーメンスVDOオートモーティブ）との協調体制を主導している。"
サード_(企業),株式会社サード（SARD Corporation ）は、主にトヨタ系などの車のアフターパーツを扱うメーカー。本社は愛知県豊田市。トヨタ製レーシングカーを使用してモータースポーツ活動も行っている。
サーブ・オートモービル,サーブ・オートモービル (Saab Automobile AB ) はスウェーデンの自動車メーカー。
サイモト自転車,サイモト自転車株式会社（さいもとじてんしゃ）は、大阪府堺市にある自転車メーカーである。
サノヤスホールディングス,サノヤスホールディングス株式会社（Sanoyas Holding Corporation）は、大阪府の造船メーカー等を営む企業の持株会社。
ジーエムいちはら工業,ジーエムいちはら工業株式会社は、栃木県鹿沼市に本社を置く、消防車メーカーである。ポンプ車、はしご車、消防艇などの製造・販売を行っている。
ジーピースポーツ,GP-SPORTS（ジーピースポーツ）は、新潟県三条市に本社を置く輸送用機器の企業。ドリフト等のスポーツカーを中心とした自動車部品（主にエアロパーツ、サスペンション、マフラーなど）の製造・販売を主力としている他、アップガレージ向けのマフラーをOEM製造している。首都圏や京阪神には、チューニング等を専門に行う店舗は数多く存在するが、地方の新潟県を軸にし、全国的に名を馳せる珍しい会社である。毎年熱走!! Exciting Car Showdownで、デモカーの出展を行う等、その活動力には、定評がある。
ジェイ・バス,ジェイ・バス株式会社（J-BUS LTD.）は、日野自動車といすゞ自動車が合弁で設立した会社。日本国内向けバスの製造を行っている。本店は石川県小松市串町工業団地30番地（小松事業所内）、東京本部は神奈川県川崎市川崎区駅前本町3番1号。社名は、日野・いすゞ両者の「Joint（結合）」を表す「J」、また日野（Hino）の「H」・いすゞ（Isuzu）の「I」を次ぐアルファベットの「J」に由来する。
シトロエン,オトモビル・シトロエン（Automobiles Citron）は、フランスの大手自動車メーカー。現在はPSA・プジョーシトロエン・グループの一企業となっている。いち早い前輪駆動方式の採用や、窒素ガスを気体バネに用いて高圧油圧制御する独自のサスペンション機構「ハイドロニューマチック」の開発などでも知られる。
シマノ,株式会社シマノ（英: SHIMANO INC. ）は、大阪府堺市堺区に本社を置くアウトドアスポーツ用品会社。自転車部品と釣具の製造をその主要な事業とし、自転車パーツメーカーとしては世界最大である。かつてはゴルフ用品やスノーボードのビンディング・ブーツも製造販売していたが、ゴルフは2005年、スノーボードも2009年3月31日をもって終了した。取扱品目の性格上、従業員の自転車通勤も積極的に奨励している。
ジャッド,ジャッド（Judd）は、イギリスのレーシングエンジンビルダーである「Engine Developments Ltd.」社の通称、並びに同社が開発・製造するレース用エンジンのブランド名。1971年にジョン・ジャッド、ジャック・ブラバムの2人により創設された。
ジヤトコ,ジヤトコ株式会社 (英語: JATCO Ltd) は日産自動車グループの自動車部品メーカー。主な製品は自動車の変速機であり、納入先は日産自動車のみならず国内外多数の自動車メーカーに及ぶ。AT/CVT製作において世界最大級の企業である。当初は日産自動車の一部門であったが、AT関連の特許問題回避のため、1970年（昭和45年）にフォード、東洋工業（現・マツダ）との合弁会社となり、1981年（昭和56年）にフォード資本、1999年（平成11年）にマツダ資本がそれぞれ撤退し、2002年（平成14年）の業務提携で三菱自動車工業が2割ほどの株式を保有することとなった。製品は日産、三菱、スズキのほか、ゼネラルモーターズ（GM）等にも供給される。
ジャパン_マリンユナイテッド,ジャパン マリンユナイテッド株式会社（英語: Japan Marine United Corporation）は、2013年1月1日にユニバーサル造船株式会社と株式会社アイ・エイチ・アイ マリンユナイテッドが合併して誕生した日本の造船会社である。
ジャムコ,株式会社ジャムコ（JAMCO CORPORATION）は、日本の航空機用内装品メーカー。本社は東京都三鷹市にある。伊藤忠商事系列。
ショーワ,株式会社ショーワ（英: Showa Corporation ）は、大手自動車部品メーカー。本社は埼玉県行田市。東証一部上場。二輪・四輪車向けショックアブソーバー（緩衝器）およびパワーステアリングシステムを主力製品とし、輸送用機器の精密機能部品などを製造。本田技研工業系列だが、日本国内外のメーカーにも部品を供給している。自社ブランドとして、高性能ショックアブソーバーＳＥＴを発売している『 ＳＨＯＷＡ ＴＵＮＩＮＧ 』がある。 （製造元 株式会社ショーワ ／ 発売元 ＳＰＫ株式会社）
シロキ工業,シロキ工業株式会社（シロキこうぎょう、英: Shiroki Corporation）は、愛知県豊川市に本社を置く自動車部品製造業を行う企業である。ウィンドレギュレータ、ドアサッシなどの自動車部品を製造、在宅用多機能介護ベッドなどの福祉用品、列車用シートなどを製造している。
スギノエンジニアリング,スギノエンジニアリングは、自転車のクランクセットを作るメーカーである。　かつてマエダ工業とともにサンツアーブランドの一角を担っていた。また世界選手権自転車競技大会トラックレースにおける中野浩一の10連勝記録を支えた部品メーカーとしても知られる。　製品として、ダイナホロー、フロントエース、マキシィ、マイティ、マイティ・コンペなどがある。コンポ「SUGINO75」（創立75年記念セット）で知られた。
スズキ_(企業),スズキ株式会社（英語：SUZUKI MOTOR CORPORATION）は、日本大手の四輪車及び二輪車のメーカーである。本社は静岡県浜松市南区に所在し、国内市場においては軽自動車の販売台数にて国内屈指である。
スズキ部品秋田,株式会社スズキ部品秋田（スズキぶひんあきた）は、スズキの二輪車・四輪車用の部品を製造している会社。本社を秋田県南秋田郡井川町に置く。
ストラトローンチ・システムズ,ストラトローンチ・システムズ（英: Stratolaunch Systems）は、空中発射ロケットによる宇宙輸送を業務とするアメリカ合衆国の企業である。2011年にマイクロソフト共同創業者のポール・アレンとスケールド・コンポジッツ創業者のバート・ルータンにより設立された。両者は民間初の有人宇宙飛行を成し遂げたスペースシップワンの開発において共同関係にあった。打ち上げシステムは主要な3つのコンポーネントからなり、ロケットを運ぶ母機の開発をスケールド・コンポジッツが、空中から発射するロケットの開発をオービタル・サイエンシズが、統合システムの開発をDyneticsがそれぞれ担当する。この計画は、2011年12月に発表された。母機の初飛行は2015年に、初の試験打上げは2018年を予定している。同社のCEO兼社長は、元NASAのエンジニアGary Wentzが務める。前NASA長官のマイケル・グリフィンが同社の取締役会メンバーを務める。母機の名前は「ロック」（Roc）、空中発射式ロケットの名前は「サンダーボルト」（Thunderbolt）、これらを含めた打上システム全体の名前は「イーグルス・ローンチ・システム」（Eagles Launch System）となった。
スパイカー・カーズ,スパイカー・カーズ（Spyker Cars N.V. ）は、オランダの自動車メーカー。かつて存在したスパイカー社とは無関係であるが、現在スパイカーブランドの所有権を保持しており、手作業で部品を組み立てた高級スポーツカーとして製造と販売を行っている。2012年3月現在はアメリカの投資会社のノースストリートキャピタルの傘下企業である。会社のスローガンは「Nulla tenaci invia est via」（ラテン語で「粘り強くやり通せば、必ず道は開ける」の意味）であり、ロゴにも記載されている。
スバルテクニカインターナショナル,スバルテクニカインターナショナル株式会社（SUBARU TECNICA INTERNATIONAL INC.、略称STI）は、富士重工業（スバル）の連結子会社で、モータースポーツへの参画やパーツ開発・販売などを行う会社である。
スペースX,スペース・エクスプロレーション・テクノロジーズ、通称スペースX（英: Space Exploration Technologies Corporation、SpaceX）は、ロケット・宇宙船の開発・打ち上げといった宇宙輸送（商業軌道輸送サービス）を業務とするアメリカ合衆国の企業である。2002年にインターネットベンチャー企業PayPalの創設者、イーロン・マスクにより設立された。最終的には再利用可能にすることを目指す打ち上げロケットファルコン1、ファルコン9、ならびにファルコン9で打ち上げるドラゴン宇宙船を開発している。スペースXは、費用と品質を管理するために、大部分のコンポーネントを自社で開発しており、その中にはマーリン、ケストレル、ドラコといったファルコンロケットで使われているロケットエンジンとドラゴン宇宙船が含まれる。 2006年にNASAは、国際宇宙ステーション物資補給のための打上げ機の設計とデモ飛行を行う商業軌道輸送サービス (COTS) を同社と契約した。2010年12月9日にCOTSデモ飛行1ミッションの打上げを行い、同社は民間企業としては世界で初めて軌道に乗った宇宙機の回収に成功した。またNASAは、有人型のドラゴン宇宙船の開発とデモ飛行を行う宇宙飛行士の商業輸送開発 (CCDev) プログラムとして同社と契約した。同社は、ファルコン9ロケットと有人型ドラゴン宇宙船を2015年には初飛行させる予定である。設立当初はカリフォルニア州エルセグンドを拠点としていたが、現在は 同ホーソーンで活動している。
スホーイ,スホーイ（ロシア語: Сухой、英語: Sukhoi、スホイとも）は、ロシアの主要航空機メーカー。ソ連時代はスホーイ設計局として軍用機（戦闘機・攻撃機など）を手がけ、現在は株式会社スホーイ・カンパニー (ロシア語:ОАО Компания Сухой“) となり、民間機も製造している。
ゼネラルモーターズ,"ゼネラルモーターズ（General Motors Company, LLC）は、アメリカ合衆国の自動車メーカーである。本社はミシガン州デトロイト。略称は「GM」。2009年6月1日に連邦倒産法第11章の適用を申請し国有化された。2013年12月9日にアメリカ合衆国財務省が保有するGMの株式を全て売却し国有化が終了した。"
ゼロスポーツ,株式会社ゼロスポーツとは、岐阜県各務原市に本社がある自動車メーカーである。
