青山高原ウインドファーム,"青山高原ウインドファーム （あおやまこうげんウインドファーム）とは、風力発電事業及び電力の供給を行う日本の企業であり、かつ同社が保有する青山高原に位置する集合型風力発電所の名称である。中部電力グループのシーテックのほか、三重県津市と伊賀市が出資する第三セクターで、出資する両市に跨って位置している。JFEエンジニアリング製のローター直径50.5m、タワー高さ50m、出力750kWの風力発電機が20基建てられており、最大出力は15,000kWである。なお、青山高原には、ウインドパーク久居榊原の4基　ウインドパーク美里の8基　ウインドパーク笠取の19基あわせて発電用風車が51基建てられている。"
静岡ガス,静岡ガス株式会社（しずおかがす）は、静岡県中東部（静岡市、富士市、沼津市、三島市など）を営業エリアとする一般ガス事業者。また、近隣の一般ガス事業者などに卸売りを行っており、山梨県や長野県など静岡県外へも同社のガスが送出されている。都市ガスの販売量は、東京ガス、大阪ガス、東邦ガスに次ぐ全国４位。東証一部上場（証券コード9543）。なお、2015年3月までは静岡瓦斯株式会社を商号としていた。コーポレートスローガンは「くらしを考え、明日をつくる。」。
石巻ガス,石巻ガス株式会社（いしのまきがす）は、宮城県石巻市に本社を置く一般ガス事業者。石巻市に都市ガスを供給する。
仙南ガス,"仙南ガス株式会社（せんなんガス、英: Sennan-gas Co.,Ltd.）は、宮城県柴田郡柴田町に本社を置く一般ガス事業者。宮城県仙南地域の住宅団地において簡易ガス事業、名取市において都市ガスの供給を行う。"
千葉ガス,千葉ガス株式会社（ちばガス）は、千葉県北部を営業区域とする東京ガスグループの一般ガス事業者である。関連事業としてボトルウォーター（アクアクララ）の販売事業も行う。本社は千葉県佐倉市に所在する。コーポレート・スローガンは「安心そのまま、次世代へ。」。
扇島パワー,株式会社扇島パワー（おうぎしまパワー）は、東京ガスと昭和シェル石油の共同出資により設立された企業。東京ガス扇島LNG基地に隣接した東亜石油貯油地跡地にて、ガスタービンと蒸気タービンを組み合わせたガスタービンコンバインドサイクルによる火力発電を行う。
泉北天然ガス発電所,泉北天然ガス発電所（せんぼくてんねんガスはつでんしょ）は、泉北天然ガス発電株式会社が運営するガスタービンコンバインドサイクル発電方式による天然ガス火力発電所である。堺泉北臨海工業地域に位置する大阪瓦斯の泉北製造所に計4基発電機を設置し、特定規模電気事業者(PPS)の発電所として日本最大級の計110.9万kWの発電を行う。最高効率57%(LHV基準)を実現するなど発電効率に優れている。
相馬共同火力発電,"相馬共同火力発電株式会社（そうまきょうどうかりょくはつでん、英: Soma Kyodo Power Company,Ltd.）は、福島県相馬市に本社を置く卸電気事業者。東北電力と東京電力の折半出資により設立された。福島県相馬郡新地町に石炭火力発電所を有し、東北・東京両電力会社に電力の卸供給を行う。"
帯広ガス,帯広ガス株式会社（おびひろガス）は、北海道帯広市に本社を置く、都市ガスを主力とするエネルギー販売会社である。帯広市、幕別町、音更町、芽室町において都市ガス事業を展開している。
袋井ガス,"袋井ガス株式会社（ふくろいガス）は、静岡県袋井市の一部を供給区域とする静岡ガス系の都市ガス事業者。本社所在地は静岡県袋井市高尾1940‐1。供給ガスは天然ガス（13A:熱量46MJ）。2002年末現在の供給戸数は2,020戸。ガスは静岡ガスグループの清水エル・エヌ・ジーから中遠ガス経由で供給を受けている。"
台湾電力,台湾電力（たいわんでんりょく）第二次世界大戦までにあった株式会社。（#日本統治時代で記述）現在、台湾にある電力会社。（#第二次世界大戦後で記述）
大垣ガス,大垣ガス株式会社（おおがきガス）は日本のガス事業者。岐阜県大垣市に本社を置く一般ガス事業者である。経営の理念として「信頼の炎」を掲げている。営業エリアは合併前の大垣市一円。シンボルカラーはオレンジとグリーン、イメージキャラクターは「ほのりん」。
大垣液化ガス,大垣液化ガス株式会社（おおがきえきかガス）は、かつて存在した日本のLPガス事業者。1963年に大垣瓦斯のLPガス卸売部門が分離して設立。岐阜県大垣市に本社を置いていたが、2010年（平成22年）4月に親会社である大垣瓦斯に吸収合併された。大垣市及びその周辺を主な営業エリアとしており、経営理念として「信頼の炎」を掲げていた。
大阪ガス,"大阪ガス株式会社（おおさかガス、商号:大阪瓦斯株式会社、英: Osaka Gas Co., Ltd.）は、近畿地方（主に京阪神）を中心に、3,220km2、707万世帯を供給対象としている一般ガス事業者である。旧野村財閥の中核である。そのため大和銀行（現・りそな銀行）と親密である。東京ガス、東邦ガス、西部ガス、同様に大手4大都市ガス事業者の一つである。都市ガスの販売量では全国2位（約87億m3、シェア25%）。ガス導管総延長は60,395km（2011年度末）に及ぶ。本社は大阪府大阪市中央区に所在する。"
大川原ウインドファーム,"大川原ウインドファーム（おおかわはらウインドファーム）は、徳島県徳島市に本社を置く風力発電事業及び電力の供給を行う日本の企業。また同社が保有する同県佐那河内村・上勝町・勝浦町からなる大川原高原に位置する集合型風力発電所の名称である。高さ60mの風車15基が設置されており、19,500kW（1,300kW×15基)の風力発電設備を導入している四国では最大規模のウインドファームである。新エネ百選選定。"
大多喜ガス,大多喜ガス株式会社（おおたきガス）は、千葉県茂原市に本社を置く一般ガス事業者である。関東天然瓦斯開発との共同持株会社であるK&Oエナジーグループ株式会社の完全子会社である。
大津市企業局,大津市企業局（おおつしきぎょうきょく）は、滋賀県大津市において上水道事業、下水道事業および公営ガス事業（一般ガス事業者）を行う大津市の地方公営企業である。
大東ガス,大東ガス株式会社（だいとうガス）は、埼玉県入間郡三芳町に本社を置く、都市ガス事業を行う企業。
大分エル・エヌ・ジー,"大分エル・エヌ・ジー株式会社（おおいたエル・エヌ・ジー、英文社名： Oita Liquefied Natural Gas Company, Inc.）は、大分県大分市の大分臨海工業地帯において液化天然ガス（LNG）の受入、貯蔵、気化、送出等を行う企業である。九州電力が株式の98%を保有しており、九州電力グループに属している。"
大分ガス,大分ガス株式会社（おおいたガス、商号:大分瓦斯株式会社）は、大分県別府市に本社を置き、大分県大分市、別府市、由布市を供給地域とする一般ガス事業者である。
大分ソーラーパワー,大分ソーラーパワー株式会社（おおいたソーラーパワー）は、大分県大分市大字青崎に本社を置き、太陽光発電及び売電事業を行う企業である。丸紅株式会社の全額出資子会社。また、大分ソーラーパワーは同社が大分県大分市で運転する大規模太陽光発電所（メガソーラー）。
大分共同火力,大分共同火力株式会社（おおいたきょうどうかりょく）は、大分県大分市に本社を置く卸電気事業者である。
大和ガス,"大和ガス株式会社（だいわガス、Daiwagas Co., Ltd. ）は、奈良県大和高田市に本社を置く大和高田市及び周辺市町村をエリアとする一般都市ガス事業者である。2007年現在、近畿圏の都市ガス事業者としては大阪ガスに次ぐ規模の企業である。"
筑波学園ガス,筑波学園ガス株式会社（つくばがくえんガス、英: Tsukuba Gakuen Gas Corporation.）は、茨城県つくば市に本社を置く一般ガス事業者。東京ガス100%出資の子会社で、つくば市・つくばみらい市の各一部に都市ガスの供給を行う。
中遠ガス,"中遠ガス株式会社（ちゅうえんガス）は、静岡県掛川市の一部を供給区域とする静岡ガス系の都市ガス事業者。本社所在地は静岡県掛川市中央1丁目18‐1。供給ガスは天然ガス（13A:熱量46MJ）。2002年末現在の供給戸数は5,427戸。ガスは液化天然ガスとして静岡ガスグループの清水エル・エヌ・ジーからタンクローリーで運搬され、掛川駅から700mほど西の東海道本線、東海道新幹線線路脇にある中遠ガス下俣工場内にある静岡ガス小笠山事業所のタンクに貯蔵、そこで気化させた天然ガスを各戸に供給している。"
中央セントラルガス,中央セントラルガス株式会社（ちゅうおうせんとらるがす）は栃木県小山市花垣町に本社を置く、プロパンガスを主力とするエネルギー販売会社である。セントラル石油瓦斯グループの中核企業である。現在、栃木県、埼玉県、神奈川県、山梨県、静岡県に営業所を展開している。シンボルマークは緑地の家の真ん中にハートマークがあり右手に「暮らしの真ん中にいつも。セントラルガス」となっている。
中国核工業集団,中国核工業集団公司（ちゅうごくかくこうぎょうしゅうだんこうし）は、中華人民共和国の国有企業である。グループの従業員数は約10万人であり、グループの主な事業は、原子力発電である。1999年に中国核工業総公司の分割によって誕生した。中国に120社ある「中央企業」の一つである。
中国電力,"中国電力株式会社（ちゅうごくでんりょく、英: The Chugoku Electric Power Co., Inc.）は、中国地方5県および島しょ部を中心とした周辺地域を営業区域とする電力会社。"
中部ガス,"中部ガス株式会社（登記上の社名：中部瓦斯株式会社、ちゅうぶがす、英: Chubu Gas Co., Ltd.）は、愛知県豊橋市に本社を置く、愛知県東三河地方および静岡県遠州地方（浜松市等）をエリアとする一般ガス事業者である。現在のサーラグループの源流となる企業であり、グループ企業は不動産、住宅・リビング事業にも力を入れているのが特徴である。「SALA（サーラ）」のブランド名で、都市ガスを供給していない名古屋市周辺および首都圏、広島市、仙台市にも進出している。"
中部電力,"中部電力株式会社（ちゅうぶでんりょく、英: Chubu Electric Power Co.,Inc.）は、中部地方を主な営業地域とする電力会社である。略称は中電（ちゅうでん）であり、一般に「中電」と言えば当社を指す（現在のドメインは chuden.co.jp)。ただ、日本の中国地方を事業地域とする中国電力（ドメインは energia.co.jp）との混同を防止するため、株式市場では中部電力は「中部電」、中国電力は「中国電」と呼ばれている。2011年現在のコーポレートスローガンは、「時代の先へ。ひとりのそばへ。」である。名古屋の有力企業四摂家の1社だったが、福島原発事故以後は企業のアピール活動は自粛している。（他の3社は東邦瓦斯・名古屋鉄道・松坂屋）"
朝霞・三園ユーティリティサービス,"朝霞・三園ユーティリティサービス株式会社（あさか・みそのユーティリティサービス、英語表記：Asaka Misono Utirity services Co., Ltd., 通称：AMUS）は日本のコジェネレーション事業を行う会社である。本社は東京都千代田区外神田の秋葉原ダイビル。"
長野県企業局,長野県企業局（ながのけんきぎょうきょく）は、長野県の地方公営企業である。水道事業、電気事業（卸供給事業者、旧みなし卸電気事業者）を行っている。
鳥取ガス,"鳥取ガス株式会社（とっとりガス、商号：鳥取瓦斯株式会社、Tottori Gas Co., Ltd.）は、鳥取市の一部を供給対象地域とする一般ガス事業者である。本社は鳥取市五反田町6番地に所在する。"
津山ガス,津山ガス（つやまガス）は、岡山県津山市に本社を置く一般ガス事業者である。
津島ガス,津島ガス株式会社（つしまガス、正式社名は津島瓦斯株式会社）は、愛知県津島市に本社を置く、愛知県西尾張をエリアとする一般ガス事業者である。
電源開発,"電源開発株式会社（でんげんかいはつ、英語: Electric Power Development Co.,Ltd.）は、日本最大の卸電気事業者である。愛称はJ-POWER（ジェイパワー）。"
土佐発電所,土佐発電所（とさはつでんしょ）は、高知県高知市孕東（はらみひがし）町にある火力発電所。太平洋セメント土佐工場の敷地内にある。
島田ガス,"島田ガス株式会社（しまだガス‐、商号:島田瓦斯株式会社）は、静岡県島田市を供給区域とする都市ガス事業者。通常は「島田ガス」と表記される。ガスは静岡ガスグループの清水エル・エヌ・ジーから静岡ガス、東海ガスを経由して供給を受け、市内の需要家に供給している。本社所在地は静岡県島田市横井4丁目16-32。供給ガスは天然ガス（13A:熱量45MJ）。2007年12月末現在の供給戸数は4,568戸。"
東横化学,"東横化学株式会社（とうよこかがく、英語: TOYOKO KAGAKU Co., Ltd. 、通称TYK）は、神奈川県川崎市中原区に本社を置き、各種産業用ガスの供給、関連機器・設備の提供、さらに「ガストロニクス」による安全で高度な供給制御システムの構築を事業とする企業。"
東京ガス,"東京ガス株式会社（とうきょうガス、登記上の商号:東京瓦斯株式会社、英: Tokyo Gas Co., Ltd.）は、東京都都市部とその隣接区域（関東地方1都6県の主要都市）を営業区域とする一般ガス事業者。総延長約6万kmのガス導管を持ち、都市ガス事業者として世界最大規模、日本国内最大手である。東証・名証一部上場。証券コードは「9531」。他の都市ガス各社と同様、通常は「東京ガス株式会社」と表記されることが多く、自社の発行物でも「東京ガス」と表記されている。ただし広告等で、ロゴマークと合わせて表記する場合は、「TOKYO GAS」と記されていることが多い。東京ガスはグループ全体で「LNGバリューチェーン」に取り組み、原料の調達から、輸送、都市ガスの製造、供給、販売と続く一連の事業活動を行っている。現在のコーポレート・スローガンは『エネルギー・フロンティア』。"
東京ガスエネルギー,東京ガスエネルギー株式会社（とうきょうガスエネルギー）は、関東一円を営業エリアとするLPガス事業者である。都市ガス最大手の東京ガスと、石油・天然ガスの鉱区の取得から、探鉱、生産、製品の販売までグローバルな規模でエネルギーの供給を担う国際石油開発帝石の出資子会社。
東京水道サービス,"東京水道サービス株式会社（とうきょうすいどうサービス、英語表記：Tokyo Waterworks service Co., Ltd., 通称：TSS）は日本の水道事業を行う会社である。本社は東京都新宿区西新宿の新宿グリーンタワービル。東京23区以外の主な拠点として東京都立川市柴崎町の多摩事業本部がある。東京都以外にも埼玉県さいたま市大宮区大門町のさいたま事務所がある。"
東京電力,"東京電力株式会社（とうきょうでんりょく、英：Tokyo Electric Power Company, Incorporated）は、首都圏1都7県（群馬県、栃木県、茨城県、埼玉県、東京都、千葉県、神奈川県、山梨県）、静岡県の富士川以東（富士市の旧富士川町域及び富士宮市の旧芝川町域の富士川以南、及びその他の静岡県富士川以西地域については中部電力の管轄）の地域を事業地域とする電力会社である。略称は東電（とうでん）、または英語からTEPCO（テプコ）が用いられている。東証一部上場。福島第一原子力発電所事故の復旧及び賠償のために、日本国政府による公的資金が注入され、原子力損害賠償支援機構（現 原子力損害賠償・廃炉等支援機構）が大株主となり、公的管理下において、同機構委員長の下河辺和彦を取締役会長に迎えて経営再建をめざすこととなった。なお、第二次世界大戦以前に存在しのちに東京電燈（関東配電などの前身）に合併された東邦電力子会社の「東京電力」は、同名異企業であり本企業とは無関係である。"
東京都下水道サービス,"東京都下水道サービス株式会社（とうきょうとげすいどうサービス、英語表記：Tokyo Metropolitan Sewerage Servise Corporation, 通称：TGS）は日本の下水道事業を行う会社である。本社は東京都千代田区大手町の日本ビル。"
東京都市サービス,東京都市サービス株式会社は、地域熱供給事業者。蓄熱式ヒートポンプシステムを取り入れた地域熱供給などの事業を行っている。1987年（昭和62年）9月9日に、電力業界を母体とする初の地域熱供給会社として設立された。2012年5月22日、伊藤忠エネクス株式会社が発行済株式総数の 66.6 % を東京電力株式会社から取得。伊藤忠エネクスグループの一員となった。
東京発電,"東京発電株式会社（とうきょうはつでん）は、東京都港区三田に本社を置く卸電気事業者で東京電力の100%子会社である。発電所は64ヶ所（最大出力18万2,560 kW・販売電力量年間約9億 kWh）を運転、2006年からは「マイクロ水力発電」事業に取り組んで中小水力発電事業のトップ企業になっている。"
東彩ガス,"東彩ガス株式会社（とうさいガス、TOSAI GAS,Inc.）は、埼玉県越谷市に本社を置く、都市ガスやプロパンガスなどのエネルギーの販売会社である。ニチガスグループの一員である。"
東上ガス,東上ガス株式会社（とうじょうガス）は、埼玉県志木市に本社を置く、日本の都市ガス、プロパンガスを主力とするエネルギー販売会社である。
東日本ガス,東日本ガス株式会社（ひがしにほんガス）は、千葉県我孫子市に登記上の本社を置く、日本の都市ガスを主力とするエネルギー販売会社である。なお実際の本社機能は茨城県取手市にある。千葉県我孫子市、印旛郡栄町、茨城県取手市において都市ガス事業を展開している。
東部ガス,東部ガス株式会社（とうぶガス、商号:東部瓦斯株式会社）は秋田県・福島県・茨城県の一部を営業エリアとする一般ガス事業者である。
東邦ガス,"東邦ガス株式会社（とうほうガス、商号:東邦瓦斯株式会社、英: TOHO GAS Co., Ltd.）は、愛知県名古屋市熱田区桜田町に本社を置く、東海3県をエリアとする一般ガス事業者である。東京ガス、大阪ガス、西部ガスと共に日本四大都市ガスの一つに数えられる。名古屋の有力企業五摂家の1社。（他の4社は中部電力・旧東海銀行（現三菱東京UFJ銀行）・名古屋鉄道・松坂屋（現大丸松坂屋百貨店（J.フロント リテイリング傘下））"
東北天然ガス,東北天然ガス株式会社（とうほくてんねんガス）は、東北電力と石油資源開発の共同出資による企業。石油資源開発が所有する新潟~仙台間パイプラインおよび山形市・郡山市への支線を中心に、沿線の一般ガス事業者や大口需要家への天然ガスの供給を行う。沿線から離れた事業者に対しては、鉄道コンテナやタンクローリーでの輸送も行っている。
東北電力,東北電力株式会社（とうほくでんりょく）は、東北地方6県（青森県、岩手県、宮城県、秋田県、山形県、福島県）と、新潟県を営業区域とする電力会社。本店所在地は宮城県仙台市。
湯河原ガス,湯河原ガス株式会社（ゆがわらガス）は、神奈川県足柄下郡湯河原町および静岡県熱海市の各一部を供給区域とする都市ガス事業者。本社所在地は神奈川県足柄下郡湯河原町土肥1-13-11。供給ガスは天然ガス（13A:熱量45MJ）。
苫小牧ガス,苫小牧ガス株式会社（とまこまいガス）は、北海道苫小牧市に本社を置く、日本の都市ガスを主力とするエネルギー販売会社である。苫小牧市、安平町、厚真町において都市ガス事業を展開している。
敦賀ガス,"敦賀ガス株式会社（つるがガス、Tsuruga Gas Co., Ltd. ）は、福井県敦賀市を営業エリアとする一般ガス事業者である。"
南日本ガス,南日本ガス株式会社（みなみにほんガス）は、鹿児島県薩摩川内市大小路町に本社を置く一般都市ガス事業者である。コーアガス日本の子会社である。
二又風力発電所,"二又風力発電所（ふたまたふうりょくはつでんしょ、英文社名：FUTAMATA WIND DEVELOPMENT CO., LTD.）は、青森県上北郡六ヶ所村にある、二又風力開発株式会社が運営する風力発電所。2008年5月に運転開始し、34基の風力発電設備を有する。世界で初めて大容量蓄電池を併設したスマートグリッド型の風力発電所として、各種実証試験が行われている。隣接地には、日本風力開発100%子会社の六ヶ所村風力開発株式会社による六ヶ所村風力発電所・六ヶ所村風力第2発電所がある。"
日本ガス,日本ガス株式会社（登記上の社名：日本瓦斯株式会社、にっぽんガス）は、鹿児島県鹿児島市中央町に本社を置く、鹿児島市をエリアとする一般都市ガス事業者である。中小ガス事業者ながら、九州エリアでは西部ガスと並び独自に液化天然ガスを調達し専用のタンカーで運搬輸送する独自性も見せる。名前に「日本」が含まれているので地元では日本全国にあると勘違いする人もいるが、後述する様に日窒コンツェルン傘下の日本水電のガス部門から分離したことからこの名がついている。企業キャッチフレーズは『ひと、ゆめ、暮らし』。
日本海ガス,日本海ガス株式会社（にほんかいガス）は、富山県・石川県を中心に都市ガス・LPガス事業を展開する企業。
日本原子力発電,日本原子力発電株式会社（にほんげんしりょくはつでん、英語：The Japan Atomic Power Company）は、茨城県那珂郡東海村と福井県敦賀市に原子力発電所を持つ卸電気事業者。設立は1957年で、東海村にある東海発電所は日本最初の商業用原子炉である。略称として原電（げんでん）または日本原電（にほんげんでん）が使われる。日本に商用原子力発電を導入するために、電気事業連合会加盟の電力会社9社と電源開発の出資によって設立された。
日本原燃,日本原燃株式会社（にほんげんねん）は、核燃料サイクルの商業利用を目的に設立された日本の国策会社である。平成9年から平成23年現在まで、会長と社長の多くが東京電力の出身である。
