5LINKS,5LINKS（ファイブリンクス ）は、東京都杉並区宮前に本社をおく折り畳み自転車の専業メーカー及びその商品名。5LINKSのネーミングには「5LINKSに乗って走るもよし、携帯するもよし、電車に、自動車に、船に、飛行機にも積んで、世界の5大陸を移動しよう」という願いが込められている。
5ZIGENインターナショナル,5ZIGENインターナショナル株式会社（ごじげんインターナショナル、英: 5ZIGEN INTERNATIONAL INC.）は、大阪府八尾市に本社を置く自動車部品メーカー。主にマフラーやアルミホイールの製造・販売を行っている。
A・S・ヤコヴレフ記念試作設計局,A・S・ヤコヴレフ記念試作設計局 (Опытно-конструкторское бюро имени А.С. Яковлева オーカーベー・イーミェニ・アリクサーンドラ・スィルギェーイェヴィチャ・ヤーカヴリェヴァ)は、ソ連・ロシア連邦の航空機メーカーである。略称 ОКБ им. А.С. Яковлева。単にヤコヴレフ設計局、ヤコヴレフまたはヤクという略称でも呼ばれる。アレクサンドル・セルゲーエヴィチ・ヤコヴレフ (1906年1989年)が開設を命ぜられた。
Apex,Apex株式会社（アペックス-）は、日本の自動車用チューニングパーツメーカー。本社は東京都八王子市松木。自動車パーツブランド表記はA'PEXi。
ASK_TRADING,株式会社ASK TRADING（エーエスケートレーディング ）は、埼玉県三郷市に本社を置く自転車・自転車部品メーカーおよび輸入商社、セキュリテイ機器メーカー・販売商社。自社の自転車ブランドはBOMA（ボーマ）、セキュリティ機器のブランドはCEPSA（セプサ）。
ASブレーキシステムズ,"ASブレーキシステムズ株式会社（エーエスブレーキシステムズ、AS Brake Systems, Inc. ）は、日本の自動車用ブレーキメーカー。住友電気工業からアイシン精機に事業譲渡された住友電工ブレーキシステムズの業務を、アイシン精機への生産移管が完了するまでの暫定法人として設立された。"
AvtoKrAZ,"持株会社「AvtoKrAZ」(KhK AvtoKrAZ、アウトクラーズ、アフトクラーズ；ウクライナ語:ХК ""АвтоКрАЗ""アウトクラーズ；ロシア語:ХК ""АвтоКрАЗ""アフタクラーズ)は、ウクライナの自動車メーカーを束ねる持株会社(Холдинговая Компания)のひとつである。中部ウクライナの都市クレメンチュークに本拠を置き、大型車輌を主に自動車の開発・製造を行っている。また、AvtoKrAZは国際規格としてISO 9001:2000を取得している。旧称はクレメンチューク自動車工場(Кременчуцький автомобльний заводクレメンチューツィクィイ・アウトモビーリヌィイ・ザヴォード；Кременчугский автомобильный заводクリミンチュークスキイ・アフタマビーリヌィイ・ザヴォート)で、その略称KrAZ(КрАЗクラーズ)に「自動車」を意味する「авто」を付けて新しい社名とした。なお、公式ホームページでは大文字と小文字の使い分けが判然としない部分がある。企業名は恐らく正式にはAVTOKRAZやAvtoKRAZではなくAvtoKrAZであるが、車両商標についてはKrAZとKRAZが混在している。このページでは、特に企業名と違える根拠もないため、企業名に合わせ商標についてもKrAZを用いることとする。"
BBSジャパン,BBSジャパン株式会社は、車輛用軽合金ホイールの輸出入及び国内製造販売する自動車部品製造メーカーである。かつては小野ホールディングスの子会社であったが、小野グループの経営破綻により、前田工繊の傘下となった。元はワシマイヤー株式会社の社名で鍛造ホイール製造を行ってきたが、2013年12月1日に日本BBS株式会社とワシ興産株式会社を吸収合併し、現社名に変更した。
BLITZ,株式会社ブリッツは、カーチューニングパーツ（ターボ、コンプレッサー、マフラー、エアクリーナー、メーター、燃料制御コンピューター、インタークーラー、エアロ、バイナル等）の企画、製造、販売を目的とする日本の企業。1981年設立。BLITZはドイツ語で稲妻と言う意味。2002年より野村謙とともに、全日本プロドリフト選手権（D1グランプリ）に参戦している。「電脳集団」とたびたび称され、その通り電子系統パーツ（特に既存の電子系統をさらなる調整が可能になるコントローラーが多い）などの最新の電子機器を満載した新型車への対応もいち早く行っている。
CAF_(企業),CAF（Construcciones y Auxiliar de Ferrocarriles）は、スペインの鉄道車両メーカーである。主な製品として機関車や鉄道車両、様々なボギー台車に対応出来る軌間可変車軸などがある。CAFは香港MTR、ワシントンメトロ、サクラメント地域交通、アレゲーニー郡港湾局（ピッツバーグのLRT）などへ車両を納入している。最新の顧客の一つはアイルランドのイルンロード・エールンであり、多くの客車とDVTを発注した。CAFはまた、2009年に部分開業したイスタンブル・アンカラ間高速鉄道向けの車両を製造した。2004年2月、レンフェ（スペイン国鉄）は時速250kmでの地域輸送サービス向けに交流25000V / 直流3000V対応の軌間可変電車を2006年10月から2009年5月まで5億8000万ユーロでCAFとアルストムから購入する契約を結んだ。また、2005年8月24日、CAFはメキシコシティ都市圏郊外鉄道（Ferrocarril Suburbano de la Zona Metropolitana de Mxico）の30年間の車両供給権及び鉄道建設権・運営権を連邦区から得た。
CNHインダストリアル,CNHインダストリアル (CNH Industrial) は産業機械や商用車の製造・販売を手がける多国籍企業である。オランダで法人登記が行われ、イギリス・ロンドンに本社を構える。アニエッリ家の投資会社であるイタリアのエクソールが筆頭株主である。
DRD,"株式会社 DRD（ディーアールディー、DRD Co,. Ltd. ）は、テンプホールディングスグループの、主として開発・設計、実験業務を行う企業。2013年5月31日まではUDトラックス（旧・日産ディーゼル工業）の子会社だった。"
G・M・ベリーエフ記念タガンローク航空科学技術複合体,G・M・ベリーエフ記念タガンローク航空科学技術複合 (ロシア語: Таганрогский авиационный научно-технический комплекс имени Г. М. Бериева タガンロークスキイ・アヴィアツィオーンヌィイ・ナウーチュナ・チフニーチェスキイ・コームプリェクス・イーミェニ・ゲー・エーム・ビリーイェヴァ、ТАНТК имени Г. М. Бериева) は、ロシア連邦の航空機メーカーである。主として飛行艇や水陸両用機の開発で知られる。ソ連時代は特にベリエフ設計局として知られる。
GMB_(企業),駆動系部品のOEM供給と補修用部品を製造販売する独立系自動車部品メーカー。
IJTテクノロジーホールディングス,"IJTテクノロジーホールディングス株式会社（英:  IJT Technology Holdings Co., Ltd. ）は、自動車部品工業・アイメタルテクノロジー・TDFなどを傘下に持つ持株会社である。いすゞ自動車の子会社。"
KIホールディングス,KIホールディングス株式会社（ケイアイホールディングス）は、神奈川県横浜市戸塚区に本社を置く、航空機シート製造を行う事業持株会社。1967年に小糸製作所の事業の内、鉄道車両用機器・シート部門ならびに照明・電気機器部門を継承した。2011年8月1日に航空機シート以外の事業については「コイト電工」として分社した。本項目ではコイト電工株式会社についても説明する。
M-TEC,"株式会社M-TEC（エムテック、M-TEC Co., Ltd.）は、ホンダ車用アフターパーツの製造販売やレース用エンジンの開発製造を行う日本の企業。2003年設立。"
M・L・ミーリ記念モスクワ・ヘリコプター工場,M・L・ミーリ記念モスクワ・ヘリコプター工場 (Московский вертолетный завод им. М.Л. Миля マスコーフスキイ・ヴィルタリョートヌィイ・ザヴォート・イーミェニ・ミハーイラ・リオーンチイェヴィチャ・ミーリャ) は、ソ連およびロシアの航空機メーカーであった。カモフと並ぶロシアの代表的なヘリコプター製造メーカーであった。2007年に、カモフらと共に合併し、ロシアン・ヘリコプターズとなった。略称はMVZまたはM・L・ミーリ記念MVZ (МВЗ им. М.Л. Миля)。旧ソ連時代はミル設計局として知られている。なお、「ミル」は英語文献経由の読み方で、ロシア語としては「ミーリ」が正しい。
MiG,"公開株式会社「ロシア航空機製作会社『MiG』」（Открытое акционерное общество Российская самолётостроительная корпорация МиГ“ アトクルィータイェ・サマリョタストライーチェリナヤ・カルパラーツィヤ・ミーグ）は、ロシア連邦の航空機設計企業（公開会社）である。略称RSK ""MiG""（РСК МиГ“）。ソ連時代のA・I・ミコヤーンとM・I・グレーヴィチ記念設計局 (ОКБ и.м. А.И.Микояна и М.И.Гуревича) が母体となっており、一般に「ミグ」と略称される。日本語表記としては「ミグ」「MiG」「ミコヤン」「ミコヤン・グレヴィッチ」「ミコヤン・グレビッチ」などが使われる。このページでは「ミグ」に統一している。"
NOK_(企業),NOK株式会社（エヌオーケー、NOK Corporation）は東京都港区に本社を置く自動車部品、電子部品等を製造・販売する総合部品メーカー。
PSA・プジョーシトロエン,PSA・プジョーシトロエン（PSA Peugeot Citron。仏略称:Groupe PSA)は、プジョー自動車を製造発売する「オートモビル・プジョー社」およびシトロエン自動車を製造発売する「オートモビル・シトロエン社」をはじめとする事業会社を保有する、フランス共和国の自動車・工業持株会社「プジョー株式会社」（Peugeot Socit Anonyme。略称:PSA）のグループ名称である。
R&D_SPORT,R&D SPORT（アールアンドディースポーツ）は、日本のレーシングチーム。正式商号は株式会社アールアンドデースポーツ。元々はレーシングカーコンストラクターの東京R&Dの関連会社だったが、2008年3月末で資本関係を解消している。
S・V・イリユーシン記念航空複合体,公開株式会社「S・V・イリユーシン記念航空複合体」（ロシア語: ОАО Авиационный комплекс имени С.В. Ильюшина オーアーオー・アヴィアツィオーンヌィイ・コームプリェクス・イーミェニ・セルギェーヤ・ヴァスィーリイェヴィチャ・イリユーシナ）は、ロシア連邦の航空機メーカーである。セルゲイ・イリユーシン（1894年 - 1977年）によって創設された。ソ連時代には同国を代表する航空機設計局のひとつで、S・V・イリユーシン記念試作設計局」（ОКБ имени С.В. Ильюшина オーカーベー・イーミェニ・セルギェーヤ・ヴァスィーリイェヴィチャ・イリユーシナ）と称した。そのため、日本語文献ではイリューシン設計局の通称で知られていた。
S&Tモータース,"S&Tモータース（S&T、S&T Motors Co., Ltd.）とは、大韓民国慶尚南道昌原市に本社を置くオートバイメーカーである。2014年にKRモータース（KR、KR Motors Co. Ltd.）から商号を変更した。"
SAAB,SAAB （サーブ、Saab AB） は、ヴァレンベリ家の支配する、スウェーデンの航空機・軍需品メーカーである。一般的に「サーブ」として知られている自動車会社のサーブ・オートモービルは、当初はSAABの自動車製造部門であった。その後、同部門はゼネラルモーターズ、スパイカー・カーズ（2011年にスウェディッシュ・オートモービルに社名変更）の傘下企業として渡り歩き、2011年12月に破産しており、SAABとのあいだに直接の資本関係は無くなっている。
SIM-Drive,株式会社SIM-Drive（株式会社シムドライブ）は、東京都板橋区に本社がある自動車メーカー。
SMLいすゞ,SMLいすゞ (SML Isuzu Limited) 、旧社名スワラジマツダ (Swaraj Mazda Limited) は、インド・パンジャーブ州・チャンディーガルに本社を置く商用車（トラック・バス）メーカーである。
SNS_(株式会社),SNS株式会社（英: SNS Inc.）は、北海道赤平市を拠点に液体燃料ロケット開発を行う日本の会社である。本社は東京都港区。代表は高崎博之。SNSとは旧商号（指紋認証システムズ株式会社）の頭文字を並べたもの。なつのロケット団と称して超小型衛星打ち上げ用の小型液体燃料ロケットを開発している。
STXフィンランド,"STXフィンランド（STX Finland）は、フィンランドにある造船会社。韓国のSTXグループの一つであるSTXヨーロッパの傘下。ヘルシンキ、トゥルク、ラウマの3カ所に造船所を持つ。約4,000人を雇用している。2014年8月、ドイツの造船会社マイヤー・ヴェルフトとフィンランド政府は、共同でSTXフィンランドを買収。株式の取得比率はマイヤー・ヴェルフトが70%、フィンランド政府が30%。諸手続が完了次第、「マイヤー・トゥルク造船」に社名が変更される予定。"
TBK,"株式会社TBK（ティービーケー、TBK Co., Ltd. ）は、東京都町田市に本社を置く日本の自動車部品メーカー。東証1部上場。1949年創立。旧「東京部品工業」。"
THKリズム,"THKリズム株式会社（THK RHYTHM CO., LTD.）は、静岡県浜松市に本社を置く自動車部品メーカー。旧名は株式会社リズム（Rhythm Corporation ）冷間鍛造加工を得意とし、主に自動車関連のステアリング、サスペンション、エンジン、トランスミッション等の構成部品を製造している。"
UDトラックス,UDトラックス株式会社（ユーディトラックス）は、日本の埼玉県を拠点とする大型車専業（トラック・バスなど）の自動車メーカーである。2010年2月1日に旧社名の日産ディーゼル工業株式会社（にっさんディーゼルこうぎょう）から社名変更した。現在は世界最大の重型トラックメーカー・ボルボ社傘下の外資系企業である。旧社名の元である日産自動車と資本関係は消滅するも業務提携は継続している。
アイ・シー・エル,株式会社アイ・シー・エルは、東京都品川区に本社をおく自動車用品の開発・購買・販売を取り扱う企業。主に、いすゞ自動車用純正アクセサリーパーツ(純正用品)、ベストフィックス（アフターマーケット用サービスパーツ）をいすゞ自動車系列販売店及びトラック架装メーカーに提供するいすゞ自動車販売（旧称：いすゞネットワーク）の100%子会社である。
アイコクアルファ,アイコクアルファ株式会社（英: AIKOKU ALPHA CORPORATION. ）は、愛知県稲沢市に本社を置く自動車部品メーカー。
アイシャー・モーターズ,アイシャー・モーターズ (Eicher Motors) は、1982年に創立されたインド・グルガーオンに本社を置く自動車メーカーで、アイシャー・グループの中核企業である。
アイシン・エィ・ダブリュ,"アイシン・エィ・ダブリュ株式会社（アイシンAW、AISIN AW CO., LTD.）は、オートマチックトランスミッション（世界シェア1位）、カーナビゲーションシステム（世界シェア2位）などを開発、製造、販売する大手自動車部品メーカー。アイシン主要5社の一つ。アイシン精機の子会社であるが、アイシン精機単独と比較すると売上高はほぼ変わらず、経常利益額や従業員数は上回っている。"
アイシン・エーアイ,"アイシン・エーアイ株式会社（AISIN AI CO., LTD.）は、小・中容量マニュアルトランスミッションを開発、製造、販売する大手自動車部品メーカー。アイシン主要5社の一つ。"
アイシン高丘,"アイシン高丘株式会社（アイシンたかおか、英: AISIN TAKAOKA CO.,LTD.）は、愛知県豊田市に本社を置く自動車部品・音響機器メーカー。アイシン主要5社の一つ。"
アイシン精機,"アイシン精機株式会社（アイシンせいき、AISIN SEIKI Co.,Ltd.）は、トヨタグループの大手自動車部品メーカー。トヨタ自動車系列だが、2011年現在では日本国外メーカー、さらには日産自動車をはじめとする日本国内他社にも部品を供給している。CIは「Geared up for the future」。"
アイシン辰栄,"アイシン辰栄株式会社（アイシンしんえい、英: AISIN SIN'EI Co., Ltd. ）は、愛知県碧南市に本社を置くアイシン精機の連結子会社で自動車部品メーカー。自動車部品のプレス加工および塗装、車体部品の製造等を行っている。"
アイメタルテクノロジー,株式会社アイメタルテクノロジーは、茨城県土浦市に本社を置く自動車用鋳物などを製造、販売するメーカーである。いすゞ自動車の子会社（孫会社）。2013年、同じくいすゞ自動車と関係の深い自動車部品工業・TDFと経営統合し、持株会社IJTテクノロジーホールディングスの完全子会社となった。
アグラレ,アグラレ（Agrale）は、ブラジルに本拠地を置くトラックなどの商用車や軍用車、農業用トラクター、エンジンを製造するメーカーである。かつてはオートバイ、スクーターも製造していた。
アスカ_(自動車部品),アスカ株式会社（英: ASKA CORPORATION ）は、愛知県刈谷市に本社を置く自動車部品メーカー。自動車部品の他に、配電盤やFAシステムの製造も行っている。
アスモ_(輸送機器メーカー),"アスモ株式会社（ASMO CO., LTD. ）は、静岡県湖西市に本社を置く自動車部品の製造会社である。デンソーの子会社。"
アドヴィックス,"株式会社アドヴィックス（英: ADVICS Co., Ltd.）は、愛知県刈谷市に本社を置く自動車部品サプライヤー。アイシン主要5社の一つ。ブレーキシステムにおいて、2013年時点で国内シェア50％以上、世界シェア10％以上となっている。"
アドバンスト・カー・エンジニアリング,株式会社アドバンスト・カー・エンジニアリング（ACE）は、沖縄県うるま市に本社を置き、自動車の製造・加工を行うメーカーである。うるま市の自由貿易特区に生産拠点を持ち、ストレッチ・リムジンの製造販売を行っている。東京都内に設置している営業所では、製造したストレッチ・リムジンを利用したハイヤーサービスを行っていた。2011年に操業停止。
アラコ,アラコ株式会社は、かつて存在したコーチビルダー・部品メーカーである。トヨタ自動車株式会社の子会社であった。2004年（平成16年）10月1日に吸収分割により、トヨタ車体株式会社に車体部門を承継させた後、同日に、シート部門を豊田紡織株式会社（現・トヨタ紡織株式会社）らと合併し消滅した。なお2015年（平成27年）7月1日に、トヨタ紡織株式会社の子会社である株式会社KYOEIARACOが、アラコ株式会社に商号変更した。本稿では主に2004年に消滅した旧・アラコ株式会社について述べる。
アルナ車両,"アルナ車両株式会社（アルナしゃりょう、英称：ALNA SHARYO CO., LTD.）は、主に軌道線向けの車両製造および鉄道車両の改造、整備を行う企業。路面電車車両の国内トップメーカーとして高いシェアを誇っている。阪急阪神ホールディングス（旧阪急電鉄）の連結子会社で、阪急阪神東宝グループに属する。2001年12月に設立後、2002年4月1日に旧アルナ工機株式会社から軌道線向け車両製造・保守事業と鉄道線向け車両保守事業を会社分割（吸収分割）により承継した。本項目ではアルナ工機株式会社についても説明する。"
アルナ矢野特車,"株式会社アルナ矢野特車（アルナやのとくしゃ、ALNA-YANO TOKUSYA Co., LTD.）は、陸上輸送用の冷凍車に搭載するための冷凍庫（バンボデー）や路面清掃車などを製造するメーカーである。本社は滋賀県米原市村居田。本店所在地は福岡県糟屋郡新宮町。前身のアルナ工機（ナニワ工機）については、アルナ車両の項目を参照されたい。2002年4月1日のアルナ工機の事業別分社化に伴い、バンボデー事業部門を継承する会社として設立された。設立当初の社名は「アルナバン株式会社」であったが、2005年4月1日に現社名に変更された。設立当初は阪急電鉄の子会社であったが、2003年6月1日に矢野特殊自動車に営業権を譲渡し、現在は同社の完全子会社となっている。"
アルナ輸送機用品,"アルナ輸送機用品株式会社（アルナゆそうきようひん、英: ALNA YUSOKI-YOHIN CO., LTD.）は、鉄道車両・バスなどのドア・窓枠およびバス停標識などを製造する会社。川崎重工業の子会社で、本社は岐阜県養老郡養老町にある。前身のアルナ工機(ナニワ工機)については、アルナ車両の項目を参照されたい。2002年4月1日のアルナ工機の事業別分社化に伴い、輸送機用品部門を引き継ぐ会社として設立された。設立当初は阪急電鉄の子会社であったが、2006年5月10日に全株式が川崎重工業へ譲渡され同社の子会社となった。"
アンデン,"アンデン株式会社（英: ANDEN CO., LTD.）は、愛知県安城市に本社を置く自動車部品メーカーである。デンソーの子会社。"
アント工業,アント工業株式会社（アントこうぎょう）は日本の輸送用機器メーカー。社名と同じ「アント」と呼ばれる鉄道用車両移動機の製造販売を行っている。
イクヨ,"株式会社イクヨ（Ikuyo Co., Ltd.）は、自動車用部品を製造する企業。神奈川県厚木市上依知に本社がある。社名は設立した1947年の194（イクヨ）に由来する。"
いすゞバス製造,"いすゞバス製造株式会社（いすずバスせいぞう）は、1997年から2004年9月まで存在したいすゞ自動車100%出資のバス車体製造会社（コーチビルダー）。略称は I-BUS, IBM。2004年10月ジェイ・バスが日野車体工業といすゞバス製造の2社の存続会社となり、三社合併した。いすゞバス製造になる前の1997年以前については、ルーツは川崎重工業グループの航空機製造会社で、第二次世界大戦後の民需転換でバス車体の製造を始めた事による。変遷をおおまかにまとめると、いすゞとの提携時代が川崎産業→川崎岐阜製作所→川崎航空機工業→川崎重工業→川重車体工業（川崎ボデー）までの各務ヶ原工場時代(1947～1985)と、その後いすゞ50%出資のアイ・ケイ・コーチを経ていすゞバス製造となる宇都宮工場時代(1986～2004)に分けられる。"
いすゞ自動車,いすゞ自動車株式会社（いすずじどうしゃ、英語：Isuzu Motors Limited）は、主にトラック・バスの商用車を製造する日本の自動車メーカーである。一時ゼネラルモーターズの関連会社だったが、2006年4月に資本関係を解消した。
