日本自然エネルギー,日本自然エネルギー株式会社（にっぽんしぜんエネルギー、英文社名：Japan Natural Energy Company Limited）は、東京都中央区日本橋室町に本社を置く自然エネルギーの導入促進会社である。風力発電、バイオマス発電、水力発電の推進事業を主とし、「グリーン電力証書」を発行して自然エネルギー価値基準を創造している。
日本発送電,日本発送電株式会社（にほんはっそうでん）は、1939年（昭和14年）から1951年（昭和26年）までの間に存在した日本の電力事業を司った特殊法人である。国家総力戦体制を構築しようとする当時の日本政府の電力国家管理政策に基づき、東京電燈・日本電力など全国の電力会社の現物出資や合併によって設立された半官半民のトラストである。略称は「日発」（にっぱつ・ニッパツ）、また英語表記は、Nippon Hassoden K.K. あるいは Japan Electric Generation and Transmission Company であった。
日本風力開発,"日本風力開発株式会社（にほんふうりょくかいはつ、Japan Wind Development Co., Ltd.）は、東京都港区に本社のある、風力発電の開発や風力発電機の販売を目的とした事業会社。青森県六ヶ所村、千葉県銚子市、石川県珠洲市などで、直営または子会社を通じて風力発電事業を展開している。また、ドイツ・ニーダーザクセン州にも、現地法人により風力発電所を設置している。"
日立電力,日立電力株式会社（ひたちでんりょく）は茨城県にかつて存在した日本の電力会社である。1927年に久原鉱業株式会社から分社化して発足した。大北川水系本流や夏井川水系本流沿いの水力発電所を主に運営していた。1941年に関東配電に全資産を出資し、翌年に解散した。
八戸ガス,八戸ガス株式会社（はちのへガス）は、青森県八戸市に本社を置き、同市内の一部をエリアとする一般都市ガス事業者。青森県都市ガス協会加盟6社のうちの1社である。
浜田ガス,浜田ガス（はまだガス）は、島根県浜田市に本社を置く都市ガス会社。
富山セントラルガス,富山セントラルガス（とやまセントラルガス）は富山県高岡市に本社を置く、プロパンガスを主力とするエネルギー販売会社である。セントラル石油瓦斯グループの一員である。旧名は高岡セントラル瓦斯であったが2000年にセントラル石油瓦斯の地域密着型総合施策に基づいてセントラル石油瓦斯富山支店の石油、プロパンガスの卸売事業を継承した際に現在の富山セントラルガスに社名変更した。シンボルマークは緑地の家の真ん中にハートマークがあり右手に「暮らしの真ん中にいつも。セントラルガス」となっている。
武州ガス,"武州ガス株式会社（ぶしゅうガス、商号：武州瓦斯株式会社、英称：BUSHU GAS CO.,LTD.）は、主に埼玉県西部地区を営業区域とする一般ガス事業者である。"
武陽ガス,武陽ガス（ぶようガス）は、東京都福生市に本社を置く、都市ガスとLPガスの供給業者。
福井市企業局,福井市企業局（ふくいしきぎょうきょく）は、福井県福井市を営業区域とする水道事業者・一般ガス事業者（地方公営企業）である。
福山ガス,福山ガス株式会社（ふくやまガス、英: Fukuyama-gas.co.ltd.）は、広島県福山市に本社を置く一般ガス事業者。福山市の一部に都市ガスの供給を行う。供給区域内に製鉄所があり、1967年から2008年にかけてコークス炉ガスを供給したが、現在は天然ガスを供給している。
米子ガス,米子ガス株式会社（よなごガス、商号:米子瓦斯株式会社、YONAGO GAS Co.Ltd.）とは、米子市を供給対象地域とする一般ガス事業者である。
北海道ガス,北海道瓦斯株式会社（ほっかいどうがす）は札幌市、石狩市、北広島市、恵庭市、千歳市、小樽市、函館市、北斗市、北見市を営業エリアとする一般ガス事業者である。東証一部上場。現在は原料の天然ガスへの転換が終了している。通常は「KITA GAS」「北ガス」（読みは「きたガス」。「ほくガス」ではない）と表記されることが多く、TVのCMにおいても「KITA GAS」「北ガス」と表記される。
北海道セントラルガス,北海道セントラルガス（ほっかいどうセントラルガス）は北海道札幌市白石区に本社を置く、プロパンガスを主力とするエネルギー販売会社。セントラル石油瓦斯グループの一員である。シンボルマークは緑地の家の真ん中にハートマークがあり右手に「暮らしの真ん中にいつも。セントラルガス」となっている。
北海道パワーエンジニアリング,北海道パワーエンジニアリング株式会社（ほっかいどうぱわーえんじにありんぐ）は北海道札幌市に本社を置く卸電気事業者である。
北海道電力,北海道電力株式会社（ほっかいどうでんりょく）は、北海道を営業地域とする電力会社。略称として、北電（ほくでん）あるいは、HEPCO（ヘプコ）が使われる。また株式市場などで、北陸電力と区別する場合は、道電（どうでん）、北海電（ほっかいでん）、北海道電（ほっかいどうでん）と呼ばれることもある。コーポレートスローガンは「ともに輝く明日のために。Light up your future.」、コーポレートキャラクターはエネモ。
北九州エル・エヌ・ジー,北九州エル・エヌ・ジー（きたきゅうしゅうエル・エヌ・ジー）は、福岡県北九州市に本社を置く、液化天然ガス（LNG）の受け入れ、貯蔵、気化、送出などを行なう、九州電力と新日本製鐵（現・新日鐵住金）の共同出資によって設立された企業である。
北日本ガス,北日本ガス株式会社（きたにほんガス）は、栃木県小山市に本社をおく都市ガスを主力とするエネルギー販売企業。日本瓦斯の系列である。
北陸ガス,"北陸ガス株式会社（ほくりくガス、商号 : 北陸瓦斯株式会社、 英: HOKURIKU GUS CO., LTD.）は、新潟県新潟市中央区に本社を置く一般ガス事業者である。"
北陸電力,北陸電力株式会社（ほくりくでんりょく）は、主に北陸地方（詳細は営業地域を参照）を営業地域とする電力会社。営業地域内では北電（ほくでん）の略称を用いているが、地域外では北海道電力との区別のため陸電（りくでん）を用いている。公式ウェブサイトのドメイン名も rikuden.co.jp となっている。また株式市場などでは、北陸電と呼ばれる場合がある。
名張近鉄ガス,名張近鉄ガス株式会社（なばりきんてつガス）は、大阪ガスグループのガス会社。三重県名張市、伊賀市青山地区、奈良県吉野郡大淀町の花吉野住宅地、志摩スペイン村でガス供給を行っている。近畿日本鉄道・名張市の出資により1961年12月設立。近鉄が名張市に開発した住宅地周辺でのガス供給から始まった。2002年、大阪ガスが近畿日本鉄道ならびに近鉄不動産から株式の80%を取得、傘下に収めた。都市ガスの供給は、6Aの液化石油ガスから13Aの天然ガスに転換した。
六本木エネルギーサービス,六本木エネルギーサービス株式会社（ろっぽんぎエネルギーサービス）は、六本木ヒルズ（東京都港区六本木）に電気と熱（暖房用の蒸気と冷房用の冷水）を供給している会社である。本社は六本木ヒルズ森タワーの最下階の地下6階にあり、「六本木ヒルズエネルギーセンター」と同様に併設されている。ガスタービンコージェネレーションシステム、蒸気ボイラー、吸収式冷凍機などの設備を有しており、六本木ヒルズで使用される電気と熱の大部分を供給している。
和歌山共同火力,"和歌山共同火力株式会社（わかやまきょうどうかりょく、英: Wakayama Kyodo Power Company , Inc.）は和歌山県和歌山市に本社を置く卸電気事業者である。"
鷲宮ガス,鷲宮ガス株式会社（わしのみやガス）は、埼玉県久喜市に本社を置く一般ガス事業者。東京ガスグループに属する。久喜市・加須市の各一部に都市ガスの供給を行う。2010年3月23日の市町村合併により誕生した新久喜市により鷲宮地区の呼称が「わしのみや」に統一されたことにあわせ、社名呼称を「わしみやガス」から「わしのみやガス」に変更したが、URLのコピーライト表記などに「Washimiya」の表記が残る。
